id,created_at,text
311146428011524096,2013-03-11 16:07:43,"""hvis en kommune for eks. øger cyklingen med 1.000 kilometer om dagen, så har de tjent en halv million om året"" http://t.co/OiD1ATKx8l #fb"
311126200292605953,2013-03-11 14:47:21,"""VIA Campus Randers fik her til eftermiddag, onsdag den 20. juni, et nyt studentervæksthus.""?? Vi har sag om nyt studenterhus i byråd i dag!"
310353776680767490,2013-03-09 11:38:01,Er til RAAM crew møde - rejseplan er nu klar. Får 4 t i Billund inden fly til Milano for deltagelse i EFITA konferenc http://t.co/6ljtpIM3I7
309736217182879744,2013-03-07 18:44:03,"Ørrild som område for et biogasanlæg bliver næppe relevant, idet der er en oplagt placerings mulighed ved teglværket syd for Hammershøj. #fb"
309729829631172608,2013-03-07 18:18:40,Nyhuus har netop på tværs af partifællers beslutning i MTU trukket plan om biogas ved Daka. De kunne blot have lyttet til mig &amp; nej'et fra V
309625775664021504,2013-03-07 11:25:12,"Forståeligt bekymring - Daka dur ikke til biogas anlæg. Jeg stemte imod, idet der er bedre alternative placeringer. http://t.co/SVlRubcXez"
309022501026013186,2013-03-05 19:28:00,"Go Basic er en hjemmeside startpakke til offentlige myndigheder. En godt tiltag, der blot kommer 10 år for sent. Se http://t.co/gr8brTAw3v"
309007913400287232,2013-03-05 18:30:02,Borgermøde på Laksetorvet om Kommuneplan 2013. Vi er ca. 40 hvoraf 18 er kommunalt ansatte og politikere :-( #fb http://t.co/W7I1gWToy2
308664356449697792,2013-03-04 19:44:51,Min Vasa tider http://t.co/10qYw0uKdb og ditto for kronprinsen http://t.co/wLecdORvMK. Var vi startet samme sted var jeg i mål 3 min før ham
306292948876795904,2013-02-26 06:41:44,Fin omtale af min idé om flat rate bus billetter: Kør ubegrænset med bus i Randers - Randers | amtsavisen.dk http://t.co/52bsLMdShU
304622261279813633,2013-02-21 16:03:01,Drøfter mobilitetspolitik i MTU. Min prioritering er 1) Reducér behov 2) M uden fossil energi 3) M ved kollektiv 4) M individuel fossil #fb
304462711742423040,2013-02-21 05:29:01,Bliv medlem af Dansk Cyklist Forbund i Randers http://t.co/xOSafchLDf
303774950953721856,2013-02-19 07:56:06,Landmænd drukner i bøvl http://t.co/TfNACO8U
303560299108249601,2013-02-18 17:43:09,"Bjarne Overmark og Steen Bundgaard taler som om ""skolelukninger"" er et tabu ord. Hvorfor dog? Hvis lukkede erstattes af funklende ny skole."
298890559689482240,2013-02-05 20:27:17,"Plads nr. 6 på Venstres samlede liste gik til Jens Peter Hansen, nr. 13 til Marianne Høj Madsen og nr.  22 til Jørgen Kirk. #fb"
298885780347183105,2013-02-05 20:08:17,Opstillingsmøde i Venstre i Purhus - vi har præsenteret os selv og nu tælles stemmerne. Spændende. #fb
296338201264668672,2013-01-29 19:25:07,Ugeavisen Landsbyerne fokuserer pt. på aktiv dødshjælp til landsbyer – her er mit bidrag til debatten. http://t.co/kOvWI0SQ via @pinterest
293968701580009472,2013-01-23 06:29:34,En opfordring om at engagere sig aktivt i demokratiet. Indlægget er stort set en kopi af et tilsvarende skriv i 2005. http://t.co/ThYcsNUU
293612656823246848,2013-01-22 06:54:47,@Endomondo Sure - if you promise to provide an option for direct upload of data from MotoACTV
293612157524914176,2013-01-22 06:52:48,Effektivt at arbejde hjemme - radioen fortæller om trafik kaos rundt om og ind i Aarhus - slipper heldigvis for at spilde tid i bil kø. #fb
291766781603885057,2013-01-17 04:39:56,"Amtsavisen på iPhone: Randers får indvandrere i jobhttp://t.co/R05Man9H"
290497432142360576,2013-01-13 16:35:59,Så blev det lige til 15 km ski ved Mariager Fjord - faktisk rigtig fine forhold http://t.co/pq2w37ZE
290028294106144768,2013-01-12 09:31:48,I 1997 foreslog jeg tilbud om læringsplejerske til nybagte forældre - nu skriver KL  at der kan spares milliader :-) http://t.co/9BlkpxTx
289513184363180032,2013-01-10 23:24:56,"Tjek @sched for Plantekongres 2013 på http://t.co/G9ZgqTxR.  http://t.co/hJobtdZJ er ret godt: Billigt, brugervenlig og funktionelt."
288615257235148801,2013-01-08 11:56:54,Just added a new discussion on UNIFARM http://t.co/AGjeOZB5
288347044446343168,2013-01-07 18:11:07,Nytårsmøde i Venstre i Randers (@ Øster Bjerregrav Forsamlingshus) http://t.co/WRiOAw3y
287573051506307072,2013-01-05 14:55:32,"Efter 50 min gråvejr brød solen frem i Skyæine Arena, idet Randers HK endelig kom foran - nu med 2 og 3 min tilbage #fb"
287556426375757824,2013-01-05 13:49:29,RT @BeGrowCreate: 3 firms account for more than half of U.S. wine sales. What impact does this concentration have on consumer choices?   ...
287556188147707905,2013-01-05 13:48:32,"Forbløffende at se hvoledes Strangholt får smæk på sit skud i kraft af en hurtig afvikling modsat kagekoneskud ,når hun svæver. #fb"
286565736380526592,2013-01-02 20:12:50,Efter 48 min. skod hådbold er Randers HK endelig kommet foran mod FIF. Nu skal sækken snøres. #fb
286554280373153792,2013-01-02 19:27:19,"Ren walk-over - men stik mod alle forventninger er det FIF, der fører 13-7 over Randers HK"
285860436342104067,2012-12-31 21:30:13,Godt nytår til alle
284970714551955457,2012-12-29 10:34:47,G+: Bjorli deltagere 2013 http://t.co/3VX0WxBb
284276074626572289,2012-12-27 12:34:32,G+: Far og Louise bryllup (143 fotos) https://t.co/pv7oUY4J
282634614139400194,2012-12-22 23:51:57,http://t.co/FLJYMqvA Tyvstartede på juleaften - har lige sat strøm til min nye Lenovo Yoga. Den bliver jeg glad for: En ren schweizerkniv.
282585604733169665,2012-12-22 20:37:13,G+: Videncentret på Agromek 2012
281331834346934272,2012-12-19 09:35:10,G+: Agromek (27 fotos) https://t.co/dH5r8YxE
280744977577955330,2012-12-17 18:43:13,"Respekt for politikerne i Randers byråd, der havde det politiske mod og ansvarlighed til at sige ja til 3 vindmøller til trods for protester"
280720494678904832,2012-12-17 17:05:56,Byrådsmøde - de første tre kvarter gik med tre spørgsmål fra borgerne. Har vindmøller på senere - spændende http://t.co/1BctJimx
280684841983434752,2012-12-17 14:44:15,"Hi! Which companies is working with GNNS based services, devices, applications, machinery  etc. in EU? I'm...: http://t.co/FYO9g9bw"
280298579900375043,2012-12-16 13:09:23,"Denne burde jeg have haft på bruseren, da børnene boede hjemme  - http://t.co/HSmL7vLn"
278912471295737856,2012-12-12 17:21:29,"I'm at I/S Fælles Forbrænding (Hobro, Nordjylland) http://t.co/F2opWWC1"
278750247642091521,2012-12-12 06:36:52,Der er rigtig mange indsigelser mod vindmøllerne på Trikelshøj. Jeg savner det  større perspektiv - derfor dette indlæg http://t.co/KU8LeCid
278377828687421440,2012-12-11 05:57:01,"Amtsavisen på iPhone: Bred kritik fra modstandere af  vindmøllerhttp://t.co/QE3bNACI"
276741937296461824,2012-12-06 17:36:34,"I'm at Jensen Plus (Randers, Midtjylland) http://t.co/KmZA8j69"
276679186763112449,2012-12-06 13:27:13,I'm at Danmarksparken http://t.co/f9ZHqm7Q
276574224209018882,2012-12-06 06:30:08,"Undrer mig, at byrådet ikke for længe siden via varmeplanlægning har sikret billig og miljøv. fjernvarme i hele Hobro. http://t.co/uA33DFd5"
276223514309181440,2012-12-05 07:16:32,Mener Frank Nørgaard det alvorligt bør han klage til Tilsynet - ellers er det tom leflen for vindmøllemodstanderne. http://t.co/gA45sf6V
274983040558714880,2012-12-01 21:07:20,Naturstyrelsen producerer CO2: Lader bil stå med tændt oliefyr - og det endda i soskin. http://t.co/39AFWA0F via @youtube
274630815927906304,2012-11-30 21:47:43,Mange byer fejrer decembers komme ved at tænde lys i juletræer - i Hvidsten tænder vi gadelyset - endelig er dette ved at blive sat op:-)
274189304505434112,2012-11-29 16:33:19,"MTU har enstemmigt indstillet, at vindmøller ved Trikelshøj godkendes  endelig #fb"
273447380538494976,2012-11-27 15:25:10,Mød mig i hal B på Videncentrets stand (@ Agromek) http://t.co/9dHcC5gY
271186855507156992,2012-11-21 09:42:39,Landbrugsmøde med vel knap 200 deltagere hos Dansk Revision (@ Dansk Revision) http://t.co/vwXA41iI
270185856529219584,2012-11-18 15:25:02,Den er hjemme #fb
270185473148850176,2012-11-18 15:23:31,2 min og foran med 9 #fb
270184300178206721,2012-11-18 15:18:51,Krise -  ser ud yi dommerne er betalt af Hypo og nu leverer de varen:  Ubegribelig rødt til bedste spiller hos Randers. Kun 9 nu
270183014187798529,2012-11-18 15:13:45,Forrygende stemning i Randers - foran med 11 og 11 min tilbage. Skal vinde med 7
270176936523882496,2012-11-18 14:49:35,Det her kan blive rigtig spændende. Randers HK skal i CL mod Hypo vinde med mindst 7 - her ved halvleg er de foran med 6 :-) #fb
270084477496225792,2012-11-18 08:42:12,"Lyt til P4 Østjylland NU, hvor der om et øjeblik kommer forklaring på, at SF's to Indvalgte i Randers byråd nu begge er løsgængere"
268405044766990337,2012-11-13 17:28:44,Garantmøde i Sparekassen Kronjylland (@ Purhus Hallen) http://t.co/f9LOPWQv
267028892735389698,2012-11-09 22:20:23,En præcis analyse af en professor: Why We Should (and Should Have) Run the Marathon | Psychology Today http://t.co/Aho2UGl9
266789830812389378,2012-11-09 06:30:27,Hatten af for Puk Studio ved Peter Iversen og ros til Amtsavisen for at bringe en positiv vindmølle historie. http://t.co/aUIaHHCF
266558272734105600,2012-11-08 15:10:19,Jeg bestod testen - hvad med dig?Test dit kendskab til trafikreglerne for cyklister http://t.co/ZOxgg7Wk
266031596933611520,2012-11-07 04:17:29,Så er den ifølge CBS News hjemme - tillykke til USA og verden med 4 år mere med Obama #fb
257896115041624064,2012-10-15 17:29:59,Buxtehude har ikke meget at byde ind med - Randers HK har det let og fører 16-7 efter 22 min. #fb
255984592685764609,2012-10-10 10:54:17,Ikke overraskende ligger Yammer i front mht. Completeness of vision Magic Quadrant for Social Software in the Workplace http://t.co/6AsO4EPF
255783049994850305,2012-10-09 21:33:25,Respekt: Niels Krause-Kjær smed vand i hovedet på maling smideren Per Stig Møller http://t.co/DtS1Z4pi
255753716815261696,2012-10-09 19:36:52,Great Barrier Reef halveret sidste 30 år (Times). Fisk er 24% mindre (JP). Pga temp stigning. Østjyske borgere kæmper mod vindmøller ??(TV2)
253134528284086273,2012-10-02 14:09:09,RT @asgriffin: Disruption in Higher Ed: student loans have exceeded cc debt in our country #nexc2012 #741
253133131207565312,2012-10-02 14:03:36,Cattlemen Steakhouse were mentioned in the welcome. Anybody going there tonight? - being over from Denmark I would like to join in #nexc2012
252388555689717761,2012-09-30 12:44:55,QR codes &amp; smartphones has a potential as means to access context specific instructions around the farm https://t.co/tOaifSdW #nexc2012 #680
251374761144377345,2012-09-27 17:36:28,"LAG Randers har et problem: Vi mangler gode projekter, der fremmer levevilkår og erhvervsudvikling på landet. Vi har tilskudskroner at give."
251372937926557696,2012-09-27 17:29:13,"RT @EuCyclistsFed: UNICEF  ranks the Netherlands, Sweden, Denmark and Finland as having the happiest children. Coincidence: These kids c ..."
251280761611751425,2012-09-27 11:22:56,"Coming from Denmark to #nexc2012, I have Thursday &amp; Friday for visiting ICT progressive farms, companies &amp; institutions. Any suggestions?"
251071811238891520,2012-09-26 21:32:39,"Enig i målet - Regnskovens gæster ind i midtbyen - men forskønnet Hospitalsgade som middel tror jeg ikke på.Lav i s… http://t.co/MpF81tRG"
250594549137817601,2012-09-25 13:56:10,Randers Sportscollege bygger på fejl. Nok et skelet falder nu ud af  Boligforening sagen. Fejl er ikke opdaget. Økonomi hænger ikke sammen.
250297705946034176,2012-09-24 18:16:38,Anders Buhl-Christensen er ny folketingkandidat for Venstre i Randers Nord. Modkandidaten Jonas trak sit kanditatur.
249026682873331712,2012-09-21 06:06:02,Endelig har Træningshuset fået et velfortjent tilskud på 1 mio i budget 2013 for Randers http://t.co/2R2Mn7JB
248900529848209408,2012-09-20 21:44:45,Der bliver ikke et budget i Randers i aften med Venstre deltagelse. Har ventet timevis og en del af os har et arbejde at passe - vi går hjem
248895446116872192,2012-09-20 21:24:33,Venstres i Randers forhandlere har siddet fra 15 til nu 23:20 hvoraf blot 45 min er gået med forhandling og ellers vente.Vi går snart hjem.
248894747094183936,2012-09-20 21:21:46,Borgmesteren i Randers har indkaldt til pressemøde kl. 9 i morgen - forhåbentlig er det ikke bestemmende for forløb af budget forhandlinger
248888772253593600,2012-09-20 20:58:02,"Budget forhandlinger i Randers - borgmesteren vil kun snakke med et parti ad gangen, så det er vente - vente - vente."
248667375564640256,2012-09-20 06:18:17,Rigtiig mange er beskæftiget indenfor vindindustrien - se  interaktivt kort over virksomheder http://t.co/aelxehP3
248037955971731456,2012-09-18 12:37:11,Lyder vældig spændende https://t.co/YQphT2an #nexc2012 #709
245492337969606656,2012-09-11 12:01:49,"I Randers er der 695 passive ikke-arbejdsmarkedsparate kontanthjælpsmodtagere –  208 under 30 år og 487 borgere, der er 30 år eller derover."
245485509185515520,2012-09-11 11:34:40,Kriseramt landbrug redder eksporten http://t.co/zG1ZcfcY
242672242490744832,2012-09-03 17:15:45,Taburetter betyder mere end ren energi for politikere i Greve: Havmøllerne må mindst 8 km. længere ud :: dknyt http://t.co/9uONFmmS
242445701940912128,2012-09-03 02:15:34,Participating in Afita/wcca 2012 conference (@ Tianmu Convention Center) [pic]: http://t.co/OccCfAvX
240330529453506560,2012-08-28 06:10:38,Never ending story. Som samfund ønsker vi at gøre noget ved klimaforandringer - bare det ikke berører min baghave. http://t.co/sX6ZZAvN
239106370937434112,2012-08-24 21:06:15,"Kongeetapens 177 km på 5:49, VIP afslutning på PostDanmark og derefter forkælelse på Hotel Munkebjerg med spa og delikat buffet med Inga"
237489042613231617,2012-08-20 09:59:34,"Just registered at Twellow, the Twitter yellow pages. Are you listed yet? http://t.co/IYc2UjGI"
235765698138353664,2012-08-15 15:51:37,"Er mageligheden ved at indfinde sig i Venstre? Lige nu holdet vi gruppemøde isf som sædvanlig at løbe med i Randers Stafetten, der løbes nu"
235038702668247043,2012-08-13 15:42:48,Herligt cykelvejr - hjem fra Skejby på 1:25 for de knap 47 km. MOTOACTV! http://t.co/muAK6Fwt
230505467661647872,2012-08-01 03:29:20,"Har vi råd til den luksus, Gjerskov? http://t.co/k70WpYsU"
230205892090544128,2012-07-31 07:38:56,"http://t.co/oIYtIIRP Sergey &amp; Daryl - there are a number of apps out there, which can used for geotagging information such as gap in..."
230194079697367040,2012-07-31 06:52:00,"Grim ulykke på Asfergvej, idet en bilist overså og med høj fart kørte op bag i parkeret fuldfodervogn, som en landmand var ved at læsse."
230007005459410944,2012-07-30 18:28:38,Den trofaste 305'er med vemod blevet lagt på hylden til fordel for opkomlingen MOTOACTV med al motion+mp3+navigation+FB http://t.co/fRjs9Lz8
229594721339711488,2012-07-29 15:10:21,Ufattelig stor afbrænder af Randers FC og kort efter hovedstød på overliggeren - alt i løbet af kampens første 3 minutter - heldige AGF #fb
223097708402057216,2012-07-11 16:53:33,Vred dansker pga manglende bredbånd. Han er ikke den enestehttp://epn.dk/teknologi2/computer/article4776382.ece
221365185565298688,2012-07-06 22:09:07,"Wow - har nu pakket MotoACTV'en ud. Imponerende. Fitness ur, mp3 spiller og visning af SMS, vejr, tweets, FB mm. #fb http://t.co/13mMa9cA"
221150598895108096,2012-07-06 07:56:26,Gav interview til P4 Østjylland om hvordan Spar kæden i Wien målrettet  forkæler cyklister for at tilknytte denne købestærke gruppe #fb
218728401161297920,2012-06-29 15:31:29,Hver dag dræbes i trafikken et antal personer svarende til 10 fyldte Jumbo 747 fly. Total 1.3 mio. Dvs det er ikke specielt farligt at cykle
218424651460780034,2012-06-28 19:24:29,Mystisk. Vi skulle være 3 fra Randers til Velo City cykel konferencen i Vancouver - men her på 3. dagen har vi endnu ikke set Kasper Fuhr
218069419631460352,2012-06-27 19:52:55,Took a ride on Central Valley Greenway this morning from end to end. I'm not impressed - had troubles just following the path #velocity2012
217732962077253633,2012-06-26 21:35:58,@toddedelman Agree. We live in 2012. We have travelled miles and paid a lot. We bring mind extending devices - but no wifi. #velocity2012
216356650980872192,2012-06-23 02:26:59,"Brug ikke Billund Lufthavnsbus. Små sæder, ingen benplads og selv en rigtig stor kuffert måtte jeg bakse ind i bussen. Og forsinket ankomst."
215428003088441344,2012-06-20 12:56:53,"Dybt skuffende, at Randers ikke får støtte fra Cykelpuljen til sti under Randersbro. Hvor var Torben, Maja &amp; Michael? http://t.co/lkNFvPnj"
215335225457246208,2012-06-20 06:48:13,Antal undervisningstimer har IKKE signifikant betydning for skolernes faglige resultater jf. skolesnak i Randers. http://t.co/mxfhmVgs
214829858587553792,2012-06-18 21:20:04,Så er Randers byråd nået til behandling af de lukkede sager på byrådsmødet - vi bliver færdig inden midnat :-).
214810000823029761,2012-06-18 20:01:09,"DF i Randers er imod vindmøller - mener ikke, at det gør forskel hvad vi gør i Danmark. De ""andre"" skal gøre noget. Det siger de andre også."
214794217267015680,2012-06-18 18:58:26,"Nu sender borgmesteren S, DF og K ud for at tænke over sagen? Det sejler i Randers byråd pt."
214793257094352898,2012-06-18 18:54:37,"Så udsætter et konfliktsky Randers byråd bestående af S, DF og K beslutning om Ørum Værum Varmeværk til efter sommerferien???"
214755935866986496,2012-06-18 16:26:19,Så lykkedes det endeligt for Randers byråd  at få vedtaget OPP aftale om nyt vandland i Randers. Radikale og Beboerlisten stemte imod.
214731795348979712,2012-06-18 14:50:24,Er din forretningsmodel 100 år gammel? Ny bog sætter spørgsmålstegn ved selve virksomhedens grundlag: http://t.co/9AP286wr
212978538264014853,2012-06-13 18:43:35,Dejligt igen at cykle i Paris selv om det kun er på en Velo Lib og ikke en Rynkeby cykel #fb
212855246601461760,2012-06-13 10:33:40,Wonder if anybody has mental capacity to comsume all the information delivered by Progis in just 15 minutes?  #smartagrimatics
212808023129862144,2012-06-13 07:26:01,Do you need a ticket for the dinner &amp; cruise tonight? You can buy mine #smartagrimatics
212540643497607168,2012-06-12 13:43:32,Så sidder vi som et ikke beslutningsdygtig MTU udvalg - to har meldt afbud og Kasper Fuhr er ikke dukket op :-(  #fb
212320078937600000,2012-06-11 23:07:06,Tjek 225.000 kr. indsamlet og Asferg får en Spar købmand på AsfergNet: http://t.co/D7GXuara
211827416811843584,2012-06-10 14:29:26,G+: Cykelbroen - indvielse 10. juni 2012 (32 fotos) photos/108127112150950354762/albums/5752411564376384961
210721638881300480,2012-06-07 13:15:29,"MeetRanders - et tiltag, der skaber det samarbejde, der trækker flere møder og konferencer til Randers http://t.co/1HCnpVNb"
209943739504922624,2012-06-05 09:44:22,Regner Graasten holder en blændende god grundlovstale i haven ved Hvidsten Kro. Sammenbinder fint demokrati og Hvidstengruppen #fb
208512146970128384,2012-06-01 10:55:44,Her har S &amp; SF en historisk chance for at forbedre vælgeropbakning:  Udkantsdanmark går måske ikke offline alligevel: http://t.co/THkavDUE
208366676142604289,2012-06-01 01:17:41,G+: Hej Her er nogle billeder fra vores pinse i Stockholm sammen med Christina. Måske er det letteste at trykke på… https://t.co/nxvd0cvV
208366659365376001,2012-06-01 01:17:37,G+: Stockholm (154 fotos) photos/108127112150950354762/albums/5748857741963657105
208209297954443264,2012-05-31 14:52:19,Randers byråd orienteres om Dania og VIA. Basale læseevner er et problem - byrødder slæber kaffe &amp; kage ind i lokalet trods forbudsskilt ;-)
207812907164123136,2012-05-30 12:37:12,"UnBoss? Lyder fornuftigt, at nogen har skrevet en bog om, at ledelse ikke er hvad det har været - heldigvis. http://t.co/9AP286wr"
207106221734498306,2012-05-28 13:49:05,"Stockholm har betalingsring men ingen cykel kultur. Kan hilse og sige, at det omvendte er at foretrække. Trafikken ud ad byen står stille."
204952055113191425,2012-05-22 15:09:12,Herligt at opleve engagerede kandidater i kampvalg til bestyrelsen for Randers Erhvervs- og Udviklingsråd - et ganske stærkt felt.
204948679608635392,2012-05-22 14:55:47,"""Bønder overlever altid"" Naivt indlæg fra Bjarne Møller, Vestjysk Bank. Ja - de overlever men ved at flytte produktionen ud af Danmark #fb"
204947379823185920,2012-05-22 14:50:37,"""Fokus på udførsel frem for flere planer"" Igen et godt råd til Randers fra Svend Erik Sørensen, Danish Crown.  #fb"
204946326411161600,2012-05-22 14:46:26,"@jenspeterhansen Ingen i panelet forholder sig til udmeldingen om politisk uforudsigelighed :-( Ej heller et spørgsmål fra salen følges op"
204938339349049345,2012-05-22 14:14:42,"""Hvor meget fylder arbejdet med at reducere transportbehov i Transportministeret?"" Fik ikke chancen til at spørge transportministeren om det"
204937466342424577,2012-05-22 14:11:14,Politisk uforudsigelighed eller kommune med tradition for frugtbar samarbejde? Helt afgørende iflg direktør fra Danish Crown på REU møde #fb
204913748417331200,2012-05-22 12:36:59,Infrastruktur er vigtig hører vi på REU årsmødet. Undrer mig så over at Randers Cityforening ikke ønskede Rosenørnsgade projektet realiseret
204707623692550144,2012-05-21 22:57:55,G+: Copenhagen Marathon (44 fotos) photos/108127112150950354762/albums/5745111955202344753
204635235743309824,2012-05-21 18:10:16,Konfliktsky Randers byråd: Selv om mange går ind for at stoppe bilkørsel i Sløjfen tør vi ikke tage beslutningen - sagen startede i 2007 #fb
203770349052104704,2012-05-19 08:53:31,Randers er godt på vej - var nomineret til Årets Cykelby. I 2013 tager vi titlen bl.a. pga af cykelsti under Randersbro http://t.co/kpAPec5h
203132734837760000,2012-05-17 14:39:52,"Så gælder det: Randers HK mod Viborg. Masser af folk i VIP'en, hvor man som byrådspolitiker ha god nytte af at huske to ører og en mund #fb"
200484552588800000,2012-05-10 07:16:56,Amtsavisens leder leverer en relevant og egentlig ganske præcis analyse af borgmesterkandidat valg #fb http://t.co/gbxCCnsA
200273313820446720,2012-05-09 17:17:33,Mon de laves i danske størrelser? Business Suits for Bicycle Commuters http://t.co/VilqDeU5 #fb
199985087901741056,2012-05-08 22:12:15,"Øv - trods løbetur tvivler jeg stadig på, at Venstres medlemmer valgte rigtig. Ellers ofte, at en løbetur klarer tankerne."
199938525670551553,2012-05-08 19:07:13,"Hårde odds, når Venste gruppeformand og folketingsmand anbefaler min modkandidat :-("
199854810734919681,2012-05-08 13:34:34,"Stærkt udspil fra RenoSam - målet er at overflødiggøre sig selv ved at betragte affald som en ressource, der holdes i kredsløbet #renosam"
199409645234827265,2012-05-07 08:05:38,"Søren Gade, tidl. forsvarsminister, er ny direktør for Landbrug &amp; Fødevarer"
199409220989362177,2012-05-07 08:03:57,"Netop blevet meddelt, at Carl Aage Dahl er fratrådt som direktør for Landbrug og Fødevarer. Søren Gade bliver ny mand på posten fra på onsda"
199120540873662465,2012-05-06 12:56:51,Fredericia vil score og så lykkes det - FC bagud 0-1. Vi har chancerne men triller bolden rundt frem for direkte forsøg. #fb
198299314286641152,2012-05-04 06:33:35,Til udvalgsmøde via Skype - fornuftigt. Hvad med udlevere webcam og bruge Skype når sygedag meldes ind til leder? : http://t.co/3ApA2K2Y #fb
198292353432305665,2012-05-04 06:05:55,"Spottede dette foto, hvor jeg stiller spørgsmål til Ida Auken på ""Planlægning af vindmøller frem mod 2020"". http://t.co/QxVYcvog"
197366733156270080,2012-05-01 16:47:50,@camilladalby Hold trykket - I gør det godt med 9-5
197222045690511362,2012-05-01 07:12:54,Føler mig ganske ung - er til Markedsføring på de nyeste digitale medier hos Creuna. Ses på dåbsattester er jeg nok den ældste af tilhørere
197202958608375809,2012-05-01 05:57:03,Top 10 opgaver på Vejle Kommunes intranet - kort og præcis artikel. http://t.co/Ruib6wzE
197014259744505856,2012-04-30 17:27:15,"Ca. 75 deltager i Randers Venstres ""Den Varme Stol"" hvor Michael Aastrup pt. giver indlæg. Demokratiet trives i Venstre http://t.co/Rfm7M4fA"
196993012075724800,2012-04-30 16:02:48,"Er til møde i Arbejdsmarkedsudvalget - meget gøres for at få folk i job. Vi bør bruge samme energi på at støtte de, der skaber jobs."
196980408506785793,2012-04-30 15:12:43,"1. maj er sidste frist for medlemskab af Venstre, så du kan stemme på mig som Venstres borgmesterkandidat i Randers se http://t.co/ebHTlWVY"
196281970009964544,2012-04-28 16:57:23,"@janusboye, you're the #8 influencer about Intranet on @klout! Sign in today and check it out! http://t.co/tGiHmocc"
196281188304945152,2012-04-28 16:54:16,I added @michaelaastrup as one of my influencers on @klout. Who influences you? http://t.co/cr5LHK1J
195778119003668481,2012-04-27 07:35:16,"Eksempler på hvordan kommunen kan møde virksomheder med en håndsrækning (Lars Goldschmidt, DI) #fb http://t.co/MJsdlPlU"
195774238655922176,2012-04-27 07:19:50,"Viden kan overvejende først sælges globalt, når den er omsat i konkrete produkter. Sagt af Lars Goldschmidt, DI, på KL Politisk Forum"
195520525332783104,2012-04-26 14:31:40,"Integreret intensiv drift - landbrugets bud på deres bidrag til grøn omstilling. Vil beskytte miljø, spare energi og skaffe mad til 7 mia"
195133919895621632,2012-04-25 12:55:26,"Har via mobil fra Kaiserslautern givet interview til Debatten DR Østjylland, der i morgen kl. 17 skal diskutere den forbedrede rygelov #fb"
194669943235678208,2012-04-24 06:11:45,"Var med nattoget Flensburg - Mannheim i ""eneværelse"". God søvn og god service - kan absolut anbefales og OK pris hvis på tilbud. #fb"
