id,created_at,text
661286920299913216,2015-11-02 21:01:02,75 pct. af verdens fødevarer stammer fra blot 12 afgrøder og 5 dyrearter - vi er sårbare over for klimaforandringer. https://t.co/6bcn1UdWdi
661251521162661888,2015-11-02 18:40:22,"Ser på TV2OJ Kim Christiansen trafikordfører, DF, skælde ud over at #E45 ikke udvides. Sjovt nok - kommer til at tænke på #cykling &amp; sundhed"
661145274086100993,2015-11-02 11:38:11,”Den internationale blåstempling af undersøgelsens resultater er vigtig. De førende forskere på området står nu bag…https://t.co/n8eJwB6ipq
660780682017431552,2015-11-01 11:29:25,"Er der behov for Cyklistforbundet? Innovér eller dø. Råd fra Jan Ejlstad, Friluftsrådet, i panel debat på #cflm15 https://t.co/xMWDJsBq36"
660735547871072257,2015-11-01 08:30:05,Et lille udsnit af omtale af aktiviteter i Cyklistforbundet Viborg - årets lokalafdeling #cflm15 https://t.co/nTV4bbRHiL
660513813360431105,2015-10-31 17:48:59,Resultat af valg til Cyklistforbundets hovedbestyrelse #cflm15 https://t.co/xlfColQuW0
660512327532326913,2015-10-31 17:43:05,"Cyklistforbundet's ""Vi Mener"", der netop er vedtaget på #cflm15, er fyldt med fakta og cases… https://t.co/JbsGEwpQ1g"
660509850716237825,2015-10-31 17:33:14,På #cflm15 diskuteres under Eventuelt diverse ulogiske regler for cyklister - se / gense her eksempler fra Randers https://t.co/FupsiZ1soJ
660489996605005824,2015-10-31 16:14:21,RT @climatemessages: @GeorgeMonbiot PLEASE RT #100ClimateMessages https://t.co/FKH4GlSCyW
660477367299764224,2015-10-31 15:24:10,Er diverse vedtægtsændringer i Cyklistforbundet lige lovlig tørt nok for dig kan du studere denne infograhic #cflm15 https://t.co/SJeBh5r6ZL
660461581747265537,2015-10-31 14:21:26,Nej tak til - af hensyn til transport- alene at holde landsmøder i Kbh. 34 af 86 fra Stor kbh. Øvrige omk. vil være lavere i Jylland #cflm15
660454474159378432,2015-10-31 13:53:11,Ofte er der 50 km/t hastighedsbegrænsning hvor der er cykelstier mens der mange steder uden cykelstier må køre 80. Hvor er logikken? #cflm15
660451161414066176,2015-10-31 13:40:02,God pointe af Reni Hatting på #cflm15: Hvorfor er hovedpræmier i konkurrencer ofte en bil? Hvorfor ikke kvalitetscykler (til hele familien)
660447688387862528,2015-10-31 13:26:14,Definition af supercykelsti? Bør være funktionsbaseret ud fra fremkommelighed og sikkerhed og ej specifikke krav om dit eller dat #cflm15
660443470209880064,2015-10-31 13:09:28,@YenzOle ... og Vi Mener indeholder en bunke af faktuelle data eller links til sådanne.
660442759174692864,2015-10-31 13:06:38,"Frank Elm Jakobsen på #cflm15: Cyklistforbundet bør fungere som forbruger organisation. Købt - hvis et ""også"" indsættes og medlemsdrevet #fb"
660421631290929152,2015-10-31 11:42:41,Nedrullede sol gardiner skjuler det glitrende vand og solen for 160 cyklister ved #cflm15 https://t.co/PRQtbUxIHP
660408007361241088,2015-10-31 10:48:33,Vi cykler for at blive i sadlen. Kloge ord af Claus Bonnevie på Cyklistforbundets landsmøde #cflm15
660397294613864449,2015-10-31 10:05:59,160 engagerede deltagere i Cyklistforbundets landsmøde 2015 #cflm15 https://t.co/RnfAvnjec9
659827795565133824,2015-10-29 20:23:00,Et tweet onsdag om svinekød i institutioner i Randers affødte en opringning fra DR journalist - læs interviewet her https://t.co/JZmCatzY0K
659500483514626048,2015-10-28 22:42:22,Derfor arbejder jeg på at skabe bedre forhold for cykling: 11.5 mia - hvorfor ikke fordoble det tal? #gørdetpåcykel https://t.co/n4HOX9DQ8Q
659440506603216900,2015-10-28 18:44:03,"#TV2OJ misinformerer. V &amp; DF i #Randers har ikke aftalt, at der skal serveres svinekød. Aftalt er at der skal lægges vægt på dansk madkultur"
658256624839184384,2015-10-25 12:19:43,Hr og fru Hansen på lånte Randers Cykelby mountainbikes gennem skovene fra Hem op til Mariager Fjord… https://t.co/DLRrObsL8k
657431830979850240,2015-10-23 05:42:17,@NOWsupport Demo: User name or password invalid. Community: Made a new profile but again I get All fields are required - I fill all fields??
657167698128982016,2015-10-22 12:12:43,No service at #servicenow. Demo accounts don't work. Can't logon Community - SSO fails in IE. In Chrome asking for missing info stops access
656065473583411200,2015-10-19 11:12:52,Will it be possible to register on-site for #ICT2015 tomorrow morning (Tuesday)? Or did someone sign-up but not going? (I could re-use seat)
652418729976942593,2015-10-09 09:42:01,Bliv hjemme eller kør ordentligt - relevant indlæg om adfærd på cykelstien #gørdetpåcykel http://t.co/wbIX9Kf71p
650258601488072704,2015-10-03 10:38:26,Workshop for hovedbestyrelsen i Cyklistforbundet (@ Cyklistbutikken 1905 in Copenhagen) https://t.co/AQ8bySSc4R
650247374187528192,2015-10-03 09:53:49,Nyder solen på Israels Plads inden workshop i Rømersgade for Cyklistforbundet s hovedbestyrelse @… https://t.co/LQUKqCqO2p
649937252043390976,2015-10-02 13:21:30,Fint at JP skriver artikel om at #Randers er højdespringer i godt erhvervsklima #fb http://t.co/TkvZjG2JfW
649584250241609728,2015-10-01 13:58:48,Nok en afvisning af klage fra Bjarne Overmark og Kasper Fuhr #randers #dkpol http://t.co/qAHKPfWtwr
649317531799429120,2015-09-30 20:18:57,Sejltur på Eider med Gudenåkomiteen. Bemærk ingen mtorstøj - sejler 2 t på batteri https://t.co/10KXckLU9H
648522148978532353,2015-09-28 15:38:23,Hovsa - i gennemarbejdet Mobilitetsplan med 4 indsatsområder sætter #Randers byråd letbane på som 5. punkt - uden bagved liggende arbejde!?
648382062676852737,2015-09-28 06:21:44,Klima eller flygtninge er ikke største udfordringer – derimod manglen på politisk vilje og evne til at håndtere dem.https://t.co/n0FBSEeltL
648027015426232320,2015-09-27 06:50:54,Endelig sættes fokus på hvorledes jordisk gods af kirken vægtes højere end menneskers ve og vel. #vindmøller #dkpol http://t.co/zald6q4ebb
646774441645510658,2015-09-23 19:53:38,33 mio. til skoleområdet i #Randers. Beløbet er netto provenuet af ændret skolestruktur og bliver i skoleområdet http://t.co/VUwrYkXrVh
645533288908636160,2015-09-20 09:41:44,36 cyklister nyder søndagstur på 39 km med Cyklistforbundet #Randerd #gørdetpåcykel https://t.co/jX8m8yZM7u
644765785139867649,2015-09-18 06:51:57,"Pressemeddelelse om budgetforlig i #Randers indgået i nat mellem Venstre, DF og Socialdemokratiet #dkpol http://t.co/ZbUzWsceuq"
644765408017432576,2015-09-18 06:50:27,"Forligsteksten for budgetforliget i #Randers kommune indgået af Venstre, DF og Socialdemokratiet #dkpol https://t.co/8SQb3qlLz2"
644667728427659264,2015-09-18 00:22:18,"Venstre, Dansk Folkeparti og Socialdemokratiet i #Randers Byråd har netop indgået aftale om budget 2016. #fb #dkpol"
643742420975374340,2015-09-15 11:05:27,"@Topdanmark Kan fortælle, at dine kollegaer hurtigt og korrekt har imødekommet min klage. Dvs. thumb up til #topdanmark &amp; ned for taksator"
643386595647848448,2015-09-14 11:31:32,@Topdanmark Tak for tilbud. Har sent klage. Ikke i orden at taksator fejler og jeg skal bruge +20 timer på jura &amp; dokumentation #forsikring
642819814566694912,2015-09-12 21:59:21,#topdanmark taksator føjer spot til skade: Tilbyder 5.500 kr. erstatning for cykel - jeg har seneste 14 md har købt nye dele for det dobbelt
642552352835289088,2015-09-12 04:16:33,#Randers nævnes i debat om #vindmøllers å jeg svarer: Samfundsnyttig brugskunst ved Vandel | Vejle Amts Folkeblad http://t.co/R0uO1Eig1L
642323679184035841,2015-09-11 13:07:53,@copenhagenize @KlausBondam Hvor kan vi se en liste over deltagende politikere?
642322891141480448,2015-09-11 13:04:45,@nielshoe @AndersVJensen @Sustainia @CopenhagenDaily @copenhagenize Don't you guys not use #Spinlister? http://t.co/AmSNsONLhA
642268059068186624,2015-09-11 09:26:52,"Low Power, Wide Range comparing #sigfox #onramp #LoRa #Weightless and more http://t.co/CohhfDq7ix http://t.co/MAF13TlYdc"
641698603753455616,2015-09-09 19:44:03,Endnu en cyklist blev påkørt bagfra - bilisten så ikke cyklisten. Men kiggede han??? #gørdetpåcykel http://t.co/vZXdRjNAJl
640639437207154688,2015-09-06 21:35:18,#Garmin proves its value as it navigate Lasse Normann Hansen to victory in #tourofalberta - the peleton didn't use Garmin took a wrong route
640637244290789376,2015-09-06 21:26:36,Amazing that everybody besides Danish winner Lasse Normann Hansen managed to take a wrong route just 6 miles before finish #tourofalberta
640563877416202240,2015-09-06 16:35:04,"Kloge ord på væggen i sundhedsklinikken, Kollektivhuset, #Randers https://t.co/LsWIfERdfd"
640557961778040832,2015-09-06 16:11:33,"@LeifPlauborg Fotovogne på skoleveje - det er jo netop det politiet gør og jeg ser gerne endnu flere frem for vogne, hvor der tjenes penge"
639323236111642624,2015-09-03 06:25:12,#Randers er en af årets højdespringere i erhvervsvenlighed  - fra nr. 69 til nr. 36  i DI undersøgelse http://t.co/qBsNvebc7Y
638786677062922240,2015-09-01 18:53:06,Flipped Classroom og landbrugsfaglig rådgivning? Hvor vidt er vi kommet i den retning i DK? Læs US artikel #ldkviden http://t.co/Nu9BwhYmSC
638786023913320448,2015-09-01 18:50:30,Mon der er forældre på vej til skole med deres barn/børn blandt fart bilister? https://t.co/9zZCUF33vC
638457773538340864,2015-08-31 21:06:09,Her TV2 OJ indslag om Alle Børn Cykler i #Randers http://t.co/LUyNqJV5Y9
638457172008038401,2015-08-31 21:03:46,Alle Børn Cykler i #Randers - det er målet og der laves et rigtig godt arbejde for at nå målet - se DR Nyheder https://t.co/KG1TFJWIXh
638271264805781504,2015-08-31 08:45:02,Op på cyklen - det er bedre for alt og alle lyder det fornuftigt fra skolebestyrelse og skoleleder  #allebørncykler http://t.co/LUyNqJV5Y9
638064796894666752,2015-08-30 19:04:36,"Sørgeligt at se, hvordan lister og nogle små partier betragter #Randers Byråd som en kommunikationsplatform http://t.co/tiS8XLpC3e #fb"
634779973883162624,2015-08-21 17:31:54,Traktortræk i herligt vejr ved byfesten i Asferg https://t.co/4iekvzYrIj
634596112649854976,2015-08-21 05:21:18,How blazing Internet speeds helped Chattanooga shed its smokestack past http://t.co/a11EOk0hUS via @CNET
634362653566214146,2015-08-20 13:53:37,Kan man få en krykke holder til cykel? Er startet på genoptræning. #gørdetpåcykel https://t.co/ff01LXDBJ3
634005325801197569,2015-08-19 14:13:43,Jeg cykler - jeg lever. Første tur til #Randers - med krykker bundet på stangen - siden jeg blev kørt ned i fredags. #gørdetpåcykel
630506606074200064,2015-08-09 22:31:03,#cyklingudenalder på Fjordløbets 30 km rute (#randers) med livsglade Jens Christian Hansen som passager. http://t.co/XdwxXyIOvL
629959645554196480,2015-08-08 10:17:38,That's the way to deal with cars parked on cycle paths - if your are as strong as this cyclist :-) https://t.co/WwqIjRcSGM via @YouTube
629590476384026624,2015-08-07 09:50:41,Cyklistforbundet i #Randers benytter crowdsourcing for at fremme bedre forhold for kommunens cyklister http://t.co/ytzSJWoovF #gørdetpåcykel
629033322618953728,2015-08-05 20:56:45,Impressed by #Ideascale support. Send their support an e-mail asking them to change url on a free site - job done in less than 5 minutes :-)
629016649107173376,2015-08-05 19:50:30,Børnene begynder i skolen igen i næste uge - hjælp dem til en tryg start #gørdetpåcykel https://t.co/tyXaI2stYA
626992776119513088,2015-07-31 05:48:21,Fibernet og cykelstier til #landdistrikter i et hug: Cykelsti af plastik med plads til kabler http://t.co/lrYrNR3Rox http://t.co/S2amYFdQ9G
626850896446652416,2015-07-30 20:24:34,"Lun gut ham Froome: Will you return to Denmark? Yes - it is a cool place! Eller sagde han mon ikke ""a cold place""? ;-)  #fb"
625907724086329344,2015-07-28 05:56:44,Kyst #vindmøller: Pinligt som politikere lader medier bestemme hvad de mener. ..kun 4 km ude?! På land 600 m! #dkpol http://t.co/gWIIbvpqKp
625711728505036800,2015-07-27 16:57:55,Boykot #føtex! En 50% stigning på hvidløgsflute er bare for groft. Slut med for en ti'er at få flute i flaskeholderen http://t.co/gKwm9OHd48
625706524472668161,2015-07-27 16:37:15,"Så piver mange ""Vi kan egentlig godt lide #vindmøller"" over kystnære møller 4 km fra kysten. Stop piveriet eller kom med bedre løsninger"
624526621895172096,2015-07-24 10:28:44,"Kantinen på SEGES er lukket, men pyt - jeg arbejder hjemme i dag og lider absolut ingen nød takket… https://t.co/45N4OPw7is"
624504807961849856,2015-07-24 09:02:03,"Et travlt efterår venter: Geneve, Lissabon &amp; Los Angeles :-) http://t.co/IHm7tu77Vz"
622679646975475712,2015-07-19 08:09:31,Indkøb på cykel? Naturligvis - og du kan have rigtig meget i alm. lille rygsæk. Her søndag morgen… https://t.co/P12NWTyr7s
622676280086016000,2015-07-19 07:56:08,Stakkels sommerhusejere - nu skal de se på vand+møller isf. vand. Min mening: Kortsigtet egoisme uden perspektiv. http://t.co/zlFzjqnbYo
622326844155686912,2015-07-18 08:47:36,Få det store overblik over fitness trackere: The Best Fitness Tracker for Every Need http://t.co/BPgfmQHKma
621356952275136512,2015-07-15 16:33:36,Jeg går i rette med Mogens Nyholms (R) NATO: No Action Talk Only i indlægget Grøn konsekvens efterlyses http://t.co/vwTgykt9eh #randers
616547386756866048,2015-07-02 10:02:06,"I'm at Browar Lech in Poznań, wielkopolskie https://t.co/ixUOQebQzz"
616241935133618176,2015-07-01 13:48:21,"Value is not in data - value is in services build on top af data. Damian Adamczak, #johndeere, presenting at #efita2015"
616194657299640320,2015-07-01 10:40:29,Iver Thysen from Eranet Ict-Agro explains what #Sgfox is all about. #efita2015 http://t.co/515CFcYnqs
616193660191932416,2015-07-01 10:36:31,If the problem is data collection #LPWAN as #Sigfox now also being rolled out in Denmark are the solution #efita2015 http://t.co/syHkS8NFyT
616192618150666240,2015-07-01 10:32:23,Had a fine #efita2015 conference dinner last night - they served wine but soon most was drinking their excellent beer http://t.co/weuQvWaJqy
616152468909621248,2015-07-01 07:52:50,"My followers live in 14 countries: Denmark(59%), France(7%)... http://t.co/oNbIPwTecpGet your free map! http://t.co/bs94UeVJJO"
615874842731147264,2015-06-30 13:29:39,RT @ageekculture: Le wearable pour les agriculteurs présenté par JP Hansen du Danemark #efita2015. Smartwatches mieux que smartglasses? htt…
615874504502444032,2015-06-30 13:28:18,RT @nicolaifog: Listen to @jenspeterhansen and his nice Wearable Tour  ... #eftia2015 http://t.co/YIazxWHZY7
615874332804390912,2015-06-30 13:27:37,20 kg of grain needed to produce 1 kg meat. 1.1 kg grain to 1 kg milk. Seishi Ninomiya at #efita2015 http://t.co/6DlHTBHn45
615873143421435904,2015-06-30 13:22:54,We will be 9.3 billion in 2050. Agriculture can produce feed energy for 20 billions - if they only have rice. Seishi Ninomiya #efita2015
615840381197000704,2015-06-30 11:12:43,Do these people look satisfied? They should as they just got my #efita2015 presentation Wearables and the farmer #fb http://t.co/vKrcboDGdA
615797928179822592,2015-06-30 08:24:01,Not able to attend my #efita2015 presentation Wearable and the farmer? You can enjoy my Prezi at https://t.co/QB8OImIbxB
615796976647405568,2015-06-30 08:20:14,"Young farmers in Ireland uses Twitter. Sinead Quealy at #efita2015. Farmers in DK have not yet ""found"" Twitter - why? Lack of useful tweets?"
615501253766983680,2015-06-29 12:45:09,Being chairman for #efita2015 session on Decision Support System I'm glad to look at an almost full room http://t.co/qSvmf9Cm3N
615442294913802240,2015-06-29 08:50:52,Important word in #efita2015 opening keynote: cloud; Iot as data source; big data analysis; crowdsourcing; simulation &amp; visualisation
615009440064999424,2015-06-28 04:10:51,Modstand: Skærve belægning på Faurskovvej i modvind. #gørdetpåcykel http://t.co/ugrpBE7Xfl
614839056325844992,2015-06-27 16:53:48,Tak til @TV2SportenCykel for at ændre overskrift på artiklen om Tesgaards ulykke #431 http://t.co/sm7y8cl3vl
614144157314117632,2015-06-25 18:52:32,"@TV2SportenCykel - skam jer over stupid overskrift, der signalerer, at Tesgaard selv var ude om det pga vanvidsløb http://t.co/6TOMmv8Pl6"
614070661099728896,2015-06-25 14:00:29,So sad to hear that Tesgaard was struck by a pickup truck and now fighting for his life instead of a well deserved place on #RAAM2015 podium
613745439175798784,2015-06-24 16:28:10,Blooomberg reports a total 2014 investment of 995 billion $ in #windturbine projects providing 51.000 MW new capacity - half of it in China
613728660378492929,2015-06-24 15:21:29,Spending the whole day going to Copenhagen for #Sigfox workshop but no details about cost of using service in DK - not satisfied :-(
613710330837905408,2015-06-24 14:08:39,Old wine on a new bottle presented by Microsoft as Iot example. I heard about activity trackers 25 years ago. http://t.co/c1FG79oMtf
613702085033328640,2015-06-24 13:35:53,#Flextronics show us this slide with estimated savings by using #Sigfox - notice 100 billion $ in agriculture #fb http://t.co/gJj04Qg9QU
613701053423316992,2015-06-24 13:31:47,Region le Loriet saves 3 mio. € a year in home care system by using #Sigfox network - can we do the same in Randers? http://t.co/1AZR2SREwh
613692505947660289,2015-06-24 12:57:49,Right now #Microsoft workshop as Denmark becomes the fifth full-country supporter of #SIGFOX’s IoT network http://t.co/i3nbnQTna3 via @Atmel
613691458411827200,2015-06-24 12:53:40,"Thomas Nicholls, #Sigfox promise total coverage of US and Europe in next 3 years + a couple of countries in Asia and Latin America"
613690153819750401,2015-06-24 12:48:29,Analysts forecast 3 billion LPWAN connections by 2023 surpassing total number of 2G/3G/4G connections ( not competing with these)
613681769406042113,2015-06-24 12:15:10,100-120 #Sigfox antenna will in mid 2016 provide at better coverage all over  Denmark than what is experienced with existing mobile networks
613678161453281280,2015-06-24 12:00:49,Ankommer på trods af DSB kl. 13:58 til #Sigfox / Iot Denmark seminar med start kl. 14 :-) (at @Microsoft Danmark) https://t.co/BrKgqKz5Np
613091602647642112,2015-06-22 21:10:03,Velfærdslisten (mis)bruger #Randers Byråd som kommunikationsplatform. Forslag stilles i sidste øjeblik - politisk resultat er ikke vigtigt
613073673570926592,2015-06-22 19:58:48,"@madsskoedt Noget beregningsteknisk giver den lille valggruppe en ekstra, og så må den store sætte en ekstra ind for at bevare flertal"
613073250705383424,2015-06-22 19:57:07,"Danish Fatboy on Wheels have passed Rob White, so now danish riders is number 3, 4, 5 &amp; 7 in #RAAM2015 #gørdetpåcykel http://t.co/EZiMXrJXIn"
613033008615026689,2015-06-22 17:17:13,Her er de nye udvalgsformænd/kvinder og næstformænd/kvinder eftr om konstituering i #Randers Byråd https://t.co/rWSdQdyNfu #dkpol
612719830450503680,2015-06-21 20:32:46,@jenspeterhansen Due to flooding near the Missouri and Mississippi River the @RAAMRaces route TS33 - TS36 was diverted.
612714707619848193,2015-06-21 20:12:24,What is happening here? A screen clip from Tractalis showing Zotter way off route in #raam2015 #fb http://t.co/8yQhQ5M0Dq
612686729187880960,2015-06-21 18:21:14,Omkonstituering? Hvad foregår der egentlig i #Randers? http://t.co/wZazFzka8o
612617630927732736,2015-06-21 13:46:39,David Haase is now entering Missouri 52 km in front of Strasser but 130 km behind Severin Zotter who is current leader in #RAAM2015 #fb
612215533698723840,2015-06-20 11:08:52,Interesting #RAAM2015 news: Rookie Severin Zotter have passed Strasser arriving as the first in Congress http://t.co/MVcQfimnrz
611872290448482304,2015-06-19 12:24:56,"Maj blev den varmeste nogensinde målt på kloden - men pyt, andre tager sig vel af den udfordring? #fbhttp://t.co/ORO4eZ6kJN"
611843952124276736,2015-06-19 10:32:20,"»Verden kan leve uden Danmark, men Danmark kan ikke leve uden verden.« Kim Nøhr Skibsted, Grundfos.http://t.co/H3YyEe8ahm"
611621925052383232,2015-06-18 19:50:04,Ser ud til at blå blok er på vej til at vinde en Pyrrhus sejr :-( #fb
611452191379976192,2015-06-18 08:35:37,Godt tilbud der er til at få øje på: Lån en cykel i tre uger fra #randerscykelby. Set i Spentrup. http://t.co/4D12B7BUGL
611155585032130560,2015-06-17 12:57:00,"@Dalixam @cyklistforbund Kampen går fint i #Randers Årets Cykelkommune 2013. I Byråd sagde V ja til høj godtg. for cykelbrug - S, R &amp; SF nej"
610776882183831552,2015-06-16 11:52:11,Demo at SEGES of Sigfox LPWAN.  120 antennas as this will cover whole Denmark. Farming should pay interest #ldkviden http://t.co/FRaHPFcYXd
610069009304825856,2015-06-14 12:59:21,"Her er noget, som dansk landbrug absolut bør have fokus på: #SIGFOX Network to Connect Denmark http://t.co/KvLte5KKwA #ldkviden"
610062929283653632,2015-06-14 12:35:11,"Vejledning i om du skal stemme socialistisk eller liberal ud fra holdning til konsekvensløshed, centralisering, vækst http://t.co/1Kb5A9uBMb"
609708608335556608,2015-06-13 13:07:14,"Hovedstadsområdet har væsentligt lavere skat og væsentligt bedre service, Randers-borgm. Claus Omann Jensen (V).#fmdk http://t.co/VsoYsuCdRA"
609413543386054657,2015-06-12 17:34:45,"En populær stand - i dette telt lytter vi til relevante diskussioner,  der skylles ned med velbrygget øl #fmdk http://t.co/Rty9CGRWVd"
609410516780515328,2015-06-12 17:22:44,"""Vi mangler politiske med nosser - vi skal have ordentlige forbindelser"" sagt af fmd. for landsbyerne i Aalborg. #fmdk"
609409489524146176,2015-06-12 17:18:39,Kreative forslag: Lad Google overtage netdæknig - flyt DI hovedsæde og diverse styrelser til udkantsdanmark - så vel der ske noget. #fmdk
609408805990977536,2015-06-12 17:15:56,"Seks diskuterer net i udkantsdanmark - Adam Lebech,  DI ITEK, står alene i sin insistering på markedskræfter. #fmdk http://t.co/0rICmysDM7"
609407096883298304,2015-06-12 17:09:08,"Den digitale udvikling fortsætter hvorfor højhastigheds net er afgørende for vor velfærd siger Jørn Guldberg,  IDA bestyrelsen.  #fmdk"
609404468870955008,2015-06-12 16:58:42,DIREKTE på #Periscope: Netdækning i udkantsdanmark https://t.co/wgzPUIC9Se
609403680723456000,2015-06-12 16:55:34,"Michael Jensen, AAU: Statens opgave er vel at træde ind hvor markedet ikke sikrer netdækning.#fmdk"
609402990085165056,2015-06-12 16:52:49,Fornuft fra Hans Peter Dueholm: Forretningscase for netdækning skal ses i et større samfundsmæssigt perspektiv. #fmdk
609401896474923008,2015-06-12 16:48:28,"Jeg siger til Adam Lebech, DI ITEK: Hvordan er uinteressant blot der kommer net i udkantsdanmark Markedet gør det ikke alene. #fmdk"
609400663269855233,2015-06-12 16:43:34,"Ole Lehman Madsen: Det er ikke markedet der bestemmer om der skal være veje, el &amp; vand. Samme burde gælde for netdækning. #fmdk"
609371556796583936,2015-06-12 14:47:55,"Betryggende at høre, at Rådet for Digital Sikkerhed er en privat organisation, så de forhåbentlig ikke har magt som agt. #fmdk"
609365774113865728,2015-06-12 14:24:56,"Zornig: Måden vi lagrer data er styret af hvordan vi har organiseret os med kommuner, region og stat frem for nyttevurdering. #fmdk"
609363421465808896,2015-06-12 14:15:35,"Birgitte Kofod Olsen, Rådet for Digital Sikkerhed: Bliver bange ved at høre ønsker om data samkørsel. #fmdk"
609362813409214464,2015-06-12 14:13:10,Udbetaling fejludbetaler 2 mia pr. år pga manglende datasamkørsel med f.eks. Skat. Udbetaler ialt 210 mia. #fmdk
609362235903840256,2015-06-12 14:10:53,Zorning: I England bruges data til på forhånd at spotte udsatte familier. Må myndigheder bruge dine data? #fmdk http://t.co/8tWPBjYQ34
609354076661370880,2015-06-12 13:38:27,Big data er for kvinder! Ved Kraka's big data event kommer spørgsmål (relevante spg) til panelet alene fra kvinder (mig undtaget) #fmdk
609350650602881024,2015-06-12 13:24:50,Big Data panel er lidt naive omkring hvem der scorer gevinsten.Monsanto scorer kassen med deres FieldScript http://t.co/dhFhI65yxG #fmdk #fb
609346753112997889,2015-06-12 13:09:21,Et godt tilbud på Kampeløkke Havn: Få vejledning af en professionel pendler-coach. #fmdk #gørdetpåcykel #fb http://t.co/xTPccaJ3lQ
609343487587287041,2015-06-12 12:56:23,"Kraka's big data event fylder teltet så rigelig. Panel med DTU, KU/Stanford og Damvad. #fmdk #fb http://t.co/NmxOtiwUVv"
609339824189874177,2015-06-12 12:41:49,"Hvotfor har man undladt at opsætte de ""trekantede"" pissoirs, som ellers bruges når mange mennesker er samlet? #fmdk"
609334519037063168,2015-06-12 12:20:44,Vi skal nudge pendlerne ud af bilerne er budskabet fra Supercykelstier. #fmdk #gørdetpåcykel http://t.co/6qiydApzGY
609325821006848000,2015-06-12 11:46:11,"Peter Tuborgh: Problemet i DK er ikke miljøkrav men de alt for langtrukne processer. Helt enkle ting, der ikke koster noget at ændre. #fmdk"
609323562986553344,2015-06-12 11:37:12,"Anders Krab-Johansen (forfatter til ""Vi vinder når vi vågner""): Mange af os aner intet om hvordan erhvervslivet fungerer #fmdk"
609319373317275648,2015-06-12 11:20:33,"Kjeld Johannesen, Danish Crown: Vi skal leve af de områder der har økonomisk vækst hvilket især vil sige Asien og Sydamerika #fmdk"
609317618881830912,2015-06-12 11:13:35,Peter Tuborgh: Er skuffet over at diskussioner går på hvordan vi bruger velfærd frem for hvordan grundlag for velfærd skabes #fmdk
609316426508312576,2015-06-12 11:08:51,"Irriterende mange til Landbrug &amp; Fødevare's Hvad gør vi i DK, når vi vågner af søvnen? #fmdk http://t.co/n86guY7VVS"
609312593438711808,2015-06-12 10:53:37,Rådet fra tre borgmestre om alternativ lokaldemokrati: Glem alt om repræsentativ valg af borgere til fora og udvalg - vælg ift behov #fmdk
609311647266684928,2015-06-12 10:49:51,Voldsomt generende larm af helikoptere over Folkemødet - er det pressen? Brug dog en drone #fmdk
