id,created_at,text
463359064571793408,2014-05-05 16:46:24,"Rune din Brøndby taber, få dig et arbejde og betal selv. Næste nomineret er Frederik Just Blangsted, Thomas... http://t.co/kQT54YH2zA"
463323720439058432,2014-05-05 14:25:57,Check out my professional profile and connect with me on LinkedIn. http://t.co/4EXwSasomm #in
463189969784172544,2014-05-05 05:34:29,I posted a new photo to Facebook http://t.co/YOtf8bLg47
463065518157885440,2014-05-04 21:19:57,"#koegepol #dkpol Ved at adskille bestiller rollen fra udbyder rollen, opstår en sund og oprigtig konkurrence... http://t.co/OkEmvdems8"
463057146230603776,2014-05-04 20:46:41,Frihedsbudskabet 4 Maj 1945. Johannes G Sørensen fra BBC..wmv http://t.co/LZZ55JP5F7
463034863554424832,2014-05-04 19:18:08,http://t.co/fKEXormrkw
463030652536119296,2014-05-04 19:01:24,"Havde egentlig som 40 årig rationelt menneske som havde fundet roen i mit liv med kone og børn....Men på en... http://t.co/xZibT3YCSN"
463000835870715904,2014-05-04 17:02:56,Fornuftigt http://t.co/vov6VFhMWJ
462887460062887936,2014-05-04 09:32:25,Jeg har det fundamentalt svært med at straffe folk for at gøre en ekstra indsats i livet. Der med min holdning... http://t.co/68YxosQyx9
462878212734070784,2014-05-04 08:55:40,Søndag formiddag i danevang http://t.co/nF9Mo7jjYo
462878206937530369,2014-05-04 08:55:39,Søndag formiddag i danevang http://t.co/RpCapt06DM
462878205633105921,2014-05-04 08:55:38,Søndag formiddag i danevang http://t.co/gc9ngwQLMF
462878204026703872,2014-05-04 08:55:38,Søndag formiddag i danevang http://t.co/eudtiW6rEO
462878202709684224,2014-05-04 08:55:38,Søndag formiddag i danevang http://t.co/hOJgaDOlrX
462470186067832833,2014-05-03 05:54:19,Så tankes der op inden spejder lejr http://t.co/tiPEShPzin
462310286754844673,2014-05-02 19:18:56,Putin tilbyder Qvortrup asyl http://t.co/V4FfJPnUTg
462304370076688384,2014-05-02 18:55:25,"Ifølge Skat får man som udlænding adgang til en række danske fradrag - heriblandt håndværkerfradraget, som man... http://t.co/Bsjps0k0t7"
462267617710202880,2014-05-02 16:29:23,Venter på min pung󾌯 — hos Netto Bjæverskov http://t.co/sTphL1aYWu
462161273375842304,2014-05-02 09:26:48,Kom til Costa del Køge :-) http://t.co/q2hji8WgXR
461986561295675392,2014-05-01 21:52:34,Spændende udvikling........ Er det en tekninsk social dumpning? http://t.co/AxBrGxJNqH
461974451945758720,2014-05-01 21:04:27,"#selvsving skal vi nu ikke lige blive enige om at det er nogle umoralske mennesker, og ikke niveauet af... http://t.co/4q96zsaVtg"
461964960994963456,2014-05-01 20:26:44,Jeg har slået et nyt billede op på Facebook http://t.co/g3Lvoix05C
461950296307302400,2014-05-01 19:28:27,Live Webinar with Coop Danmark: http://t.co/ICPHPOauUl
461849739638476801,2014-05-01 12:48:53,Loyalitet http://t.co/qjGF2sVOW0
461844361907433472,2014-05-01 12:27:31,Hverdag i Bjæverskov http://t.co/pug4LAk0dj
460521833524367361,2014-04-27 20:52:15,"Store visioner fra SF, et nyt højde punkt i kampagne førelse. Jacob håber at ikke i er så skarpe hernede i Køge :-/ http://t.co/32kGDNX1tX"
460490158438350848,2014-04-27 18:46:23,Mit lille filosofiske citat i uligheds debatten. Tilbage til Rolf og LA http://t.co/N0nFe25dym
460484038051262464,2014-04-27 18:22:04,Det ser ud til at vi skal have en valgkamp med sagligheden i top...... http://t.co/d81XZ5i8oM
460454076774612992,2014-04-27 16:23:01,Det er noget rod http://t.co/cQa54GSD12
460414654770982915,2014-04-27 13:46:22,Sådan Malte Lindberg flyvende eftermiddag. http://t.co/wIdNiz1DRn
460414654615801856,2014-04-27 13:46:22,Sådan Malte Lindberg flyvende eftermiddag. http://t.co/D7dn3kM8Xh
460414653579788289,2014-04-27 13:46:22,Sådan Malte Lindberg flyvende eftermiddag. http://t.co/bBFe0T67ZN
460414653525274624,2014-04-27 13:46:22,Sådan Malte Lindberg flyvende eftermiddag. http://t.co/9kkbNmDvIr
460374397350850561,2014-04-27 11:06:24,Malte under ind march til sin første gymnastik opvisning http://t.co/dhMg3N36wI
460373673887551489,2014-04-27 11:03:31,Gymnastik opvisning 2014 http://t.co/a6oL7DXsB4
460149811636076544,2014-04-26 20:13:58,http://t.co/M8Q2cCbqVj
460148257252208640,2014-04-26 20:07:48,"Start your journey to the new normal http://t.co/SJEP8y7gmo"
460146219256672257,2014-04-26 19:59:42,#apm  http://t.co/Uoj388VMLA
460001705376378880,2014-04-26 10:25:27,Forklaring på hvor fulde mennesker er super skarpe :-/ http://t.co/PWc8DCukrQ
459773450106990593,2014-04-25 19:18:27,Fandme et mirakel at lande til tiden fra Heathrow - føler sig begejstret her: Copenhagen Airport (CPH) http://t.co/pDuE74qstK
459723500085719040,2014-04-25 15:59:58,Man må nøjes http://t.co/vEKTi22ek9
459719250018861056,2014-04-25 15:43:05,Hjem til familien - føler sig super godt tilpas her: Heathrow Airport http://t.co/oixV3tSz8b
459395842890141696,2014-04-24 18:17:58,Bliver aldrig god til at kører bil uden rat. http://t.co/8ukPBMkiW0
458943361291149312,2014-04-23 12:19:58,rejser til Maidenhead fra Copenhagen Airport (CPH) http://t.co/Lum6AL8U0z
458475694033743872,2014-04-22 05:21:38,http://t.co/vKKE7vY8c1
458296846268760064,2014-04-21 17:30:57,"Rebekka mangler 464,- kroner (af hendes egenbetaling) for at komme på drømme hestesommerridelejr.Hun kan slå... http://t.co/VKfzr1CI2r"
457994887116652544,2014-04-20 21:31:04,I posted a new photo to Facebook http://t.co/gwBCSU1fhZ
457828399860707328,2014-04-20 10:29:31,Lader op til endnu en påskefrokost i familiens skød — hos FamLindberg http://t.co/k8R8GnVXFX
457475646038757376,2014-04-19 11:07:48,Live Webinar with Coop Danmark: http://t.co/AjB87vkcol
456690874210979840,2014-04-17 07:09:23,"Efter Nikoline har fortalt hvorfor vi fejre påske, nævner jeg at jeg også elskede at hører om gamle i skole.... http://t.co/A9WEQvBile"
456688936715173888,2014-04-17 07:01:42,Godmorgen http://t.co/2HCnXP6fqj
456481941793951744,2014-04-16 17:19:10,Aah ferie — hos FamLindberg http://t.co/woIygioiPI
456142707795427329,2014-04-15 18:51:10,RT @AndersFoghR: #Russia’s aggression against #Ukraine shows that we cannot take our security for granted
455804402759385089,2014-04-14 20:26:52,I took Zimbio's 'Lord of the Rings' quiz and I'm Gandalf! Who are you? http://t.co/4Iu22PKGiq
455804300925861889,2014-04-14 20:26:28,I took Zimbio's 'Lord of the Rings' quiz and I'm Gandalf! Who are you? http://t.co/UbUqLZaW6J
455804291518062592,2014-04-14 20:26:26,Spot on http://t.co/54XrLTGssE
455705812376113152,2014-04-14 13:55:06,"Se det brokker de sig sgu ikke over, ude i den pæne verden..... :-) http://t.co/JhBGNPfvm6"
455282853832835072,2014-04-13 09:54:25,Erik Swiateks 65 års fødselsdags reception — hos Hugo's Kælder http://t.co/6bmx5GXrUv
454690987122884608,2014-04-11 18:42:33,Sync your Timeouts: When Load Balancers Cause Database Deadlocks http://t.co/mRPOwtV9Iq
454653057109065728,2014-04-11 16:11:50,"20 timers politik, 40 timers arbejde så er der flueben ved uge 15."
453962910189252608,2014-04-09 18:29:26,Ud og hjem på 12 timer det er sgu effektivt — hos Copenhagen Airport (CPH) http://t.co/Eh66FwOTn0
453921324042567680,2014-04-09 15:44:11,"Har netop set svensk presse gå i selvsving over en talsmand fra færgeselskabet Silja Line. Hans udåd bestod i,... http://t.co/fzyYOoRx4O"
453906760529879040,2014-04-09 14:46:19,For Jari http://t.co/99MExtbp7s
453900034237804544,2014-04-09 14:19:35,"Det var den dag 😎 – rejser til Bjæverskov, Roskilde, Denmark fra Stockholm-Arlanda Airport: Terminal 5 http://t.co/TUyRX1jFIV"
453885249232338944,2014-04-09 13:20:50,Næste møde og så hjem — hos Stockholm C http://t.co/LmWKSA2Avr
453652345138606082,2014-04-08 21:55:22,"Rasmus Ankersen i Skovbohallen, Bjæverskov http://t.co/LQ5h8nY9ad"
453652052845944832,2014-04-08 21:54:12,http://t.co/RAvrLuFG7X http://t.co/jMeGHnwa3Z
451459348665868288,2014-04-02 20:41:11,Dagens møde blev holdt i 22 graders varme http://t.co/yPy56OTcC2
451459348309368832,2014-04-02 20:41:11,Dagens møde blev holdt i 22 graders varme http://t.co/af11uqvCOH
451459347910901760,2014-04-02 20:41:10,Dagens møde blev holdt i 22 graders varme http://t.co/EudJXxpPD6
451458072859660289,2014-04-02 20:36:06,"Gaaaaab – rejser til Bjæverskov, Roskilde, Denmark fra Copenhagen Airport (CPH) http://t.co/T9nk3h89QB"
451243228298481664,2014-04-02 06:22:23,Dagens indlæg holdes her http://t.co/4ueSzPlyA0
450963699637813248,2014-04-01 11:51:39,21 grader og sol — hos Brussels Airport (BRU) http://t.co/CgcJvJl063
450529805427945472,2014-03-31 07:07:30,http://t.co/uNzPb01poq
449862092380987392,2014-03-29 10:54:15,"Mit navn er Jeppe og jeg reflektere lige nu. God og ærlig artikel. http://t.co/X1GPGjArYM"
448495168652857344,2014-03-25 16:22:35,Byrådsmøde hvor Helle P gir den gas med sunde V værdier om hvorfor Vemmedrup-Lellinge Dagpleje skal bestå — hos... http://t.co/DMLARGpUWq
447634976096649217,2014-03-23 07:24:29,Til Mads  med håb om du overlevede KULM :-) http://t.co/5XSQ5bGZX0
447633218884218880,2014-03-23 07:17:30,"Så er der bold med Rolf , Baron Frank  og Lars Hall Friis Farsøe HB Køge - Marienlyst kl 15. Ses vi? — hos... http://t.co/qUQRh9tfIU"
447624749066489856,2014-03-23 06:43:51,"""Giv en mand en fisk, og du fodrer ham for en dag. Lær en mand at fiske, og du fodrer ham i en menneskealder.""... http://t.co/cyv3UBN2uS"
447456458876403712,2014-03-22 19:35:07,"Søren Pind i Borupkulturhus. Kom og hør hans anekdoter om livet som politiker, entertainer og meget mere ..... http://t.co/xpr8sTktcc"
447355302921641985,2014-03-22 12:53:10,Familie fodring — hos Carl's Jr. http://t.co/sBrJJXfeAx
447288500850028544,2014-03-22 08:27:43,Fogh talte dunder til Rusland http://t.co/fLnBG0Y5tK
447007009913987072,2014-03-21 13:49:10,"Snart hjemme — hos Statoil, Stop 39, Slagelse http://t.co/kK7H6WVOkf"
446978418610298880,2014-03-21 11:55:34,Det er vigtigt at kommunerne selv kan styre sin udvikling.... http://t.co/vKSngr0v2V
446967719615672320,2014-03-21 11:13:03,#koegepol Venstres delegeret suser hjem efter et super KL Topmøde i Ålborg. — hos E45 http://t.co/AetVJsqPHM
446749722636595200,2014-03-20 20:46:48,Jeg har slået et nyt billede op på Facebook http://t.co/gaJ6JrNB2q
446749721567035392,2014-03-20 20:46:48,Jeg har slået et nyt billede op på Facebook http://t.co/11VGdByuad
446749721193754624,2014-03-20 20:46:48,Jeg har slået et nyt billede op på Facebook http://t.co/99l5MeQdny
446749720795709441,2014-03-20 20:46:48,Jeg har slået et nyt billede op på Facebook http://t.co/gQCx5AgIJ3
446749719818424320,2014-03-20 20:46:48,Rene gættede en udkants kommune (Kbh) ved Anders Lunds udkants quiz
446738638617849856,2014-03-20 20:02:46,KLs nye indpisker 󾌰 http://t.co/CUZZx650uN
446680787271024641,2014-03-20 16:12:53,Mareridt- Fandt mig selv midt i Enhedslistens landsmøde 󾌯 !!! Så tager altså hellere en tur på hotellet 󾰀 http://t.co/fgDbqRxjg1
446639273127985152,2014-03-20 13:27:55,@J_Hesselberg pas nu lidt på fruen ;-)
446639201237602304,2014-03-20 13:27:38,"@J_Hesselberg #koegepol masser, følg du bare med i Køgepol."
446637530847666178,2014-03-20 13:21:00,"@J_Hesselberg #koegepol Beklager ordvalget :-) men hvis vi ikke konkurence udsætter, får vi ikke trykprøvet prisen vi betaler for ydelserne"
446636012899672064,2014-03-20 13:14:58,@J_Hesselberg #koegepol Vi skal sikre at vi får det vi betaler for. Jeg er ligeglad med om det er kommunal leverandør eller et A/S
446610088388984832,2014-03-20 11:31:57,"We need you....http://t.co/MoLOBymVmU http://t.co/6DyG49laMc"
446598851471114240,2014-03-20 10:47:18,#koegepol I den kommende tid skal vi til at tale Velfærds shopping. Vi skal konkurenceudsætte dele af sundhedsområdet.
446589169608163328,2014-03-20 10:08:49,#koegepol En menig politiker i Køge får omkring 5500 kr om måneden for det der ligner en 20 timers arbejdsuge.... http://t.co/MYbp2GeS3I
446585540998344704,2014-03-20 09:54:24,#koegepol Margrete Vestager tager byrådsmedlemmers vederlag op under sin tale her #kltop14
446585062122061824,2014-03-20 09:52:30,#koegepol #kltop14 Gruppemøde med Venstres gruppe. Føler sympati for Jacob Mark
445998293739642880,2014-03-18 19:00:54,Nu bliver den tricky forsinket 65 min. Tilgengæld er jeg i CPH på 20 min 󾌯 http://t.co/oFGlOqzbew
445992425086263297,2014-03-18 18:37:34,Sidst jeg fløj hjem fra Amsterdam endte jeg i Finland. Det startede med en forsinkelse på en time󾰬 http://t.co/EK8mvNi7cy
444800457966628864,2014-03-15 11:41:07,Bssiiiim http://t.co/GTIbKMfHog
444800457060651008,2014-03-15 11:41:07,Bssiiiim — hos Køge Torv http://t.co/XMDnHsXx8C
444736662329753600,2014-03-15 07:27:37,Liberalisme – mere end rå egoisme http://t.co/dESagNem4N
444558465953177601,2014-03-14 19:39:32,Tak for bøf Jannie
443685646948139008,2014-03-12 09:51:16,Det IKKE en kommunal opgave at agerer betalte rejsekammerater for borgere der ikke falder under nedenstående... http://t.co/7R2Z7dnMut
442354101889019904,2014-03-08 17:40:11,"Saltvand til ældreområdet....https://t.co/1MaxOXSwlb"
442211485545406464,2014-03-08 08:13:28,"En god saltvands indsprøjtning, her inden vi skal i gang med at lægge budget. http://t.co/xA8lVWfIvl"
442027956731666432,2014-03-07 20:04:12,"RT @PalleSvendsen: I dagens udgave af Dagbladet Køge, er der et stort interview med Social- og Sundhedsudvalgsformand Jeppe H... http://t.c…"
441549590538760192,2014-03-06 12:23:20,@jeppelindberg: #performglobal14 APM Associate Cert available. Come by CSO both to learn more http://t.co/wUUeYfI1GF
441537617734430721,2014-03-06 11:35:46,"#performglobal14 @andreasgrab quotes, DevOps is Roll Forward not back"
441502601444872192,2014-03-06 09:16:37,#performglobal14 great crowd in Helsinki Kingfisher talks of their succes's with APM http://t.co/cJrkBz1l1v
441226268239872000,2014-03-05 14:58:34,"Min politiske kollega, private ven og hele Køges guide gennem den nye folkeskole reform. http://t.co/2ULhdinfC4"
441214891584937984,2014-03-05 14:13:22,"Det er dejligt at se at vi bliver færre rygere i Køge. Men det er bekymrende at se at vi bliver tungere og... http://t.co/3PdPKs4yf9"
438451349790134272,2014-02-25 23:12:02,"Formandskifte i Venstre i Køge. Tak til Bodil for de travle år, det er noget af nogle stilletter den nye formand... http://t.co/euuVfSZJT0"
437517392026304512,2014-02-23 09:20:49,Hmmm søndag http://t.co/TYmJGAIDjB
437321439243685888,2014-02-22 20:22:10,"Sådan siger en man så op, og sådan respondere man på det som chefen….. http://t.co/6E1gVjEND5"
437307270612156416,2014-02-22 19:25:52,Er det bare mig? Er det her ikke en af de fedeste live koncerter der givet af et dansk band? http://t.co/j7JP8J0ks6
437148036373164033,2014-02-22 08:53:08,Fornuft med et godt stænk humor http://t.co/oFw7hxqPNT
437147924469133312,2014-02-22 08:52:41,Fornuft med et godt stænk humor http://t.co/9XibqAMeKD
437136710666031105,2014-02-22 08:08:08,Dagbladet i dag. Portræt af en Venstre mand med humor (jf. Journalisten) 󾌰 http://t.co/GnIGKMMqIx
436257893768495105,2014-02-19 21:56:01,24/7 APM University. Get your APM Certification http://t.co/8J6kwXW2fP
436256480095125505,2014-02-19 21:50:24,APM Industry Certification proves competence and empowers organizations and APM professionals to increase their APM …http://t.co/CinX9EMtRu
436254084535181313,2014-02-19 21:40:53,RT @compuware: Compuware APM Announces 2013 Best of the Web Award Winners - http://t.co/arZejJ2omM
436251049910083584,2014-02-19 21:28:50,Tell me and I forget. Teach me and I remember. Involve me and I learn.
436197251044876288,2014-02-19 17:55:03,"Men man skal skrive bøger i eget navn, for at blive taget seriøst. http://t.co/pysF9gxRtO"
436106170374569985,2014-02-19 11:53:08,@KaldmigFelt @J_Hesselberg @SoerGom gode vandrør ;-)
436105573206339584,2014-02-19 11:50:45,@J_Hesselberg @KaldmigFelt @SoerGom snart
436105553400844288,2014-02-19 11:50:41,@J_Hesselberg @KaldmigFelt @SoerGom du tillægger mig større magt over medierne end jeg har. Men mon ikke der kommer afklaring om detaljer
436090215460261888,2014-02-19 10:49:44,"@KaldmigFelt @SoerGom Tyv tror hver mand stjæler. Jeg vil derfor slutte med dette, da min hensigt misforstås. Bevist eller ubevist"
436088985304440833,2014-02-19 10:44:50,"@KaldmigFelt @SoerGom Jeg stopper gerne med det, men syntes i fairnesss over for Randi og Lissie er jeg ville poste det.."
436088145340534784,2014-02-19 10:41:30,@KaldmigFelt @SoerGom eeh nej jeg har aldrig snakket om besparelser ifbm dette her. Læs lige artiklerne før på ugen kammerat.
436086269177634816,2014-02-19 10:34:03,@KaldmigFelt @SoerGom Var forøvrigt i Oslo i sidste uge
436086184674988032,2014-02-19 10:33:43,@KaldmigFelt @SoerGom Ikke min opgave at læse korrektur. Men hvis du kan magte at læse bagud ser du kilden: Pårørende og brugere
436085288561942528,2014-02-19 10:30:09,@KaldmigFelt @SoerGom Hvad er det du vil opnå Rasmus? er du ikke glad for at der er kommet en løsning?
436084181907431424,2014-02-19 10:25:45,"@KaldmigFelt @SoerGom Nej, jeg forholdte mig til løsningen, årsagen har været rent gætværk fra brugerne, der rent faktisk startede dette"
436080233981419520,2014-02-19 10:10:04,"@KaldmigFelt @SoerGom vejen til helved er brolagt af folk der troede, tænkte og dragede forkerte konklusioner"
436077713640943616,2014-02-19 10:00:03,@KaldmigFelt @SoerGom Er Socialdemokraterne uenige med DB's indhold må de tage kontakt til DB. Jeg forholder mig til Serviceniveauet i KK
436073395311366144,2014-02-19 09:42:53,"@SoerGom jo, herunder ældre med hjerneskader"
435881051768889344,2014-02-18 20:58:35,Faldt lige over denne og lad mig i al anstændighed og til min forgængers forsvar slå fast. Det var pga. af budget... http://t.co/8oJx4GmCHM
435864244366901248,2014-02-18 19:51:48,Faldt lige over denne og lad mig i al anstændighed og til min forgængers forsvar slå fast. Det var pga. af budget... http://t.co/iydVSFjzmi
435525288119001089,2014-02-17 21:24:55,RT @Kristian_Jensen: .@anderssamuelsen tja - EL og SF er  imod. S og RV tøver med at støtte deres egen kommission. V er glad for støtten ti…
435425372247973888,2014-02-17 14:47:53,Det er ikke så vigtigt hvem der levere. Men at vi får den bedste service for pengene er super vigtigt.... http://t.co/uqUhvrA8J6
435391742222024704,2014-02-17 12:34:15,#koegepol jeg er vild med disse kommissioner http://t.co/RTGGYAAZAe
435385136767463425,2014-02-17 12:08:00,http://t.co/HXtg1NRWRn
435190732048302080,2014-02-16 23:15:30,Nåede så lige at smadre  mig selv på cyklen. Ikke været på den siden 4 uge før KV13. Ikke smart at lægge ud med... http://t.co/krp92QkaZo
435030163659980800,2014-02-16 12:37:28,@KaldmigFelt @jeppelindberg #koegepol og AE hvad har de så gjort for at få det til at se ud som nulvækst?træk lige hoved op af hullet struds
434984591510622208,2014-02-16 09:36:22,imm024 http://t.co/xm4jnUpdGL
434980350234591232,2014-02-16 09:19:31,imm015 http://t.co/VbLhwGIqqx
434980155274977280,2014-02-16 09:18:45,imm025 http://t.co/FDQZIlDq9f
434370922166747137,2014-02-14 16:57:52,Det er ikke i Venstres ånd at forringer tilbud til dem der behøver. http://t.co/lFG4jxIpKi
433939590140141568,2014-02-13 12:23:55,Sådan skal den flyver sættes ned. Foråret er ikke helt kommet til Oslo. Det vælter ned med sne. http://t.co/VMiHm2sKIY
433893637324566528,2014-02-13 09:21:19,Velfærdsmassakre ordene var stærke #koegepol #dkpol http://t.co/WsWxSHYamV
433687927042756609,2014-02-12 19:43:54,"Dette er ihvertfald ikke en menu der er tilberedt i et af Venstres i Køge's køkkener. Jeg blev gjort opmærksom... http://t.co/y8GEeMPxCD"
433667708874264576,2014-02-12 18:23:33,Danish rationalism meets British outrage…. What do you think are danes to cynical? http://t.co/T4yq1oyUSU
433354844875681793,2014-02-11 21:40:21,"Hvis vi skal kunne holde den gode velfærd i samfundet om, 5-10-15-20 år, er det vigtigt at vi forholder os til... http://t.co/ArdLQXq03E"
432624342338240513,2014-02-09 21:17:35,"#koegepol  #dkpol Køge Kommune søger 9,7 mio. til løft af ældreområdet http://t.co/3Fb9RLTAdJ"
432616135536549888,2014-02-09 20:44:58,@SoerGom @VenstreKoege #koegepol Ha ha ha NEJ. Men det er et liberalt parti og folk må selv tage ansvar for deres helbred ;-)
430836985645637632,2014-02-04 22:55:16,"#koegepol Langt S&amp;S møde, der hvor der kan samarbejdes bredt gør vi det. Tak til @doraolsen13 for konstruktive inputs til ældrepuljen."
430779848236486656,2014-02-04 19:08:13,#koegepol Er netop blevet formand for Social &amp; Sundhedsudvalget (igen)
429954376191725568,2014-02-02 12:28:06,"Kanalrundtfart..... Har en masse billeder fra i går, der skal renses væk http://t.co/4oJv8S2Qsz"
429620452349468672,2014-02-01 14:21:12,"Heeeere we go again. Kl 16:00 skal vi være kulturelle http://t.co/yJNC9FnLvL"
429580046232465409,2014-02-01 11:40:38,Er jeg beruset eller er husene i Amsterdam vind og skæve http://t.co/zEjS8Ja3L4
429211621928747008,2014-01-31 11:16:39,Selvom man er sjælden gæst er man ikke glemt på jobbet http://t.co/oTlLbtmkdX
428624675128631296,2014-01-29 20:24:20,Drinking Our Own Champagne: Improving Data Center RUM Performance with PurePath Technology http://t.co/3v0kdHi08k
427532453239328768,2014-01-26 20:04:14,http://t.co/kZfw5zM8Nd http://t.co/3Fr2EbQTY2
426839242514653185,2014-01-24 22:09:40,Budget træningen i KLs træningslejr http://t.co/ybhXQSBoT9
426765944199716864,2014-01-24 17:18:24,En RET skuffet 3F'er (se portion størrelse) http://t.co/dHOr5k2dVF
426756063049027584,2014-01-24 16:39:08,@SoerGom #koegepol Søren der kommer masser af den nære sundhed og forebyggelse på programmet. Meget snart vi kan ikke være mere enige.
426741826507505664,2014-01-24 15:42:34,"En af udfordringerne nu og i fremtiden, der truer den danske velfærd er vores stigende levealder. http://t.co/aGosOho84w"
426105357304606720,2014-01-22 21:33:28,"Da internettet gik ned i Kina, var vi på plads. Læs min kollega Heikos analyse http://t.co/WrdzHN7t4W"
425990827169824768,2014-01-22 13:58:22,We solve problems before they happens.... The revolution is Under way http://t.co/pPt2BcL8ow
425989833086238720,2014-01-22 13:54:25,"Faster, Better and Smarter http://t.co/Z8Fcbis5ZZ"
425983270275518464,2014-01-22 13:28:20,SAP er en tung investering. Vi sikre at den også performer http://t.co/F07Pg5d289
425571891202387968,2014-01-21 10:13:40,@koege_politik Niveauet er højt :-)
425570880346161152,2014-01-21 10:09:39,"By giving your employees a ""Freedom Pass"" you will experience not only satisfaction from you team, but grow your mar…http://t.co/DWmMUKii2u"
424628666510110720,2014-01-18 19:45:37,@SoerGom forklar det uansvarlige?
423370039077912576,2014-01-15 08:24:17,"@KaldmigFelt @casperfelt vi sidder aldrig ned, så vi ses på banen"
423366838652006400,2014-01-15 08:11:34,"@KaldmigFelt @casperfelt Virkeligheden rammer nok snart Rasmus, og der igennem ser vi hvordan terningerne lander."
423342849158295552,2014-01-15 06:36:15,@casperfelt @KaldmigFelt du snakker sort Felt
423229618246914048,2014-01-14 23:06:18,@casperfelt @KaldmigFelt du må da egentlig gerne forklare hvad du mener der er ændret i Venstres holdning?
423229386150916096,2014-01-14 23:05:23,@KaldmigFelt vi har nu de samme holdninger som før valget. Men som du ved så skal man kunne samle et flertal før man kan køre 100%
423207518094241792,2014-01-14 21:38:29,@casperfelt @KaldmigFelt #koegepol Forklar?
422430894964871168,2014-01-12 18:12:28,@SoerGom kommer i dagspressen :-) hvis det er foredraget du søger mere Info om. Ellers skriv mig en mail. (162 karakter grænsen)
422429293063725056,2014-01-12 18:06:06,@SoerGom #koegepol kom i Teaterbygningen og hør om K.R.A.M d. 11. Feb..
419985506513207296,2014-01-06 00:15:22,Kom til Nytårsbrunch med Venstre i Køge. http://t.co/IEqrc7mM9o
419460059031019522,2014-01-04 13:27:25,@KaldmigFelt Den lå lige til højre benet ;-)
419458064962428928,2014-01-04 13:19:30,@KaldmigFelt Tror alle vil fryse i -18 grader.
418859709060644864,2014-01-02 21:41:51,Det betyder noget at være høflig http://t.co/nCoyY3sB6e
417991205084233728,2013-12-31 12:10:43,Nogen gange kan man ikke lade være med at grine af folk. Jeg ved godt det er dårlig stil..... Men COME ON GUYS http://t.co/xFa9yUmDXW
417968837313572864,2013-12-31 10:41:50,Godt nytår #koegepol #dkpol
417954682410373120,2013-12-31 09:45:36,"HAPPY NEW YEAR. We are recruiting. Please share with your network http://t.co/VfS3TjUKFl"
417943397257986048,2013-12-31 09:00:45,http://t.co/BrCraqlJVj
417776837486317568,2013-12-30 21:58:54,Godt nytår min skønne kone..... http://t.co/m1TeLoNhmG
417353016845799424,2013-12-29 17:54:47,http://t.co/4KncJ80o30 http://t.co/gBE7At57mS
417249073511809024,2013-12-29 11:01:45,@KaldmigFelt @SoerGom @Spolitik @DanskDf1995 i samarbejder vel kun med dem der følger Jeres vilje. Godt Nytår
416693490248990720,2013-12-27 22:14:04,"De findes virkeligt.. De mennesker der mener, at de har ret til offentlig støtte fremfor, dem der virkelig har... http://t.co/KOhTwgEWnz"
416162365470932992,2013-12-26 11:03:34,Lader op til en god eftermiddag/aften i 2630 Taastrup.
416128057205067776,2013-12-26 08:47:14,"Har snart læst, Brian Holms bog ""Den sidste kilometer"" på to dage. Den er ret rå."
415853926899261440,2013-12-25 14:37:57,Vupti så er der lige endnu en arbejdsplads skabt... del gern. http://t.co/QMmqL1B7iQ
415248192981454848,2013-12-23 22:30:58,Vores 2014 teknologiske forudsigelseser. http://t.co/iGdlOEvzbi
414902457781993472,2013-12-22 23:37:09,@KaldmigFelt jeg bøjer mig 😳
414890656952090624,2013-12-22 22:50:15,@koege_politik Arbejdet bære lønnen i sig selv :-/ Forventet Køgebugt motorvejen er fri og ryddet i morgen tidlig.
414888750083485696,2013-12-22 22:42:40,Så er vi klar til endnu en dag på arbejdsmarkedet i morgen....
