id,created_at,text
585443647358902273,2015-04-07 14:06:57,Så levere Yahya Hassan en ny oneliner 'Vi har større tiltro til de tosprogede end vi har til de enøjede'. Den er da meget passende #dkpol
585309292221353984,2015-04-07 05:13:04,"Yes, så kender vi arbejdsgiverne igen. Vi skal have gang i byggeriet - med at opføre fattiggårde og genopfinde Kommandusen #dkpol"
585307972802347009,2015-04-07 05:07:49,"Gang i den i dansk politik! Glæder mig til farverige debatter, når den vrede unge mand ruller sig ud... #dkpol http://t.co/PdzwhfMQ8I"
585049056390557697,2015-04-06 11:58:59,Hov hov. Vi andre vil da også gerne vide det.... #dkpol http://t.co/0W6rdqHoO8
584804120642637824,2015-04-05 19:45:42,"Ikke så mærkeligt, når hun overtog en økonomi i bund @Timo67"
584611460753530880,2015-04-05 07:00:08,Trist besked sådan en søndag morgen. Klaus Rifbjerg er død. http://t.co/9KJLQpc3uk
584604377962389504,2015-04-05 06:31:59,"Igen taler Løkke økonomien ned i et sort hul. Til gavn for hvem? Ingen. Som et trodsigt barn skriger han DER ER KRISE, DER ER KRISE! #dkpol"
584251201950191616,2015-04-04 07:08:36,RT @AndersLadekarl: @danskrodekors mangler 60 værger til uledsagede flygtningebørn - læs mere på http://t.co/0XhRxJmqTS og RT gerne - tak #…
583996342441238529,2015-04-03 14:15:52,"Ok, fair nok @fol2690"
583955283044597760,2015-04-03 11:32:43,"Hmmm. Vidste ikke, at der var et ateist-politi, der kunne bestemme den slags @fol2690 @_jorgenegon"
583940419681132544,2015-04-03 10:33:39,@AsgerMan1 Tjah. Noget lokalt traditionelt med at kirkerne i Gundsømagle og Jyllinge har dannet rammerne for store begivenhed i min familie
583937965610704897,2015-04-03 10:23:54,Al den religionssnak gør mig rundtosset. Jeg er dansk. Ateist. Og medlem af Folkekirken. Hvad er jeg så? Dårligere eller bedre? Næppe #dkpol
583914593044561920,2015-04-03 08:51:02,De har ret. Jeg er glad! #IranskAtomaftale #dkpol http://t.co/XVEayUbhdO
583901749754355712,2015-04-03 08:00:00,Når vi forhindrer et ungt menneskes kriminalitet har vi hjulpet for resten af livet. Fantastisk udvikling! #dkpol http://t.co/dll7sZQ90t
583867588079398912,2015-04-03 05:44:15,Hurra. Så kom rammeaftalen om Irans atomprogram. Vi hæver sanktioner og forhandler videre om en endelig aftale #dkpol http://t.co/wJpdqwBNvj
583650948054130689,2015-04-02 15:23:24,"RT @Spolitik: Ny kampagne i luften. Danmark skal fremad, og vi skal videre #dkpol Tjek vores resultater på http://t.co/6sBoHFw0hF http://t.…"
583650778046451714,2015-04-02 15:22:43,Måske du lige skulle tjekke #ViSkalVidere kampagnen en gang til. Det er ikke løfter - det er RESULTATER @jacobjensenMF #dkpol
583647833800241152,2015-04-02 15:11:01,@SirSH_ @JensHusted Igen taler blå blok DKs økonomi ned i et sort hul. INGEN har gavn af det - og så er det i øvrigt løgn. #dkpol
583643619426492417,2015-04-02 14:54:17,Fra minus til plus. Skønt med optimisme i kongeriget. #ViSKalVidere #dkpol http://t.co/l2sSJumdeV
583637515002896384,2015-04-02 14:30:01,"RT @jesper_vh: Ny kampagne fra @Spolitik: Det går fremad i Danmark - 40.000 nye job og styr på økonomien, lyder budskabet #dkpol http://t.c…"
583534385946894336,2015-04-02 07:40:13,"Gå i krig med Tyrkiet? For at få en mand udleveret, som de ikke har? Tag dig sammen....@LyngeKurt"
583527569305292800,2015-04-02 07:13:08,"De glemmer den lille detalje, at jeg rejste sagen overfor Tyrkiets EU-minister i Istanbul for få uger siden. #dkpol http://t.co/ZcAb16XBMa"
583525307438751744,2015-04-02 07:04:09,Dagens Christiansborgquiz i @berlingske handler om lyserøde elefanter - stå på hovedet og se svaret. #dkpol http://t.co/ECbQzs1YpI
583258068613509120,2015-04-01 13:22:14,DF er allieret med det yderste højre i USA og Israel når det gælder Iransk atomaftale. Måske Kr Thulesen Dahl skulle genoverveje? #dkpol
583170611746365440,2015-04-01 07:34:43,Atomskrot deponeres på Louisiana! Dagens bedste aprilsnar går til @ingdk 'Radioaktiv dosis begrænset' #Haha #dkpol http://t.co/F5HFJaw5lr
582966296893067264,2015-03-31 18:02:50,"@LiberalAlliance Liiiidt sent at annoncere det - tjek mit tweet fra i går, hvor jeg gættede på Mette  :-) @DR1TV"
582965501166510081,2015-03-31 17:59:41,"Tillykke Nigeria. I dag fejrer i demokratiet - i morgen venter arbejdstøjer, for der er nok at tage fat på. #dkpol #dkaid"
582847351498399744,2015-03-31 10:10:12,"RT @tv2politik: ""Katrine og Marius – i et Danmark du genkender?"" Ny blog fra @MetteGjerskov http://t.co/5HboLuhXW4 #dkpol #fv15"
582814919265017856,2015-03-31 08:01:19,På fire år er vi gået fra #BanditteriHabitter til #DetDanmarkDuKender http://t.co/G6yR5nRMbQ #dkpol
582807649982513152,2015-03-31 07:32:26,RT @almeneboliger: Sociale klausuler trækker unge ud af praktikkøen. Viser opgørelse fra Københavns Kommune. #dkpol
582804358552817664,2015-03-31 07:19:21,Vil bruge dagen på at heppe på en  iransk atomaftale. #FordiFredTrodsAltErBedreEndKrig http://t.co/LC0KkUiyki #dkpol
582606876308828160,2015-03-30 18:14:38,Gætter på @mettebock i '#KenderDuTypen '. #dkpol
582128426577969152,2015-03-29 10:33:26,"Interessant overskrift. Læge uden betaling - nu,  men bare vent om et par år. Så falder den liberale hammer http://t.co/zZk7ZNhkbD #dkpol"
582094846313271296,2015-03-29 08:20:00,En voldelig TV-vært skal ud med fuld musik - Top Gear eller ej. Der ER ingen dilemmaer! @PRESSELOGEN #dkpol
582092743037607936,2015-03-29 08:11:39,"Arh, hold nu op @PRESSELOGEN. Russerne er stærkt provokerende og ambassadøren vidste præcis hvad han gjorde! #RuslandErIkkeAmatører #dkpol"
582091551100297216,2015-03-29 08:06:55,Jeg foretrækker Margot Wallstöm - anytime. #FordiMargotErSej #dkpol @margotwallstrom http://t.co/tK27phtn3w
581775598948904960,2015-03-28 11:11:26,På gaden i Roskilde med budskab om renovering af almene boliger. Folk er glade - også for regeringen 😄 #dkpol http://t.co/QLMYDQNKcf
581086940830765056,2015-03-26 13:34:57,RT @AndersLadekarl: DK er ikke i top 10 over vestlige lande der modtager relativt flest asylsøgere #mytebusters #dkpol http://t.co/F1TunAK0…
580475240360329216,2015-03-24 21:04:16,"Godt at vide. Jeg ikke er den eneste, der efterlyser detaljer om Venstres mærkelige moderne kontanthjælpsloft. #dkpol http://t.co/BCWludJY6J"
580383443604905984,2015-03-24 14:59:30,RT @hansersej: Dagens budskab fra Løkke #dkpol https://t.co/rzyWAh6VWA
580344753818046465,2015-03-24 12:25:46,"Igen taler LLR DK økonomi ned i et sort hul. Se på 3A rating, ungd arbløsheden styrtdykker, forbrugeroptimisme i top. #LLRStårAlene #dkpol"
580106247426408448,2015-03-23 20:38:01,"Så blev jeg valgt som folketingskandidat for Socialdemokraterne i Roskilde. Super duper! Og vældig heldigt, når plakaterne ER trykt #dkpol"
580004876547149824,2015-03-23 13:55:13,Mandelas datter kommer til Danmark som ambassadør. Hun er velkommen! #dkpol
579700077922525184,2015-03-22 17:44:03,"RT @DavidTrads: Rød blok haler i den grad ind på de blå. For 4 mdr siden bagud med 8,3 procentpoint hos voxmeter. Nu blot 3,3 #dkpol http:/…"
579319575961022465,2015-03-21 16:32:04,Hvad skjuler de blå? #dkpol http://t.co/4xs6XXPqdG
579267913909145600,2015-03-21 13:06:47,Så fik Danmark en ny nationalpark. Tillykke! #SkjoldungernesLand #dkpol http://t.co/CjRS9eDJay
579265091096473600,2015-03-21 12:55:34,Russisk melding er uacceptabel og under lavmålet #dkpol http://t.co/270OX4g96y
579205877875507200,2015-03-21 09:00:17,Og denne har hele citatet :-)  @margytte1 http://t.co/DURpWsQfyt
579205626246627328,2015-03-21 08:59:17,Fandt denne artikel http://t.co/OfaYAFp9yi @margytte1
579204279786942464,2015-03-21 08:53:56,"Svin den ene vej, polakker den anden. Var det ikke LLRs kommentar til Hærvejsmotorvejen? #dkpol"
579200883084435456,2015-03-21 08:40:26,Det var til Sigaard :-) @hec4x4 @dkpolparrot @MartinSigaard
579200702645403649,2015-03-21 08:39:43,Missilskjoldet er rettet mod slyngelstater og terrorister. Ikke mod Rusland. #dkpol http://t.co/UAr7Idf4Lf
579192173108789249,2015-03-21 08:05:49,"Det var dig, der sagde at historien er på Putins side...??? @hec4x4 @dkpolparrot @MartinSigaard"
579182055881338880,2015-03-21 07:25:37,Du mener da Sovjet og WaPA faldt fra hinanden og Nato udvidede? @MartinSigaard
579181245957083136,2015-03-21 07:22:24,"Vi samarbejder da også med Putin - selvom ambassadørens trusler sørger for, at det er op ad bakke... @TheDorteOlsen"
579174101589319680,2015-03-21 06:54:01,Mig bekendt har vi ikke underkastet os Rusland? @MartinSigaard
579171700241235968,2015-03-21 06:44:28,"Tror Ruslands ambassadør virkelig, at han kan true DK - et NATO-land - til underkastelse? #Fail #DropDet #dkpol http://t.co/nSwcQ0JS4Q"
578855020159959040,2015-03-20 09:46:06,Hov. Hvem slukkede lyset? Nogen i #dkpol man ka gi skylden?
578595578805948417,2015-03-19 16:35:10,Vrøvl. Det er nyt i #dkpol at en partileder ikke er enig i partiets politik @SandRasmus @fredearnholdt @Spolitik @JensHusted @Trinebramsen
578574178363781120,2015-03-19 15:10:08,"Det et såmænd bare 100% rod i butikken i Venstre, især når formand taler imod partiets linje. #Rodebutik @JensHusted @Trinebramsen"
578573588980199424,2015-03-19 15:07:47,"RT @RasmusJakobsen9: @MetteGjerskov var elitesportsudøver i gym, det var ikke gået uden su. Mange kammerater havde ikke taget udd. uden su…"
578558805891506177,2015-03-19 14:09:03,Har Venstre ikke lige lovlig mange modsatrettede holdninger og standpunkter for tiden?  @Trinebramsen @JensHusted
578553826296406016,2015-03-19 13:49:15,Hvilke lande vil du sammenlignes med? Jeg har højere ambitioner for danske unge @BirgitteLSoee
578553443553550336,2015-03-19 13:47:44,RT @TarpCPH: Kære @larsloekke. Din hjemmeboende søn SKAL ikke have SU. Det er skam noget man selv aktivt skal søge om... #dkpol http://t.co…
578524886223695872,2015-03-19 11:54:16,For LLR er det måske bare et par sko. For nogle unge er det forskellen mellem at få en uddannelse eller ej #dkpol http://t.co/V6JnS4EFb8
578291649912143872,2015-03-18 20:27:28,Ikke vildt imponeret over Ingolfs viden. Men finder hans indlæg decideret usmageligt. Fortsæt Mogens! @David_Garby @MogensJensenS @nationen
578075469926432768,2015-03-18 06:08:26,Israelerne valgte freden fra. http://t.co/jLwDXC4l9c #dkpol
577809500830371840,2015-03-17 12:31:34,Udenrigspolitisk Nævn i morgen 13.30 m afrapportering fra Europæisk Råd #dkpol
577798811902443520,2015-03-17 11:49:06,RT @DennisFOA: Alligevel noget af en udtalelse oven på 8. marts. :-) #tvavisen #dkpol http://t.co/s0t2Tga4VL
577718734762209280,2015-03-17 06:30:54,Kære @astridhaug. Nogle gange handler det bare om at have det sjovt! #LommepengeFraLøkke
577571329416830976,2015-03-16 20:45:10,Du skulle overveje lidt humor i dit liv - det gør det hele lidt lettere - også sure kommentarer :-) @farfarbusk
577471825413824512,2015-03-16 14:09:46,"Anbefaler denne til alle blå politikere, der skal brække sig. #GodtForGulvtæpperne http://t.co/O7DxMnqVoz #dkpol http://t.co/MMNrcoE1Bo"
577419725392719872,2015-03-16 10:42:45,"Nej. Problemet er, at de vil tage dem fra de fattigste: kontanthjælpsmodtagere. @SandRasmus @IdaAuken"
577413910720069632,2015-03-16 10:19:38,Næh tak du. Foretrækker velfærd. @Rolf_Larsen @LiberalAlliance
577412386010853376,2015-03-16 10:13:35,"RT @IdaAuken: Hvis du smider en 5'er oveni, kan du få en hel avis i løskøb for den skattelettelse, V vil gi dig #LommepengeFraLøkke http://…"
577412133547298816,2015-03-16 10:12:35,"RT @AbdelsTweet: Arghh, konservative... Ikke når de er på tilbud! #LommepengeFraLøkke http://t.co/7oquHFtSV9"
577411885022199808,2015-03-16 10:11:35,Damn. Kan ikke engang få 1 pakke pålægschokolade om måneden for Venstres skattelettelse #LommepengeFraLøkke #dkpol http://t.co/d2GARh0p90
577410292335906816,2015-03-16 10:05:16,RT @TarpCPH: 3 pilsnere eller en lille fadøl for den skattelettelse Løkke vil give dig. #LommepengeFraLøkke #dkpol http://t.co/eNd8eLFK4u
577407378947227648,2015-03-16 09:53:41,En pose Matadormix - på tilbud - om måneden! Så meget kan du få for Venstres skattelettelse #LommepengeFraLøkke #dkpol
577403133317500928,2015-03-16 09:36:49,"Hold nu op med det dagpengeævl. Du ved godt, at dagpengereformen ikke er vores politik @JoeEngevik @MortenDahlin @Spolitik"
577380228605087744,2015-03-16 08:05:48,"Jaja, lad os bare hænge os i ordvalget i stedet for intentionerne - at Venstre vil skære i hjælpen til DKs fattigste...@MortenDahlin #dkpol"
577377941203607552,2015-03-16 07:56:43,Hvad vil du ellers kalde det? @MortenDahlin 'beskæftigelsesfremmende nødforanstaltninger'? 'pisk? Vi kalder det fattigdomsydelser
577373129703587840,2015-03-16 07:37:35,Pris for at slagte kontanthjælpsmodt.: 25 kr PR MÅNED til folk i arbejde. #SvarerTilEtParSnørebåndTilLLRsSko #dkpol http://t.co/GWvv6FQplN
577365428349063168,2015-03-16 07:06:59,Haha. Rygterne om Putins forsvinden kan vist mest betegnes som ønsketænkning.. #dkpol http://t.co/40md1vF273
577150018219565056,2015-03-15 16:51:01,"Hvad mener du? Vi tager da ansvar - både for UNHCR og WFP, som jo står for maden? @LindholmJK"
577142675914268672,2015-03-15 16:21:51,"Lad nærområderne tage imod Syriens børn, siger blå blok - barnebrudene betaler prisen #dkpol #dkaid http://t.co/6GGozxjyrX"
577072360181915648,2015-03-15 11:42:26,"Og fordi der teoretisk set findes et antal hypokondere, skal vi alle betale? Mærkelig logik. #HypokondereKanOgsåBliveSyge @jacobDKlarsen"
577068702979461120,2015-03-15 11:27:54,"Til gengæld en af de få V'er, der indrømmer, at #0vækst koster på velfærden...  #dkpol @BennyEngelbrech @rasmushorn @tv2newsdk"
577053494886162432,2015-03-15 10:27:28,"RT @MaryLouLund: Største undersøgelse af brugerbetaling hos læge viste, at helt nødvendige lægebesøg for børn faldt med 30 pct #dkpol http:…"
577049628945850368,2015-03-15 10:12:07,"Så slipper vi for alle hypokonderne, siger Colette Brix, V, til @tv2newsdk #dkpol http://t.co/Ip5rZywh9h"
577048506868871168,2015-03-15 10:07:39,"Hvad er det dog for noget ævl... @KruuseThomas @PRESSELOGEN"
577043771264729089,2015-03-15 09:48:50,"Kære @Presselogen, I behøver ikke tage helt til Jylland for at efterlyse pressedækning. Kom endelig til Roskilde - vi savner jer! #dkpol"
577039515803586560,2015-03-15 09:31:56,"Når man har spildt kostbar tid på at diskutere OM der overhovedet er et problem, i stedet for at løse det, bliver man mavesur. @SteffenWM"
577016334338404353,2015-03-15 07:59:49,Yes. Hjælpen er nået frem til Vanuatu. Hvorfor mon de blev ramt? #HåberKlimaskeptikerneHarEnDårligSmagiMunden #dkpol #dkaid #dkgreen
576664920793677824,2015-03-14 08:43:25,"Medietid er ikke alt! Kald mig bare gammeldags, men indhold i politikken er vigtigst... @AsgerMan1 @alternativet_ @uffeelbaek"
576657367397457920,2015-03-14 08:13:24,Næh tak... @AsgerMan1 @alternativet_ @uffeelbaek
576644946146525184,2015-03-14 07:24:03,"Interessant at konkludere på et udspil, som ingen kender :-( @bupldk @politiken"
576644669813182464,2015-03-14 07:22:57,Tillykke til @alternativet_ med liste Å. Og med den kloge beslutning om at sende Riskjær ud i kulden. #MedDenSlagsVenner..#dkpol @uffeelbaek
576403352675852288,2015-03-13 15:24:02,På stationen med glade budskaber. 3000 almene boliger i Roskilde bliver nu renoveret. Hurra! #dkpol http://t.co/ndRlINHpwc
576089624193429504,2015-03-12 18:37:24,"RT @DRDetektor: Har vores folketingspolitikere haft ""rigtige"" job? Se grafikken over, hvad hvert enkelt medlem har lavet: http://t.co/QUrEY…"
575940186330243072,2015-03-12 08:43:35,Glædeligt med fokus på Syriens børn. Vil blå blok genoverveje politik m mindre hjælp i nærområderne og færre flygtninge her? #dkpol #dkaid
575932562675253248,2015-03-12 08:13:17,Vi skal himle op og presse massivt på hos alle internationale venner @ThomasMonbergSF @dkpolparrot
575920979123269632,2015-03-12 07:27:16,Enig. Verden svigter Syriens børn. Madrationer næsten halveret for de flygtninge jeg mødte i Jordan forleden #dkpol http://t.co/paD72UwTb0
575625137489342465,2015-03-11 11:51:42,"Herrejemini. Ser frem til at saglige hensyn måske engang bliver taget i anvendelse, når det gælder atomaffald. #dkpol http://t.co/cHYFJt4PVJ"
575336369347756033,2015-03-10 16:44:14,"Enig om hvad? VKO sænkede fradraget, vi hævede det. Det er vist ikke enighed. @Rasmus_Skalde @blindholt"
575281858566553600,2015-03-10 13:07:37,"Interessant at @MaiMercado vil have flere penge til politiet. Det vil vi også, men hvor vil K tage dem fra? Løkkes #0vækst? #dkpol"
575273979142934528,2015-03-10 12:36:19,"Hvem skal hjem? Mennesker, der flygter fra krig og ødelæggelse? Det er jeg uenig i. @LyngeKurt"
575273726964539392,2015-03-10 12:35:19,Og det har I arbejdet på i årevis. #EnSagForProduktivitetskommission #DerGrorSnartMosPåVenstresKontanthjælpsloft #dkpol @Kristian_Jensen
575273120921051137,2015-03-10 12:32:54,Lav starthjælp fik IKKE flygtninge i arbejde. #GåIkkeTilbageTilEnFuser #FattigdomErIkkeLøsningen #dkpol
575272729907195904,2015-03-10 12:31:21,"Fordoblet fradrag for fagforening er EN af grundene til, at det kan betale sig at arbejde. Venstre var imod. #HvadVilVenstre #dkpol"
575271789695229952,2015-03-10 12:27:37,"LLR mener, at Vs politik er åbenlys. Mærkeligt, at ordføreren så ikke kan svare om deres kontanthjælpsloft http://t.co/OvKBh2NnPQ #dkpol"
575270708885987328,2015-03-10 12:23:19,"Iflg LLR er det åbenbart kun folk i arbejde, der vasker tøj og gør rent! #ArbejdsløseGårOgsåIBad #TingVenstreRegnerMedIKontanthjaelp #dkpol"
575269637182636032,2015-03-10 12:19:04,"Påstanden var, at det IKKE kan betale sig at arbejde. Og det kan det. Under tusind familier svarer til Vs eksempel @Thorsen_Mark"
575269333976420352,2015-03-10 12:17:51,LLR synes åbenbart ikke 6 kr (1000 kr/md) i timen er nogen særlig stigning ved at gå på arbejde. Har han sidst set en OK-forhandling? #dkpol
575268324088672256,2015-03-10 12:13:51,"Hov. Synes jeg kan høre på LLR, at det KAN betale sig at arbejde. #Kursskift #dkpol"
575268003450908672,2015-03-10 12:12:34,"RT @politikodk: Politisk morgenpost forsøger at finde ud af, hvad Venstres kontanthjælpsloft går ud på http://t.co/BMZHD79iNp #dkpol http:/…"
575267708595478529,2015-03-10 12:11:24,Er det en lakridspibe LLR vil give danskerne i skattelettelser? Eller har han en ny plan?#dkpol https://t.co/bxi8UPxTKn
575231166497841152,2015-03-10 09:46:12,Det offentlige har skåret 90pct sprøjtegift på 20 år. Hvad siger landbruget? #dkpol #dkgreen http://t.co/gHyyUYzlOh
574618070217527297,2015-03-08 17:09:58,"Ritt holdt takketalen for værten - og talte meget pænt både om og til hende!@NiclasBekker @jesper_vh"
574616498926448640,2015-03-08 17:03:43,Kun hver 3.? @AnalyseDanmark Så står det bedre til end jeg havde ventet :-)
574616209452331008,2015-03-08 17:02:34,"Er nu også lidt fedt sådan en #8marts at have to piger på 4 og 8 på besøg, og de SELV vælger at lege med hhv lego og biler :-)"
574560741031804928,2015-03-08 13:22:10,Der råbes tværpolitisk hurra for DKs første kvindelige statsminister til ministerfrokost på Marienborg #dkpol #8marts http://t.co/2AYBrRNDfp
574492289113976833,2015-03-08 08:50:09,"Enig med @oestergaard: Starthjælpen var en fuser, vi ikke skal gå tilbage til. #dkpol"
574471067156279296,2015-03-08 07:25:50,Mænd mener vi har ligestilling - kvinder gør ikke. Interessant undersøgelse af JP #dkpol http://t.co/PEHT3EPlLA http://t.co/buVw16x8iw
574118205704245248,2015-03-07 08:03:41,"WTF! Når Sjælland har udkantsproblemer, er vi bare dovne. Når Jylland har samme er det en nationalt katastrofe #dkpol http://t.co/MHW53ErDvB"
573533688086003713,2015-03-05 17:21:01,And a warm thanks to you. @volkan_bozkir Wonderful city and fruitful meeting
573533310778998785,2015-03-05 17:19:31,RT @volkan_bozkir: Showed @MetteGjerskov Chair of Foreign Affairs Com of Danish Parliament &amp; her delegation Bosphorus view from Ortaköy. ht…
573431448398647296,2015-03-05 10:34:45,RT @volkan_bozkir: Idag kl 13 mødes jeg til frokost med Mette Gjerskov @MetteGjerskov Formand for Udenrigspolitisk Nævn&amp;medlem af Folketing…
573371057807204352,2015-03-05 06:34:47,"I denne sag tror jeg snarere det er DF end præsterne, der skuer bagud @kramse http://t.co/ty7m5yrSSa"
573370758250020864,2015-03-05 06:33:36,Så er det jo godt at præsterne ikke lytter til denne DF'er. @LivHA #TranskønnedeErOgsåMennesker #dkpol #tpn #dkaid http://t.co/ty7m5yrSSa
573358394163257344,2015-03-05 05:44:28,"Stærk kvindelig kurdisk politiker, Leyla Zana. Arbejder hårdt for demokrati og selvstyre trods 10 års fængsel #dkpol http://t.co/BkeMln2Q1u"
573356014956912640,2015-03-05 05:35:01,Nogen der kan forklare HVORFOR præster sku ha noget imod at vie transkønnede? #StårNæppeNogetOmDetiBiblen #dkpol
572778365624692736,2015-03-03 15:19:38,"RT @jesper_vh: 300 kontanthjælpsmodtagere får under 0 kr ved at tage job. 94,3% tjener 2000 kr el mere #dkpol http://t.co/WYxiwDRI3c http:/…"
572762604998922241,2015-03-03 14:17:01,"Okay så. @venstredk's klapjagt gælder ikke bare fattige, men fattige med udenlandske rødder #SkuDetDaVæreBedre http://t.co/0quSqpiW7V #dkpol"
572759161433280515,2015-03-03 14:03:20,RT @rolhol1: #Danish #parlamentarians @folketingdk visit @UNWOMEN women's centre for #Syrian refugees in #Za'atari camp #Jordan http://t.co…
572758908827267072,2015-03-03 14:02:19,"RT @rolhol1: #Danish parlamentarians @folketinget visit #Jordanian Womens Union, #gender discrimination, meet abused women http://t.co/BUIR…"
572758776513765377,2015-03-03 14:01:48,RT @rolhol1: #Danish #Foreign Policy Committee @folketinget meets #Jordan Minister of Interior Hussein Majali http://t.co/1YoxP6YPzh
572650645414682624,2015-03-03 06:52:07,"Jeg kan kun elske Twitter, når jeg læser #tingVenstreRegnerMedIKontanthjaelp. Ærgerligt at #smwdkpol var sidste uge..."
572649958224105472,2015-03-03 06:49:24,"Værdien af den sok, der ALTID forsvinder ved tøjvask  #tingVenstreRegnerMedIKontanthjaelp #dkpol"
572474307248562176,2015-03-02 19:11:25,"Når 99,97% af kontanthjælpsmodtagere tjener på at komme i arbejde, hvorfor tænker V så kun på 0,03%? #HarViIkkeStørreProblemer dkpol"
572267064481738752,2015-03-02 05:27:55,"Får mine fordomme udfordret i Jordan. Her en, der arbejder FOR prævention MOD hustruvold og børneægteskaber. #dkpol http://t.co/Gz0eWy0sIJ"
572265553844416513,2015-03-02 05:21:54,Egentlig ufatteligt at vi danskere har en af verdens top beskæftigelsesrater når @venstredk hævder det ikke kan betale sig at arbejde #dkpol
571891756800737282,2015-03-01 04:36:34,"RT @Trinebramsen: Kære Kastholm❤️ Din evige tilsvining af #dkpol-kvinder ville være mer troværdig, hvis du formåede at stave deres navn htt…"
571726243109974016,2015-02-28 17:38:53,Konkurrencen er slut. Vinderne fundet. Stort tillykke. Bidrager alligevel med denne selfie fra Jordan #smwdkpol http://t.co/KEDHoNTSjP
571725730167431168,2015-02-28 17:36:50,Stort tillykke til @Kristian_Jensen @IdaAuken og @SimonEmilAmmitz. Godt gået! #smwdkpol
571722765247635457,2015-02-28 17:25:03,"Ja, de knokler på ambassaden, så vi er meget taknemmelige for al den viden de hælder på os på få dage. @rolhol1 @karmel80 @peterkofod"
571719210776338433,2015-02-28 17:10:56,"Men det er altså også en engageret flok, jeg rejser med. Her er ingen, der blunder til møderne. Tvært imod. @karmel80 @peterkofod"
571709995621826560,2015-02-28 16:34:19,RT @rolhol1: #Danish parlamentarians @folketing meet #Jordan youth to discuss youth empowerment and #anti-radicalisation http://t.co/UvLmdo…
571709062393438208,2015-02-28 16:30:36,"Haha. Flatterende udlægning, men de andre MF'ere fik vist også talt med de seje unge frivillige. @karmel80 @rolhol1. Er @ActionaidDK projekt"
571548027283873793,2015-02-28 05:50:43,Skjoldungerne. Væn jer til dem. De har lige fået en nationalpark. Fantastisk. #dkpol #dkgreen http://t.co/8PaWj7pBuh
571230364070514688,2015-02-27 08:48:26,Forlader #smwdkpol sammen med gode kolleger med kurs mod flygtningelejr i Jordan #dkpol #dkaid http://t.co/2ktdUcaDXh
571174550274240513,2015-02-27 05:06:39,DF: Stop for alle syriske flygtninge. Jeg tager i dag til Jordan og ser på forholdene i nærområderne. Martin Henriksen burde se med #dkpol
571168949829820416,2015-02-27 04:44:24,Muslimske børn danner fredsring i Kbh. Pia K påstår grotesk at terror er regeringens skyld. Ved godt hvem jeg helst lytter til. #dkpol
570927679450574848,2015-02-26 12:45:40,"RT @SophieRytter: @MetteGjerskov: Somalia, Nigeria, etc. must be very rich - can afford leaving 1/2 the population behind. #DKTalkPost2015 …"
570927437472796672,2015-02-26 12:44:43,RT @TGJakobsen: @MetteGjerskov: 'Big surprise for Danish parliament when they realise the World Goals mean that THEY have to do something' …
570900863499296768,2015-02-26 10:59:07,.@LyngeKurt Ingen er bange. Politiet har bare brug for arbejdsro til at efterforske. Det er da det vigtigste.
570891165375045632,2015-02-26 10:20:35,"Forstår simpelthen ikke, at de blå har så travlt med at så mistanke om politiets arbejde #dkpol http://t.co/kchRyNVdLY"
570888086139359232,2015-02-26 10:08:20,RT @TarpCPH: Rigspolitichefen modsiger nu de borgerlige og SF's krav om hurtig redegørelse. #ThisJustIn #dkpol #cphshooting http://t.co/UCO…
570887654365114368,2015-02-26 10:06:38,RT @nadeemfa: 4000 flere i job på en måned. Beskæftigelsen er på sin højeste i 5 år. Kampen for flere nye job fortsætter #dkpol  http://t.c…
570691555872415744,2015-02-25 21:07:24,Mit #smwdkpol kram går til @StemLAURITZEN fra Venstre for hans store engagement for kvinders #RetTilEgenKrop  #TalOp http://t.co/hDTrL1Jktf
570674345888112641,2015-02-25 19:59:01,Mit #smwdkpol kram går til @StemLAURITZEN fra Venstre for hans store engagement for kvinders #RetTilEgenKrop 😄 http://t.co/3WF0V16hES
