id,created_at,text
525229369850355713,2014-10-23 10:16:54,Vigtig drøftelse om køligt forhold til Tyrkiet. Her: Den tålmodige presse i en pause i Nævnsmøde #dkpol http://t.co/61KbFrHQvu
525160325776429056,2014-10-23 05:42:33,"RT @louisehededam: .@MetteGjerskov er vred over, at tyrkerne har løsladt den Hedegaard-mistænkte, som har en international arrestordre over…"
524868133249880064,2014-10-22 10:21:29,Giver en god følelse i maven når min by vil gøre plads til nødstedte mennesker fra Syrien #dkpol http://t.co/tW66q1OJ5X
524860114134900737,2014-10-22 09:49:37,RT @SexogSamfundDK: #nypåtwitter: Velkommen til FT'sTværpolitiske Netværk @TPNforSRSR. Vi ønsker god høring i dag #omskæring. @MetteGjersko…
524860066575704064,2014-10-22 09:49:25,Det fyger med meninger i debat om omskæring af drenge. Venter hed debat på høring i dag. #RetTilEgenKrop #dkpol  http://t.co/WxmhD7xUk8
524858685257187328,2014-10-22 09:43:56,"@R4nd4hl Vi kunne kun få Fællessalen, og der er ikke mulighed for tvoptagelse. Desværre."
524804941307994112,2014-10-22 06:10:23,Godt indlæg af Per Mich Jespersen. Jeg sagde hvad jeg havde tænkt mig at sige. Er altid i mine følelsers vold. #dkpol http://t.co/xTXMC0AQnn
524790148392030208,2014-10-22 05:11:36,RT @Cqmillq: Naturligvis skal han det. Man skærer ikke i raske børn. #dkpol #fredforhuden http://t.co/kwFvpHm9U5
524787210512789504,2014-10-22 04:59:55,RT @BosseStine: #dkpol Selvfølgelig http://t.co/hv0QYZOIn7
524610519421177856,2014-10-21 17:17:49,Yes. @R4nd4hl Et initiativ fra http://t.co/aZdXfyqC1B
524609346354028544,2014-10-21 17:13:09,"@R4nd4hl Næh, sådan har jeg det også instinktivt. Men nu får også de religiøse lov til at fremlægge sagen fra deres synspunkt..."
524606038075797504,2014-10-21 17:00:00,Drengeomskæring? #RetTilEgenKrop eller Ret til egen religion? Forventer høj bølgegang i Fællessalen onsdag. http://t.co/WxmhD7xUk8 #dkpol
524577871864795138,2014-10-21 15:08:05,Human rights for all. Also Al Khawaja in Bahrain. Visit in my office at Parliament today by devoted daughter @MARYAMALKHAWAJA #dkpol #dkaid
524519429686956032,2014-10-21 11:15:51,Hvad er det for noget ævl? Jeg har aldrig været sundhedsminister. Og betalte i øvrigt selv kabinen.. @PeterA4200
524518070774427648,2014-10-21 11:10:27,@sorenpind Vil du da ophæve sanktionerne mod Putin? #zigzag #dkpol
524504049409093632,2014-10-21 10:14:44,Farvel til Henrik og tillykke til ny gruppeformand Leif. Lange klapsalver til begge #dkpol http://t.co/Y8Oab96UmZ
524502830632415232,2014-10-21 10:09:54,Du er da langt ude @sorenpind Fortrudt at i støttede regeringen? Sammenhold mod Putin i EU er afgørende. Du vil splitte og svække #dkpol
524476726811058176,2014-10-21 08:26:10,"Man har en holdning.. @sorenpind Du plejer da at klage over, at regeringen er for slap, nu gør det ondt at være hård, og så...? #dkpol"
524432769355878401,2014-10-21 05:31:30,"Var så stålsat, at han sendte soldater i krig på meget spinkelt mandat. Trynede han også embedsmændene? #dkpol http://t.co/8yGOYVvdyn"
524256268857659393,2014-10-20 17:50:09,@Morgan_Kruger @august_solkaer Jeg kan tilbyde en uges praktik hos mig i Folketinget i uge 47 - skriv på mette.gjerskov@ft.dk hvis du vil
523916539389804544,2014-10-19 19:20:11,@LoneYalcinkaya ingen fortjener vel død. # dødstrafAfskaffet
523916018268536834,2014-10-19 19:18:07,Grotesk at mistænkte for mordforsøg på Hedegaard er løsladt. Bryder mig ikke om Hedegaard. Forsv ret til at have bizarre synspunkter #dkpol
523765243718410240,2014-10-19 09:18:59,Klogt at Irak-Kommissionen inddrager anonyme embedsmænd i UM. Hver en sten vendes #AFRvilleiKrigForHverEnPris #dkpol http://t.co/ommjDGc1yJ
523542298077192192,2014-10-18 18:33:05,RT @CKjersgaard: Er DK forandret? Klippet fra @DebattenDR2 med @MetteGjerskov er nået ud til 100.000+ brugere på FB: http://t.co/9CF1nppfYz…
523092348180660224,2014-10-17 12:45:09,Fra 800.000 til 352.000 på passiv forsørgelse. Godt at få fakta på plads. #Nuancer #dkpol Nu med rigtigt link...  https://t.co/VX5ArXOFRG
523091956722057216,2014-10-17 12:43:35,@m_abs Tak for info - prøver igen :-)
523087952872996864,2014-10-17 12:27:41,Fra 800.000 til 352.000 på passiv forsørgelse. Godt at få fakta på plads #nuancer #dkpol http://t.co/nDqiAS9TE6
522848879189164032,2014-10-16 20:37:41,RT @AnjaKristoff: Haarder virkede overrasket over at Mette Gjerskov kender Vs politik #DetGørDeIkkeSelv #SomVindenBlæser
522797521685725184,2014-10-16 17:13:36,"RT @CKjersgaard: I @DebattenDR2 20.00 desuden: @MetteGjerskov, Bertel Haarder, @JoachimBOlsen, Marie Krarup og @trinemach #dkpol #dkmedier"
522775002702434304,2014-10-16 15:44:07,Efterlysning: er medmenneskeligheden gået bort i nedtrykt sindstilstand? Se med i @DebattenDR2 kl. 20 #dkpol
522654574084378624,2014-10-16 07:45:35,"Beklager, @jesper_vh, desværre noget så almindeligt som en hårdtarbejdende håndværker :-)"
522610830169628673,2014-10-16 04:51:46,Samråd kl 9 om udleveringssagen fra Tyrkiet. Med udenrigs- og justitsminister i Udenrigsudvalget. #dkpol
522111921496285186,2014-10-14 19:49:17,@AbdelsTweet Som medlem af folkekirken føler jeg mig ikke forpligtet til at tage afstand fra kristne tosser - og de findes @MortenSFruergaa
522069558648385536,2014-10-14 17:00:57,"RT @AbdelsTweet: Hvis alle dk muslimer skal tage afstand fra ekstreme imamer, bør alle kristne så ikke tager afstand fra ekstreme Søren Kra…"
522069467640397824,2014-10-14 17:00:35,@JakobSClausen Ja
522065421865070592,2014-10-14 16:44:30,Glædelig nyhed: Positive udmeldinger fra den katolske kirke om homoseksuelle. @TPNforSRSR #dkpol #dkaid
522004271152496641,2014-10-14 12:41:31,"@harlev1234 Vi vil gerne have udleveret den mistænkte, og dermed et svar fra Tyrkiet.  @Spolitik"
521988448081940480,2014-10-14 11:38:38,Samråd torsdag om Tyrkiet. Gu' ve' om DFs forsvarsordfører vil gentage ønsket om at nedlægge Nato....#dkpol
521977137096830976,2014-10-14 10:53:42,@john1966olsen Super. Og tak.
521947600489295873,2014-10-14 08:56:19,@KirstinMund Selv tak. Det var en noget rystende oplevelses - ud af Nato? Og så lige nu hvor krige og kriser hærger...
521780630917373953,2014-10-13 21:52:51,"Ja, Nedlæg Nato og lav snævre alliancer. @KristianThulsen kan måske fortælle om det giver tryghed? @SrenKVillemoes @dr2deadline #dkpol"
521779137556410368,2014-10-13 21:46:55,"RT @jensensander: Uacceptabelt Tyrkiet ikke har udleveret mistænkt i Hedegaard-sag, men tæt på vanvid at ville smide dem ud af #NATO Marie …"
521767981282758657,2014-10-13 21:02:35,"Hov! Sagde Marie Krarup lige at de ikke bare vil smide Tyrkiet ud, men nedlægge NATO? #ikkeligefremtryghedtildanskerne @DanskDf1995 #dkpol"
521729778848919554,2014-10-13 18:30:47,Mon DF vil gentage deres overilede forslag om at smide Tyrkiet ud af Nato? Og redegøre for konsekvenserne? Se med i @dr2deadline #dkpol
521645498441400320,2014-10-13 12:55:53,"Også undrer folk sig over, hvorfor det altid er DF, der kommer i medierne... #justsaying #IngenHøjere #dkpol http://t.co/1BGhzAw8Fd"
521632085149515776,2014-10-13 12:02:35,"RT @Smedenxborg: Der findes kun et land i verden, der har en højere fertilitetsrate end Mogens Camre. Det er Niger med 7,2 børn i snit. #dk…"
521631363590791168,2014-10-13 11:59:43,Ærgerligt at den sorte ideologi skygger for det vi ved virker på overbefolkning: Udvikling @mettealbaek #dkpol #dkaid http://t.co/mpy4OHptX5
521629194552639488,2014-10-13 11:51:06,"RT @AbdelsTweet: Mogens Camre vil forbyde afrikanere at få mere end 1 barn. @MCamre selv har velsignet verden med 7 børn fra tre forskelli…"
521628765982842881,2014-10-13 11:49:23,RT @BayMads: Tilslutter mig @MetteGjerskov’s kommentar om at Mogens Camre må have have spist søm. Nej til eksperimenter med #dkaid http://t…
521628763646595073,2014-10-13 11:49:23,Ham Camre og @DanskDf1995 må ha spist søm. Overbefolkning  håndteres ved udvikling - ikke tvang! #vbn14 #dkaid #dkol http://t.co/W7rXcNVmKo
521580413383639041,2014-10-13 08:37:15,RT @Cafu86: @Jan_Andreasen men interessant hvordan mænd generelt kræver at feminister skal klare hele jobbet for dem @MetteGjerskov @inform…
521578505965158400,2014-10-13 08:29:40,Måske du selv som mand skulle kæmpe for mænds rettigheder i stedet for at brokke dig over kvinderne? @Jan_Andreasen @Unwomen @informeren
521576394539941888,2014-10-13 08:21:17,Passer ikke helt - prøv at se @UNwomen og deres #HeForShe kampagne @Jan_Andreasen @informeren
521575636360761344,2014-10-13 08:18:16,Både mænd og kvinder taber når vi ikke har ligestilling. #dkpol @Jan_Andreasen @informeren
521563783899389952,2014-10-13 07:31:10,Kære @informeren. Læg Jane Korczaks glimrende indlæg på nettet: 'Vi bilder os ind at vi har ligestilling'. #dkpol #TrætAfMændsTøHø
520660868221386752,2014-10-10 19:43:19,Er kommet til at holde af Uffe Ellemann: At sende flygtninge tilbage eller til Afrika - 'de må ha spist søm' Nemlig! #dkpol #dkpol #tv2news
520646864077856768,2014-10-10 18:47:40,Piger er børn - ikke brude! @TPNforSRSR kampagne til Kulturnat i Folketinget #HeForShe #RetTilEgenKrop #dkaid #dkpol http://t.co/eI7iUY080g
520631259379539969,2014-10-10 17:45:39,Piger er børn- ikke brude. #HeForShe #RetTilEgenKrop http://t.co/NnFLDhZHVQ
520602019019915264,2014-10-10 15:49:28,@Aquiladk du kender vist ikke mig...
520501015054123008,2014-10-10 09:08:07,"Fantastisk. Tillykke til Karen, Mette og Henrik. Og tillykke til Malala med Nobelprisen. Også et stærkt valg. #dkpol http://t.co/D3QxlSc8DE"
520334129750343680,2014-10-09 22:04:58,"Hov, nu er der en mere fra @venstredk på talerstolen. Hold nu op, deres formand har åbenbart brug for støtte fra adjudanterne... #dkpol"
520331589092646912,2014-10-09 21:54:52,"Hm, Venstre har brug for hele tre ordførere til en åbningsdebat. Godt nok har vi været i gang i 14 timer, men andre kan nøjes med én #dkpol"
520327958977060865,2014-10-09 21:40:27,"Skal de ta DK-flygtninge? Libanon: 4 mio indb.+2 mio flygtninge +0,6 mio palæstinensere. #DeHarMasserAfPlads #dkpol http://t.co/BBNJkObnM0"
520317116247859200,2014-10-09 20:57:22,"RT @mette_annelie: Kan man ikk overskue indisk mad i kantinen, er verden udenfor en stor mundfuld- 12 point @CamillaHersom #dkpol"
520305496461705216,2014-10-09 20:11:11,"Øh, Støjberg +@venstredk. Regeringen finansierer asyl via finansloven og dermed Finansmin. Hvad ellers? Foretrækker V også Saxobank? #dkpol"
520291820870594560,2014-10-09 19:16:51,Vrøvl. STM redegjorde for rigets tilstand i åbningstalen i tirsdags. @TobiasBaadsgaar @harlev1234
520290496858836992,2014-10-09 19:11:35,@Chr_Broholm STMs tale i tirsdags var regeringens udspil. I dag svarer hun oppositionen. Sådan fungerer det. @engelschmidt
520287485524713472,2014-10-09 18:59:37,"Det er desværre dig @engelschmidt og dine VU-venner, der har misforstået principperne. STM har taletid for at SVARE på andres indlæg #dkpol"
520240359897837569,2014-10-09 15:52:22,"Øh @hansersej Er det bare mig, eller ligner det mere 'klappe-kage' end 'high-five'...?"
520168666424684544,2014-10-09 11:07:29,"RT @TarpCPH: Nogen der forstår, hvad Løkke siger her? https://t.co/BzeBHPC8oU #dkpol"
520147896839458816,2014-10-09 09:44:57,"Vs udlændingeudspil åbner for underbetalt arbejdskraft, social dumping og alskens ulykker for almindelige lønmodtagere. Enig med Maja #dkpol"
520143063491280896,2014-10-09 09:25:44,"Har du overhovedet fulgt med i de sidste 10 år? Blå blok, der kunne 'købe hele verden' @Dahldebat"
520142658128596992,2014-10-09 09:24:08,Haha - Løkke taler sort. #dkpol http://t.co/LGur7Wv7Vl
520139095155408896,2014-10-09 09:09:58,Og de havde brugt alle pengene - og glemt at polstre Danmark til dårligere tider. @Dahldebat
520138477523206144,2014-10-09 09:07:31,"RT @RasmusPrehn: Løkke i topform. Jeg troede, hans disciplin var cykling. Men efter hans tale i dag, står det klart, at det er rygsvømning.…"
520137730706407424,2014-10-09 09:04:33,"De vil gerne med til festen, men er pist væk når der skal ryddes op. @PanduroMaja om blå blok :-) Passer sgu da meget godt... #dkpol"
520134065824206848,2014-10-09 08:49:59,Der fik jeg vist ramt en nerve.... @Rolf_Larsen @J_Hesselberg @anderssamuelsen
520133856075472896,2014-10-09 08:49:09,"Står han deroppe og påstår, at blå blok har gjort op med blokpolitikken?!?!? #dkpol #Herrejemini"
520130945077493760,2014-10-09 08:37:35,"LLR: Vi i @venstredk lader os ikke påvirke af pengestrømme til partiet. Nå nej, men cykelvennerne får direkte skriveadgang til Vs FFL #dkpol"
520127370653876224,2014-10-09 08:23:23,Løkkes 'retning' for nulvækst er snarere en rundkørsel. Efterfulgt af en afkørsel for velfærden. #dkpol #HvorErPlanen http://t.co/Ij6t5JJPO0
520122316853096448,2014-10-09 08:03:18,"Hov @anderssamuelsen Hvad skete der lige med dit og Gitte Seebergs ""Nok er nok"" overfor DFs udlændingepolitik? #dkpol"
520117594440081409,2014-10-09 07:44:32,RT @amnestydk: Planen om at sende befolkningsgrupper til Afrika har været forsøgt før. Det var i 1940 http://t.co/9k2BZHU7MO #dkpol #Madaga…
520094646945726464,2014-10-09 06:13:21,"@laursen_kenneth Spørg dem i Jordan og Libanon og Tyrkiet, hvor de er ved at bukke under for presset..."
520094370805346305,2014-10-09 06:12:15,"@DonDueholm Måske du ikke har opdaget det: nabolandene er ved at bukke under for presset af mio af flygtninge. Sker det, får vi endnu flere"
520075312886190081,2014-10-09 04:56:31,"Rimelig rystende, at DF og LA vil behandle mennesker i nød som kvæg i karantæne. Nærområderne ER brugt #dkpol #dkaid http://t.co/Z1kJ4A8Rve"
519866557917569024,2014-10-08 15:07:00,RT @redbarnetdk: Gode nyheder for vores frivillige. Regeringen lemper reglerne for frivilligt arbejde - hurra #dkaid @Spolitik http://t.co/…
519780066377465857,2014-10-08 09:23:19,"Det er så din udlægning. Det kunne også være fordi antallet af asylansøgere eksploderer, og vi må prioritere... @betty_rasmussen"
519773875597344768,2014-10-08 08:58:43,Og du vil naturligvis lige dokumentere den påstand? Verdens krig og nød øger flygtningepresset - ikke regeringen @Jan_Andreasen @venstredk
519768152570200064,2014-10-08 08:35:59,"Racistisk? Mig?!? @LucasWJCarn Ok, den var så ny - helt ny...."
519762662767353857,2014-10-08 08:14:10,Absurd situation. Vi strammer asylregler og @venstredk himler op om at vi er slappe og tiltrækker flygtninge #dkpol #VerdenErIFlammer
519474973694758912,2014-10-07 13:10:59,På vej i hænder på #pressenpåP3 med @TueBlaedel og @TonyScottDK #dkpol
519463509575618560,2014-10-07 12:25:26,RT @MogensJensenS: Rigtige mænd er feminister. @manusareen og jeg bakker op om FNs #HeForShe kampagne for #ligestilling i verden #dkpol htt…
519437920621846528,2014-10-07 10:43:45,Nej. @LineSofieK Per skal op og følge kongehuset ud. Han kom jo netop i Præsidiet! @PerClausen3 #dkpol
519437341577191425,2014-10-07 10:41:27,Jes! Så kom naturen ind i #aabningstalen #dkpol #dkgreen
519436388073488384,2014-10-07 10:37:40,Kipper med flaget for de mange frivillige danskere. #dkpol #ftlive
519435051034226688,2014-10-07 10:32:21,Tandrensninger?!? Er det jeres offensiv? #herrejemini @JaneHeitmann #dkpol
519434435100688384,2014-10-07 10:29:54,"Øh, har du hørt HTS invitere 50 mio flygtninge til Dk? Come on, du må ku finde på et bedre skræmmebillede @LouiseElholm #dkpol"
519433920807718912,2014-10-07 10:27:51,Ventetider har aldrig været lavere end de er i dag. Og faldet med en måned for psykisk syge børn og unge. Nemlig. #dkpol #ftlive
519433591047348224,2014-10-07 10:26:33,HTS: tiden er ikke til eksperimenter med vores økonomi og velfærd. Enig! #dkpol
519432754128506881,2014-10-07 10:23:13,"@LouiseElholm Sikke noget vrøvl. Det er da jer, der åbner grænserne med jeres nyeste udspil. Vi holder fast. I tilbyder underbetalte jobs"
519430819514175488,2014-10-07 10:15:32,Eller måske fordi verden har 50 mio mennesker på flugt. Højeste antal nogensinde. Drop skyklapperne og se ud i verden #dkpol @LouiseElholm
519429941633769472,2014-10-07 10:12:03,Er du ikke kommet videre @sorenpind ? Indenrigspolitisk paragraffnidder mens danske soldater drager afsted #dkpol
519427221631803392,2014-10-07 10:01:14,"Her er så krukken, der afgør om EL eller SF skal i Præsidiet - og kontroludvalget http://t.co/2qJSjPsbIv"
519355284050169856,2014-10-07 05:15:23,Kommer verden altid for sent når mennesker er i nød? Sidste chance for at tilmelde sig Røde Kors Akademiet. #dkpol https://t.co/OHiNcBKHMm
519055845355950080,2014-10-06 09:25:31,RT @BayMads: Det svært at være uenig med @MetteGjerskov. #Dkpol er en lidt sølle politisk virkelighed. #globaltansvar #dkaid http://t.co/N0…
519036771049672704,2014-10-06 08:09:44,RT @hansersej: DF-viceborgmester i Faaborg-Midtfyn er modsat Pia K. ret begejstret for 9 dage gamle håndmadder til ældre http://t.co/3DnBqn…
519036314126397440,2014-10-06 08:07:55,RT @msalakim: @MetteGjerskov efterlyser globalt udsyn i #dkpol. http://t.co/3iMhkNSn5d. Tjek http://t.co/xGKkGWcsrl
519024234283036672,2014-10-06 07:19:55,"RT @tv2politik: Verden har aldrig haft så mange katastrofer, og DK diskuterer stadigvæk Løkkes underbukser, skriver @MetteGjerskov http://t…"
518815287060492288,2014-10-05 17:29:38,RT @TarpCPH: Pia K raser over politik gennemført af byrødder og udvalgsformand fra hendes eget parti. http://t.co/JkYVLD4b0K #dkpol
518747809873678337,2014-10-05 13:01:30,Slam! Ramt af virkeligheden i den hjemlige politiske andegård efter et par ugers solidarisk udsyn i FN #dkpol #dkaid http://t.co/Aqj2u40X6a
518697969676468224,2014-10-05 09:43:27,Aaarh @MortenDahlin Det må du ku gøre bedre... #SølleSvar @venstredk
518675921042407424,2014-10-05 08:15:50,Enig med Engell. Trist genbrugstale fra Løkke. Hvornår kommer svarene på nulvækst? Hvad vil @venstredk? #HvemKanUndværes? #dkpol
518343045591597056,2014-10-04 10:13:07,"RT @AlexanderGrandt: . @larsloekke i lm-tale 2010 ""Vi ved godt, at de kommende år må være præget af fornuft og mådehold” #dkpol #vlm14 http…"
518304354668146688,2014-10-04 07:39:22,Mange kloge ord i dagens kronik af @BosseStine og Traberg: 'V på den anden side af ligusterhækken' #dkaid #dkpol http://t.co/oApR7eQrQD
518293230543446016,2014-10-04 06:55:10,"RT @AbdelsTweet: Og hvis vi fjerner varmen, rengøringen og andre ligegyldige ting, kan vi få endnu flere offentligt ansatte !! #dkpol http:…"
518128211864322048,2014-10-03 19:59:26,Stop skattefusk og bevar bistanden! Sej kampagne. Mon Venstre lytter? #Solidaritet #dkaid #dkpol http://t.co/CYB9neqpp4
518029245772496896,2014-10-03 13:26:11,Under et år til valget og Løkke har ingen plan for nulvækst. Måske vi får et svar i weekenden? #HvemKanViUndvære #dkpol
517665935331983360,2014-10-02 13:22:31,"RT @AndersLadekarl: SÅ ER DET NOK. Anders går over grænsen - Ingen børn, politikere eller studieværter har ...: http://t.co/0fHdfFXmyZ via …"
517649544516231168,2014-10-02 12:17:23,Fy for den lede. Seksuel vold er bare SÅ krænkende. #RetTilEgenKrop #dkpol #dkaid http://t.co/kOLP9YsnDT
517456794835509248,2014-10-01 23:31:28,"RT @je5perl: Denne artikel fra 2006 udløste selvfølgelig et spm fra DF, som blev besvaret af daværende KF justitsminister http://t.co/Ehbvx…"
517433106358226944,2014-10-01 21:57:20,.@BrianMikkelsenC Snarere blå blok i panik for at drive indenrigspol fnidder. Vigtigt spm men behøver ikke forsinke vigtig indsats #dkpol
517432016233832449,2014-10-01 21:53:00,Fair at blå blok vil afklare om syrienskrigere kan blive landsforrædere. Men behøver det blokere for vigtig indsats her og nu? #dkpol
517323196484554752,2014-10-01 14:40:36,"Mærkeligt at sidde i FN og ikke i FT, når vi skal sende danske soldater i felten. Jeg støtter 100% #dkpol http://t.co/zqwmeFqtH6"
516221847202193408,2014-09-28 13:44:13,Hurra. Nuancer og balancer i debatten - også fra industriens højborg. #DanmarkErIkkeEnØdeØ #dkpol #dkaid  http://t.co/N2jRB6X787
516069210557263873,2014-09-28 03:37:42,End extreme poverty by 2030. Strong message from 60.000 i Central Park. #EmpireState #GlobalCitizens #dkpol #dkaid http://t.co/1KLVgzy7QX
515871238640918530,2014-09-27 14:31:02,@ClausRasmussen Mærkeligt spørgsmål. Halshugning er endnu mere bimlende. Kan der være andre svar på det?
515870795336548352,2014-09-27 14:29:16,@NaaJaSerManDet Nævnte faktisk ikke bestemte religioner - med vilje. Al fundamentalisme er bimlende i mine øjne...
515870529933557760,2014-09-27 14:28:13,En god følelse i maven at være i New York og fornemme hele verdens afstand til ISILs brutale fremfærd. Den kamp skal vindes. #dkpol
515691725902610432,2014-09-27 02:37:43,Det er jo fuldstændig bimlende... Fundamentalisme er bare langt ude. #dkpol http://t.co/OO58F2nJ5P
515564415245365250,2014-09-26 18:11:50,RT @_PPPeer: Let's welcome @MetteGjerskov a new @DIPDtweets Board member! http://t.co/TVXCRIstta
515564253659815936,2014-09-26 18:11:11,"RT @RosaLundEl: Møde med UN women - god organisation, seje damer @MetteGjerskov #UNGA14 http://t.co/PnvlcNQ1ex"
515149151869624320,2014-09-25 14:41:43,Venstre må være meget forhippede på at tale om andet end Søren Gade siden LLR nu vil have F16 og Pind soldater på jorden mod ISIL #dkpol
515147713173000192,2014-09-25 14:36:00,Ingen danske soldater på jorden i Syrien. Punktum. Den strategi har vi prøvet - og det var ingen succes. #dkpol #dkaid @sorenpind
514891913049440256,2014-09-24 21:39:32,RT @RavnP: @HelleThorningS ready to brief #UNGA69 on need for #educationforall #ibis #dkaid #vbn14 let's get all in school now http://t.co/…
514862537381527552,2014-09-24 19:42:49,Bifaldet rullede i salen da Michelle Obama skulle tale om hvor vigtigt det er at piger kommer i skole #dkpol #dkaid http://t.co/nPAhR111rp
514860616415469568,2014-09-24 19:35:11,"Elsker FN, men hvorfor skal hørebøfferne være så hamrende uklædelige? #dkpol #dkaid http://t.co/d03y7UynFF"
514765425348194304,2014-09-24 13:16:55,"Ban Ki-Moon: States must govern for all their peoples! Stærkt. Husk det i Irak, Sydsudan, Syrien... #dkpol #dkaid #UNGA14"
514764147767390208,2014-09-24 13:11:51,Følger Ban ki-Moon og Obamas taler fra FN Missionen i NY. Spare-åbningsceremoni. #PengeTilFattige #dkpol #dkaid http://t.co/8JI83obj7B
514748257248219136,2014-09-24 12:08:42,RT @SMSerup: Lidt Søren-forvirring på @politiken ?  :-) #dkpol http://t.co/URNGy2dT5v
514747030766616576,2014-09-24 12:03:50,Hvis du kun orker at se én tale i år. Bevægende Emma Watson: mænd har glæde af feminister. #HeForShe #dkaid #dkpol http://t.co/Od7wQ26oLs
514595587816448001,2014-09-24 02:02:03,"RT @troelsdamchrist: DK spillede god rolle på FN klimatopmøde. Kom med penge til grønne klimafond, lancerede nye initiativer og skubbede på…"
514575264358338560,2014-09-24 00:41:18,RT @martinlidegaard: Launching Convention Against Torture Initiative at #UNGA69 in #NY. Global fight against torture a priority of #DK huma…
514496875278655488,2014-09-23 19:29:48,RT @RavnP: Om ti år er der måske ikke fattige LANDE men kun fattige MENNESKER.Ny svær udfordring @martinlidegaard #dkaid #vbn14 http://t.co…
514460568888311809,2014-09-23 17:05:32,Fantastiske farverige kvinder der knokler for oprindelige folks rettigheder hos #UNWomen #dkaid #dkpol http://t.co/Wc4IV7596o
514420756567293953,2014-09-23 14:27:20,Hurra. Færre sættes på gaden. Godt for dem og godt for os alle. #dkpol http://t.co/LMumYlgFbW
514412393632641024,2014-09-23 13:54:06,"@betty_rasmussen Fra finansloven naturligvis. Danske skatteydere. Som en investering i en verden, der er rigere og tryggere for os alle"
514411932091424768,2014-09-23 13:52:16,Om sex og retten til at sige nej - for kvinder i hele verden. Indlæg i @politiken #RetTilEgenKrop #dkpol #dkaid http://t.co/lcKxlXpDEl
514223270640750592,2014-09-23 01:22:36,@lauritsholdt Måske kommer det senere. Initiativ lige lanceret med 82 mio kr. Se tidl. tweet. Fantastisk initiativ helt ude hos græsrødderne
514214094103404544,2014-09-23 00:46:08,Og hun gjorde det igen. Kronprinsessen med en engageret tale til Women Deliver. Welcome to Cph May '16 #dkaid #wd2016 http://t.co/KdEzCUtAUi
514177669576265729,2014-09-22 22:21:24,"RT @UNFPA_Nordic: ""MR og SRHR er fundamentalt for at udrydde ekstrem fattigdom"" @MogensJensenS flot tale! @ICPDBeyond2014 @Denmark_UN @UM_d…"
514177528375033857,2014-09-22 22:20:50,"@MogensJensenS i NY: DK giver 82 mio kr til kvinder, for sikre aborter, mod seksuel vold, for sunde graviditeter #dkaid #RetTilEgenKrop"
514175040745897984,2014-09-22 22:10:57,Så er Kronprinsessen på talerstolen. #RetTilEgenKrop #AmplifyFund #dkaid #dkpol
514157192543756290,2014-09-22 21:00:01,@lauritsholdt Det er Hewlett og Packard familiernes fonde
514156812518838272,2014-09-22 20:58:31,@lauritsholdt Tjek UM.dk
514150750034083840,2014-09-22 20:34:25,På vej til arr. med Kronprinsessen og @MogensJensenS om ny dansk rettigheds fond. Sådan! #RetTilEgenKrop #dkaid http://t.co/zlJTDejitg
514127507613028353,2014-09-22 19:02:04,RT @Uffe_Tang: Lidegaard: Danmark vil sende flere penge til syriske flygtninge #dkpol http://t.co/Hdrq34OeE9
514126304137187328,2014-09-22 18:57:17,#showyourselfie @UNFPA http://t.co/3AATjTflUA
513807225018933249,2014-09-21 21:49:23,RT @Katja_Iversen: What can we do with the SDGs and #post2015 ? We need to get #SRHR higher on the agenda. Says. @MetteGjerskov at @UNFPA_I…
513792394178084864,2014-09-21 20:50:27,Zambia: Give women the right to decide when to have children #ipci unga2014 #dkaid
513791023265628163,2014-09-21 20:45:00,"RT @Katja_Iversen: ""Every time I read the outcome docu from the IPCI conf in Stockholm I get goosebumps. It is so strong on #SRHR "" @Babatu…"
513704859292663809,2014-09-21 15:02:37,"Hvis Kr Thulesen Dahl skal være statsmin, håber jeg han finder en rig finansmin, der kan spytte i kassen #HvorErPengene #dkpol@NiclasBekker"
