id,created_at,text
793515123805712384,2016-11-01 18:08:42,Tak @karmel80 for godt møde og stort engagement! #eudk #radikale #internationaltparti https://t.co/jElre4WEpy
793436393770979328,2016-11-01 12:55:52,DF leger politik men det er drønalvorligt: danskernes tryghed og muligheder for at bekæmpe org kriminalitet. Trist https://t.co/nJ38QvmGk1
793039781764665344,2016-10-31 10:39:52,@johnwagnerdsk Det har jeg heldigvis også. Hver gang (stort set)
793039132792676352,2016-10-31 10:37:17,"RT @DanskEnergi: 50 kr. per ton CO2 driver ikke grønne investeringer. DK må arbejde på højere kvotepris i EU, skriver @BendtEU og @mortenhe…"
793035632029364224,2016-10-31 10:23:23,Selvfølgelig. Med den indsigt lad os endelig få flere erhvervsfolk i politik...#dkpol https://t.co/xMd4IHVq6J
792760658878169088,2016-10-30 16:10:44,@Kasperloeye At frihandel bidrager til at skabe jobs er der flere hundrede års empiri på...
792760396121837569,2016-10-30 16:09:41,@m_abs Virkelig forundret over at en forbruger organisation indtager de standpunkter
792745003726536704,2016-10-30 15:08:32,Tillykke til os alle! CETA kan skabe jobs og velfærd. Vi trænger til det. For meget skræmmekampagne. For lidt friha… https://t.co/Ceqtje4OK9
792023166537302016,2016-10-28 15:20:12,"Folketingets formand kalder Europa-Parlamentet for en ""rotterede"". Folketingets formand! Hvem er rotter? Dem der svindler? #dkpol"
791680537765224448,2016-10-27 16:38:43,@LisbethBPoulsen CETA er den mest åbne og gennemsigtige handelsaftale nogen sinde. Og med dét land udenfor EU der ligner os mest...!
791678478206853121,2016-10-27 16:30:32,"""Fedt""? At mange helt almindelige mennesker går glip af jobs og velfærd?Trist at venstrefløjen er blevet så forstok… https://t.co/Exj1wf63bl"
791646062297616384,2016-10-27 14:21:43,Mageløst. Flov EU bashing fra nederste hylde. Men nyt at DF vil konvent! eu/artikel/df-ikke-megen-tegn-paa-selvransagelse-i-eu-systemet
791644051586052100,2016-10-27 14:13:44,RT @AndersLadekarl: Så fik flere flygtninge alligevel ikke kriminaliteten til at eksplodere #dkpol https://t.co/uMNc09iezy
791592535814762496,2016-10-27 10:49:02,Bedre sent end aldrig. Absurd hvis ikke vi skulle have aftale med det land der ligner os mest udenfor EU #dkpol https://t.co/tVzk0YoNDz
791581970757259264,2016-10-27 10:07:03,"RT @GuyVerhofstadt: Breaking: @NadiaMuradBasee &amp; @LamiyaAjiBashar,brave Yazidi women who escaped captivity by Daesh &amp; @ALDEgroup candidates…"
791201118944624642,2016-10-26 08:53:41,RT @ALDEgroup: RT if you agree. https://t.co/a2ddmhyW2z
791172139026149377,2016-10-26 06:58:31,Havde møde med det tyske mindretal for et par uger siden. De kan (heller) ikke se meningen med grænsekontrollen https://t.co/LY28U9oIKB
791013469831196672,2016-10-25 20:28:02,"Nej. Og jeg forstår heller ikke at hvis jeg røver en bank, bliver opdaget og leverer pengene tilbage at vi så ikke… https://t.co/14odLXYvwy"
790915072684089344,2016-10-25 13:57:02,Good news! But still a lot to be done! Need for ambitious targets and stable framework #enersolutions #dkgreen https://t.co/wMl1tEg4JS
790557485870514176,2016-10-24 14:16:07,@Marianne_Mog @R4nd4hl @MarieKrarup Tjaeh spørg Marine le Pen...
790519467595931649,2016-10-24 11:45:02,@KatheB1952 Hun! 😁
790492908319338496,2016-10-24 09:59:30,Set i Frankfurt lufthavn. Så er man godt nok bange for at flyve #flyskræk https://t.co/i9OezcuweE
790446944745381888,2016-10-24 06:56:52,@R4nd4hl @MarieKrarup Tak - skal huske på det
790269593512214533,2016-10-23 19:12:08,"Dybt skadeligt. For Danmark, Europa og vesten. Marie Krarup er Putins nyttige idiot. Putin må skrige af grin #dkpol https://t.co/8Hnc1WrfGx"
789811931515383808,2016-10-22 12:53:33,Synd for de mennesker og familier der kunne have fået arbejde og velfærd ved frihandel med et af de lande der ligne… https://t.co/VfJlUhwoB7
789751901831172096,2016-10-22 08:55:00,Et forsvar for frihandel. Det er der alt for lidt af i øjeblikket #dkpol https://t.co/1qHN92kJPf
788736774176661504,2016-10-19 13:41:15,Den græske minister for migration skriger på hjælp og solidaritet. DK bør bidrage mere til fælles flygtningepolitik… https://t.co/yh1DSA69d3
788624678193598464,2016-10-19 06:15:49,Mere vedvarende energi i fremtidens energiforsyning. Arbejder for den grønne omstilling #eudk https://t.co/3JXLsylBsh
788294342645538816,2016-10-18 08:23:11,"@mortenhelveg Uha, det bliver tæt. Hver en stemme tæller..."
788285029168316416,2016-10-18 07:46:11,Rikke Karlsson siger at der er ca 20 millioner Meld/Feld kroner der ikke er redegjort for. Hvad er op/ned? https://t.co/RaTOb1ASNJ
788283077688786944,2016-10-18 07:38:25,"RT @hansersej: ""Vi kommer helt sikkert til at betale flere MELD-penge tilbage"" -- @AndersVistisen https://t.co/nxnUZXavB8 #dkpol https://t.…"
788275734984986625,2016-10-18 07:09:15,@StenHaastrup Nåh ja - godt set! :-)
788272922800644096,2016-10-18 06:58:04,Det er altid de andres skyld hvis DF er i problemer. Men hvis? Hjælp på vej så vi kommer til bunds i sagen #dkpol https://t.co/uS6tT9hF3w
788107858936225793,2016-10-17 20:02:10,Tulle skylder svar. Det ville klæde #dkmedier at holde fast. Hvad vidste DF? Hvordan kunne det lade sig gøre?#dkpol https://t.co/8XDzSe95Ox
788104440263938048,2016-10-17 19:48:35,Tulle skylder svar. Når man tænker på alle de gange DF har været på krigsstien overfor alle andre... #dkpol https://t.co/4HDd2qM3Px
788033205010100225,2016-10-17 15:05:31,"Vi bør være fuldt og helt med i Europol. Ellers gør vi Danmark, danskerne og Europa mere sårbart #dkpol https://t.co/E32N7nCtWi"
787708903085707269,2016-10-16 17:36:52,Rigsrevisionen bør gå ind i sagen for at afklare (mis)brug af danske og europæiske skattekroner #dkpol https://t.co/zMhK0kdLom
787702440393146368,2016-10-16 17:11:11,"Fantastisk. ""Nej, jeg sætter jo ikke mine sko i EU""...citat fra et medlem af Folketinget. Sjovt - men trist #dkpol https://t.co/juCu7HaoZz"
786964891315924996,2016-10-14 16:20:25,@GerEllen @AsmusOlsen Bobbel økonomi?
786951781796474880,2016-10-14 15:28:20,Finansministeriet har gjort klar til kulturnatten. Nærmest overpyntet 😀 https://t.co/gVPd5fW40X
786650288602095616,2016-10-13 19:30:18,Super debat i Københavns omegn i Danmarks internationale parti 😀#eudk https://t.co/wDJbPPPxMS
786534653155049472,2016-10-13 11:50:49,"Frankrig, Tyskland og UK vil sanktioner mod Rusland efter rædslerne i Aleppo. Håber DK bakker op! #dkpol https://t.co/cP6qccQb7c"
786487881833541632,2016-10-13 08:44:57,Marathon afstemning i EP i dag om vigtige energi sager #eudk https://t.co/qujt7Z2y4u
786476103418404864,2016-10-13 07:58:09,RT @EnerSolutions: Greater interlinkages within the energy system - One step closer to an #EnergyUnion https://t.co/gqLRkD8NuK
786468566564478977,2016-10-13 07:28:12,Happy liberals ready to vote in Itre in EP 😀 😎 💪 @federley_eng @@AngelikaMlinar @kajakallas #aldegroup https://t.co/DnsW4ISPnD
786154989466980352,2016-10-12 10:42:10,Derfor burde regeringens tiltag om sikkerhed starte m det vigtigste: at DK forbliver fuldt og helt medlem af Europol https://t.co/Ef7i1Wzzj3
786141935685644288,2016-10-12 09:50:17,Et tryggere og mere sikkert Danmark hvis vi er med i Europol #dkpol  https://t.co/AtXhZnvKDN
786070355823693826,2016-10-12 05:05:51,Fuldt medlemskab giver adgang til alle Europols systemer. Ikke i DK's interesse at gamble. Hvad mener DF? #dkpol https://t.co/o6owsSPkBO
785819532552183808,2016-10-11 12:29:11,"Paneldebat om fjernvarme. Vigtigt i den grønne omstilling. Mere vedvarende energi i EU's energi union, mindre Putin https://t.co/Lqj12guoGF"
785778362983682049,2016-10-11 09:45:35,Europol har lavet nyt center til overvågning af ekstremisme på nettet. DK bør deltage til gavn for DK og EU #dkpol https://t.co/QkkQ8h3bqi
785727047867957248,2016-10-11 06:21:40,"RT @Hugodixon: Hard Brexit could lose UK up to £66bn in taxes, Treasury warns. Even if it's half as bad, more austerity on its way https://…"
785725006844133376,2016-10-11 06:13:34,EU programmer vigtige for Danmark og dansk forskning. Danske universiteter fortæller og forklarer #eudk https://t.co/ra8tb0raQ3
785406594427265024,2016-10-10 09:08:18,Lars Løkke og Theresa May har kun én ting til fælles https://t.co/KQ3dAAs1o8 via @twitter #eudk #dkpol
784678740173422593,2016-10-08 08:56:04,@Danfoss making strong points on need for solutions and energy efficiency #dkgreen #dkpol https://t.co/U69L9Aq0v2
784659821341605888,2016-10-08 07:40:54,RT @TheresaMEP: .@EUFORES_EU Day 2 - energy efficiency: Europe &amp; the world's first fuel #IPM16 https://t.co/yA5QgFOxTJ
784659737270972416,2016-10-08 07:40:34,Great panel on energy efficiency in Copenhagen this morning. EU's and the worlds first fuel https://t.co/vyt80ccE0D
784482819938615296,2016-10-07 19:57:33,@runningemann @Altingetdk det ville være rigtigt at gøre...
784482646562832384,2016-10-07 19:56:52,DK og EU ønsker dialog. Putin spiller efter helt andre spilleregler. Hvornår hacker Snowden Putins hemmelige konti?  https://t.co/p2E7KP2jzt
784395756044181504,2016-10-07 14:11:36,Selvfølgelig. Vi kan ikke forlade os på amerikanerne i al evighed. Måling: Danskerne klar til militært EU-samarbejde https://t.co/CDNG0OuEHf
784023998971740160,2016-10-06 13:34:22,Det er jo helt sort. Skal udenlandske medarbejdere nu have gule stjerner på i UK?  https://t.co/k7PzGnfBMH
783967731179745280,2016-10-06 09:50:47,Godt gået @naserkhaderdk og @JanEJoergensen. Syrien bløder og vi gør for lidt  https://t.co/JGJ6JPmlUI
783688920194281472,2016-10-05 15:22:53,Forfærdeligt. Vi skal være med. Hvordan? Hvad siger DF? https://t.co/TPdS3NGIAR
783272876321284096,2016-10-04 11:49:40,Fantastisk. Vil DF nu have samme Europol aftale som den Kina kan få som 3'land udenfor EU? Uden databaser mm? #eudk https://t.co/IrPGLoAVIB
783272264829591552,2016-10-04 11:47:15,@MrMesserschmidt Du vil da vel ikke i alvor have at DK politi sku have samme aftale og vilkår som Kina??? Det må da være din spøg?
783271841230053376,2016-10-04 11:45:34,"@GlobalenDK Sikkert. Så også gerne højere tempo. Men pointe er at det er EU der er rammen. Ikke nat staterne, Nordisk Råd, Østersøråd el lig"
783261584822980609,2016-10-04 11:04:48,"En god dag for klimaet. Og ja, selvfølgelig er EU rammen for hvordan vi gør mest og bedst for klimaet. Hvem ellers? https://t.co/Ds3fa9o6uK"
782932289915383808,2016-10-03 13:16:18,"RT @oestergaard: Fuldt stop! Vil @venstredk og @Spolitik forklare især syd- og østjyder, hvorfor tryghed skal lide under politisk valgt græ…"
781907371157233664,2016-09-30 17:23:39,"RT @LauritzenEuropa: Thulesen-Dahl erkender, at han fejlinformerede danskerne om DFs intentioner op til folkeafst. 3 dec @politiken https:/…"
781907342258499584,2016-09-30 17:23:32,"RT @BjarkeMoeller: Det var ikke bare noget KTD ""sagde"". DF underskrev aftale om plan B med begr. tilvalg, og tilvalg forudsætter altså Sche…"
781907315964440576,2016-09-30 17:23:25,"RT @oestergaard: Nu alligevel sjældent at en ""Breaking"" meddelelse er så ligefrem og lakonisk. Men sandt er det jo desværre. #eupol https:/…"
781779069436301312,2016-09-30 08:53:49,RT @hansersej: Her er beviset: Thulesen i kovending om Europol https://t.co/pAJMuTJPMt #dkpol #eudk
781496540753956865,2016-09-29 14:11:09,When you are in a hole stop digging... https://t.co/JNC3vVw48y
781172947759357952,2016-09-28 16:45:18,Møde med det danske mindretal i Tyskland. Skarp kritik af grænsekontrol https://t.co/K3iuPW9gaQ
781096499996393472,2016-09-28 11:41:32,Hvilken planet lever DF på? DF leger politik med danskernes sikkerhed og tryghed https://t.co/myq5jrO0kB
780989694490312704,2016-09-28 04:37:07,RT @radikale: Århundredets vælgerbluff. DF lovede udtrykkeligt danskerne fortsat medlemskab af Europol https://t.co/Btx3MWZGJr #dkpol #eudk…
780989606108008448,2016-09-28 04:36:46,"RT @oestergaard: Hvornår er regeringen klar til at afkræve DF svar på garantien til danskerne om forbliven i Europol?https://t.co/6Ei9j0l…"
780766680574267392,2016-09-27 13:50:57,På speed dating med virksomheder hos @DanskIndustri. Vi lytter...😄 https://t.co/r55CAqEUkA
780738030307082241,2016-09-27 11:57:06,"@DanskIndustri gør i dag hvad politikere over hele Europa forsømmer: taler EU op, ikke ned"
780736811274539008,2016-09-27 11:52:15,Generation Europe needs open borders. Unge stemmer fra Europa med vigtige budskaber hos @DanskIndustri
780735694104846336,2016-09-27 11:47:49,Brug for frihandel. Og verden omkring os. Kloge ord fra @DanskIndustri https://t.co/Js5mhiTCBT
780683291800301568,2016-09-27 08:19:35,RT @EuropaBev: Danskerne kræver #fællesløsninger på flygtningesituationen - opfordring til #dkpol hermed videresendt #eudk https://t.co/Dye…
780682915491508224,2016-09-27 08:18:06,RT @PaulaLarrain1: De voldsomme horder der gør os ude af stand til at leve op til int aftaler. De er nu landet i bla Lyngby-Taarbæk. 44 sjæ…
780400467096535040,2016-09-26 13:35:45,RT @thinkeuropa: EU’s lovmaskine sænker farten. Antal af nye regler halveret siden 90’erne. Analyse af @NadjaSchouL: https://t.co/Ywubb1g4m…
780373103499218944,2016-09-26 11:47:01,RT @GuyVerhofstadt: More depraved acts by Russia &amp; Assad in #Aleppo. Statements aren't enough - #EU must now explore sanctions against #Put…
780124249302372353,2016-09-25 19:18:09,Oplevede @lykketoft på nærmeste hold som finansminister. Han var fremragende. Stor inspiration #dkpol https://t.co/ZilQ8Qqcwh
780003138170449922,2016-09-25 11:16:54,I studiet med @DavidTrads om Europol #eudk https://t.co/OsawI1CFxI
778614782282895360,2016-09-21 15:20:04,Argh hvorfor ikke en superliga klub? (=FCK 😀) https://t.co/ItJb75mi2X
778608364196597760,2016-09-21 14:54:34,@Lars2312 @HeidiHsj Hahaha og slet ikke hvis det absolut skal være intellektuelle 😀😀😀
778607887799218178,2016-09-21 14:52:40,Det skulle vi have haft for mange år siden... https://t.co/BB5DfmxvbB
778607426895507457,2016-09-21 14:50:51,"@NiklasRMilthers Financial Times i dag, side 4 nederst"
778606543780581376,2016-09-21 14:47:20,@Lars2312 @HeidiHsj Og nu er mit fly blevet aflyst! What to make of that???
778590595136753664,2016-09-21 13:43:58,&amp;@😎😡😢😨😩&amp;$; på vej mellem bureau meeting i Prag og møde i Hjallerup og skal have printer i lufthavnen til at virke... https://t.co/bfgKFlzCS5
778585022563516416,2016-09-21 13:21:49,@NiklasRMilthers se foto
778556114325602304,2016-09-21 11:26:57,DK er nu alene med Tyskland og Frankrig ifølge DF. Terrible for anybody siger Berth. Måske mest for dem? #absurd https://t.co/VjE6K338lO
778523556573511680,2016-09-21 09:17:34,"Mon vi skal forvente, at @larsloekke annoncerer en ny #eudkfolkeafstemning ved Folketingets åbning den 4. oktober?https://t.co/aHCFjchUMI"
778172184619577344,2016-09-20 10:01:21,Skræmmende. Diskuterer med tjekkisk forsvarsminister der taler om Putin og russernes adfærd i Tjekkiet
778166282902466560,2016-09-20 09:37:54,Tjekkisk forsvarsminister taler om vigtigheden af fælles forsvar https://t.co/gdMg3RLAtY
777893967434248192,2016-09-19 15:35:49,Til møde med Prags liberale borgmester der taler om mangfoldighed i Prag og Europa #eudk https://t.co/75unK1VzVg
777863022928916480,2016-09-19 13:32:51,Møde i Alde Bureau. Vi diskuterer strategi og politik midt i valgperioden. Brug for reformer i og af EU. #eudk https://t.co/xnT1D3OyBr
777159482057121793,2016-09-17 14:57:14,Skarp radicool EP dresscode til #rvlm16 https://t.co/wZaDR0GVNr
777124021532057600,2016-09-17 12:36:19,Danmarks internationale parti. @vestager på talerstolen i Nyborg. Var ikke sket hos @DanskDf1995 i Herning #rvlm16 https://t.co/emYi0Y690T
777074615063576576,2016-09-17 09:20:00,"RT @radikale: .@oestergaard KTD en klar opfordr til, at du i dag i Herning bekræfter dit løfte til danskere om, at DK er med i Europol i 17…"
777071525673525248,2016-09-17 09:07:43,EU har bragt os et bedre sted hen! Yes! @oestergaard #rvlm16
777066520535035904,2016-09-17 08:47:50,Gør en forskel for dem der er svagere end os selv og dem der er efter os selv. Godt brølt @oestergaard #rvlm16 https://t.co/a4DvE2kebE
776845553560944645,2016-09-16 18:09:47,Nemlig! https://t.co/io2lui1qqY
776740922499489792,2016-09-16 11:14:01,Trist. DF bryder løfte til danskerne. Løkke: DF-krav kan sende Danmark ud af Europol - Altinget - Alt om politik https://t.co/5uyB2XgqqA
776734518816436224,2016-09-16 10:48:34,RT @BjarkeMoeller: Danskerne er ikke EU-skeptikere. Solidt flertal for EU. + tilvalg af Europol og et farvel til forsvarsforbehold https://…
776529179772870656,2016-09-15 21:12:38,"RT @dr2deadline: .@mortenhelveg: Jeg tror, at kampen i disse år står mellem de åbne og lukkede samfund i EU #eupol https://t.co/qnA9z5j07I"
776513383793393664,2016-09-15 20:09:52,RT @ThomasSoie: @JeremyRifkin tager temp på EU i @dr2deadline 22.30 - @mortenhelveg og @Enhedslistens Søren Søndergaard tager temp på Rifki…
776507978556010496,2016-09-15 19:48:23,Godt! DF løber fra løfter og spiller hasard med Danmarks sikkerhed #eudk  https://t.co/18lADDvU4p
776395990685196288,2016-09-15 12:23:23,"EU's stats- og regeringschefer skal tage sig sammen på topmødet i Bratislava. EU's fremtid er på spil #eudk #dkpolhttps://t.co/797zLwQw0q"
776064849906458625,2016-09-14 14:27:33,Meddelelsen i højttaler i toget minder om Junckers tale: We are waiting for permission to continue...#SOTEU https://t.co/VmOicmb7JV
775972551315034112,2016-09-14 08:20:47,Visioner og værdier fra @GuyVerhofstadt. Kampen står ml det åbne og det lukkede. Fælles løsninger vejen frem #SOTEU https://t.co/eYaPfZxqyG
775966585798352896,2016-09-14 07:57:05,Juncker er lige så ung/gammel som det europæiske projekt. Vigtige europæiske værdier at give videre #SOTEU https://t.co/8piXeppM0c
775964161507336192,2016-09-14 07:47:27,Stærk appel fra Juncker om solidaritet og sammenhold i en svær tid for Europa #SOTEU https://t.co/10F4bp7O5z
775959254092029952,2016-09-14 07:27:57,State of the union i Europa Parlamentet i Strasbourg. Fortsat kamp for fælles løsninger. Vi må løse problemer sammen https://t.co/IL0sYfEl0v
775956202878414848,2016-09-14 07:15:49,Thanks @MarosSefcovic. Looking forward to close coop on all the big &amp; important energy files! And tips abt 50 😀🎂 https://t.co/CvJjN1uyHB
775955853530718208,2016-09-14 07:14:26,"RT @MarosSefcovic: @mortenhelveg Right before we all turn to #SOTEU, I wish you very happy birthday! I'm a few months ahead, can give you t…"
775953205662326786,2016-09-14 07:03:55,"Skøn start på dagen i Strasbourg. Herlige kolleger, kiwikage (!) og fødselsdagssang! #50goingstrong https://t.co/jELMQ9cWSW"
775947127528656896,2016-09-14 06:39:46,@SchaldemoseMEP @vestager Tak for sang og sund kage 😀🎈🎊🎉🎂
775946492666220544,2016-09-14 06:37:14,RT @SchaldemoseMEP: Kæmpe tillykke til kollega @mortenhelveg med de 50. Vi fejrer i Strasbourg @vestager #eudk https://t.co/EHPGwpFTXt
775747945958371328,2016-09-13 17:28:17,Plus det forhold at det er første gang et EU medlemsland melder sig ud af et EU agentur som Europol Ryborg: https://t.co/f8ZAs44zDX
775426760745840640,2016-09-12 20:12:01,Selvfølgelig. Men hvad mener DF? Hvor blev garantien for fuldt medlemskab af Europol af?  https://t.co/DCkdK8b92q
775384762110382080,2016-09-12 17:25:07,King understreger Europols vigtige rolle i bekæmpelse af terror og organiseret kriminalitet. Danmark bør være fuldt og helt med!
775381384928059392,2016-09-12 17:11:42,Så er den nye engelske kommissær King i gang med høring i EP. På fransk 😀 https://t.co/cld74ZHc1a
775360577321496576,2016-09-12 15:49:01,Debat om energi i EP. Vigtigt for Europa - og for danske virksomheders muligheder for eksport og skabelse af jobs https://t.co/RaH65GhSUu
775340653098205184,2016-09-12 14:29:51,Fremragende analyse fra @BjarkeMoeller. Vi burde takke Merkel https://t.co/HCaNvk4diE
775226455294869504,2016-09-12 06:56:04,Det er sørgeligt at se regeringens leflen for Dansk Folkeparti #dkpol https://t.co/BzJWEIGYfH
774921215962210304,2016-09-11 10:43:09,@jarlner @AnneMetteEP @EPiDanmark @SchaldemoseMEP @rinakari Spændende. Godt fundet på - og udført!
774224987016327169,2016-09-09 12:36:35,Tak for gode spørgsmål og fin debat på. #ufm16#eudk https://t.co/IOjFz2uB1l
773907905502470145,2016-09-08 15:36:37,"Til #eudk debat om flygtninge, brexit mm på #ufm16 i Europa-teltet (B24) fredag 9.30 m @SchaldemoseMEP og @rinakari - kom og præg debatten 😀"
773872363087728640,2016-09-08 13:15:23,Congrats! = guarantee for visions for future of Europe. We need it...#aldegroup https://t.co/924vTOyKwk
773777731821731840,2016-09-08 06:59:22,Gad vide hvad Danmarks statsminister egentlig mener?  https://t.co/kFsd1is3Nb
773082303929131008,2016-09-06 08:55:59,Gad vide om han virkelig selv tror på det vås?  https://t.co/NJUzvnbVPZ
772867909551022082,2016-09-05 18:44:03,Fejrer flagdag i Bruxelles m @BendtEU. Æret være veteranerne og alle de der bragte de største ofre. Tak https://t.co/DNfW9muotf
772801897149456385,2016-09-05 14:21:44,RT @ALDEgroup: RT! EU needs to play its role &amp; push #Russia to respect the UN resolutions it has signed on #Syria https://t.co/5FlLAhYhD6
772789396139573248,2016-09-05 13:32:04,DK bad Eurojust om hjælp 113 gange i 2015. Vigtigt samarbejde ml anklagemyndigheder i EU gør DK sikrere. Hvor er DF? https://t.co/M54wZ7x1kd
772732618790072324,2016-09-05 09:46:27,Måske det vigtigste for DK sikkerhed at komme fuldt og helt med i Europol. Grænsebomme er symbolpolitik. Hvor er DF? https://t.co/2N0nCHiAKu
772405238619922433,2016-09-04 12:05:34,RT @BjarkeMoeller: Borgmestre: Politi-timer spildes ved grænsen https://t.co/dRH5rplpwS Brug pengene fornuftigt i stedet for på symbolpolit…
772024803683434498,2016-09-03 10:53:51,Forstår ikke hvorfor det skulle være i Danmarks interesse at stå udenfor Europol? Kan nogen forklare?  https://t.co/x7g4q9zN4d
771641644370173956,2016-09-02 09:31:19,En tidl Christiania ordfører glæder sig over at Christiania tager ansvar. Hold fast. Fælles ansvar  https://t.co/kKbvJAT3Du
771246213773471744,2016-09-01 07:20:01,"Øh ja. Fordi verden er kompliceret på trods af hvad vælgerne bliver bildt ind af Farage, Trump og Dansk Folkeparti https://t.co/09qkwEgML1"
770908816925949952,2016-08-31 08:59:19,Anti-terror og flygtninge på dagsordenen i EP i dag. Og i den kommende tid. Kæmper for fælles løsninger#eudk https://t.co/bSVjPn57Vv
770505313044819968,2016-08-30 06:15:56,"Regeringen fremlægger ""sikkerhedspakke"". Men hvad med DK i Europol? Det er det mest effektive mod org kriminalitet og terror. Haster #dkpol"
770248937747931136,2016-08-29 13:17:11,"RT @politikodk: Blog fra @mortenhelveg:Danmark er et eksempel på EU’s krisehttps://t.co/8hW8CQJFmR #dkpol"
769991405188050944,2016-08-28 20:13:51,@mfMorten Nyd det...😄
769531694521147392,2016-08-27 13:47:07,Gang i debatten i den radikale hovedbestyrelse https://t.co/EvvOPXD1tg
769517055632633856,2016-08-27 12:48:57,Ny blog: Danmark bør bidrage til fællesskabet https://t.co/Z05ObTFKek
769432330775715840,2016-08-27 07:12:17,Et trist eksempel på omkostninger ved grænsekontrol https://t.co/87paWWHbtm
769153114964430849,2016-08-26 12:42:47,"Synspunktet fra @MarieKrarup bliver ikke mindre absurd, når det bliver gentaget på engelsk. #eudk #dkpol https://t.co/tYrSjSDCuB"
767659112498954240,2016-08-22 09:46:09,Sommer gruppemøde. @IdaAuken og @sofiecn kører hårdt på 😀💪✌️ https://t.co/1kbBK2X32a
765828513790328832,2016-08-17 08:32:00,En af fordelene ved at rydde op i sine skabe 💪😊😀 https://t.co/1R1KLwMfrA
761573824664051713,2016-08-05 14:45:23,@nadeemfa tillykke!!!
760851580677677056,2016-08-03 14:55:27,Brexit koster. Synd for dem der mister deres arbejde  https://t.co/SJUh999xAk
760037177900294144,2016-08-01 08:59:18,Mærkbare øk omkostninger ved Brexit. Synd for briterne og dem der mister deres job  https://t.co/YOVx7na9wK
759304025326153728,2016-07-30 08:26:01,Ingen kommentarer fra Tulle!? Hm... https://t.co/FRTnNIFCUq
756903627437072384,2016-07-23 17:27:42,@MadsHenriksen Tæt samarbejde med de bedste politifolk på området i Europa gør også dansk politi bedre
756879518862831616,2016-07-23 15:51:54,Vi gør det ikke nemmere for os selv ved at stå udenfor Europol...https://t.co/j7zbdWJ3Hu
756607795059916800,2016-07-22 21:52:10,@je5perl Det er jo ift tjenesternes egne vilkår at Europol reagerer
756514144959037440,2016-07-22 15:40:02,Endnu et eksempel på vigtigheden af Europol. DK bør være fuldt og helt med https://t.co/OFkCamX6zK
756494979938263040,2016-07-22 14:23:52,@MrMesserschmidt Han garanterer da intet? Og kan i øvrigt heller ikke. Du garanterede - og løb fra det #løftebrud
755757075993681920,2016-07-20 13:31:42,Godt udspil. Men hvad vil Danmark? Vi har brug for flere elbiler #dkgreen https://t.co/4OGoAf56nG
755709047895105542,2016-07-20 10:20:52,"RT @EnerSolutions: Energy Solutions present its reflections in the run-up to the climate package as part of an #EnergyUnionhttps://t.co/am…"
753224657914957824,2016-07-13 13:48:47,Slut med asylshopping. Men hvad vil Danmark? Den politiske puls #dkpol  https://t.co/mEVt6sM6MQ
752818307993047040,2016-07-12 10:54:05,"God artikel om medier, Brexit og Trump. Klar parallel til den danske Europol afstemning  https://t.co/8P1oo8nCwm"
751451159181791232,2016-07-08 16:21:32,Morten Helveg: Nu svarer EU på flygtninge- og migrantkrisen. Mens Danmark svigter « RÆSON https://t.co/JhPPHWq9pm
751355596675350528,2016-07-08 10:01:48,Endnu et eksempel på vigtigheden af Europol https://t.co/Ct511p7Y1w
750674100092301313,2016-07-06 12:53:46,Godt med etablering af europæisk grænse- og kystvagt. Vi kan kun løse udfordringerne i fællesskab #dkpol https://t.co/u8Y1TlOLiX
