id,created_at,text
726127228833124353,2016-04-29 19:13:16,RT @alternativet_: Vi siger farvel og stor tak til vikaren fra paradis @NikolajAmstrup og goddag igen til @fightingheart 💚#dkpol https://t.…
726126625050517504,2016-04-29 19:10:52,@dittegiese Kringsat af cremer.
726124757511458816,2016-04-29 19:03:27,"RT @alternativet_: Den danske befolkning fortjener en offentlighedslov, der lever op til sit navn, siger @JosephineFock #dkpol https://t.co…"
726099773862862848,2016-04-29 17:24:11,Hvad er natur? #AltErNative! https://t.co/juRdECd082
726096770913193984,2016-04-29 17:12:15,@EmilKier @emma_holten det ville på alle måder være på sin plads
726095110564368384,2016-04-29 17:05:39,"@emma_holten @EmilKier Det er en fantastisk film, Emma. Både originalen og De fem benspænd."
726094227420098560,2016-04-29 17:02:08,"@LyngeKurt Så ville jeg komme til at savne mine venner, dansk kultur, min familie og mine to små knægte, Kurt. Vil gerne have lov at blive:)"
726093469224153088,2016-04-29 16:59:07,"@iNSiG9FiX Ja, det er ikke en uvæsentlig nuancering for mange, Martin. Tror dog at EU skal knuselskes før det bliver, som det skal være."
726092350745907204,2016-04-29 16:54:41,@emilnielsen Hun brænder igennem og kæmper oprigtigt og ufortrødent for en sag. Fortjent med stor respekt om Johannes potentiale og arbejde.
726091424421306368,2016-04-29 16:51:00,Det var her Dannebrog faldt ned fra himlen i Tallinn. Vi danskere kunne lære af esternes Europa-positivitet. #udsyn https://t.co/f1VpU4H2OP
726084833894617089,2016-04-29 16:24:49,Nyskabende dialoger &amp; sikkerhedspolitiske diskussioner i Tallinn og Bruxelles i denne uge. Thanks to @USNATO. #dkpol https://t.co/VrzZWaFb3I
726011164224831490,2016-04-29 11:32:04,"RT @alternativet_: Borgerdrevne forslag vil supplere, udvikle og forbedre det repræsentative demokrati #dkpol #ftlive #nypolitiskkultur htt…"
725941439541088256,2016-04-29 06:55:01,"""Processen har været hermetisk lukket og uden nogen overordnet sikkerheds­politisk plan"" https://t.co/uQFMMCSwNy #dkpol @alternativet_"
725800040539783168,2016-04-28 21:33:09,"RT @TwomasC: Jeg elsker dem som rækker ud, som prøver at bygge bro. Ikke fordi vi skal være enige, men fordi vi skal forstå hinandens forsk…"
725787829863895040,2016-04-28 20:44:37,"Tak! Vi har brug for disse nuancer i debatten. Værdien er større, når det kommer fra fagfolk, end når jeg siger det. https://t.co/L0E08aRoaT"
725786006247579648,2016-04-28 20:37:22,"Det er lige nu, og der er ingen reel debat. Derfor skaber vi den! Deltag: https://t.co/Q4Eos6ddIg #dkpol #åbenhed https://t.co/S66qdbabNs"
725552285573591040,2016-04-28 05:08:39,Åbenhed og gennemsigtighed er vejen til at genvinde tilliden til @Skat_DK - og #dkpol. Vigtigt skridt i den retning: https://t.co/wSOBo8RGOQ
725550815994339328,2016-04-28 05:02:49,RT @jpkildevang: .@PSkipperEL @JosephineFock vil styrke offentlig ansattes ytringsfrihed &amp; indføre whistleblowerordning #dkpol #ytr16 https…
725418902524694529,2016-04-27 20:18:38,@PUB_84 @alternativet_ det du hører dig selv sige:-) investering i udviklingslande er derimod #dkpol's bedste bedste værn mod terror #lyt
725414938504732672,2016-04-27 20:02:53,"RT @oceanthing: @alternativet_ har ""fanget den"": Bæredygtige fisk er eneste mulige vej at gå:  https://t.co/F4mhABGkl0 #fiskeri #alternativ…"
725414751031930880,2016-04-27 20:02:08,RT @alternativet_: Dansk udviklingsbistand næsten halveret på 15 måneder. Vi vil øge til 1% af BNP https://t.co/yUZetvbn3l #dkaid #dkpol
725286382969733121,2016-04-27 11:32:03,"@SorenHave Det var ikke tanken - men hvem ved, alt andet lige kan jeg dog blankt afvise, at jeg kommer hjem med et, Søren!"
725285992563937280,2016-04-27 11:30:30,"@RuneKier nærmere det kendte men udebatterede ... og måske derfor reelt ukendte, Rune. Ok, du vinder;-)"
725285666142171136,2016-04-27 11:29:12,"RT @medborger: A.P. Møller fonden giver 750 mio. kr. til udsatte, psysisk syge og handicappede på institutioner. #dkpolhttps://t.co/DdvKDf…"
725280114653708288,2016-04-27 11:07:09,"På vej til Tallinn for at blive klogere på noget jeg har stor respekt for, men også er meget kritisk overfor #dkpol https://t.co/2HYOshZP52"
724842486523387904,2016-04-26 06:08:10,Vi har adgang til fremragende eksperter og fagfolk i #dkpol. I dag i Bruxelles for at finde nye veje til fred. https://t.co/VvNDDic0SY
724831898682302465,2016-04-26 05:26:06,"RT @kjaerulv: International bank transfer system hacked, Swift group admits https://t.co/HlMcZEV9fu"
724711987687600129,2016-04-25 21:29:37,"@Toerning @Altingetdk indtil vi med vores medlemmer har færdigudviklet politikområdet er det ik på hjemmesiden, men kun hos mig som ordfører"
724708514392879104,2016-04-25 21:15:48,"@Toerning @Altingetdk Godnat, bliver det bedste og mest kompromissøgende svar, jeg kan give dig til den bemærkning, Kristian."
724707197758902273,2016-04-25 21:10:35,"@SonnySandberg @Toerning @Altingetdk okay, det kan jeg ikke følge dig i. Jeg linker til det der efterspørges, idet svarene findes der, ik'?"
724706008191373317,2016-04-25 21:05:51,"@Toerning @Altingetdk Glimrende. Så langt så godt. Jeg skriver ikke mine taler ned,men den ligger på ft.dk, hvor alt fra salen skrives ned."
724702965471272960,2016-04-25 20:53:45,"@Toerning Netop. Jeg har linket til min FB-side med interviews, taler og tekster om vores tilgang. Både du og @Altingetdk er velkomne!"
724700985780740097,2016-04-25 20:45:53,@Toerning bl.a. ved at insistere på at putte hinanden i bokse uden forsøg på at blive klogere og derved kun acceptere sort og hvidt i #dkpol
724697766975406080,2016-04-25 20:33:06,"Kære #dkmedier &amp; #dkpol, stop selvsvinget: Vi argumenterer IKKE for dialog med IS. Se: https://t.co/aH9WDrOLqc #lyt! https://t.co/xEKR19DRVF"
724603139194757121,2016-04-25 14:17:05,"RT @alternativet_: Vi holder politisk laboratorium i Det Grønlandske Hus i København i dag kl. 18-21. Om global politik, Arktis og rigsfæll…"
724541561653047297,2016-04-25 10:12:24,@R4nd4hl @sorenpind under alle omstændigheder må din straf udmåles efter din forbrydelses omfang - og her overlader jeg det til ministeren.
724540894687432704,2016-04-25 10:09:45,@R4nd4hl @sorenpind ... alt andet lige tillader jeg mig at vurdere din 'simplificering' som satire mere end et påstået sagligt resume;-)
724524264330780672,2016-04-25 09:03:40,RT @informeren: Vi har testet over 3.000 læsere for etiske dilemmaer forbundet med kunstig intelligens i selvkørende biler: https://t.co/vx…
724524025096077312,2016-04-25 09:02:43,"RT @ThomasBerntH: Fin kronik af @rasmusnordqvist fra @alternativet_ i @borsenopinion - vågn op, Christiansborg #dkpol  https://t.co/iYF2YAZ…"
724327046516740096,2016-04-24 19:59:59,"@LadySakai @alternativet_ @Pernilleschnoor vi har jo et partiprogram ligesom alle andre, så det løse er nok blot at vi ikke vil fastlåses;-)"
724325636261744644,2016-04-24 19:54:23,"@LadySakai @alternativet_ @Pernilleschnoor vi har højt til loftet, deler værdier, politiske holdninger og viljen til en ny politisk kultur!"
724323679258193920,2016-04-24 19:46:37,"@LadySakai @alternativet_ @Pernilleschnoor præcis, og det er netop det det lyder til, at Pernille i den grad gør"
724322181325447170,2016-04-24 19:40:39,"I @alternativet_ kan man kun være og være sig selv - hvis man mener det. Det lyder det til, at @Pernilleschnoor gør: https://t.co/HZSL40I9Nr"
724284679499685888,2016-04-24 17:11:38,"@AndersGerber jeg forestiller mig, at du har været ret 'tydelig' på sidelinjen undervejs, Anders;-) Tillykke med sejren!"
724263926301642752,2016-04-24 15:49:10,"PublicServiceB108: Nej, jeg argumenterer IKKE for dialog med IS. Og jo, militær ER nødvendigt. Se her hvorfor https://t.co/aH9WDrOLqc #dkpol"
724262038432829440,2016-04-24 15:41:40,"@KristineKryger @Tulkasdk netop, Kristine."
724261944769810432,2016-04-24 15:41:18,@OleKristensenDK @birtheskyt præcis. Virkelig spændende vinkel
724261851425574912,2016-04-24 15:40:56,@SeriousSod i så fald er der grund til forandring.
724254971311562752,2016-04-24 15:13:35,"@iNSiG9FiX jeg synes faktisk udbuddet er ret bredspektret. Tænker du på specifikke mangler, Martin?"
724239505440542720,2016-04-24 14:12:08,@Heunicke tak - og god søndag!
724236322030948352,2016-04-24 13:59:29,@Heunicke har altid haft stor respekt for Næver! Ikke mindst stjerner som Alex Nielsen og Søren Juhl - og talentudviklingens i de senere år
724182019119431680,2016-04-24 10:23:42,"@carolinamaier @BornsVilkar @alternativet_ eeeeen rigtiiig fiigjjjteeer - god bedring, seje kollega! @alternativet_ til stilstand."
724181498602110976,2016-04-24 10:21:38,"Søhøjlandets Helte spiller for åbne porte i dag! Mit bud er, at Ejlifs gode gratis-karma giver 3-0 til @SilkeborgIF! https://t.co/4dK5ZLKxBV"
724136142522580996,2016-04-24 07:21:24,"Debatten i #dkpol handler for ofte om at isolere og sammensætte 10% af modpartens pointe, så det i sin mangelfuldhed fremstår helt tåbeligt."
723787943748489216,2016-04-23 08:17:47,Hvor er det vildt at tilliden til politikerne (med rette?!) er så lav. Det er jo reelt tilliden til vores egen dømmekraft som vælgere #dkpol
723466839565701124,2016-04-22 11:01:50,"Farligt inspirerende kombi af kreativ skatteplanlægning, rummelige sengekonstruktioner og lokal deleøkonomi #dkpol:  https://t.co/TkAT8ZrzU4"
723408172556259329,2016-04-22 07:08:43,@alternativet_ #dkpol https://t.co/IJcHkjPkmR https://t.co/uY27gYkJGc
723387104655335426,2016-04-22 05:45:00,Store Bededag er til eftertænksomhed og ydmyghed. Udsyn og fællesskab - i troen på noget og nogen. Nyd den: https://t.co/3u4txjnUWv #Danmark
723382691328970755,2016-04-22 05:27:28,RT @PPresmann: Opskrift på mindre politikerlede? Den får du her. #dkpol @ChristianPoll @metteabildgaard https://t.co/ux3d8TeCp0
723208843203883008,2016-04-21 17:56:39,"Din ambition er at ruste politiet til fremtidens opgaver, så saml #dkpol om det &amp; glem frihedsberøvende og dyr #sessionslogning, @sorenpind."
723175301463728129,2016-04-21 15:43:22,En tale om langsigtet og fornuftig sikkerhedspolitik i #dkpol - i stedet for letforståelig og kortsigtet handlekraft https://t.co/aH9WDrxa1C
723149818072281089,2016-04-21 14:02:06,"RT @JosephineFock: Ministeren bør hurtigst muligt rette ind. Klar melding fra OECD @alternativet_ #dkpolhttps://t.co/z66AZjqvwW"
723147572949442560,2016-04-21 13:53:11,"Hej @SimonEmilAmmitz. Er du korrekt citeret her? Troede slet ikke, at det var den retning i ville.  https://t.co/xEnlI98xde"
723145139988910080,2016-04-21 13:43:31,"RT @kramse: Vigtigt at @renegadedreng taler om vækst, ifb #kryptering - det er jo hele grundlaget for vores samfund at firmaer kan beskytte…"
723144881263263744,2016-04-21 13:42:29,RT @jnkjaer: Tak til @renegadedreng for sit indlæg i debatten om dansk krigsdeltagelse. Fører vores bomber til fred? Se: https://t.co/BryUY…
723027313877757952,2016-04-21 05:55:19,"@brandsen @CasperKarup @shc2012, ved ik' om Casper er pacifist, men vigtigt at pointere, at nej til mørkelagt kampflykøb ik' er = pacifisme."
723009560487841796,2016-04-21 04:44:46,Danskerne om nye kampfly til milliarder: Nej tak https://t.co/36NeCrsE9F #dkpol #nysikkerhedspolitik #gennemsigtighed
722898036163084289,2016-04-20 21:21:37,@PSkipperEL @Enhedslisten ... Henning tager madbilleder til Instagram og tweeter om processen 😉!
722878192638365696,2016-04-20 20:02:46,"@tv2politik @metteabildgaard Flot! Det er en stærk tillidserklæring. Tillykke, Mette. Fortsæt endelig med din sympatiske tilgang i #dkpol"
722873143929499648,2016-04-20 19:42:42,"RT @CasperKarup: Nu smider jeg bomben. Jeg mener ikke, at Danmark skal bruge op mod 100 mia på krigsfly (inkl drift osv). Brug 100 mia på u…"
722850544273006592,2016-04-20 18:12:54,I morges havde jeg fornøjelsen af 30min krydsild om @alternativet_'s vision for #dkpol's forsvarspolitik @radio24syv https://t.co/hkqpIRV07A
722845852876808192,2016-04-20 17:54:15,@ProvoDk @alternativet_ Tusinde tak!
722845729467842560,2016-04-20 17:53:46,"RT @ProvoDk: René Gade @renegadedrengDu har været på´ hele dagen og du har fanme anti-krigsme gjort det godt!@alternativet_  https://t.co…"
722754906793193472,2016-04-20 11:52:52,"RT @alternativet_: Hvornår blev forhandlingen naiv og drabet logisk, spørger @renegadedreng https://t.co/xAO56m8AVO #dkpol #syrien"
722643191028191232,2016-04-20 04:28:57,"I går sendte #dkpol potentielt 180 danske soldater i krig på 'landjorden' mod IS. Uden slutdato, uden en klar plan:  https://t.co/zh5sor4Z0y"
722640814883606530,2016-04-20 04:19:30,"Øjnene på bolden - sådan skal det være! Både når vi er enige, og når vi er uenige. @alternativet_ #nyemål #fællesmål https://t.co/JFaym41OIf"
722519423333056514,2016-04-19 20:17:08,RT @brandsen: .@renegadedreng: 15 års dansk aktivistisk udenrigspolitik er slået fejl. #dkpol #ftlive
722519386804908034,2016-04-19 20:17:00,RT @StineSkot: @renegadedreng: Sikkerhedspolitik er andet end krig! Det er et langt sejt træk. Yes @alternativet_  Et sejere træk må jeg ti…
722519200703606787,2016-04-19 20:16:15,@Rikke_MY mange tak for opbakningen. Ærgerlig beslutning - håber vi fik åbnet for nogle nuancer og alternative muligheder trods alt
722442494714200068,2016-04-19 15:11:27,"@MadsBis @hec4x4 @dkpolparrot @tv2newsdk tak, interessant. Har du mulighed for at linke til spørgerammen og forudgående info til respondent?"
722346965405732864,2016-04-19 08:51:51,RT @hojlund82: @renegadedreng @DebattenDR2 drabet blev logisk den dag det stoppede med at være personligt.
722346928273498112,2016-04-19 08:51:42,"@hojlund82 @DebattenDR2 det er en reel, virkelig og stærk betragtning, Mikkel."
722336100572917760,2016-04-19 08:08:41,@DennerHJ @alternativet_ bibeholde. Indtil klar strategi for Danmarks internationale sikkerhedsbidrag og mål viser noget andet.
722310867556134914,2016-04-19 06:28:25,"RT @mathiaspoulsen: Grotesk situation at bredt flertal i #dkpol går i krig, når de er komplet ude af stand til at redegøre for, hvordan det…"
722303890981576704,2016-04-19 06:00:42,RT @alternativet_: Vores første klimavagt står klar på Christiansborg Slotsplads i dag kl 14-16 #dkgreen #dkpol #klimavagt https://t.co/irc…
722297128048029698,2016-04-19 05:33:49,@ahojmark_dk @uffeelbaek vi ønsker en omlægning af vores forsvarspolitik og derfor bestemt ikke at fastfryse retningen med mørkelagt flykøb.
722296608331796480,2016-04-19 05:31:45,"@ahojmark_dk @uffeelbaek giver en længere forklaring på min FB-side. Pt. kan vi ikke prioritere nyindkøbet, måske med en reel brugsplan."
722289825588645888,2016-04-19 05:04:48,"Det mest passive, man kan gøre er at gentage det, vi har gjort de sidste 15 år, som ikke har virket. #dkpol #DKiKrig https://t.co/SMwdqIo95h"
722162087947071488,2016-04-18 20:37:13,"Det eneste vi ikke ville var at lære af fortiden. Måske ku' vi, finde noget at bruge den viden til #mistillid #dkpol https://t.co/1LJGQ7B7Pa"
722066289246621696,2016-04-18 14:16:33,RT @nvillumsen: Forsvarsminister svar til FT er klar: Fanger kan blive udleveret til tortur og henrettelse i Irak: https://t.co/RQiclRhWJv…
722043708649172992,2016-04-18 12:46:49,RT @AmandaThylkjaer: https://t.co/PRshevtieX @uffeelbaek og Alternativet er noget af det bedste der længe er sket for dette land politisk.…
721976231726592001,2016-04-18 08:18:41,"@raekjaer @DennerHJ Der er nemlig flere alternativer. Enig, Casper. Har sat lidt flere ord på vores nej her: https://t.co/Xhhd9EVtta"
721952248310444033,2016-04-18 06:43:23,"Vi siger klart nej til køb af nye kampfly. Købsprocessen er mørkelagt, og vi ser det som en forkert og snæver prioritering af midler #dkpol"
721933980472356864,2016-04-18 05:30:48,"Vigtigt at vi får talt åbent om, at nej, Danmark skal ikke bidrage med bomber - #dkpol kan også vælge langsigtet. https://t.co/EywBcHB2S2"
721807237946150914,2016-04-17 21:07:10,"@StineSkot Ja, situationen er jo på ingen måde nem, og der vil være civile tab ligegyldigt hvad, men jeg ser ingen bedre fremtid i B108"
721806481826443264,2016-04-17 21:04:10,"Under 48 timer til B108 og ekstra krigsbidrag stemmes igennem i #dkpol: Manglende plan for freden, mange civile tab og dk-soldater i kamp."
721788350521286656,2016-04-17 19:52:07,"@PBoier, lyttede, men er for larmende for mig, Peter. Som du kan se på min playliste er jeg mere a la  brit-pop;-) https://t.co/6oK4TF3TOh"
721785368513785856,2016-04-17 19:40:16,"@CKjersgaard @DebattenDR2 Ja, men på tværs af blokke mener jeg faktisk, at Danmark har misbrugt muligheden for at definere en helt ny vision"
721784487386955776,2016-04-17 19:36:46,"@CKjersgaard succesfuld hitmager, stærk og vidende politiker - og så Bisse, som jeg ikke kender, men hvis navn alene sikrer toptrekløveret."
721762120120078341,2016-04-17 18:07:53,"@peterfalktoft, hvis loven fikses, og han er frisk, gør jeg min borgerpligt og giver ham min MF-trampolin for @alternativet_ i det vestjyske"
721733907562045441,2016-04-17 16:15:47,"@Jesper_Pet @SEfodbold @JensRingberg @Superligaen Jeg plejede at sammenligne SE og SIF, I spiller bare om Europa og vi i 1. Div. nu:-) Teløk"
721702931024781312,2016-04-17 14:12:42,"Vi sidder i noget nær Alternativets højeste organ i disse timer, nemlig Politisk Forum. Og her… https://t.co/SkDTNqPPny"
721620887259230209,2016-04-17 08:46:41,"@LadySakai det gjorde jeg lige før jeg skrev opdateringen, så jeg bar helt klar :-)"
721620028076998656,2016-04-17 08:43:16,"@LadySakai haha, okay så må du ikke gå derind. God søndag."
721619127572541440,2016-04-17 08:39:41,"@LadySakai Ja, det vil jeg vove at påstå, at jeg sjældent gør - prøv at læse den facebookblog jeg har skrevet og som mit tweet linker til;-)"
721618862836490241,2016-04-17 08:38:38,"@SorenHave Tjek, vi kører jo stadig med denne gruppe;-) https://t.co/b764WLal1Z #garbagegym"
721618519184515072,2016-04-17 08:37:16,"RT @mathiaspoulsen: ""Vi smadrer de offentligt ansattes arbejdsglæde"" trist &amp; helt indlysende rigtigt https://t.co/GB1t9sf4wO"
721616922375229440,2016-04-17 08:30:55,"""Hvorfor leger du ikke med dine børn i stedet for at løbe en tur - uden dem?"" #søndagstanker #merelegmindresukker: https://t.co/PivT6026mF"
721256509410295808,2016-04-16 08:38:46,"RT @silberg_mads: "" Jeg mener at være i min fulde ret som embedsmand til at beskrive konsekvensene af den politik som føres, og jeg... http…"
721242175040831488,2016-04-16 07:41:49,"Det generelle skred i forholdet mellem den frie presse &amp; #dkpol, ønsker jeg ikke, @StemLAURITZEN. Er du helt sikker? https://t.co/w6OTVnFXO9"
721062831743987712,2016-04-15 19:49:10,Hvornår blev forhandlingen naiv og drabet logisk? Jeg deltog i @DebattenDR2 i går. #dkpol er på vej i krig uden plan https://t.co/cFGSfCO8bU
720888812277264384,2016-04-15 08:17:40,Hamrende god idé &amp; @skmdk bygger platformen så den er kontinuerlig for kommende ministre. Forza #podKarsten! #tillid https://t.co/kvWHtjFul2
720634170221977600,2016-04-14 15:25:49,Ser frem til at deltage - og høre den langsigtede plan for flertallet i #dkpol's krigsprioritering uden FN-mandat.  https://t.co/fomVfhCVP9
720507389863141377,2016-04-14 07:02:02,"Særdeles gode spm. fra @Enhedslisten inden dagens lukkede samråd. Er det sådan, vi vinder freden - 'hearts &amp; minds'? https://t.co/sXEV8l31uX"
720502171524009984,2016-04-14 06:41:18,"Tak for ærligheden til det flertal i #dkpol, som har givet mandat til regnestykket om 'militær nødvendighed': https://t.co/DjYovRnjiW #dkpol"
720275966044418054,2016-04-13 15:42:27,Smilets By til politisk laboratorie om vores globale politik med freds- og forsvarsfokus. Gode visionære folk &amp; ny sikkerhedspolitik #dkpol
720185130262904832,2016-04-13 09:41:30,"Høring, #Skattely: Mangler stadig svar på, om bankerne vil hjælpe proaktivt, FØR det næste læk afkræver det? #dkpol https://t.co/T78AyKYacC"
720161514284523520,2016-04-13 08:07:39,"Høring om #Skattely: @Nordea, @jyskebank og @DanskeBank_DK, I venter på #dkpol, men det er jer der har erfaringen og svarene #samfundsansvar"
720134018616991744,2016-04-13 06:18:24,"Formålet med høringen er, at vi i samlet flok med bankerne skal skabe ny forståelse af 'to do &amp; not to do' #dkpol https://t.co/nuDVrY9Q0V"
720116288312446976,2016-04-13 05:07:56,"Fuld gennemsigtighed er nødvendig, #Panamapapers er blot toppen af isbjerget. @alternativet_ https://t.co/8xmTr0KkLi https://t.co/k8hGS3AAcx"
720103834027180032,2016-04-13 04:18:27,Rabatordninger og amnesti for skatteunddragelse er ikke forsvarligt - skatteunddragelse udsulter fællesskabet #dkpol https://t.co/gOpcRzmrzq
719892233261080576,2016-04-12 14:17:38,"Enig. Selvom jeg har fortsat min brug af @LinkedIn fra erhvervslivet, nu som MF i #dkpol, er det rent blue ocean. https://t.co/L5ERm3rTnK"
719798343724056576,2016-04-12 08:04:33,"RT @JKH_CS: #dkpol Helt enig, aflastning et sted giver belastning et andet sted, og forsvaret er udfordret ift. mål og midler. https://t.co…"
719789473228328960,2016-04-12 07:29:18,"DK's soldater er uddannet på højt internationalt niveau &amp; kan håndtere gadekonflikter, men det er af gode grunde politiets opgave #dkforsvar"
719783169004814336,2016-04-12 07:04:15,RT @QvortrupHenrik: Læs lige journalistformand @larswerge's reax på dette forslag. Lad den stå et øjeblik. Og læs så igen. https://t.co/Dj0…
719782544212946944,2016-04-12 07:01:46,"RT @adamlebech: CEO Duedahl, SE: Statsministeren bør sætte sig for bordenden for et digitaliseringsråd. Hørt! #Tele2016 Tele2016 https://t.…"
719776174604468224,2016-04-12 06:36:27,"Hej #dkmedier! Kan jeg som politiker bidrage med større åbenhed om noget specifikt, inden for lovens rammer, så bed mig gerne om det. #dkpol"
719768977883447296,2016-04-12 06:07:51,"@silberg_mads Du er en meget vigtig stemme i debatten, Mads. Siger jeg noget lignende, vurderes jeg som dybt naiv. Tak for nuancerne. #dkpol"
719767482152706048,2016-04-12 06:01:55,"""Du siger vores krig i Irak &amp; Syrien er symbolpolitik?"", ""Ja det synes jeg godt nok det lugter af"" #dkpol #dkforsvar https://t.co/cemRd5MH27"
719765724256997376,2016-04-12 05:54:55,Det er vel reelt set en meget pragmatisk og demokratisk tanke om gennemsigtighed? Jeg er i hvert fald enig #dkpol  https://t.co/4BsVItcxGU
719598897954484224,2016-04-11 18:52:01,"Det er ikke partout godt at bruge tid på #SoMe, men for mig er det både en politisk inspirations- og dialogplatform. https://t.co/bGcIdaTCH9"
719422384265170944,2016-04-11 07:10:37,"RT @R4nd4hl: @renegadedreng at Folketinget skal beslutte at tale MINDRE om terror og MERE om kræft, depression og alt det andet vi faktisk…"
719418452117745664,2016-04-11 06:54:59,"@Lea__hei måske lidt us'køn't - men jeg er pragmatisk, hvis det fremmer forståelsen og give mænd og kvinder fælles forståelse af feminismen."
719416675112771584,2016-04-11 06:47:56,"@AndersEKrag Jeg er sprunget ud, Anders, som feministo! Tror på at det er nødvendigt at skabe bred opbakning til feminismens systemkritik."
719415123568435200,2016-04-11 06:41:46,"Hvilket forslag synes du, at der skal samles 50.000 underskrifter for, når vi forhåbentligt får muligheden? #dkpol https://t.co/CcOYE4GWvH"
719411549635551232,2016-04-11 06:27:34,Politisk debat uden partifnidder om æren og ejerskabet - de borgerdrevne forslag samler os: https://t.co/aZZ0eQPhP4 #nypolitiskkultur #dkpol
719395194014146560,2016-04-11 05:22:34,RT @RuneKier: Femi-macho: termen for mansplaining storskrydende mandlige feminister som selv vil bestemme deres betegnelse... 😉 https://t.c…
719378043010162689,2016-04-11 04:14:25,"@AndersEKrag det er det heller ikke - netop min pointe, Anders - ordet (ikke betydningen) skubber bare mange mænd væk. Det er ærgerligt."
719279546420367360,2016-04-10 21:43:02,"RT @alternativet_: Iværksætteri der gavner den grønne, den sociale &amp; den økonomiske bundlinje https://t.co/LF6l52TXnU #sætiværk #dkpol http…"
719278728380071936,2016-04-10 21:39:47,"@Lea__hei enig i at det er ren ordlyd, men ord skaber handling. Jeg tror at langt flere mænd vil kunne identificere sig med ordet feministo"
719274695359643648,2016-04-10 21:23:45,"@Komikerforening vil du hellere have rene gader? Det er da både street og renegade at være feministo, min gode komiker."
719269211378446337,2016-04-10 21:01:58,@AndersEKrag den nye term er: Jeg er feministo!
719269000312721409,2016-04-10 21:01:07,"Jeg er 'feministo'! Termen for os mænd, der havde problemer med ordlyden, men er helt enig i tankerne bag feminismen. #Feministo #dkpol"
719209784579375105,2016-04-10 17:05:49,"@AndersEKrag nej, jeg ER feminist, Anders. Ordlyden er bare svær for mange mænd &amp; kvinder at associere sig med, selvom de er enige i tanken."
719208840986800128,2016-04-10 17:02:04,"@AndersEKrag jeg mener simpelthen, at feminismen lider under stigmatiserende vrangforestillinger om, at projektet er snævert og rødstrømpet."
719197768238161920,2016-04-10 16:18:04,"@hansensh1 de kan man mene, men humanist udover alke grænser til gengæld:-)"
719196906057019393,2016-04-10 16:14:39,"@hansensh1 nej, feminist. For jeg er ikke socialist, Søren:-)"
719195657232322560,2016-04-10 16:09:41,"Hvis vi fandt et nyt ord for den betydning, var du så ikke xxxxxxxx? https://t.co/trrcI0W9Du. Jeg er feminist men er frisk på ny term #dkpol"
719089910632878080,2016-04-10 09:09:29,"RT @uffeelbaek: @berlingske go, go, go @SenSanders"
719073278036471808,2016-04-10 08:03:23,»I larmen vokser kun larmen. I stilheden vokser dit sind.« Min families søndag lever under den overskrift: https://t.co/WaW41Qa5Pd #weekend
718864865063014402,2016-04-09 18:15:14,RT @Snowden: #Iceland's protest photos look like history. #PanamaPapers (via @GissiSim / https://t.co/1kRtUPtNZS) https://t.co/rpluGqmq0I
