id,created_at,text
793018110542503936,2016-10-31 09:13:45,"ALT: Omstilling fra rig til fattig. Mens 10% rigeste allerede betaler 30% af skatterne. Ingen skam i livet.#dkpolhttps://t.co/lzW4C0ijN1"
789179023024791552,2016-10-20 18:58:35,"@uffeelbaek: Hvordan kan 30 års ""neoliberalisme"" have ført til verdens højeste skattetryk + verdens største offentlige sektor?#debattendr2"
789178432085123072,2016-10-20 18:56:15,"Der findes ingen - som i: ingen - økonomiske teoretikere, der kalder sig selv ""neoliberale"".#dkpol #debattend2"
789173016651378691,2016-10-20 18:34:43,"@uffeelbaek: Hvis vi ikke bliver glade for den der vækst, hvad er den så for? Det kæmpe, offentlige forbrug, ALT kæmper for. #debattendr2"
789170574060773378,2016-10-20 18:25:01,"Alternativets økonomiske bundlinje er ikke sort. Den er knaldende rød. #dkpol #debattendr2"
789168282532061184,2016-10-20 18:15:55,"@Heunicke: Var der mindre angst, stress med videre i de hårde år uden vækst? Relevant spørgsmål uden svar.#dkpol #debattendr2"
789166216875118592,2016-10-20 18:07:42,"De fleste vækstkritikere er vilde med vækst i det offentlige forbrug.#dkpol #dr2debatten"
787698739980935168,2016-10-16 16:56:29,"De fleste vækstkritikere er mærkeligt nok vilde med vækst i det offentlige forbrug.#dkpolhttps://t.co/eYhT8OpVW1"
785387649808949248,2016-10-10 07:53:02,"Ankestyrelsen har været træls gennem en længere periode. Må nok snart have fat i ørerne på den.#dkpolhttps://t.co/rVpGCFpqz2"
783956334978957313,2016-10-06 09:05:30,"Thulesen Dahl taler netop nu anerkendende om ""en Robin Hood-model"". Han synes at glemme, at RH's modstander var en skatteopkræver.#dkpol"
783944054069420033,2016-10-06 08:16:42,"Forskellen på himmel og helvede er i følge S 1,6 mia. Altså ca 1,5 promille af statsbudgettet. Kan vi ikke få lidt mere substans? #dkpol"
783618536736522240,2016-10-05 10:43:12,Dagens gode nyhed: Forskningsministeren bebuder mere afbureaukratisering af videregående uddannelser. #dkpol
783001978867703808,2016-10-03 17:53:13,Vaterlandslose Gesellen. #dkpol
782898133315510272,2016-10-03 11:00:35,"Nå. Rapporten om frikommuneforsøgene læser jo heller ikke sig selv.#dkpol"
778589155408416769,2016-09-21 13:38:14,"S går ind i kampen om DM i stagnation med et virkelig stærkt udlæg. Men kan dog ikke være sikre på den endelige sejr.#dkpol"
778470050965561345,2016-09-21 05:44:58,"Anbefaler i dagens Berlingske, at man begynder at begrænse det offentlige overforbrug.#dkpolhttps://t.co/KxxOTnzHY8"
777808973932134400,2016-09-19 09:58:05,"Hvis du er sadist, bør du ikke kunne ansættes på et Jobcenter.#dkpolhttps://t.co/lBIu1jCmw9"
775195027832246273,2016-09-12 04:51:11,"Jeg vælger velfærd frem for elbiler.#dkpolhttps://t.co/EQ0UAKUX1x"
772520629270700033,2016-09-04 19:44:05,"Journalisters faglige niveau er ofte så lavt, at jeg ikke orker at tale med dem. Så hellere skrive en lang opdatering på FB.#presselogen"
771244097105375232,2016-09-01 07:11:36,"S er ofte meget fornuftige, når de har magten. Resten af tiden bruges ofte på uansvarlig venstrepopulisme.#dkpol https://t.co/Pnc0MJnBBt"
771220726275715072,2016-09-01 05:38:44,"Christiania blev i sin tid kaldt et ""socialt eksperiment"". Det kan nu endegyldigt konkluderes, at eksperimentet er slået fejl.# dkpol"
770560099077263360,2016-08-30 09:53:38,"Det er gådefuldt, at det nogensinde er lykkedes for en person fra et andet land at tage en videregående uddannelse#dkpol #ellersdørbaby"
768384140462792705,2016-08-24 09:47:09,@chellersgaard Ellers ville den ene procent vel næppe betale næsten ti procent af skatterne? Eller de ti procent de tredive?
768358121978761217,2016-08-24 08:03:46,"@chellersgaard Den økonomiske overklasse i DK er meget socialt sindet. Det er omfordeling, der gør gini så lav."
768328555344396288,2016-08-24 06:06:17,At snakke om ulighed i Danmark svarer til at snakke om bjerge i Danmark. #dkpol
767816495875428353,2016-08-22 20:11:32,"Svindel1 afsløret. Godt arbejde af 24 Syv.#dkpolhttps://t.co/hmNU1VPUqH"
765054595181805568,2016-08-15 05:16:44,En alkoholiker kan altid finde en undskyldning for en drink. En SF'er kan altid finde én for en skat. #dkpol
761465103887765504,2016-08-05 07:33:22,"Gribende at høre røde blok tale varmt om nationalt sammenhold og vort sprogs malmfulde klang. Gid de mente også det, når DR ikke skal spare."
752435594253524992,2016-07-11 09:33:19,"Mere statskontrol med universiteterne (https://t.co/YdVm2AJUX1)? Det bliver uden LA's medvirken.#dkpol"
728146528884293634,2016-05-05 08:57:15,Pokal1 til Aarhus! Nu!
727340342308118528,2016-05-03 03:33:45,Leicester er meicester.
723041393912872960,2016-04-21 06:51:16,"Undervisningsministeriets forståelse af dannelse mangler Kant.#dkpol"
720997271404441601,2016-04-15 15:28:39,"Fordi vi stadig har retsforbeholdet, kan Böhmermann faktisk flygte til Danmark og undgå udlevering til Erdogan og Merkel.#dkpol"
720856732851789825,2016-04-15 06:10:12,"Man skal rose sine politiske modstandere, når de har ret. Så kæmpestort ""like"" til SF for at ville sanere regler i det offentlige.#dkpol"
720160581014175744,2016-04-13 08:03:57,"Det redder ikke Mette F's opdatering at sige, der skulle have stået ""6"" i stedet for ""7"". 6 var en bundkarakter. Ikke middelkarakter.#dkpol"
719630325660454912,2016-04-11 20:56:54,"Der er fire hovedretninger på stx: sort, rød, blå og grøn. #dkpol"
719223432488099841,2016-04-10 18:00:03,"Hvis LA omtaler noget som ""en hjertesag"", vil et medie eller fem omgående spørge Hjerteforeningen, om det virkelig kan passe.#dkpol"
719092145471275008,2016-04-10 09:18:22,"Fremtidens historikere vil omtale denne epoke som ""uddannelseskatastrofens tid"". Eller nej: Der vil jo ikke være nogen.#dkpol"
718145879207776256,2016-04-07 18:38:14,Venstrefløjen: de dårliges og de sløves trofaste forsvarer. #dkpol #dr2debatten
718145478500753408,2016-04-07 18:36:39,"@MetteGjerskov: hvis du vil, men ikke kan, skal du ikke spilde egen og andres tid i gymnasiet."
718143663772147716,2016-04-07 18:29:26,"Gymnasiet er ikke for dem, der vil. Det er for dem, der kan. #dkpol  #dr2debatten"
718139002327547906,2016-04-07 18:10:55,Fokus på læring og fokus på karakterer er det samme. #dkpol  #dr2debatten
717605329241042944,2016-04-06 06:50:17,"Alle lykkelige regeringer ligner hinanden, men den ulykkelige regering er altid på sin egen måde ulykkelig.#dkpol"
715143375733833729,2016-03-30 11:47:22,"Det var ikke meget, Dansk Magisterforening og DJØF fik for de mange penge, de afsatte til at forfølge Esben Lunde Larsen.#dkpol"
714012852370206720,2016-03-27 08:55:04,Det er mandigt at støvsuge sin bil. Ergo støvsuger jeg min bil.
713687284634238976,2016-03-26 11:21:22,@NinaNowack Potato - potato.
713664713406693376,2016-03-26 09:51:41,"Når det gælder holdningen til sommertid, er jeg faktisk socialkonstruktivist."
713386072403783680,2016-03-25 15:24:28,@AndreasKarker: Vorherre bevare os. Og jeg mener det.
713310313874112512,2016-03-25 10:23:26,@ViborgFod @anderssamuelsen Det er uklogt at udelukke noget på dette tidspunkt.
713309853574438912,2016-03-25 10:21:36,@twillumsgaard: Det var et godt ændringsforlag. Tak for det.
713309719591534592,2016-03-25 10:21:04,@anderssamuelsen @ViborgFod  :-(
713306340098187264,2016-03-25 10:07:38,@JensRingberg @anderssamuelsen: Ikke i forhold til Vejle Boldklub. Der er det helt klart mig.
713290220536467456,2016-03-25 09:03:35,@ThomasFunding: Jeg har kun taget stilling til Vejleproblematikken og det manglende DM.
713286317199728640,2016-03-25 08:48:04,"Om fjorten dage vælter jeg regeringen, hvis den ikke gør Vejle til dansk mester i fodbold.#dkpol #jegkanogsåkommemedtrusler"
712937327698526214,2016-03-24 09:41:19,"Det er ganske arrogant at kalde folk, der ved, hvad de taler om, for ganske arrogante."
712935509492899840,2016-03-24 09:34:05,"Medierne skulle etablere en generel ""Imagine""-overvågning i dag og de følgende dage. Melodien: god. Teksten: umoden og naiv.#dkpol"
712356097680662528,2016-03-22 19:11:43,"Du skal aldrig lytte til folk, der kalder salafisterne ""galninge"". Det er hundrede procent tilregnelige og konsekvente.#dkpol"
712300657328459776,2016-03-22 15:31:25,@LisbethZornig @PiaOlsen: Radikalisering har intet at gøre med fattigdom. Intet.
712195819391361024,2016-03-22 08:34:49,"Den stat, der kommer op af syrebadet ""terrorisme"", er den Carl Schmitt'ske. Så tjek definitionen af ""suverænitet"", før du opdaterer.#dkpol"
710550353289355265,2016-03-17 19:36:20,"Observation efter ti en halv time i folketingssalen: Mange - måske for mange - kolleger synes at mene, at de er på akkord.#dkpol"
709642454824259584,2016-03-15 07:28:40,"I Danmark udløser sandheden ofte skandale, mens løgnen mødes med begejstring.#dkpol"
709387196986482689,2016-03-14 14:34:22,"I Danmark udløser sandheden ofte skandale, mens løgnen mødes med begejstring.#dkpol"
708244602139111424,2016-03-11 10:54:06,"At diskutere nationaløkonomi med venstreorienterede personer, er som at læse avis i blæsevejr.#dkpol"
707930816412852224,2016-03-10 14:07:14,"@C_I_Andersen @PiaOlsen: Ifm. brede reformer sænkede man også marginalskatten i Sverige. Stor succes. ""Gang i 90'erne"": også lavere topskat."
707870248066805761,2016-03-10 10:06:33,"@LarsHNielsen2 @ThomasBerntH @PiaOlsen. Jeg har ikke noget ""emperi"". Men empiri er her: https://t.co/vyZ6SZhx3J"
707863647993864192,2016-03-10 09:40:19,Du kan også læse denne: https://t.co/vyZ6SZhx3J. LA's plan for at redde velfærdsstaten ligner meget den svenske. https://t.co/IJDuLKkvuK
707862241996054528,2016-03-10 09:34:44,https://t.co/rhPvhU9Ekd https://t.co/IJDuLKkvuK
707860207129513984,2016-03-10 09:26:39,@PiaOlsen: Du bør sætte dig bedre ind i de meget veldokumenterede skadevirkninger af høje marginalskatter. De er voldsomt hæmmende for vækst
707852895006400517,2016-03-10 08:57:36,"Folk har knive i ærmet til KL's topmøde. Højre ærme, altså. I venstre skal der være plads til gaflen.#dkpol"
707831214166646788,2016-03-10 07:31:26,"Jeg tror, det er på tide at tale åbent og samlet om disintegration. Hvem der skaber den. Hvordan den kan bekæmpes.#dkpol"
702842064141160448,2016-02-25 13:06:20,"ALT har lige understreget, at politiske beslutninger skal bygge på videnskab. Så må man vel droppe støtten til alternativ medicin? #dkpol"
702794568283103233,2016-02-25 09:57:37,"DF siger, at kvælstofloven godt kunne have haft en læsevejledning. Andre hører det vist som en næsevejledning. #dkpol"
701406052974202881,2016-02-21 14:00:09,"I politik betyder ""jeg skammer mig"" rettelig: ""Du skal skamme dig!""#dkpol"
700403920284336128,2016-02-18 19:38:02,"For god ordens skyld: Ekstra-Bladet er IKKE en forretning. Man modtager ca. 17,5 millioner kroner årligt i mediestøtte.#dkpol #debattendr2"
699863541113872384,2016-02-17 07:50:45,@BennyEngelbrech: LJ har ret. Men se sådan på det: Meningsmålinger sikrer regelmæssige arbejdstider. Sådan kan man bestille nyheder.
698794811726438400,2016-02-14 09:04:00,"""Magtens tredeling"" betyder ikke, at den er delt mellem S, V og DF.#dkpol"
697406963261579264,2016-02-10 13:09:11,"EL: vi kan godt se, en gruppe ansatte og MF i årevis er blevet hjernevasket. Psykologhjælp evt. på tale.#dkpol https://t.co/0zdVKVnyD0"
696601504434802688,2016-02-08 07:48:35,"De radikale er på vej til Ishøj for at lære om integration. Og i næste uge forventes et udspil om håndtering af Sovjetunionen.#dkpol"
696578930690670592,2016-02-08 06:18:53,"400 unicensorer: sprogfagene er for dårlige. Årsag: mange års ""massificering"". Ikke finanslov '16. Derfor bør uni helt genoprettes.#dkpol"
695919323840380928,2016-02-06 10:37:51,"Regeringen lægger en Scavenius-linje i udenrigspolitikken. Og Politiken brokker sig. I'm getting too old for this s***.#dkpol"
695508185998893057,2016-02-05 07:24:08,Breaking: For fremtiden må svenske elektrikere kun bruge henstik.
695206838179119104,2016-02-04 11:26:41,@politiken Nåde og nåde. Otte års fængsel og otte hundrede piskeslag.
695206351149072384,2016-02-04 11:24:45,"Vi indrømmer gerne, vi ikke har forstand på kunst. Hvis venstrefløjen vil indrømme, den ikke har forstand på nationaløkonomi.#dkpol"
695189034579181568,2016-02-04 10:15:56,"Har lige sagt nej til en mand, der ville prakke mig en løbeseddel på. Det mente løbeseddelprakkeren var udemokratisk. Er det? #dkpol"
694808703493627904,2016-02-03 09:04:38,"DK skal have en rumlov. Hidtil har man ment, universet bestod af stof og antistof. Men det består af stof, antistof og bureaukrati. #dkpol"
694500374439411712,2016-02-02 12:39:27,"I følge Lønkommissionen (2010) havde mænd og kvinder i samme jobfunktion næsten den samme løn. Hvorfor dør ""de 17 procent"" aldrig?#dkpol"
694127501640089600,2016-02-01 11:57:47,"Leksikon. Artikel, der vækker vild debat. Se: ""ramaskriv""."
691971740562497540,2016-01-26 13:11:33,"Hvis du vil se Enhedslisten padle, skal du tænde dit tv nu. #dkpol"
691914390975700992,2016-01-26 09:23:40,"Det skader Danmarks anseelse i udlandet at lade være med at give karakterer.#dkpol"
615074296046723072,2015-06-28 08:28:34,Fire nye ministre fra Sydjyllands Storkreds. Jeg kender dem alle som værende dygtige og behagelige. #dkpol #tv2valg
611927798723297280,2015-06-19 16:05:30,2902 personlige stemmer. Er ydmyg og stolt. Vil gøre mit aller bedste. #dkpol #tv2valg #tvsyd
611502429474037760,2015-06-18 11:55:15,"Stem @LiberalAlliance Stem Henrik DahlDet er helt i orden.#dkpol #tv2valg #stemliberalt #tvsyd"
611321148215816195,2015-06-17 23:54:54,#stemliberalt #LiberalAlliance #Aabenraa #Aabenraapol http://t.co/2hF1aMahxd
611321025255600128,2015-06-17 23:54:24,#Billund #Billundpol #dkpol #tvsyd http://t.co/l0yxw7zm38
611320907978670081,2015-06-17 23:53:56,#Fredericia #Fredericiapol #dkpol #tvsyd http://t.co/NCFf0SB78N
611320622124302336,2015-06-17 23:52:48,#Haderslev #haderslevpol #dkpol http://t.co/lsS74D5AYB
611320550707884032,2015-06-17 23:52:31,#stemliberalt #LiberalAlliance #dkpol #tv2valg #tvsyd http://t.co/78AhtqIwhS
611320466691784704,2015-06-17 23:52:11,#Sønderborg #Sønderborgpol #dkpol #tvsyd http://t.co/0BkutN9GRn
611320327927386113,2015-06-17 23:51:38,#Varde #Vardepol #dkpol http://t.co/uW8VG9Ly46
611320264647950336,2015-06-17 23:51:23,#Fanø #Fanøpol #dkpol http://t.co/VpT2r9wuoX
611320186533244929,2015-06-17 23:51:04,#Tønder #Tønderpol #dkpol http://t.co/ZeicZKxeeF
611320089502158848,2015-06-17 23:50:41,#vejen #vejenpol #dkpol http://t.co/qLJheHu9Oz
611319986179702784,2015-06-17 23:50:17,Så skal der stemmes. #dkpol #tv2valg #stemliberalt #DRdinstemme #tvsyd #LiberalAlliance http://t.co/sCJWxOszNa
611319735037337601,2015-06-17 23:49:17,Stem personligt. Jeg er spidskandidat i #Kolding . #dkpol #koldingpol http://t.co/hhc5WwAY8V
611319337769660416,2015-06-17 23:47:42,Stem personligt. Jeg er spidskandidat i #Esbjerg Omegn. #dkpol #Esbjergpol #Ribe #Hjerting http://t.co/oJcYDEf6VF
611318848395038720,2015-06-17 23:45:45,Stem personligt. Jeg er spidskandidat i #Vejle #Vejlepol #dkpol http://t.co/4VaAkCfMMP
611201172813295616,2015-06-17 15:58:09,@hansensh1 @LiberalAlliance Solidaritet og sammenhængskraft kan komme fra civilsamfundet. Bedre end staten.
611200857053523969,2015-06-17 15:56:54,@LiberalAlliance har fundet 26 mia. til den øgede ældrebyrde. Det omtales for lidt i medierne #dkpol #tv2valg #DRdinstemme #dkpol
611190810642644994,2015-06-17 15:16:59,@LiberalAlliance er skatter- og afgifters værste fjende #dkpol #stemliberalt #NedMedSkatten
611141917015965696,2015-06-17 12:02:42,#stemliberalt #LiberalAlliance #dkpol #tv2valg #tvsyd http://t.co/ee40gIXccZ
610849536689487873,2015-06-16 16:40:53,Jeg ved det er svært at skifte parti. Men #DetErHeltIOrden at stemme på @LiberalAlliance #dkpol #tv2valg #DRdinstemme http://t.co/qblkDFntgw
610537165144084480,2015-06-15 19:59:38,@MicSNielsen 1000 tak!
610536922851770369,2015-06-15 19:58:40,@danstenn @venstredk Det er i orden at stemme på @LiberalAlliance
610535670570975232,2015-06-15 19:53:41,Breaking: Jeg stemmer Liberal Alliance den 18. juni #dkpol #tv2valg #DRdinstemme
610530473807360000,2015-06-15 19:33:02,RT @CarlAndersenLA: Staten skal ikke blande sig i hvordan man driver landbrug. Det skal forbrugerne! #tv2valg #stemliberalt #dkpol
610354100413165569,2015-06-15 07:52:12,Gadeaktion i #Fredericia foran cirkus Helle. #dkpol #tvsyd #ftv15 http://t.co/6PvasAmPbf
610126967300583424,2015-06-14 16:49:39,Så er min valgvideo ude https://t.co/b6r5UdWXQ2 #dkpol #stemliberalt #tv2valg #LiberalAlliance
609822384418328576,2015-06-13 20:39:21,Har været i @TVSYD. https://t.co/tZTMuvGi59 #dkpol #stemliberalt #vejlepol
609696570800504832,2015-06-13 12:19:24,Vi har gang i flyeruddelingen. #dkpol #stemliberalt #Vejle http://t.co/YxOaB1BKPA
609693744611393536,2015-06-13 12:08:10,"RT @spisekammeret: -Vi ser cannabis som en forretningsmulighed, så lad os få kigget på at legaliserer det, siger vicefmd. Lars Hvidfeldt fr…"
609073075670384640,2015-06-11 19:01:51,Den økonomisk virkelighed vil sætte @DanskDf1995 på plads. Så er ganske rolig. #tv2valg #dkpol #stemliberalt
609069096072826880,2015-06-11 18:46:03,Vi skal have kvalitet - ikke kvantitet - i uddannelserne. Ellers kunne vi lige så godt give alle en hue i dåbsgave #tv2valg #dkpol
609067199572115456,2015-06-11 18:38:30,"Borgerlig politik er gennemført med succes. Socialistisk med fiasko. Så er @alternativet_ ikke et ""eksperiment"" @HelleThorningS ? #tv2valg"
609065350089568257,2015-06-11 18:31:10,"""Regeringens politik er i vid udstrækning en videreførelse af VK regeringens økonomiske politik."" Husk det @HelleThorningS #tv2valg #dkpol"
609063642261237760,2015-06-11 18:24:22,Finanstilsynets krav hæmmer udlån i mange områder af landet. Lad dog bankerne lave faglige skøn igen! #tv2valg #stemliberalt #dkpol
609062790104539136,2015-06-11 18:20:59,"Der er ingen ""udkant"" i Danmark. Det tager (relativt) ingen tid at komme fra A-B #dkpol #tv2valg"
609061770175590400,2015-06-11 18:16:56,Kampen om historien: @LiberalAlliance var eneste parti som ikke støttede energiaftalen. #dkpol #tv2valg
609060970556760064,2015-06-11 18:13:45,Så er kampen om natursynet igang #dkpol #tv2valg
608924953266823168,2015-06-11 09:13:16,@Ottesen100 Ingen har benægtet det. Villum har sat spørgsmålstegn ved hvor mange % der direkte kan tilskrives mennesker.
608920782769692672,2015-06-11 08:56:42,Der er ikke plads til @alternativet_ eksperimenter. Vi har nok græske partier. #dkpol #tv2valg #DRdinstemme http://t.co/aNPSEOD3W3
608790371401891841,2015-06-11 00:18:29,Myteaflivning: Jeg har aldrig været medlem af @SFpolitik. Partiet er for urealistiske mennesker #dkpol #tv2valg #DRdinstemme
608757797975695360,2015-06-10 22:09:03,#stemliberalt #LiberalAlliance #dkpol http://t.co/rd0pK05MWo
608732471316897793,2015-06-10 20:28:25,Vækst og vækst... regeringens 50 initiativer vil øge BNP med 1 mia.. LA's øger med BNP med 108 mia  #DRdinstemme #dkpol #stemliberalt
608731787569836033,2015-06-10 20:25:42,@JonasNiemann Nej.
608715664094822400,2015-06-10 19:21:38,"De græske partier (O,A,F,Ø,Å) vil bruge og omfordele penge. De tyske partier (I,V,C,B) vil skaffe penge og skabe vækst.#dkpol #stemliberalt"
608377013540417536,2015-06-09 20:55:57,@persndr Planen skaber 250.000 nye private job. Vi afsætter 26 mia. til at håndtere den stigende ældrebyrde.
608337174866587650,2015-06-09 18:17:39,"LAs plan giver netto 123.000 job. Derfor giver det ingen mening alene, at fokusere på de 90.000 som vi skærer væk i det offentlige. #dkpol"
607849099904315392,2015-06-08 09:58:13,"Valgkampen er gået ind i anden uge. Nu skal der rykkes fra, og blå blok skal igen foran. Støt på #MobilePay 61548530 #dkpol #stemliberalt"
607820102428459008,2015-06-08 08:02:59,"Den rigtige overskrift er ""Utilpassede unge sender ansatte til syden"" #dkpol http://t.co/f7AHCwR3K4"
607621573693042688,2015-06-07 18:54:06,@HelleThorningS bliver fornærmet over at @larsloekke forsøger at tale ud. Hun afbryder selv konstant #dkpol #DRdinstemme
607619158373724160,2015-06-07 18:44:31,"@HelleThorningS må være bange for, det @larsloekke siger. Ellers ville hun vel ikke afbryde konstant. #DRdinstemme #dkpol"
607618878022295552,2015-06-07 18:43:24,@HelleThorningS må være bange for hvsd @larsloekke har at sige. Ellers sfbrød hun vel ikke konstant. #DRdinstemme #dkpol
607615882668457984,2015-06-07 18:31:30,Arbejdskraftens frie bevægelighed blandes igen sammen med flygtninge... #DRdinstemme #dkpol
607614441132326912,2015-06-07 18:25:46,13. afbrydelse fra @HelleThorningS #DRdinstemme #dkpol #ftv15 #DårligStil
607612838467784705,2015-06-07 18:19:24,"RT @SimonEmilAmmitz: Helle, @LiberalAlliance har ik foreslået lavere dagpenge. Tal nu sandt om din politik i stedet for forkert om vores #d…"
607611184976642048,2015-06-07 18:12:50,"Der er ikke noget, der hedder ""at finansiere skattelettelser"". #dkpol #DRdinstemme #ftv15 #stemliberalt"
607609048100425728,2015-06-07 18:04:20,Kampen om historien starter nu: Økonomien er i bedring grundet SR videreførte VKs økonomiske politik #DRdinstemme #dkpol #stemliberalt
607608038950891520,2015-06-07 18:00:19,RT @LiberalUngdomDK: Drop debatten i aften. @LiberalAlliance har løsningen. #fv15 #dkpol #DRdinstemme #stemliberalt
607529507944321024,2015-06-07 12:48:16,RT @TVSYD: .@SociologenHD Danmark skal i balance #fv15syd
607527063101284353,2015-06-07 12:38:33,RT @TVSYD: .@SociologenHD Vindmøller er en form for galskab. Det skal revurderes #fv15syd
607524763628670976,2015-06-07 12:29:25,RT @TVSYD: .@SociologenHD udlændinge skal have lov til at købe sommerhuse i Danmark #fv15syd
607523473909497857,2015-06-07 12:24:18,RT @TVSYD: .@SociologenHD vil have vækst og frihed fra bureaukrati #fv15syd
607523340589350912,2015-06-07 12:23:46,Live på @TVSYD netop nu. #dkpol
607256800887492610,2015-06-06 18:44:38,#dkpol #ftvalg15 #LiberalAlliance http://t.co/wzMATeHPpl
606815755133460480,2015-06-05 13:32:04,Grundlovsfest i #Rødding. #vejen #dkpol #ftvalg15 http://t.co/ePXrX7dcs0
606521607457280000,2015-06-04 18:03:14,@spisekammeret #dkpol #fv15 #LiberalAlliance  #valg2015 #landbruget http://t.co/PuRy0hkvzX
605406107922743296,2015-06-01 16:10:38,Gang i Haderslev #haderslevpol #dkpol #fv15 http://t.co/pZb9EdHBzU
605347870603100160,2015-06-01 12:19:13,Besøger iværksætteren Mark. 19 år med egen Frozen Yogurt shop i Haderslev. #haderslevpol #dkpol #LAvilIværksætterne http://t.co/V0Quhy7BYB
605299357274017792,2015-06-01 09:06:27,Så er de sidste ledige forsideannoncer i FD samt VAF købt #dkpol #DahlErGenial
605266385887969280,2015-06-01 06:55:26,Tillykke til @EsbjergfB! Sydjylland lever - Sydjylland Kan! #dkpol
604582911367647232,2015-05-30 09:39:33,Politikernes juæepynt #dkpol #ftvalg15 #stemliberalt http://t.co/m4I2ONHaEF
604582621335719936,2015-05-30 09:38:24,Vi skal turde at dyrke talenterne i uddannelsessystemet #ftvalg15 #dkpol #stemliberalt
604218500358520832,2015-05-29 09:31:30,Registreringsafgiften er en skat på at bo udenfor bycentre. Afskaf den! #dkpol #fv15 #stemliberalt
577812530657132544,2015-03-17 12:43:37,"@sofierye @mortenstinus @MBrgger :Hvad i alverden mener du med ""truer med vold""?"
577812342228004864,2015-03-17 12:42:52,@sofierye @mortenstinus @MBrgger @SociologenHD
572014826827997184,2015-03-01 12:45:36,"Islamisterne skader mest af alt de sekulære muslimer i vesten http://t.co/AgJvGqHRi8#dkpol #sønderborg #sydjyllandlever"
566899995757260800,2015-02-15 10:01:06,Ikke-muslimer og sekulære muslimer må stå sammen imod islams modreformation. Imod islamisk terror og frygt. #dkpol
566899340346925056,2015-02-15 09:58:29,"Ingen skal rette sig efter religioner, der ikke er deres #dkpol"
566899203696517120,2015-02-15 09:57:57,"Alle har ret til, at være i fred fra andres religion. #dkpol"
566898791937507328,2015-02-15 09:56:19,"OBS: De islamiske terrorister er IKKE syge og gale. De er rationelle og velovervejede. De udlever ""heroisme"". #dkpol #cphshooting"
566740820184035328,2015-02-14 23:28:35,@kamransarwar @cekicozlem Hold dog op.
566674520116047872,2015-02-14 19:05:08,"Sig til enhver islamist at han kan rende og hoppe. At hans idéer er så absurde, at de kun fortjener at blive mødt med latter #dkpol #frihed"
564701574199803904,2015-02-09 08:25:21,"Det er altid en stor ære, når ens modstandere føler, de er nødt til at lyve lodret om, hvad man siger og mener.#dkpol"
562006719048712192,2015-02-01 21:56:58,"Hvis man har udtænkt ""Fair Forandring"", bør man have en karensperiode på 25 år, hvor man ikke må sige ""eksperimenter"" og ""ekstrem"".#dkpol"
561803350493384704,2015-02-01 08:28:51,"Er du imod LA's økonomiske politik? Så hader du rigdom så meget, at du vil holde andre nede i fattigdom - blot for at undgå den.#dkpol"
560692942504210432,2015-01-29 06:56:29,"Socialdemokraternes nedvurdering af vælgernes intelligens vil først og fremmest ramme dem selv.#dkpol"
560447630460067840,2015-01-28 14:41:42,Så fik man lige besøgt John Skovrup i Bække. Og Dahlmobilen. http://t.co/DSahMNwHOU
560174919473184768,2015-01-27 20:38:03,"For et klichéfrit miljø: Hvis du hører nogen sige ""trykke på valgknappen"" - så giver du bare vedkommende en olfert. Okay?#dkpol"
559446033064005633,2015-01-25 20:21:42,Yderligtgående partier er altid udtryk for en fallit i de etablerede eliter. Altid.
558705197443465216,2015-01-23 19:17:53,"- Hvad er forskellen på IS og Saudi-Arabien? - Saudierne stryger deres tøj."
555491566660620288,2015-01-14 22:28:04,"Generalisering er et af erkendelsens stærkeste redskaber. Både den videnskabelige og hverdagens.#2015generalisering"
553528419338977280,2015-01-09 12:27:13,"Jeg synes ikke, at folk, der er født i 1965, er gamle nok til at fylde 50."
552905030245036032,2015-01-07 19:10:06,Be there - or be square. http://t.co/cP5Cgf3Jvb
