id,created_at,text
786226456527532032,2016-10-12 15:26:09,"En god og meget udbytterig dag i Bruxelles er ved st være slut.
Har haft møde med de danske europarlamentarikere... https://t.co/zRTu087PAb"
783988391176237056,2016-10-06 11:12:52,Kun 100 nedslidte ældre får glæde af regeringens redningskrans https://t.co/ufc1ucICY0
783987593679691776,2016-10-06 11:09:42,Det skal være slut med kontrol for kontrollens skyld. Vi skal vise de offentlige ansatte den tillid de fortjener.... https://t.co/IamVErgcqJ
783941359124287488,2016-10-06 08:05:59,S føler sig renset af Finansministeriet https://t.co/qIZKPHYnYA
783313213735702528,2016-10-04 14:29:58,Har netop været i debat med Jane Heitmann i radio Fyn om statsministerens åbningstale https://t.co/boPhVilwil
783244584595910657,2016-10-04 09:57:15,Sammen med Simon Kollerup er jeg klar til festdagen Folketingets åbning. https://t.co/oPncafeXUX
779993992125640705,2016-09-25 10:40:33,"Her har I mulighed for at læse mit seneste nyhedsbrev

Løkke løser ikke fremtidens udfordringer

I de kommende... https://t.co/Z0Pmm7V4zJ"
779287377621708801,2016-09-23 11:52:43,Er lige blevet færdig med Europaudvalgsmøde med forelæggelser af erhvervs- og vækstministeren og Klima - og... https://t.co/CezFstLfy7
778572015225671680,2016-09-21 12:30:08,"Vi har i dag offentliggjort vores bud på hvad der løser Danmarks udfordringer.
Vi tror ikke på at de nedslidte... https://t.co/RtAgI0g1vx"
776854176416628736,2016-09-16 18:44:03,TV2 Fyn fulgte mig på min første arbejdsdag som formand for Europaudvalget https://t.co/qWUGk0DziM
776757045404000256,2016-09-16 12:18:05,Nu får topskattelettelser også kritiske bemærkninger med på vejen af direktøren for Danske Bank. Vi kan jo håbe... https://t.co/EZ7NHzeqYR
775946013093658625,2016-09-14 06:35:20,Så blev jeg i går officielt valgt som formand for Europaudvalget. Et arbejde jeg glæder mig til at gå i kast med https://t.co/saMjEQrXYM
775404015584677888,2016-09-12 18:41:38,"Har i dag været med Erhvervs- vækst- og eksportudvalget på virksomhedsbesøg i det jyske. 
Formålet var at gå i... https://t.co/s95AwJAuMw"
744277938259042304,2016-06-18 21:17:43,Stemningsbillede fra folkemødet sammen med Benny Engelbrecht https://t.co/R57IcGaNRR
744188665132367872,2016-06-18 15:22:58,"Så er min sidste debat på folkemødet slut.
En debat om hvordan vi udvikler turismeerhvervet og trækker flere... https://t.co/Er06rHQm2x"
743747727561916416,2016-06-17 10:10:51,"En busfuld forventningsfulde mennesker på vej til folkemødet i Allinge.
Har min første debat her kl 15
Desværre... https://t.co/Md2poUjvRK"
737915605186138112,2016-06-01 07:56:04,"Mette Frederiksen er lige gået på talerstolen ved afslutningsdebatten. 
Vi ønsker at styrke fællesskabet, vi vil... https://t.co/C6PX4mrauU"
733285212700987393,2016-05-19 13:16:33,"Hvis du var i tvivl så kan du her se, at DK går i den helt forkerte retning med Lars Løkke ved roret. https://t.co/Ivn1zk3rjR"
726702812424462336,2016-05-01 09:20:26,"Havde en dejlig start på 1. maj sammen med rigtig mange gode socialdemokrater i Odense.
Godt humør og kampgejst.... https://t.co/juIdWQBF0p"
723026915645362176,2016-04-21 05:53:44,For de af der er interesseret i problemerne for pendlerne på Svendborgbanen kan I på Folketingets TV følge med i... https://t.co/SYDtYlNemy
722056129832951808,2016-04-18 13:36:11,Så er Erhvervsudvalget på vej til Mærsk boreplatformen Halfdan. En fantastisk oplevelse og megen nyttig viden med hjem
721614766192635904,2016-04-17 08:22:21,"Dan Jørgensen har netop budt velkommen til Socialdemokratiets stormøde om et nyt principprogram. ""Danmarks... https://t.co/1vflFMjYhF"
717082620874633216,2016-04-04 20:13:14,"Var her til aften dirigent på et meget velbesøgt repræsentantskabsmøde.
Kulminationen på mødet var valget af... https://t.co/zTbDJlirZG"
716239574289235969,2016-04-02 12:23:16,Er i dag til Ankers bisættelse i Grundtvigs kirken. En flot og bevægende afsked med en af de helt store danske... https://t.co/XzVixw2ANJ
715459748548751360,2016-03-31 08:44:31,Endnu en gang viser DF sit sande ansigt https://t.co/N7APunR1ki
715160119827410944,2016-03-30 12:53:54,Har i dag sammen med Mette Frederiksen og Peter Rahbæk været til møde med ungerådet i Vollsmose. Et fantastisk... https://t.co/WQgKQ8JxkC
714830203562901504,2016-03-29 15:02:56,Har i dag været til afskedsreception for Helle Thorning. Vi skylder Helle en stor tak for indsatsen både som... https://t.co/bbjzDuXPht
709725923931725825,2016-03-15 13:00:20,Endnu en gang viser DF sit sande ansigt. https://t.co/teM1x5iWpN
708304812966858754,2016-03-11 14:53:21,Så skal vi gang med turens sidste dag. Men et par billeder fra Chicago ved søkanten og Drake hotel. Chicagos... https://t.co/vf9ZtTbwTP
708081853320798209,2016-03-11 00:07:24,"Så er vi nået til Chicago.
Har haft møde med lille dansk firma Nissen med 22 ansatte i Danmark. Firmaet er kommet... https://t.co/jbcsYJY54X"
707661285521928192,2016-03-09 20:16:12,Så er turen nået til Washington. Først møde med Medicon så møde med Google og Uber. Herefter lige tid til en tur... https://t.co/yltiDoqt77
707316708818755585,2016-03-08 21:26:59,Har i dag været på besøg hos Novo og AP Møller i New Jersey. Utroligt spændende at høre om de to danske... https://t.co/ODfp1Ak0AF
707036070425272320,2016-03-08 02:51:49,Dagen blev afsluttet med middag hos den danske generalkonsul. Hendes lejlighed er penthouse lejlighed på 75.... https://t.co/H2DrP0AMTe
707035324095078400,2016-03-08 02:48:52,"På samme tur kom vi forbi den nye subwaystation, den gamle børsbygning og New York rådhus"
707034895982444545,2016-03-08 02:47:09,På vores tur fik vi en gåtur med guide på Manhatten hvor vi bla så World Trade memorial og det første af de to... https://t.co/Ls78zC6ETN
706936717320855556,2016-03-07 20:17:02,Har lige afsluttet møde med succesfuldt dansk firma i new York Red Associates som har specialiseret sig i... https://t.co/C8ofdac8kZ
706921734289510400,2016-03-07 19:17:30,Har lige afsluttet besøget på Grand Central hvor Claus Meyer starter sit danske koncept op til maj. Claus... https://t.co/llJspsPI67
706808079963152384,2016-03-07 11:45:52,Så er første dag med Erhvervs- og vækst udvalget i new York gået. Møde med det privat/offentlige samarbejde... https://t.co/mBYpJZBekN
704942658314231808,2016-03-02 08:13:21,Er Startet dagen med samråd med integrationsministeren om flygtningesituationen. Herefter er der rundvisning på... https://t.co/TYvF44U3zX
702827823417921537,2016-02-25 12:09:45,Hvilken overraskelse. Min fantastiske sekretær Maikin har pyntet mit kontor op med flag i anledning af min fødselsdag.
701871701156618240,2016-02-22 20:50:28,Har her til aften været til generalforsamling i foreningen Centrum. Dejligt at mødes med gode engagerede fynske... https://t.co/MDuTXfYsSu
695362261536235521,2016-02-04 21:44:17,Hari dag været på rundtur omkring Københavns havn med direktør for by og havn og tidligereoverborgmester Jens... https://t.co/C4DEFThTdv
694495886664146945,2016-02-02 12:21:37,"https://t.co/Qv8s5pCHrZ
Forsøger i dette interview at forklare... https://t.co/cXKmlEW50e"
694290707415171072,2016-02-01 22:46:18,Har her til aften haft et godt og konstruktivt møde med den tværgående socialdemokratiske gruppe i Odense med... https://t.co/Tfvt25amOb
692707695061778433,2016-01-28 13:55:59,DF's og Kristian Thulesen Dahls hykleri vil ingen ende tage. Først siger han ja til at skære i pensionisternes... https://t.co/QFc7m4XYx0
692012654584578050,2016-01-26 15:54:08,"I dag strammer vi Danmarks udlændingelovgivning. Det er en svær beslutning, men vi gør det fordi det er... https://t.co/cTybcSHtCW"
691583798471966720,2016-01-25 11:30:01,Har her til formiddag været til møde med LO Fyn og de fynske folketingsmedlemmer. På mødet var også ledende... https://t.co/gIKbfyFchC
690939589465346048,2016-01-23 16:50:09,"Har i dag været til generalforsamling i foreningen Korsløkke. Dejligt med en generalforsamling med god debat,... https://t.co/Y5WePD8LtM"
688717369007562753,2016-01-17 13:39:51,Kattegatbro: Så kan vi ligeså godt lave Fyn om til sommerhusområde!... https://t.co/xAnbTgCcvI
688119622365609985,2016-01-15 22:04:37,Vi skulle i dag 1. behandle lovforslag fra erhvervs- og vækstministeren. Han valgte helt uacceptabelt at tage på... https://t.co/oWRdqWXUkl
688118885720010758,2016-01-15 22:01:41,https://t.co/m7l5bA2RBl https://t.co/8gbOID0DOp
674326131181559812,2015-12-08 20:34:12,En spændende dag med besøg af Emil fra Fyens Stiftstidende og praktikant Mie fra Ullerslev begyndte i... https://t.co/szuwHs6BJG
672758926052630528,2015-12-04 12:46:41,Som I kan se stemte DF i dag imod oppositionens forslag om at droppe omprioriteringsbidraget som betyder at... https://t.co/JQIKRAuoiH
672700061495779328,2015-12-04 08:52:47,"Kære fynske. DF'ere
Dorthe Ullemose, Jens Henrik Thulesen Dahl, Alex Ahrendsen og Pernille Bendixen I kan alle i... https://t.co/MOmCcehTMl"
672519125734989824,2015-12-03 20:53:49,"Et stort flertal af danskerne har i dag stemt nej til afskaffelsen af retsforbeholdet. 
Det er jeg ked af fordi... https://t.co/qv09hvnAgq"
672024479653076993,2015-12-02 12:08:16,Vi ved kriminaliteten og terror er grænseoverskridende derfor er det nødvendigt at dansk politi og danske... https://t.co/GHvzHdn7Ia
667421096954732544,2015-11-19 19:16:04,De borgerlige partier har i dag indgået aftale om finanslov 2016. Mon ikke der er mange DF vælgere der er... https://t.co/816FWlPM9E
666951245182169089,2015-11-18 12:09:02,Så er der paragraf 20 spørgsmål til undervisningsministeren og skatteministeren https://t.co/FjRaGCnnF4
666494494439825408,2015-11-17 05:54:05,"Efter gårdsdagens gode debatmøde i Metal i Odense om retsforbeholdet. Så går turen nu tilbage mod Kbh.
En... https://t.co/1gjulIcFeg"
666157047000494080,2015-11-16 07:33:11,Første opgave som ældreordfører bliver 1. behandlingen af lovforslag L 47. Det omhandler en ændring af det... https://t.co/O77qulzJVF
665617615809851392,2015-11-14 19:49:40,Deltog her i eftermiddag i folkemødet i Nyborg. Et flot arrangement som var arrangeret af frivillige i Nyborg... https://t.co/c8O9xrVtrD
664829876495630336,2015-11-12 15:39:29,Afsluttede en lang dag i salen med at være ordfører på lovforslag L39 https://t.co/CwD3sPsduA
664460692016222208,2015-11-11 15:12:28,Er blive færdig med paneldebat på Nyborg Strand omkring kriminalitet i transportbranchen. Et voksende problem med... https://t.co/rckB1bqok9
661545204537761792,2015-11-03 14:07:22,En dejlig hilsen fra mine politiske kollegaer på Christiansborg i anledning af min jomfrutale https://t.co/0IwihLX5mW
661542148647555072,2015-11-03 13:55:13,Så har jeg haft debut på Folketingets talerstol. En stor oplevelse. Skal også på talerstolen i næste uge. Også en... https://t.co/Evifs1uGwZ
658965587880747008,2015-10-27 11:16:53,Endnu en gang ser vi DF løbe fra deres løfter. Nedenfor er der interview med Rene Christensen hvor han ikke vil... https://t.co/9fH3dQpPwr
658964271657709569,2015-10-27 11:11:39,Forstår du DF? Syv skarpe til finansordføreren om støtte til minusvækst https://t.co/KJyYZ4857p
656812356631138304,2015-10-21 12:40:43,Så er min debut veloverstået har i dag blev stillet to paragraf 20 spm til sundheds- og ældreministeren i salen https://t.co/qw2eDR04aR
656206296375533568,2015-10-19 20:32:27,Har i dag været til møde på SDU hvor vi startede på 14. etage på det nye kollegie. Et fantastisk view ud over... https://t.co/d24d24riww
652033673169121280,2015-10-08 08:11:56,Så er åbningsdebatten igang og vores formand Mette Frederiksen er som den første på talerstol. Hun står fast på... http://t.co/7Wny5qNLWO
651336553445367808,2015-10-06 10:01:50,Så er kongefamilien på plads og åbningen er nu igang http://t.co/Ihm1BP9be4
651303597469265920,2015-10-06 07:50:52,En begivenhedsrig dag. Folketinget åbner. Var på DR Fyn kl 8.10 sammen med Pernille Skipper. Herefter interview... http://t.co/78UMfUhRyk
650641409221992449,2015-10-04 11:59:34,Så er det en realitet det første top er ankommet og holder på Langeskov station. Her er mange glade og... http://t.co/ho4dk5Xals
649547413896736768,2015-10-01 11:32:26,"En god dag for Odense men en skidt dag for Fyn.
Det er godt der flyttes 286 statslige arbejdspladser til Odense.... http://t.co/7f0xclwSjW"
648894486987309056,2015-09-29 16:17:56,Fantastisk oplevelse på DI' topmøde at høre vores astronaut Andreas Mogensen http://t.co/3UvaYIIhjJ
648838120251760641,2015-09-29 12:33:57,Er til topmøde i DI vores formand Mette Frederiksen taler om vores fælles opgave om at skabe flere... http://t.co/UFKf7IBee3
645185410558246913,2015-09-19 10:39:23,Til kongres i socialdemokratiet. Vores formand Mette Frederiksen er igang med en stærk tale http://t.co/BERthnba6g
643452683479818240,2015-09-14 15:54:09,Regeringen vil afskaffe fattigdomsgrænsen. Karen Ellemann udtaler at fattigdom ikke kun drejer sig om kroner og... http://t.co/wh15CgmbJL
642019612587085824,2015-09-10 16:59:38,Administrerende direktør for DTL Erik Østergård stiller det relevante spørgsmål til statsministeren. Hvad blev... http://t.co/0FLkmMgwpP
638831765855993856,2015-09-01 21:52:16,Det her er fuldstændig uacceptabelt. Og jeg tager dyb afstand fra det. Uanset hvilken religion vi bekender os til... http://t.co/abZwFUQfe2
638448629305446400,2015-08-31 20:29:49,På vej til København efter en god dag på Fyn. Dagen begyndte med et godt og konstruktivt møde hos Fynbus.... http://t.co/ot50bcuNZU
636902871078989825,2015-08-27 14:07:32,"Er i dag sammen S transportudvalgsmedlemmerne.
En spændende dag som startede med møde med tillidsfolk fra... http://t.co/vMMWH4UjEp"
636276293382836224,2015-08-25 20:37:44,Jeg havde her til aften det sidste byrådsmøde. Det var vemodigt at skulle sige farvel til lokalpolitik som har... http://t.co/14EGqQbxZV
635528923149922304,2015-08-23 19:07:57,http://t.co/p0xv9mxhev
623107506236227584,2015-07-20 12:29:40,"Så har vi fundet en vinder af valgkampskonkurrencen. Stort tillykke til Liselotte Lykkemark, der har vundet et... http://t.co/MvWSc13gn3"
617411746509287424,2015-07-04 19:16:45,En fantastisk stemning her på Roskilde http://t.co/Iy30LUdJ4o
616547624666181632,2015-07-02 10:03:03,Så er vi igang med første møde i salen. http://t.co/XJkv9iiiGt
615911884202582016,2015-06-30 15:56:50,En enig gruppe vedtog på gruppemødet igår konstitueringen. Jeg fik mine ønsker opfyldt og fik plads i... http://t.co/DahGkg1DSw
615159348868857857,2015-06-28 14:06:32,Den ekstraordinære kongres er overstået. En stor og velfortjent hyldest til Helle for 10 års formandsskab. Et... http://t.co/ixbgKNJ02k
613750813471719424,2015-06-24 16:49:31,"En spændende dag på Christiansborg hvor jeg bl.a fik mit adgangskort.
Det var en meget ydmyg Erik der gik op af... http://t.co/PcmXPh6TyW"
613358664615862272,2015-06-23 14:51:15,"Så er vi ved at have taget valgplakaterne ned. Stor tak til alle jer, der har kravlet rundt i lygtepæle overalt i... http://t.co/ZgHyUrCp84"
612311644216164352,2015-06-20 17:30:46,Så er vi til fest med alle de frivillige fra valgkampen. Det er de mennesker jeg skylder den største tak. De har... http://t.co/jsGYemlTQp
612243564018421760,2015-06-20 13:00:15,"Er på vej hjem fra møde mellem hovedbestyrelsen og den nye folketingsgruppe.
Helle overdrog depechen til Mette... http://t.co/qt91t1tv6G"
611952057034108929,2015-06-19 17:41:54,"En kæmpe tak til alle jer, der har knoklet for at få mig valgt ind - og ikke mindst til alle jer, der har stemt... http://t.co/UJCLWfcIZO"
611504055173648384,2015-06-18 12:01:42,Slutspurt på Vollsmose Torv :-) http://t.co/u064l7YAIG
611452162242121728,2015-06-18 08:35:30,"Så er der stemt! I kan måske gætte, hvor jeg har sat mit kryds..? Håber mange af jer følger mit eksempel ;-)... http://t.co/qRmOomvtSR"
611429906329796608,2015-06-18 07:07:04,"VALGKØRSEL. Fra kl. 12.30 idag kører Abdinoor alle i Odense 1. kreds, der ikke selv har mulighed for at komme til... http://t.co/gAMMr5Fd1o"
611257540530307072,2015-06-17 19:42:08,En hyggelig afrunding på valgkampen til 'Det sidste ord' på TV2 med tre gode partifæller.  #dkpol #tv2valg... http://t.co/FXSINK78xs
611149497796796417,2015-06-17 12:32:49,"Tak Tim, for de pæne ord :-) http://t.co/zrJwZYxopC"
611125970381205504,2015-06-17 10:59:20,"Jeg sidder klar nu og den næste time frem til at svare på de spørgsmål, du måtte have i forhold til mig, og det... http://t.co/u1sC9Oknha"
610810336262914048,2015-06-16 14:05:07,"Hvis du endnu ikke har fundet en god grund til at stemme personligt på mig på torsdag, kan du måske lade dig... http://t.co/ZRIXq6Epo5"
610507278140182528,2015-06-15 18:00:52,"Så er vi ved at være klar til min sidste paneldebat i denne omgang her på Dianavængets beboerhus, hvor vi bl.a.... http://t.co/VdULR5HwoB"
610095969464655872,2015-06-14 14:46:28,"Jeg sidder klar ved tasterne den næste time. Så hvis du har spørgsmål til mig, kan du skrive dem her i tråden, så... http://t.co/1XNcibw1tV"
609745860709216256,2015-06-13 15:35:16,"Søndag sidder jeg klar ved tasterne fra kl.17-18. Så skriv til mig her, hvis du har nogle spørgsmål om mig, hvad... http://t.co/Srx8fHWVKV"
609744977812455424,2015-06-13 15:31:45,"Søndag sidder jeg klar ved tasterne fra kl.17-18. Så skriv til mig her, hvis du har nogle spørgsmål om mig, hvad... http://t.co/S8k90JxLbQ"
609706552711376896,2015-06-13 12:59:04,"Vi står klar til at tage imod en masse fodboldfans om lidt, når B1909 skal spille oprykningskamp mod Dalum. Jeg... http://t.co/uaNvb0THln"
609323754313940992,2015-06-12 11:37:58,"Om lidt går jeg på TV2Fyn Live og fortæller lidt om, hvorfor jeg er Socialdemokrat, og hvad jeg kan bidrage med,... http://t.co/kMjUhfGdke"
609010833813831680,2015-06-11 14:54:32,"Klar til at tale arbejdsløshed og beskæftigelse på Fyn på Radio24syv. Vi går live om ganske få sekunder, så stil... http://t.co/G67kFGizOM"
608712757140144129,2015-06-10 19:10:05,"Startede dagen idag med en paneldebat på Den Sociale Højskole, hvor vi især diskuterede ulighed. De studerende... http://t.co/kwsv2HUJZ0"
608685891008262145,2015-06-10 17:23:19,"Så er debatten i gang her på Coworking Odense. Debatten livestreames, så har du ikke mulighed for at komme forbi,... http://t.co/yYLiipC5RV"
607914416693215232,2015-06-08 14:17:46,"Jeg er rigtig glad for anbefalingen fra byrådsmedlem Peter Rahbæk Juel. 
#fv15 #dkpol #odensepol #mitodense... http://t.co/h0hFgvvGLL"
607803229875879936,2015-06-08 06:55:57,"Starter morgenen i Nyborg idag med elever fra Danehofskolen, der har bedt mig medvirke i deres valgfilm. Dejligt... http://t.co/LTXxqyjzLj"
607292752053829633,2015-06-06 21:07:29,"Oplæring og opvarmning til en aftenduel bag baren. Kig forbi No. 5 mellem 23-24, køb en rød drink og lad os vise... http://t.co/imqIoDkMFm"
607240452916527104,2015-06-06 17:39:40,"Valgkampen byder på mange forskellige arrangementer. I går var jeg bl.a. til et stort somalisk bryllup, i dag har... http://t.co/ZT7nfZRaPp"
607126932409487360,2015-06-06 10:08:35,"Så blev det lørdag, og de næste timer står mit team og jeg klar til Det Fynske Folkemøde med bolsjer, balloner og... http://t.co/9GXWitQ3ne"
606734016012775424,2015-06-05 08:07:16,I dag fejrer vi ikke kun Grundloven men også 100 års dagen for kvindernes valgret. Vi hylder med rette de gæve... http://t.co/yYMx8k00t4
606580431471972352,2015-06-04 21:56:59,"Til dem, der ikke nåede at se Dagens Duel på TV 2/FYN i aften :-) http://t.co/6D0XiF7TXX"
606511464099266561,2015-06-04 17:22:56,"Er igang med lydprøverne til Dagens Duel på TV2Fyn, hvor jeg skal op mod Anne Katrine Melvig fra Venstre. Vi går... http://t.co/LfIq2kfV1q"
606497754496540673,2015-06-04 16:28:27,"Fik kamp fra morgenstunden idag, da jeg var ude og gå stavgang med en masse meget morgenfriske kvinder fra... http://t.co/xvflX7jlH0"
606194857598664704,2015-06-03 20:24:51,"Mens jeg er ude med Mithaq Eddan til et hyggeligt møde med en gruppe af hans Irakiske venner, knokler kampagnens... http://t.co/bPqFHzETaM"
605727418607915008,2015-06-02 13:27:25,"Til trods for silende regn har vi indtil videre både fået delt kaffe ud til fremtidens sygeplejersker på UCL,... http://t.co/fQZOJQtpk1"
605670599898329088,2015-06-02 09:41:38,"Rigtig mange har spurgt, om de kan stemme på mig, selvom de ikke bor i Odense. Svaret er ja! Du kan stemme på mig... http://t.co/FGWYO6Qc5H"
605050133814882304,2015-05-31 16:36:07,"Det kostede hverken blod eller tårer, men lidt svedige var de, vores stærke frivillige, efter de havde fået... http://t.co/eXPinVjnuz"
605001036269555712,2015-05-31 13:21:02,I dagens udgave af Fyens Stiftstidende er der et dobbeltinterview med Carsten Kudsk og jeg. Specielt... http://t.co/DMEh3rEnpQ
604666868306210816,2015-05-30 15:13:10,"Rigtig god stemning i Odense idag. Nåede bl.a forbi Havnekulturfesten, Grønttorvet, Bazaren og kræmmermarkedet på... http://t.co/VIJgfTJSxh"
604562565360984064,2015-05-30 08:18:42,"Startede morgenen med en mindehøjtidelighed for de 8372 bosniske krigsofre, der for 20 år siden blev brutalt... http://t.co/UfpzIjFrWn"
604369707555229696,2015-05-29 19:32:21,"Valgkampens dag 3 blev rundet af med en flok gæve, men gennemblødte DSU'ere til Open by Night i Odense.... http://t.co/w3htcOaugF"
604355300863406082,2015-05-29 18:35:06,"Selvom vi er i valgkamp, skal der også være tid til lidt hygge! Nåede lige at se første halvdel af Marienlyst -... http://t.co/S6YFnLpkqA"
604334170576424960,2015-05-29 17:11:08,"Det er beskæmmende at læse, at Bladt Industries på Lindø ikke ønsker at hyre danske svejsere! Ifølge Fyens... http://t.co/F8HBiLbWQV"
604274031743930368,2015-05-29 13:12:10,"Står klar med en flok friske DSU'ere til åbningen af byens bro, der binder midtbyen og havnen sammen. http://t.co/juqWY4aChC"
604027936203771904,2015-05-28 20:54:16,"Valgkampens dag 2 i selskab med vores dygtige statsminister Helle Thorning-Schmidt, Carsten Hansen, Trine... http://t.co/y40T1ZouXP"
603665642588393472,2015-05-27 20:54:39,"Så er Odense Østkredsen plastret behørigt til, og det er blevet tid til at genoplade batterierne. En kæmpe tak... http://t.co/rxd76pJHbl"
603637929479634944,2015-05-27 19:04:32,"Det er dejligt med min gode ven Abdinoor Adams anbefaling til folketingsvalget! Se her og del gerne! 
#stemerik... http://t.co/RR1s2uCepu"
603580040194990080,2015-05-27 15:14:30,#FT15 #stemerik #såerviigang #dkpol #Spolitik TV 2/FYN http://t.co/EXCBySdtTH
603463031377567744,2015-05-27 07:29:33,"Så er vi igang! Husk, at vi mødes til Kick off i aften kl. 19!"
603232345798406144,2015-05-26 16:12:53,Regeringen har idag med deres velfærdsudspil valgt at investere 39 mia i det danske fællesskab. Det betyder bl.a.... http://t.co/jHH77yetNW
602838279575175168,2015-05-25 14:07:00,"Så er tre ugers valgkampen planlagt, og det er blevet tid til lidt valgudvalgshygge. God pinse! #FV15 #Vierklar... http://t.co/hrc740iLF6"
601384233412722689,2015-05-21 13:49:09,"Pædagogerne har længe nok løbet alt for hurtigt, og det er gået udover både dem og børnene. Derfor glæder det mig... http://t.co/77N0Bj6aQk"
598901249791098880,2015-05-14 17:22:39,"Så er vi igang på Heidis Bier Bar... Der er stadig ledige pladser, så hvis du er i nærheden og har lyst til at... http://t.co/kZkYAP88mz"
596374158650507264,2015-05-07 18:00:54,I aften handler det om fødevarer og landbrug her hos Centrovice. Hvilke muligheder har vi på Fyn for vækst og... http://t.co/DSi9894hLD
596023346506158080,2015-05-06 18:46:54,Har her til aften været på Nyborg Gymnasium for at tale om planerne for Campus Nyborg. Det er efterhånden en del... http://t.co/TPPHr88GCC
594199275380301826,2015-05-01 17:58:41,Lidt blandede billeder fra en dejlig dag! #1maj2015 #Spolitik
594172518929403904,2015-05-01 16:12:22,"Hvis du ikke hørte min tale i Kgs. have idag, kan du høre den her :-) Fortsat god 1.maj til jer alle! #1maj2015... http://t.co/18uMfdafAr"
594029384287289344,2015-05-01 06:43:36,"Så er 1. maj skudt igang her i seniorhuset på Toldbodgade. Om lidt er det min tur til at tale, og så går turen... http://t.co/8yEC5Vwg6P"
593706405871353856,2015-04-30 09:20:12,Imorgen starter jeg dagen i Seniorhuset på Toldbodgade kl. 7.30 og fortsætter ind til arrangementet på Flakhaven... http://t.co/xnkSq5WEeE
593448287853748225,2015-04-29 16:14:32,"Trine Bramsen, Carsten Hansen, Peter Rahbæk Juel og jeg har forenet vores kræfter i kampen om et tredje spor på... http://t.co/gbHu4372y7"
592742135516024832,2015-04-27 17:28:32,"Er i aften til møde hos LO Fyn for at diskutere broafgiften på Storebæltsbroen. Det er besluttet, at... http://t.co/h3knC2NtEW"
592313101992747008,2015-04-26 13:03:42,Den næste time sidder jeg klar at svare på spørgsmål om mig selv og mine politiske ambitioner her i studiet hos... http://t.co/Ex6Lkj5j0P
591234938747355138,2015-04-23 13:39:28,"I dag var jeg på Odense Katedralskole. Her diskuterede vi bl.a. uddannelse, hvor vi Socialdemokrater - i... http://t.co/qR6ocbqfI8"
589043881511100417,2015-04-17 12:32:59,"Løkkes nulvækst vil helt konkret betyde, at 486 offentlige ansatte skal fyres alene i Odense! Spørgsmålet er så... http://t.co/Jo6XcfpcVl"
587720364337274881,2015-04-13 20:53:48,Har her til aften været til møde med 30 somaliske kvinder i Aktivitetshuset i Fyrreparken. Et fantastisk møde med... http://t.co/VlTxLUqkdZ
587540261187801088,2015-04-13 08:58:08,Løkke og Thulesen Dahl har ingen problemer med at skære i førtidspensionen. Jeg kunne ikke være mere uenig.... http://t.co/8MakBDEdIH
587183696165400578,2015-04-12 09:21:17,"Tiltrods for alt, hvad hun har stået model til, står hun stadig – måske endda rankere og stærkere end nogensinde.... http://t.co/0nc0ufOC8i"
