id,created_at,text
792597252820852736,2016-10-30 05:21:25,"Vi har 12.000 politifolk, og heraf vogter 140 grænserne. Frederiksen mener vist, at hvis de 140 bare blev trukket væk, ville alt løses..."
792122688269582336,2016-10-28 21:55:40,Rusland blev stemt ud af FNs Menneskerettighedsråd. Saudi Arabien blev stemt ind. Hmmm...
791895330078023680,2016-10-28 06:52:14,"Bemærkelsesværdigt, at Jyllands-Posten er det eneste medie, som slet ikke beskæftiger sig med Flemming Roses nye bog..."
789871482776223744,2016-10-22 16:50:11,Dronningen med kontroversiel udmelding: Vi tog fejl om indvandrerne https://t.co/mD2f2jxnis
788429967222837248,2016-10-18 17:22:07,- Euroman https://t.co/FBdPlGhwjc
787539230113366017,2016-10-16 06:22:38,"Hvorfor gør FN og araberne sig altid selv til grin?...FN: ""Tempelbjerget har ikke noget med Jødedommen at gøre..."" https://t.co/6aIELoGfkb"
787184052428308480,2016-10-15 06:51:17,@krizling Hilarious...!
786967502836363264,2016-10-14 16:30:48,"#besservisserne Glad for, at min gamle krigskammerat, er blevet rask igen. Hurra for det, Villy...!"
786871448539426816,2016-10-14 10:09:07,"Jubler over, at Kronprinsen er OK - og at han efter alt dømme slipper for men efter sit alvorlige uheld... 😄👍😄"
786642932237565952,2016-10-13 19:01:04,"Trist med alle de herlige amerikanere, som kunne have været præsidentkandidater, og så står valget mellem Trump og Hillery...! Øv"
786639172811489280,2016-10-13 18:46:08,"En Bruxelles-Græker er ved at finde ud af, om vi får lov til at forsvare vore egne grænser. Nøjh, hvor ER vi spændte! Næsten som Juleaften!"
786449840586665984,2016-10-13 06:13:48,Danmark tvinges nu til at tigge Bruxelles om at få lov til at forsvare vore egne grænser... Hvordan i alverden er vi dog kommet så langt ud?
786235690082144256,2016-10-12 16:02:50,@cordua_jarl @PeoplesPressDK @CorduaSteno @Radio24syv Ja.... Hvorfor har Jakob Kvist ikke sagsøgt Politiken for at tyv-stjæle en hel bog?
786234029179670528,2016-10-12 15:56:14,@alternativet_ dropper debatter uden kvinder. Jeg har en idé: Fra nu af stiller Alternativet altid med en kvinde. Og Bingo... Alle er glade!
786116702350245888,2016-10-12 08:10:01,"Aarhus ""Europæisk Kulturhovedstad""... Nå! Er der nogen, der har nogen ide om, hvad alle de andre vindere i årenes løb har fået ud af det??"
785819290247180288,2016-10-11 12:28:13,"Kunne være skønt lige at få oplyst, hvor stort et beløb, Politiken betalte People's Press og Jakob Scharf for at kunne bringe hele bogen..??"
785812976788004864,2016-10-11 12:03:08,"@PolForlag Beklager - Det var naturligvis dagbladet Politiken, jeg mente. Vh Espersen"
785811918594445312,2016-10-11 11:58:55,"Pinligt, at Jakob Scharf ved sin ansættelse i PET højtideligt skriftligt lovede at holde fortroligheden, og så nu plaprer løs i en bog."
785562183505702912,2016-10-10 19:26:34,"Tv2News har alt, alt for hyppige ""BREAKING NEWS""... Det er efterhånden ved at virke lidt latterligt. Vent nu med det, til der sker noget..."
785073742925983744,2016-10-09 11:05:40,"Arrogante @PolForlag bør i dén grad skamme sig over, på trods af en kendelse om fogedforbud for PET-bogen, bare at sætte sig over retsstaten"
785022371518353408,2016-10-09 07:41:33,"@Th0rChristensen Hverken du eller jeg eller andre herboende danskere skal jo stemme ved USA's valg, så det er jo ligegyldigt, hvad vi mener."
785018911074951168,2016-10-09 07:27:48,Er ret så rystet over Donald Trump's kvindeforagtende væremåde. Sikke da en repræsentant for Lincoln's og Reagan's gamle hæderlige parti...!
784357841373110272,2016-10-07 11:40:56,"2016 bliver rekordår mht udenlandske turister til DK.... Men var der ikke noget med, at ingen ville komme, hvis vi havde grænsekontrol...?"
784348200660533248,2016-10-07 11:02:38,"Columbias præsident får Nobels Fredspris. Stortingets beslutning bør roses... Mellem mange missere, belønnes endelig et reelt fredsarbejde."
784056405804347392,2016-10-06 15:43:08,@SonneOlsen Hvordan skulle jeg dog vide det. Jeg kender dig jo ikke...
783652657902841856,2016-10-05 12:58:47,@RasmusJarlov Så lidt...!
783598023796461569,2016-10-05 09:21:42,DF siges at have taget patent på Dannebrog. Men her er så dagens glade nyhed: Jeg ophæver hermed patentet! Alle kan nu frit bruge Dannebrog!
782833122400436225,2016-10-03 06:42:15,@HanneVeje Lige præcis...!
782832381522800640,2016-10-03 06:39:18,"Her fik EU læsterlige folke-prygl: DK 3/12, Holland 6/4, UK 23/6, Ungarn 2/10. Mon de snart finder ud af det i Bruxelles...? Jeg tvivler."
782828438444974080,2016-10-03 06:23:38,"Theresa May: ""Vi vil ikke nogensinde igen forhandle vor suverænitet væk til EU!"" Sikke en statsminister! Sådan en kunne jeg godt tænke mig."
782523521440309248,2016-10-02 10:12:00,"Nu gælder det om at Danmark hjælper UK alt det, vi kan! May: Senest i marts tager vi første skridt til Brexit https://t.co/ogoPiQ3smP"
782498851525627904,2016-10-02 08:33:58,"Jamen, selvfølgelig skal det danske folk da spørges, hvis vi for altid skal tvinges til at finde os i piv-åbne grænser. Det siger sig selv."
782106016431439874,2016-10-01 06:32:59,"Skønt at vide, at Dronningen bliver på sin post... Tak og Hurra!
Dronning Margrethe taler ud: 'Nægter at abdicere' https://t.co/VmAeSMA5or"
782104413188067332,2016-10-01 06:26:37,"Sært, så vilde de andre partier er for at afskaffe kontrollen over grænserne, så også enhver tænkelig slyngel får fri adgang til Danmark..."
781888109659230208,2016-09-30 16:07:06,"To US præsidenter og i tonsvis af statsoverhoveder ved Peres-farvel. Kæmpe-respekt for Kristian Jensen, men hvor var Kongehuset og Løkke?"
781819465646366720,2016-09-30 11:34:20,Dansk Folkepartis helt afgørende mål er genindførelse af permanent grænsekontrol - med såvel toldere som politi. Den kamp må og skal vindes!
781731723109367809,2016-09-30 05:45:41,Radio24syv | Forlag tør ikke udgive bog med én vittighed om muslimer https://t.co/Q763b1nkle
781175878961229824,2016-09-28 16:56:57,"@fancy_maiken Nåhhh, er det SÅDAN det hænger sammen ?!"
780872217634766849,2016-09-27 20:50:19,EU-Kommissionens Tindemanns demonstrerer påny ulidelig arrogance og foragt overfor Danmark. Derfor er EU-leden blandt folkeslagene så stor.
780635581395107840,2016-09-27 05:10:00,"SÅ irriterende, at amerikanerne - givetvis for at genere europæerne - altid lægger alle store debatter midt om natten...!"
780466678018805760,2016-09-26 17:58:51,@Hansalyse Vi I Dansk Folkeparti har aldrig interesseret os det allerfjerneste for hudfarve. KUN og KUN sindelag er det afgørende.
780442201021112325,2016-09-26 16:21:35,Der er nu ikke noget skønnere end den danske september måned. Den gør mig - ligesom sommeren - i det allermest strålende humør. Hurra!!
780440801818148865,2016-09-26 16:16:01,Israel's Leviathan natgas partners sign export deal with Jordan | Agricultural Commodities | Reuters https://t.co/HnPt6XK7GS
777510230108299270,2016-09-18 14:10:58,"Pyha... Jubler og tørrer lige sveden af panden: De radikale afblæser på landsmødet ""Republikken Danmark"" med dommerstemmerne 115 mod 97..."
776751959667802112,2016-09-16 11:57:53,"Løkke er parat til at hjælpe Bulgarien med grænsekontrol... Bedre, om han erklærede sig parat til at hjælpe Danmark med grænsekontrol."
776708968269971456,2016-09-16 09:07:03,Klar til herligt årsmøde...! https://t.co/sw7GUkm8RW
776339817084878849,2016-09-15 08:40:10,"Juncker vil have endnu mere union - mere af det, som ikke virker... Ak, ak, ak. Det er lige før, man mister sit fortrinlige sensommerhumør!"
776116602244853761,2016-09-14 17:53:12,"Lattervækkende og fjoget, at TV2 stadig benytter Marlene Wind som ""ekspert i EU"". Hun optræder altid som EUs enøjede, loyale spindoktor."
775598582657318912,2016-09-13 07:34:46,"Søværnet oplyser, at man mangler folk til at bemande fartøjerne. Endnu en begrundelse for at fordoble antallet af værnepligtige."
775576952547794945,2016-09-13 06:08:49,"Nu strides tyrkere mod tyrkere - i Danmark...! SÅ irriterende, når udefrakommende belemrer Danmark med ufred, som er os uvedkommende."
774993038783483904,2016-09-11 15:28:33,"@jakobnielsen @politiken Hvis udviklingen er, at UK er ude og Tyrkiet er på vej ind, og vi går dybere og dybere ind i EUs ufrihed, så: Ja!"
774963407791456256,2016-09-11 13:30:49,"@jakobnielsen @politiken Ja, naturligvis. Det må da være enhver dansk politikers opgave: At sikre Danmarks frihed."
774906841054806016,2016-09-11 09:46:02,"UKs terrorist-opildner, Choudary skal spjælde i 5 år. Hvad med at tage Koranen fra ham - og give ham noget andet at læse. Anders And, måske?"
774904845484560384,2016-09-11 09:38:06,"Politiken @Politik bruger 32 sider på at ynke UK for Brexit. Sjovt nok betragter jeg 23. juni som dagen, hvor UK atter blev et frit land."
774683393015545856,2016-09-10 18:58:08,@AngelaBrink Ja bestemt fra mig: Varmt velkommen på Borgen..! Kom bare lige til at sende en kærlig tanke til Oberst Hackel.
774667682503352320,2016-09-10 17:55:42,"Opdelingen af skole/gymnasieelever er endnu et trist kapitel i det indvandrings-eksperimentet, som fra 1983 blev påtvunget det danske folk."
774256392832225280,2016-09-09 14:41:23,"@cekicozlem Sikke da et dumt svar. At dele befolkningen op i brune og hvide, som du gør, er vulgært, og hører ikke Danmark til."
774118142423425024,2016-09-09 05:32:02,"Putin er altter ved at udmanøvrere Obama
Netanyahu, Putin envoy discuss meeting with Abbas in Moscow - Israel News https://t.co/gLiP3UI3zj"
774116677415899136,2016-09-09 05:26:12,"@cekicozlem Nej, Özlem. Hudfarve er helt uden betydning i Danmark. Sindelag er altafgørende. Du forfladiger sagen med din brune-snak...!"
774114721477697536,2016-09-09 05:18:26,"Konservative har hyret folketingskandidat fra Radikale Venstre som pressechef. Det rapporteres, at Oberst Hackel har vendt sig i sin grav."
773783958773436416,2016-09-08 07:24:06,"Özlem ævle-vrøvler, når hun taler om ""brune"". Hudfarve er overhovedet ikke noget emne i DK - kun sindelag, religion og demokratiforståelse."
773407938228748288,2016-09-07 06:29:56,På årsdagen for migrant-vandringen på motorvejen: Det syn vil vi aldrig igen se! Vi danskere skal påny genvinde kontrollen med vore grænser.
773387796950163456,2016-09-07 05:09:54,"Özlem Cecic er begyndt at anvende udtrykket ""brune børn"". Jeg må sige, at jeg ikke bryder mig om sådanne racistiske og nedsættende udtryk."
772497568882421760,2016-09-04 18:12:27,"@jacobmark_sf Der er masser af fortilfælde for, at et udvalgs medlemmer holder kaje til de kommer hjem. Netop for at få arbejdsro på rejsen."
772496152059076609,2016-09-04 18:06:49,"Godt kørt af AfD, og en knaldende ørefigen til Angela Merkel. Ja, sådan går det, når man dumt og naivt råber: ""Wir schaffen das""..."
772491798883295232,2016-09-04 17:49:31,Som altid - og i alle tænkelige sager -havde jeg selvfølgelig ret: Vi HAR et fodboldlandshold...!! Tillykke og hurra!
772473641175027712,2016-09-04 16:37:22,"Noget tyder på, at vi har et fodboldlandshold ...!!"
772443508724604929,2016-09-04 14:37:38,Jacob Mark burde have ventet med at udtale sig efter at han var kommet hjem fra Nauro. Så ville han også have været mere vidende....
772348681928531968,2016-09-04 08:20:49,"Jacob Mark fra SF må da være forfærdelig flov over, at hans plapren løs betød, at den lange Nauru-rejse var forgæves. Han kostede 400.000 kr"
772159348709687298,2016-09-03 19:48:29,Frankrig ud af EU...?! Ikke længere blot et udsandsynligt scenarie...!  https://t.co/p6EhFsVIEZ
772068838468911104,2016-09-03 13:48:50,Tyrkiets forhandlinger med EU om visum-fritagelse siges at være brudt sammen ved mødet i Bratislava... Det var dog en skøn nyhed. Hurra..!
771615211539210240,2016-09-02 07:46:17,"Dejlig sensommer-humør-oplevelse, at christianitterne endelig træder i karakter, og rydder pusher-skidtet.. Keep up the good work...!"
771074286874423296,2016-08-31 19:56:50,https://t.co/yks0ZYjUfz
770854336855433216,2016-08-31 05:22:50,Hurra for B.T. og tillykke med 100 år. 8 af dem var jeg selv med til som journalist 1980-1988. Herlige år med skønne kolleger og chefer...!
770521507172904962,2016-08-30 07:20:17,Britisk avis: IS sender bunker af jihadister ind i Europa Revealed: Isis sends new waves of jihadis to attack Europe https://t.co/SwUXVlZf3x
770260683908911104,2016-08-29 14:03:52,... så er dén vist slået fast...! https://t.co/id4wqC8dnS
770218351591301120,2016-08-29 11:15:39,Løkke fremlægger sin store 2025-plan på Facebook i aften. Nu er jeg jo så ikke på Facebook - så jeg ser en DVD med John Wayne i stedet...
770149990027108352,2016-08-29 06:44:00,"EB oplyser, at Konstantin og Anne-Marie ""..lever i vild luksus""... 
Sikke dog en dejlig nyhed. Det glæder mig, at det går dem så godt..!"
769905792661200897,2016-08-28 14:33:39,Can Israel and the Arab States Be Friends? https://t.co/mdxMdJqZdt
769653703842402304,2016-08-27 21:51:57,"Merkel: ""EU skal have sin egen hær"". Jeg er bange for, at hun igen må have spist søm..."
768010727961624576,2016-08-23 09:03:21,DF: Boykot af russisk gasrørledning øger risiko for ny kold krig https://t.co/FVHaZQS1Gl
767972354374922240,2016-08-23 06:30:52,"Nu truer tyrkere i Danmark andre tyrkere i Danmark... Stærkt irriterende, at de og andre folkeslag slæber deres lokale opgør med herop..."
767277312563933184,2016-08-21 08:29:01,"Er det mon DF, Søren Pind hentyder til?? I så fald synes jeg da, han skulle tage at sige det lige ud....
https://t.co/hMWKHr1VZo"
765228701835485184,2016-08-15 16:48:34,Skønt ved sejlerkonkurrencerne lige at spotte Skoleskibet Danmark ved kaj i Rio de J...!
765147747771179008,2016-08-15 11:26:53,"Kristian Th. Dahl til @Spolitik : Er I overhovedet til noget?
https://t.co/Krelq2rtB7"
764170725645291520,2016-08-12 18:44:33,Ægypter ville ikke trykke israelsk OL modstander i hånden Sikke da et fjoget narrehoved... https://t.co/pmWCYb4KTI via @MailOnline
764082064735948800,2016-08-12 12:52:14,"I den grad upassende, at en af Dronningens ministre, Bertel Haarder, står offentligt frem og kritiserer Kronprinsen."
764065141524615169,2016-08-12 11:45:00,"Glade points herfra til Regeringen for at ville finde milliarder til styrkelse af Forsvaret, Politiet, PET og FET. Mit sommerhumør stiger..!"
763988830990901250,2016-08-12 06:41:46,"Om jeg fatter, hvorfor Inger Støjberg ikke bare drøner tyvagtige asylansøgere ud af landet. Hvorfor ryster hun nu igen-igen på hånden...?"
762343901659275264,2016-08-07 17:45:24,Israel Hayom | Minister: Lebanese Olympic team 'racist and anti-Semitic' for humiliating Israeli athletes https://t.co/Y0Am4FvUf7
762239782516908032,2016-08-07 10:51:40,Espersen sviner OL-kommentatorer: Jeg følte mig forrådt https://t.co/vMrepcKYRN
761809419713773568,2016-08-06 06:21:34,DRs Henrik Liniger og Peter Falktoft udgjorde en skandale ved åbningen af OL  De anede INTET om tonsvis af nationerne. Uforberedte! Pinligt!
761800411347095552,2016-08-06 05:45:46,"Merkel-aftalen: 30.000 migranter modtaget i Grækenland. 468 sendt tilbage til Tyrkiet. Men EU synes sikkert, det hele går forrygende godt."
761114156116258817,2016-08-04 08:18:50,"Greater Copenhagen indleder et projekt for at finde ud af, hvordan der fødes flere børn i regionen. Jeg har 5, og giver gerne et par fif..."
760728430119911424,2016-08-03 06:46:06,"40.000 berlinske tyrkere demonstrerer med larmende begejstring, at de er helt vilde med islamisten Erdogan. Jeg gyser....!"
760569275518218244,2016-08-02 20:13:40,"Frankrigs regering tvangs-lukker nu 20 moskeer. DF forventer, at Søren Pind nu også gør sin pligt og ser at få lukket Grimhøjmoskeen..."
760479942727634944,2016-08-02 14:18:42,Præster i Church of England vil nu bruge Pokémon Go til at lokke sognebørn ind i kirkerne. Præster bliver da osse mere og mere mærkelige...
760119648545284096,2016-08-01 14:27:01,"Søren Espersens ugebrev: Kriminelle asylansøgere skal ud.
https://t.co/a6Cr6vxXqJ"
751148777138978820,2016-07-07 20:19:58,"@fatmaoektem Ja da... God Bayram til dig, Fatma...!"
751143313718345732,2016-07-07 19:58:16,"@fatmaoektem Jo, skønt...! Men det sker bare ikke. Vent og se..."
751139191296253952,2016-07-07 19:41:53,"Forstår, at Statsministeren fremover vil sende hilsner på helligdage for bhudister, scientologer, jøder, Jehovas vidner og hinduer. Hurra!"
751087186452344832,2016-07-07 16:15:14,@cordua_jarl @Bo_Cph Så presser vi videre overfor svensken... Sådan endte vi med at få ældste udg. af Jyske Lov hjem for et par år siden!
751024976292147201,2016-07-07 12:08:02,@cordua_jarl Det tilbageleverer vi.... Hvis der da overhovedet er noget...
750984608217530368,2016-07-07 09:27:37,"Eksperter advarer om, at det nye islam-gymnasium vil gøre integrationen sværere. Ja, og mon ikke også det præcis er det, der er meningen?"
750982274632548352,2016-07-07 09:18:21,"Godt, at Glyptoteket tilbageleverer stjålen kunst til Italien. Hvornår mon Sverige returnerer alle de kunstskatte, de huggede i Danmark...?"
750713799397761024,2016-07-06 15:31:32,Body-shaming ads will be BANNED from London's transport network https://t.co/oyxRtCzDI1 via @MailOnline
750681539831209984,2016-07-06 13:23:20,"Min dom skal advare andre om tage det alvorligt, hvis deres sønner/døtre bliver overdrevent interesseret i Koranen.. https://t.co/25YrWIgxjD"
750680588386832384,2016-07-06 13:19:33,"Respekt herfra til Nigel Farage. Han sagde et værdigt farvel, da hans mission var lykkedes. Præcis som Jens Otto Krag gjorde i 1972...!"
750420507653246976,2016-07-05 20:06:05,"Ansvaret for radikaliserede piger har alene forældre, som tillader, at pigerne frekventerer koran-kurser. Der starter hjernevasken...!"
750320486542966784,2016-07-05 13:28:38,"RT @OleRyborg: Den 2. oktober holder Ungarn folkeafstemning om, hvorvidt Ungarn skal acceptere flygtninge under EU´s kvotesystem https://t.…"
750239113421451264,2016-07-05 08:05:18,"Ordentlig hjemmeside om Israel...!
https://t.co/9Z56iEICso"
750000744301006848,2016-07-04 16:18:06,https://t.co/WfAd5qgm7C Netanyahu lands in Uganda to kick-off historic Africa visit
749863558800965632,2016-07-04 07:12:58,"Aviserne beretter, at UK er ved at smelte ned. Nu fortæller min engelske familie mig, at alt går fint derovre. Hvem skal man dog stole på..?"
749710685018423297,2016-07-03 21:05:30,"Når kvinder frivilligt melder sig til Islamisk Stat og dermed til hellig krig, må vores piloter så ikke bombe dem fordi de er kvinder...?"
749707002419568640,2016-07-03 20:50:52,"Sikke da en flok herlige, vulkanske jernmænd, disse islændere er! Sikken en oplevelse, det har været at følge dem.  Hurra og stor tak!!"
749677788697886720,2016-07-03 18:54:47,"Afram, Island....!!😄"
749496870930636800,2016-07-03 06:55:53,Brexit BOOM: FTSE 100 leaps to HIGHEST level since 2011 just a week after EU referendum https://t.co/tgjhOlw2Rg
749496547071631360,2016-07-03 06:54:36,https://t.co/EHrzbO3VHi
748841809367994368,2016-07-01 11:32:54,"Hallel - en 13 år gammel jødisk pige - blev myrdet af en araber, mens hun lå og sov. Nu hylder sære palæstinensere ham, som var han en helt."
748769814336770048,2016-07-01 06:46:49,"""Vi har ikke været gode nok til at fortælle, hvad EU er"", jamrer taberne. Jo, det er netop fordi vi præcis ved, hvad EU er, at vi siger fra."
747772758583541760,2016-06-28 12:44:53,"Forstod på den modbydelige Schultz, at det nu skal være slut med det engelske sprog i EU. Hold da kæft, hvor er de dog barnagtige dernede.."
747533239921815552,2016-06-27 20:53:07,Island...!!!!!!!!!!!!
747439802358829056,2016-06-27 14:41:50,"Nu endnu et vulgært, voldeligt angreb på festende studenter - begået af indvandrerbander. Hvordan kan de dog få sig til det...!?"
747014861801021440,2016-06-26 10:33:16,"Forward England - in the European Cup - do as we Danes did in 1992: ""If you can't join them - beat them...! ""#EURO2016 #Brexit #dkpol"
746978753557966848,2016-06-26 08:09:47,Dødtræt af at høre på alle de jamrende og flæbende Europa-Unionister... Tag jer dog sammen - og se at komme i sommerhumør.
746783243295285248,2016-06-25 19:12:54,"William Pitt after the defeat of Napoleon: ""England has saved herself by her exertions, and will, as I trust, save Europe by her example.”"
746451326213709824,2016-06-24 21:13:59,"Spanien begynder nu efter Brexit igen frækt at kræve herredømme over Gibraltar. Glem det, Spanien, og hold nallerne fra Gibraltar...!"
746319645708263424,2016-06-24 12:30:44,Boris Johnson's speech in full as he reveals thoughts on David Cameron quitting https://t.co/s6Zo5wAH8K
746255812113371136,2016-06-24 08:17:05,"@BosseStine Underligt og intellektuelt fattigt, at du beskriver dine politiske modstandere som ""gale mænd""."
746199209175506944,2016-06-24 04:32:09,"Lader til, at briterne lige har reddet folkestyret - ikke alene i UK, men så sandelig også i Danmark. Tak! Three cheers for Britain!"
745695097291935744,2016-06-22 19:09:00,Dejlig reportage i DR1 om Dronningens besøg på Færøerne. Hvor kan vi da bare allesammen være stolte af den kvinde!
745676200241160192,2016-06-22 17:53:54,@KnudBrixTV2 @DanskDf1995
745675645477396480,2016-06-22 17:51:42,Ich bin ein Islænder...!!!
744952496934785026,2016-06-20 17:58:10,DR Mobil https://t.co/IyksAsLfeQ
744610979066093568,2016-06-19 19:21:06,"DR afslører fup og svindel og Sharia-hjernevask på dansk-finansierede skoler i Afghanistan. DF forlanger, at al støtte nu ophører...!"
744609610074587136,2016-06-19 19:15:39,Ny dokumentar: Svindel med antallet af elever på danskstøttede skoler i Afghanistan https://t.co/DyliGOdZ4I
743110126769479681,2016-06-15 15:57:15,Lamaen på besøg hos præsident Obama. Det kunne skiftende danske regeringer lære noget af. Herhjemme nøjes vi med at fedte for Kommunist-Kina
743009692419522560,2016-06-15 09:18:09,"Rystet over politisk motiveret overfald på @mfMorten Bødskov... Håber, du hurtigt er OK igen, Morten. Måtte politiet hurtigt fange slynglen!"
740913984421957634,2016-06-09 14:30:34,https://t.co/Pj2jCKWV5y
740496596564070400,2016-06-08 10:52:01,Said Mansour udvist for bestandig - og frataget sit danske statsborgerskab. Mit i forvejen storartede sommerhumør er blevet til sommerjubel!
740427596727488513,2016-06-08 06:17:50,"""Udmelding =Økonomisk katastrofe for UK..."", råbes der. Orkke-ja-okke-ja. Sådan advarede de også engang UK, hvis de sagde nej til euroen."
738990301537275904,2016-06-04 07:06:32,"Harald Blåtand grundlagde altså ikke 5 vikingeborge, som ""historikerne"" nu fortæller os, men 6. Den sjette ligger i det sydlige Skåne."
736874619945242624,2016-05-29 10:59:34,Herfra ønskes @alternativet_  et groovy og crazy årsmøde...!! Kærligst S https://t.co/7fL0BSU87q
735910937119580160,2016-05-26 19:10:14,"At Danmark er tvunget til at udbetale SU til studerende fra udlandet er bare endnu et af EUs mange, mange skøre påhit."
734274278045188096,2016-05-22 06:46:44,"Taliban oplyser nu, at deres leder, Mullah Mohammad Mansour Akhtar, er dræbt ved et amerikansk militært angreb. Storartet...!"
734258838896050176,2016-05-22 05:45:23,"""Vilde elefanter skal nu genindføres i DK"". ""Genindføres?!?! Sidst, de var her, var for 125.000 år siden. Hvad med at genindføre istiden""?"
733297766135435264,2016-05-19 14:06:26,DF vil gerne betale et engelskkursus for Jeppe Kofod...! Han kan bare melde sig...
733296849600323587,2016-05-19 14:02:47,@Aaenstable  du kan åbenbart heller ikke engelsk..! Hvad med et kursus
733242421983772672,2016-05-19 10:26:31,@JeppeKofod @BarackObama @ecrgroup Dear Jeppe. You KNOW that this is a lie. Please remove your tweet... Thanks S
732825699321565184,2016-05-18 06:50:36,"Fortvivlende at fornemme, at Regeringen hverken har evne, vilje eller mod til at ordne noget så simpelt som en parallelaftale med EU..."
732824209848700928,2016-05-18 06:44:41,"Grimt af @Enhedslisten at de nu vil tvinge arbejderne til at arbejde Jul, Påske, Pinse, Kr. Himmelfartsdag og St. Bededag. Solidaritet, tak!"
732702358786842624,2016-05-17 22:40:29,"Jeg forstår, at mange er blevet vrede over min anvendelse af ordet neger. Jeg er ked af, hvis jeg skulle have fornærmet. Det var ej tanken!"
732437762763296770,2016-05-17 05:09:05,Hundreder af danske mælkeproducenter er nu på randen af konkurs alene som følge af EUs dumme sanktioner mod Rusland. Det fik vi så ud af det
732123789497147392,2016-05-16 08:21:28,Så sætter Storm-P-museet en satire-udstilling op. Tema ytringsfrihed. Men uden vore verdensberømte Muhammedtegninger. Museums-Bangebukse...!
732115305254752256,2016-05-16 07:47:45,Så smuldrer allerede den skrupskøre aftale mellem EU og Tyrkiet. Selvfølgelig gør den da det. DFs anvisning: Luk Danmarks grænser permanent!
732089300142178304,2016-05-16 06:04:25,"Henriksen om Støjberg: ""Inger snakker for meget, og strammer for lidt"". 
Så sandt, Martin. Venstre skuffer!"
731014081021399040,2016-05-13 06:51:53,"Jeg forstår godt, Levakovic,, at du ikke kan undvære dine mindreårige børn, men kunne du så ikke bare tage dem med, når du snart rejser...?"
730801437953953793,2016-05-12 16:46:55,"Kære Levakovic... Du slap så fra udvisning, men det ville se pænt ud hvis du nu selv vælger at rejse. Herfra skal lyde et ""lykke på rejsen""!"
728559124607315968,2016-05-06 12:16:45,"...og nu vi er ved præsidentvalget: Er der nogen, der kan komme i tanke om, hvorfor Obama fik Nobels Fredspris og alle de dér millioner...?"
728133603335413760,2016-05-05 08:05:53,"Den nye bro ved Nyhavn skal have navnet ""Inderhavnsbroen"". Sikke da et åndssvagt navn. Hvad med H.C. Andersens Bro eller sådant noget...?"
727883575119511552,2016-05-04 15:32:22,"EUkommissær Frans Timmermann siger på tv, at UK, Irland og Danmark IKKE behøver at være en del af flygtningekvote ordningen...!"
