id,created_at,text
579039638477807616,2015-03-20 21:59:42,"Det går galt med de ulve i landet. Hvad har vi dog gang i? Den dag et barn bliver overfaldet, kommer landet vel til fornuft.... #dkpol"
578834429344391168,2015-03-20 08:24:16,"Nu sigtes 5 for at have hjulpet terroristen El-Hussein. Den så ofte brugte teori om ""1 gal mands værk"" holder ligesom ikke længere...#dkpol"
578832451826511872,2015-03-20 08:16:25,"Er der mon andre end mig derude i cyberspace, der også er træt af de dér glubske ulve, som lusker hærgende rundt i Jylland...??#dkpol"
578830864106283008,2015-03-20 08:10:06,"Hvor må grækerne dog forbande den dag, de virkelighedsfjernt tilsluttede sig den ideologiske Euro-Titanic-Sejlads....#dkpol @tv2newsdk"
578464152768876544,2015-03-19 07:52:56,"Frit og demokratisk valg i Israel - og så brokker sure Obama sig over resultatet. Han er godt nok en sær snegl, ham Obama...#dkpol"
578220756821254144,2015-03-18 15:45:45,@LotteRod @tv2newsdk Ja...!
578220578773082112,2015-03-18 15:45:03,"Ryan Air's indtog i Danmark - ny trussel mod den danske arbejdsmarkedsmodel... Ikke i tvivl om, at EU ville elske at forbyde den #dkpol"
578077979500146688,2015-03-18 06:18:25,Kommunerne penge-lokkes til at skaffe 30.000 flygtninge arbejde - så de kan tage jobs fra danske arbejdere. Mærkelig regering! @tv2newsdk
578068606094688257,2015-03-18 05:41:10,Kommunerne lokkes med penge for at skaffe 30.000 flygtninge arbejde - så de kan tage jobs fra danske arbejdere. Mærkelig regering! #dkpol
578061865932050432,2015-03-18 05:14:23,"Nu truer de så - ""et bredt flertal"" - igen danskerne med al landsens ulykker. Hvem tror på det? Glæder mig til folkeafstemningen! #dkpol"
577818746313707521,2015-03-17 13:08:19,"Løkke: ""Vil man grænseoverskridende kriminalitet til livs, skal man stemme og ellers kan man jo stemme nej...!"" Hvor pinligt!!!.... #dkpol"
577748467692519424,2015-03-17 08:29:03,"Jeg synes efterhånden det er ved at være flere måneder siden, der har været ministerrokade. Hvad sker der?? #dkpol"
577363387266527232,2015-03-16 06:58:53,"Tirsdag stemmer så den demokratiske retsstat Israel... Hvornår mon palæstinenserne stemmer? Jeg har glemt, hvornår det sidst var.. #dkpol"
576993640117104640,2015-03-15 06:29:38,"Træt af avis-hetz mod Dronningen, fordi hun -selvfølgelig..!!- benytter Forsvarets flyvende maskinel. Hun er sgu Dronningen...!!!#dkpol"
576636708189560834,2015-03-14 06:51:19,"Riskjær smidt på porten af Elbæk.... Jeg synes GODT nok, det dér hersens Alternativet virker temmelig topstyret. Puha-da-da-da-da...!#dkpol"
576474710093012992,2015-03-13 20:07:35,Forsvarschefen har ikke ret i sin antagelse om at Rusland udgør en fare for Danmark og vort riges territorium.#dkpol
576129739389300736,2015-03-12 21:16:48,Ret ubegavet af JA-partierne at foranstalte folkeafstemning om Retsforbeholdet... De taber....!
576120845862612992,2015-03-12 20:41:28,Island har meddelt at det ikke længere er ansøger til EU medlemskab Hvor jeg dog beundrer det tapre lille land! #dkpol
575948251813257216,2015-03-12 09:15:38,"1864 og 9. april... Glæder mig nu til film om vore mange, herlige militære sejre - eks: 6. juli, 1. juli, 25. juli, osv Naivt.? Tjah.."
575681445534044160,2015-03-11 15:35:26,"Handelssanktioner virker ikke. Beviser: Cuba i 50 år, Iran i 36 år. Rusland i..? år? Hvornår lærer vi det? Kun vort landbrug lider! #dkpol"
575033274491404288,2015-03-09 20:39:50,"Fint med muslimsk freds-ring omkring Synagogen - håber også nu på freds-ringe omkring Lars Vilks, Westergaard, Hedegaard  og JP #dkpol ..."
574934302095503360,2015-03-09 14:06:34,"Ikke helt sikker på, om Riskær har ansøgt hos os. Der ligger en stor bunke ansøgninger, som vi endnu ikke er nået igennem...#dkpol"
574858723031715840,2015-03-09 09:06:14,"Stor skam få kvindebevægelserne, som på kampdagen igen-igen-igen ikke turde stå op for et tusindtal af undertrykte muslimske kvinder.#dkpol"
574845433589186560,2015-03-09 08:13:26,"Spejdede forgæves efter tørklæde-kvinderne, da HTS havde inviteret til kvinde-kamp i Vega. Nå, de måtte nok ikke for deres mænd... #dkpol"
574612926818033664,2015-03-08 16:49:32,"""Vi har stadig meget, vi skal nå"", råber Helle Thorning-Schmidt og ser bidsk ud. Uha, uha - det lyder sørme da ikke rart...! #dkpol"
574550467281297408,2015-03-08 12:41:20,@YildizAkdogan Tak - og i lige måde!
574507537971736577,2015-03-08 09:50:45,"@YildizAkdogan Nej, faktisk foretrækker jeg klart brunetter. Men ingen vil jo heller, seriøst, beskylde mig for at være en gentleman!"
574504406336565248,2015-03-08 09:38:18,"@YildizAkdogan Det er på plads, Yildiz. Hun har fået farvet håret.... (!) Og er i øvrigt lige nu en tur hjemme i England, så hun ved intet.."
574479734408626176,2015-03-08 08:00:16,"Har som en markering af Kvindernes Internationale Kampdag fundet DVD'en frem med Marylyn Monroe i filmen ""Gentlemen Prefer Blondes""..."
574130511452504064,2015-03-07 08:52:35,"Hvis feminist-grupperne heller ikke i år 8/3 adresserer undertrykkelsen af de mange muslimske kvinder, bør de nedlægge sig selv #dkpol"
573867174516891650,2015-03-06 15:26:10,"Har nu læst den tre gange, men kan stadig ikke rigtig finde ud af, om jeg bryder mig om tonen i Kristian Jensens kronik..."
573778767543451649,2015-03-06 09:34:53,@liberty_dane @specht1963 Vi har aldrig haft magten.
573589181554892802,2015-03-05 21:01:32,Undervisningsministeriets Historiekanon uden tabet af Skånelandene! Mon ikke ministeriet mangler lidt historieundervisning?#dkpol
573523819618529280,2015-03-05 16:41:48,"Saudi Arabien foreslår landtropper mod IS. Hvad om de selv kom i sving? Sidst, jeg talte, havde S.A. 150.000 mand under våben! #dkpol"
573518675904479232,2015-03-05 16:21:22,Finlands statsminister spår NATO-ansøgning inden for 4 år. Og så følger Sverige med garanti trop. Nordisk forsvar... Hurra herfra! #dkpol
573398374541598720,2015-03-05 08:23:20,Et medlem af Hibz-ut-Tahrir-kulten er blevet boligforeningsformand. Så beboerne har altså stemt på kult-manden. Jeg gyser...!#dkpol
573042073642930176,2015-03-04 08:47:31,"""Ulovlig krig"" - Skørt udtryk! I mine øjne er dansk krigsdeltagelse fuldt lovlig, når Folketinget har besluttet det jvf. Grl §19.#dkpol"
572724311741607938,2015-03-03 11:44:51,"@ProvoDk Jeg svarer af princip ikke folk, som ligner Stauning."
572695673168138240,2015-03-03 09:51:03,@cekicozlem Fri - som fuglen i bur.... pip-pip
572694213281878016,2015-03-03 09:45:15,"@cekicozlem Nixen-bixen, Özlem. Kun hvis det bliver brugt fordi det regner - og man lige har fået sat håret flot hos damefrisøren..."
572692844969918464,2015-03-03 09:39:49,"@Vonrask Kun det, at puritanere er mørkemænd, selvsmagende, grinagtige og selvhøjtidelige. Ellers ingenting...."
572691863838334976,2015-03-03 09:35:55,"Håber, at ""Kvindernes Kampdag"" i år vil slå et slag for de mange indespærrede, tildækkede, undertrykte muslimske kvinder i landet #dkpol"
572691390808903680,2015-03-03 09:34:02,"Overrasket over, at der er alkohol-forbud ""i arbejdstiden"" på Ekstra-Bladet... Puritanismen breder sig til de mest uventede steder. .#dkpol"
572485533693300736,2015-03-02 19:56:02,Hurra for aftale om omfattende dansk-svensk militært samarbejde!
572398997249380352,2015-03-02 14:12:10,"Irak/Afghanistan Komissionen har indtil nu kostet 13 mio, og der er ikke fortaget en eneste afhøring.... Bare vent til de begynder! #dkpol"
572099897610137600,2015-03-01 18:23:39,"@Aarestrup71 Jamen svenske journalister er, som det fremgår af min blog, jo netop IKKE journalister, men propagandister... Læs igen!"
572002875204882433,2015-03-01 11:58:07,"@AsgerMan1 Hurra! Og forresten var jeg også i Søværnet, så vi er en slags kolleger. Jamen det er da mageløst !"
571993776950018048,2015-03-01 11:21:58,"@AsgerMan1 Randers Amtsavis Halvandet år, BT i 8 år, 4 år i England, 3 år på BB, 10 år pressechef, 10 år MF og DIN karriere?"
571985388543328256,2015-03-01 10:48:38,"I de gode gamle dage (dengang far her var med!) ville vi journalister have stået sammen, når nogen forsøgte at boykotte et medie...#dkpol"
571984420640587777,2015-03-01 10:44:47,"@Aarestrup71 OK, Steffen Aarestrup... hvilke journalister er det, du har i tankerne, som jeg skulle have afvist at tale med??"
571947392779595776,2015-03-01 08:17:39,"Saudi-Arabiens ambassadør bør meddeles, at han er uønsket i Danmark. Det vil være en passende reaktion på hans hospitals-arrogance #dkpol"
571672319111897088,2015-02-28 14:04:36,@KristofferMiles Duer ikke! I gamle dage ville journalister have stået sammen
571671993772331009,2015-02-28 14:03:19,@Aarestrup71 Vrøvl. Jeg taler med ALLE journalister på Christiansborg...
571645318409940992,2015-02-28 12:17:19,"JP forment adgang til Hizb-ut-Tahrir-pressemøde. Usselt, at de andre mediers journalister så ikke boykottede mødet...! #dkpol  #dkmedier"
571622202543611905,2015-02-28 10:45:27,"@YildizAkdogan Prioritet, i hvert fald! Alle hylder jo for tiden landets ytringsfrihed, men her har vi noget censur, vi skal have afskaffet."
571586058850312192,2015-02-28 08:21:50,"""Regeringen redder blasfemiparagraffen"", lød overskrifterne. Jah..., men lad os nu lige se, hvor længe dén redning holder... #dkpol"
571284905713401856,2015-02-27 12:25:10,"Endnu en person anholdt i forbindelse med Kbh-terror. Det lader til, at ""den ensomme ulv"" nok alligevel ikke var SÅ ensom...#dkpol"
571252954826706944,2015-02-27 10:18:12,Irak/Afgh-kommissionen er i lal og opløsning. Uskønt at bivåne. Alle griner vi højlydt. Dog ikke over pengespildet. Stop farcen nu! #dkpol
571208915679125504,2015-02-27 07:23:12,"Super, at et FT-flertal nu vil forbyde indrejse for hadefulde volds-mullaher. Men hvordan forhindre det uden grænsekontrol???#dkpol"
571186513834344448,2015-02-27 05:54:11,"Norge fængsler volds-pervers mullah. Hurra...! Hvad venter Danmark på?: Fat i kravetøjet på ""vores"", og i spjældet med hele banden #dkpol"
570834581693329408,2015-02-26 06:35:44,"""Mente Helle det mon, da hun fældede tårer...?"" Det spørgsmål florerer angiveligt på de sociale medier. Hvor usselt! Hvor uværdigt! #dkpol"
570616379608588288,2015-02-25 16:08:41,Hvorfor skal højt betalte professionelle fodboldspillere egentlig have penge for at spille for Landsholdet? Burde være en ære! #dkpol #DBU
570533192526139392,2015-02-25 10:38:07,"RT @flydtkjaer: S indrømmer, at forslag om dyresex er pga. DF-kampagne. Kan vi også overtale S til grænsekontrol? #dkpol http://t.co/aFSSXQ…"
569769503485243392,2015-02-23 08:03:30,"Min kone og jeg skændes helt vildt her til morgen. Det væsentlige emne: Hvad skal vi bruge de 315 mio. til...., som vi ikke har vundet?"
569762994453938176,2015-02-23 07:37:38,"""Vi skal omfavne alle religioner"", kræver USA's ambassadør. Og vi krammer Scientology, Manson-kulten, Islamisk Stat, Hizb-ut-Tahrir #dkpol"
569421287636004864,2015-02-22 08:59:48,Forfatter Jakob Skyggebjerg håner i Politiken den opreklamerede ytringsfrihed. Han har da ej heller gjort stort inden for sin metier.#dkpol
569086510257053697,2015-02-21 10:49:31,"Torben Lund (S) bekræfter i dag på facebook det, jeg længe har ment, at han er: En fuldblods jødehader. Hvad siger Statsministeren?? #dkpol"
569068750844104704,2015-02-21 09:38:57,"Yahir Hassan ""forstår godt gerningsmanden""(dobbeltmorder-terroristen). Herfra: Færdig med Yahir...!#dkpol @tv2newsdk"
569058197455147008,2015-02-21 08:57:01,Engelsksprogede uddannelser? Spørgsmål: Er danske lærere -generelt- sprogligt dygtige nok til at undervise på engelsk?#dkpol @tv2newsdk
569052887990571008,2015-02-21 08:35:55,"Tankevækkende, at Lars Vilks ikke var inviteret som taler til én eneste af landets højtideligheder for dobbeltmordet... #dkpol @tv2newsdk"
568804180883861505,2015-02-20 16:07:39,700 sørgende med ved dobbeltmorderens begravelse. Man tror det er løgn...
568744716034019328,2015-02-20 12:11:21,Forkromet 12-punkt terrorplan fra Regeringen. Ikke fem flade øre sat af til beskyttelsen af Synagogen og Carolineskolen. Nyt svigt! #dkpol
568691933557751808,2015-02-20 08:41:37,"Nyt fra Sveriges Ornitologiske Forening: ""Negerfinken"" skifter navn til ""Nigrita"" og ""Sigøjnerfuglen"" til ""Hoatzin""... #dkpol @tv2newsdk"
568685441366532097,2015-02-20 08:15:49,"Spritnye tal: 127.000 fremmede strømmede ind i Sverige i 2014.... Stakkels, stakkels Sverige!"
568661928647778304,2015-02-20 06:42:23,"På tide, at jødehad-prædikanten Hajj Saed fra Hibz-ut-Tahir bliver smidt på porten, og at hans usle forening forbydes. #dkpol @tv2newsdk"
568287779978940416,2015-02-19 05:55:39,"Naser Khader forlanger danske soldater på jorden i Syrien... Den ide kan du ligeså godt glemme med det samme, Naser. #dkpol @tv2newsdk"
568163542765047810,2015-02-18 21:41:59,Gør som Frankrig: Sørge for at terroristen begraves på et hemmeligt sted. Vi vil ikke ha et islamistisk pilgrimssted #dkpol @tv2newsdk
567987416830746624,2015-02-18 10:02:07,@Dahldebat @naserkhaderdk @tv2newsdk Min kone er også indvandrer...
567940765365768192,2015-02-18 06:56:44,"Glæder mig over, at @naserkhaderdk vender tilbage til Borgen. Nasers tilbagekomst vil styrke det borgerlige Danmark #dkpol @tv2newsdk"
567572561664704512,2015-02-17 06:33:38,"Bjørn Elmquist: ""El-Hussein er ikke-skyldig, fordi han er skudt og dermed ikke er dømt...!"" Hvornår holder Bjørn mon op med at lege? #dkpol"
567415353538777089,2015-02-16 20:08:57,Meget glad for arrangementet på Østerbro til aften! #dkpol @tv2newsdk
566917370770620416,2015-02-15 11:10:08,Tak til Statsministeren for gode ord ved Synagogen! #dkpol @tv2newsdk
566511245667627008,2015-02-14 08:16:20,"Jon Stewart.. Politiken beskriver ham som ""amerikansk jøde"". Hvad rager det egentlig os - og nogen -, at han er jøde!? #dkpol #politiken"
566253163620343808,2015-02-13 15:10:49,"Nu over TI år siden, at Abbas fik magten i ""Palæstina"". Siden intet valg. Nyt usselt diktatur har set dagens lys i Mellemøsten! #dkpol"
566227738949062656,2015-02-13 13:29:47,Engelsk-sprogede uddannelser? Men har danske faglærere mon overhovedet de nødvendige engelsk-kundskaber til en sådan undervisning? #dkpol
565508412063375360,2015-02-11 13:51:26,"Udenrigsmin.: ""Verbalnoten til Kina blev til for at forbedre menneskerettighederne"". Ja, han er sjov, ham Martin..  Ha-ha-ha...(!).#dkpol"
564740568958631937,2015-02-09 11:00:18,"EU's ledere taler nu grænsekontrol mellem EU-landene.... Men: Var der ikke noget med, at den ikke virker?.. Eller hvad? #dkpol @tv2newsdk"
564321364845531137,2015-02-08 07:14:32,"Churchill talte om ""en pagt med djævelen"" - og mente Stalin. I dag betyder en ""pagt med djævelen"" Assad. Begge dele en nødvendighed! #dkpol"
563999471886151680,2015-02-07 09:55:27,"Fabelagtigt, hvis det i Moskva virkelig er lykkedes for Merkel/Hollande...! Stor ros til de to for utrættelig indsats.. ! #dkpol @tv2newsdk"
563366469556531200,2015-02-05 16:00:07,"@karenclement hørte først nu.... ak, ja BNB er altid foran. Hvorfor ringede du ikke bare til mig, så får du jo altid svar..."
563362882805846016,2015-02-05 15:45:52,Mugabe valgt til formand for Den Afrikanske Union (...!) Hvad bliver det næste: Nobels Fredspris? Generalsekretær for FN? #dkpol @tv2newsdk
563059565118640129,2015-02-04 19:40:36,V-kandidat Traberg-Schmidt mener Støjberg hører hjemme i DF. Flottere kompliment kunne Inger vist ikke ha drømt om! #dkpol @tv2newsdk
562498814503034880,2015-02-03 06:32:22,I gamle dage blev der altså ryddet for sne på jernbanestationerne. Det sker aldrig længere. Elendig kundeservice #dkpol @tv2newsdk
562328538343538688,2015-02-02 19:15:45,Har hørt rygter om at nogle af Enhedslistens medlemmer går ind for revolution. Hvornår blir de mon ekskluderet? #dkpol @tv2newsdk
562154673386569729,2015-02-02 07:44:53,"Skole-valget cementerede rygterne om, at unge siger nej til Enh., som nu er blevet partiet for gamle mennesker... interessant! #dkpol"
561810545582829569,2015-02-01 08:57:26,"For 6 måneder siden: Tariq Mahmood, Hvidovre, anmeldt for fb-gruppen ""Død over Jøderne"". Hvorfor er han stadig på fri fod...? #dkpol"
561517693208367104,2015-01-31 13:33:45,"Ægypten har nu - som Danmark, EU og USA - har sat Hamas på terrorlisten. Hvornår gør den ""moderate"" Abbas det samme?...#dkpol @tv2newsdk"
561460003509649408,2015-01-31 09:44:30,"Papes angreb på Løkke bringer i erindring den gamle sentens: ""Forholdet mellem V og K er had/kærlighed - uden kærlighed!"" #dkpol @tv2newsdk"
560319427020083201,2015-01-28 06:12:16,"Ubegavet af S at ""genoptage"" Thorning/Kinnocks skattesag. Nu hvirvles så det hele op igen.. Var det mon det, Helle ville? #dkpol @tv2newsdk"
559985142748704768,2015-01-27 08:03:56,"Uanset hvor megen henstand, Grækenland får , vil landet aldrig komme på fode - førend de på ny indfører deres egen valuta #dkpol @tv2newsdk"
559699130495549441,2015-01-26 13:07:26,"Det dummeste, EU samt kålhøgne danske politikere kan gøre nu, er at blive ved med at lege skolemester overfor Grækenland.#dkpol @tv2newsdk"
559446745730801664,2015-01-25 20:24:32,"Lykketoft siger at ""Euroen var en fejlkonstruktion "" Hvorfor sagde han ikke det dengang i år 2000? @tv2newsdk #dkpol"
559402771343245312,2015-01-25 17:29:48,"Grækerne bliver langt bedre stillet med deres egen valuta. Euroen er om nogle år en saga blott, og godt det samme! @tv2newsdk #dkpol"
558913700120522752,2015-01-24 09:06:24,Tænk hvis vi stillede ultimative krav som: Hvis håndværkerfradraget ikke genindføres vil vi ikke støtte Løkke som statsminister #dkpol
558901507580780545,2015-01-24 08:17:57,"De kyniske kræfter, som nådesløst indførte Euroen, har ene-ansvaret for økonomisk drama i Grækenland, Spanien og Italien #dkpol @tv2newsdk"
558536565941874688,2015-01-23 08:07:49,"Mon der stadig er enkelte støvede typer derude, som stadig synes, at afskaffelse af grænsekontrollen var en god idé....?? #dkpol @tv2newsdk"
558492383260975104,2015-01-23 05:12:15,"Markeringen i Polen af 70-års dagen for befrielsen af Auschwitz bliver uden russisk deltagelse. Putin erklæret ""uønsket"". Galt... ! #dkpol"
558182689581592576,2015-01-22 08:41:38,"""Jeg stak en nødløgn dengang"", siger anti-opstandelses-pastor Per Ramsdal nu. Gad vidst, om denne nye udtalelse måske er en nødløgn? #dkpol"
557066637585940480,2015-01-19 06:46:50,"Chokerende for folkestyret, at Pediga må aflyse demo fordi politiet ikke agter at forsvare den mod AFA's voldsmænd. #dkpol @tv2newsdk"
556410599392165888,2015-01-17 11:19:59,"På tide, at Regeringen åbner for at danske kampfly kan operere frit såvel i Irak som i Syrien... Nuværende restriktion er latterlig #dkpol"
556376714499358720,2015-01-17 09:05:20,"Unge i Jesus-Kulter fik fjernet Biblen, når man de-briefede dem. Sådan bør man fjerne Koranen fra muslim-radikaliserede fanger #dkpol"
556072841624690688,2015-01-16 12:57:51,"Berlingske ""afslører"", at DF er et stærkt, velorganiseret parti. Det samme har ca.100 avisartikler tidligere ""afsløret"". Vi tilstår! #dkpol"
556056667033702400,2015-01-16 11:53:35,@JesperVangkilde Ikke enig! Kun en DEL af islamisk kultur skal ud - nemlig islamismen. Muslimerne må selv i høj grad tage fat på det projekt
555995917078503424,2015-01-16 07:52:11,"Det får mig altid til at kluk-le,  når folketingsmedlemmer fra Enhedslisten advarer imod ekstremisme..."
555386996357873664,2015-01-14 15:32:33,Tyrkiet forbyder websites med Charlie Hebdo-forside... NATO-kulturværdier?Kommende EU-land..? #dkaid @tv2newsdk
555090534487048193,2015-01-13 19:54:31,Fatwa mod snemænd i Saudi-Arabien... Ha ha ha ha ha....
555012838734196736,2015-01-13 14:45:47,"Norsk politi indbyder landets chefredaktører til møde om, hvorvidt sikkerheden er tilstrækkelig. Hvad sker der herhjemme? #dkpol @tv2newsdk"
554939665258934272,2015-01-13 09:55:01,"Pøj-pøj til håndboldherrerne. Synd, at de pæne folk må finde sig i at spille i Qatar - det modbydelige islamist-land. #dkpol @tv2newsdk"
554695215576260608,2015-01-12 17:43:39,"Hvad Frankrig og Vesten nu lider under, har i årtier været dagligdag i Israel. #dkpol @tv2newsdk"
554370233335820289,2015-01-11 20:12:17,7.000 jøder flygtede fra jødehadet i Frankrig til Israel i 2014. I år skønnes flugten at nå mindst det dobbelte... #dkpol @tv2newsdk
554329390168170496,2015-01-11 17:30:00,"Je suis Charlie, Jyllandsposten, Kurt Westergaard, Lars Vilks et Dan Park...! #dkpol  @tv2newsdk"
554313569349951489,2015-01-11 16:27:08,"Mette Frederiksen vil indføre ""intelligent grænsekontrol""... Sikke da en god ide. Den er vi med på! #dkpol @tv2newsdk"
554195107860463616,2015-01-11 08:36:24,"Alexandra-penge: Har tillid til, at Dronningen suverænt afgør, hvem der skal have apanage - og hvor stort et beløb...! #dkpol @tv2newsdk"
554192842311335936,2015-01-11 08:27:24,"Hvis DU ""er Charlie"", så tegn eller fornærm profeten Muhammed - ellers bør du ikke smykke dig med de fra kunstnerne lånte fjer.#dkpol"
553847454672891904,2015-01-10 09:34:57,"Dødtræt af at høre om islam, islamisme, jihad, koranen, sharia, moskéer... det fylder alt! Trættende, trættende, trættende...! #dkpol"
553313006516731904,2015-01-08 22:11:15,Samuelsens forslag om at Statsministeren indkalder alle partiledere til krisemøde om ekstremistisk islam er et godt forslag #dkpol
553184702082056192,2015-01-08 13:41:25,"Jeg ser, at Frankrig har lukket sine grænser. Hvad skal det nu til for, når det er alment kendt, at grænsekontrol ikke virker...? #dkpol"
553132411286855680,2015-01-08 10:13:38,"""Dagbladet Arbejderen""s journalistiske dækning af terrorangrebet i Paris: En notits på side 7 - fem linjer...! #dkpol @tv2newsdk"
552852607543541760,2015-01-07 15:41:47,"Per Clausen, - synes du, at kunstnerne på Charlie Hebdo er nogle narre...?"
552799780523769856,2015-01-07 12:11:52,"CharlieHebdo: alle fordømmer islamist-terroren, men det ender som det altid ender: Hændervriden og bortforklaringer @tv2breaking #dkpol"
552441966429241344,2015-01-06 12:30:03,"Helle, hvis du nu ikke længere skulle lade som om - hvor ville du så bo? London? Wales? Bruxelles? Eller i Ishøj?? #dkpol #tv2news"
552354567984529409,2015-01-06 06:42:45,Støtter Bertel Haarders forslag om nedsættelse af en nordisk forsvarskommission! #dkpol #tv2news
552094789647478784,2015-01-05 13:30:29,"Helle med EU-drømme: ""Jeg er af hjertet europæer!"". Nu - med fornyede statsministerdrømme - er hun vist blevet dansker...  #dkpol #tv2news"
551681547808804864,2015-01-04 10:08:25,"Lykkeligt for Grækenland, hvis landet kan befries for euroen, og atter får egen valuta. Turister vil strømme til, og eksporten øges #dkpol"
551306567103311872,2015-01-03 09:18:23,"Kom så med ""1864 - II""? Kunne da være fedt, om vi bankede tyskerne, så vi fik Danmark til Ejderen. Og fiktion er jo lige Ole..!. #dkpol"
550936972886564864,2015-01-02 08:49:44,"Efterlyses: En Helle Thorning-Schmidt-tale, hvor hun IKKE nævner, at hun voksede op på Vestegnen... #tv2news #dkpol"
550351470160543744,2014-12-31 18:03:10,"""Gør jer umage"", sagde Dronningen til skolebørnene... Herligt at høre den vending blive brugt. Har ikke hørt den i årtier! #dkpol #tv2014"
548803613028790272,2014-12-27 11:32:32,"@DavidTrads næh, David, du må selv igang. Men der er masser af guldkorn fra Espersens skattekiste!! S"
548798246085472256,2014-12-27 11:11:12,@DavidTrads Jeg vil gerne på listen. Er det mon muligt? VH S Espersen
548797178203078656,2014-12-27 11:06:58,Sveriges demokrati vakler dramatisk... Lovene ændres af ren frygt for SD. Udsat valg = Udsat SD-sejr! #dkpol #tv2news #DR
548587008084697088,2014-12-26 21:11:49,"Sveriges grænser er ""opfundne"", siger Reinfeldt. Den slyngel! Titusinder af svenske soldater har givet deres liv for de grænser!! #dkpol"
548394820507811841,2014-12-26 08:28:08,"De kongeliges økonomi? Jeg har det fint med, at Dronningen dels beslutter apanagens størrelse - og dels hvem, der skal have den. #dkpol"
548183622579421184,2014-12-25 18:28:55,"Dansk udenrigspolitisk logik: Rusland tager Krim og bliver sanktioneret, Kommunist-Kina tager Tibet og bliver kælet for... #dkpol"
547320652299255809,2014-12-23 09:19:46,"""Topchefer frygter DF indflydelse"", skriver Berl. Endnu et trist bevis for, at erhvervsfolk ofte sætter egen profit over fædrelandet.#dkpol"
546945123343667200,2014-12-22 08:27:33,"S-kandidater bekriger hinanden, og har ""forbud"" mod at være i andres kredse. I DF er vi fri for skøre regler. Vi arbejder sammen! #dkpol"
546718374521483265,2014-12-21 17:26:32,"Kina erklærer sig klar til økonomisk at hjælpe Rusland igennem krisen. Superfarlig alliance-udvikling. Vist ikke det, vi ville... #dkpol"
545996315281207297,2014-12-19 17:37:20,Ham her islamistgutten må de gerne kyle ud af Danmark...24syv Morgen 08.05 15-12-2014 (3) fra @radio24syv http://t.co/gM3zrHtM60
545213781455159297,2014-12-17 13:47:49,Hurra for anklagemyndighedens anke: den kedelige fætter til Said Mansour gider vi da overhovedet ikke ha som landsmand... #dkpol
545108015935148034,2014-12-17 06:47:33,"Fedt, at elgene nu sættes ud i Danmarks natur - så får ulvene mad..."
544167830187687936,2014-12-14 16:31:35,"Glubsk hund får lyst til rådyr-steg, indfanges og skydes...! / Glubsk ulv får lyst til rådyr-steg, fredes og hygges om...! Øhh...! #dkpol"
543863471004459008,2014-12-13 20:22:10,"Russerne chikanerer civile fly omkring Danmark... På tide, at Udenrigsministeren indkalder den russiske ambassadør til spanking.. #dkpol"
543733055333351425,2014-12-13 11:43:57,"Bornedal: ""1864 var blot fiktion...."" Men, Bornedal, hvorfor lod du så ikke danskerne vinde?? Sikke glade, vi alle så var blevet... #dkpol"
