id,created_at,text
657632261026746369,2015-10-23 18:58:43,Sverige beder nu EU om økonomisk hjælp til flygtningene! Hvem havde forestillet sig det..? En nordisk økonomi i frit fald. .#dkpol
657157196170567681,2015-10-22 11:30:59,"Rolig nu, Mit tweet handler UDELUKKENDE om 200.000 migranter i Sverige i år - og at myndighederne ikke længere kan håndtere situationen."
657145840474169344,2015-10-22 10:45:52,"Jeg ynker ikke svenske vælgere for dette kaos, for de er medskyldige. Også de må nu sande, at ""et folk har de tyranner, det fortjener"""
656523494533021696,2015-10-20 17:32:53,Glæder mig over Regeringens stramninger på udlændingeområdet. Nu begynder det at køre i DFs retning.... Og der er mere i vente #dkpol
656120261499068416,2015-10-19 14:50:35,"@BosseStine Og hvor er det så, Bosse, at jeg i min artikel anfører, at jeg er vild med Putin...? Jeg kalder ham i artiklen for en slyngel..."
656084895022870528,2015-10-19 12:30:03,DF langer ud efter Prins Henrik: End ikke Dronningen vil høre om din konge-snak http://t.co/csb556NBRM
656080348858728448,2015-10-19 12:11:59,"""Vestager afviser ikke statsministerposten"", skriver http://t.co/PkM2Y9UyEd .. Trusler hører ikke hjemme i den offentlige debat! #dkpol"
655671307938484224,2015-10-18 09:06:36,Obama og Putin bliver nu piskende nødt til at mødes - med henblik på at indlede en tæt alliance i kampen mod Islamisk Stat #dkpol
655283557506641920,2015-10-17 07:25:49,"Grønland har en ""forsoningskommission"". Nu vil de også have en ""forfatningskommission"". Hvad med i stedet at løse landets problemer?#dkpol"
654966711695839232,2015-10-16 10:26:47,"9.000 migranter har i Sverige fået at vide, at de skal udsendes. 70% af dem er nu forsvundet. Dén havde jeg ikke lige set komme...!#dkpol"
654681866990063617,2015-10-15 15:34:55,"Statsminister Löfven: ""Der er grænser for, hvor mange flygtninge Sverige kan tage"" Hov-hov... Lyder det ikke som en racistisk udtalelse.?"
653479347093901312,2015-10-12 07:56:32,Kvinder stiller nu op til parlamentsvalget i Saudi-Arabien. Valgplakaterne siges at være noget ensformige...
653094735528218624,2015-10-11 06:28:13,"JP oplyser søndag, at 77 procent af danske muslimer mener, at Koranens anvisninger skal følges fuldt ud. Føj, da...! #dkpol"
652919042450309120,2015-10-10 18:50:05,"Nikolaj Villumsen fra Enh. VED allerede, at det er den tyrkiske regering står bag terror i Ankara. Imponerende, hvad den mand ved ! #dkpol"
652789831790149632,2015-10-10 10:16:38,"Det er da herligt, når kunstnere udtaler sig politisk - man bør bare tillægge deres udsagn præcis samme vægt som alle andres #dkpol"
652738381101834240,2015-10-10 06:52:12,Var ved Ungarns grænse til Kroatien: 7.000 nye migranter pr dag - 210.000 pr. måned. Vanvid! Europa er ved at blive løbet over ende.#dkpol
652429231381684224,2015-10-09 10:23:44,Jubel over at Merkel IKKE som spået fik Fredsprisen. Hun har kastet Europa ud i den største folkevandringskatastrofe i moderne tid.#dkpol
651991426960592897,2015-10-08 05:24:04,"MF Martin Henriksen og jeg er p.t. I Ungarn, hvor vi har møder med Regering og Parlament inden vi besøger migrant-lejre og grænser. #dkpol"
651287024847204352,2015-10-06 06:45:01,"Så er dagen, hvor vi igen-igen-igen skal opleve Enhedslistens barnagtige fornærmelse af Statsoverhovedet - og dermed af Folkestyret. #dkpol"
650583675030085632,2015-10-04 08:10:10,Følger i spænding EU-udviklingen hos de britiske Tories. I den kreds afgøres måske også naturen af Danmarks fortsatte EU-medlemskab. #dkpol
650204528353148928,2015-10-03 07:03:34,"ENDELIG er det ved at gå op for andre end DF i hvor høj grad, det officielle Danmark i årevis har fedtet for kommunist-kineserne...#dkpol"
650187399532814336,2015-10-03 05:55:30,"Naturstyrelsen havde indkaldt krise-psykologer til medarbejderne, da det stod klart, at styrelsen skulle flytte til provinsen (....!)"
649928949250813952,2015-10-02 12:48:31,Hyppige palæstinensiske terror-angreb på jøder rapporteres ikke i danske medier: Det er da noget mærkeligt noget... http://t.co/vAqyJmi12j
649825698308296704,2015-10-02 05:58:14,Kbh's biskops præste-udsending klippede snoren til den shiitiske stormoské (...!). Mon ikke de begge har drukket lidt for megen altervin?
648956553513537536,2015-09-29 20:24:34,TV2 nyhederne kl 22 bragte Muhammed-tegningerne her til aften modig journalistik Tak og hurra ...! #dkpol
648753215924793344,2015-09-29 06:56:34,"Politiet siger til JP, at de tog Tibet-flagene fra demonstranterne for at ""beskytte dem mod kineserne..."" Ha-ha-ha-ha-ha... #dkpol"
648750246009380864,2015-09-29 06:44:46,"Træt af aviser, som i 10-års artiklerne anfører ""Her burde Muhammed-tegningen have været...!"" Hvad med at træde i karakter... #dkpol"
648747055008104448,2015-09-29 06:32:05,"Restaurant ""Fiat"" på Kgs. Nytorv nægter Fl. Rose og Hedegaard adgang. Sådant et sted gider da ingen ordentlige mennesker fremover at komme."
648494704955408384,2015-09-28 13:49:20,Obama og Putin siges at have fundet sammen i kampen i Syrien mod Islamisk Stat. Det er en lykkelig udvikling - og på tide...!#dkpol
648037059421147136,2015-09-27 07:30:49,"Lykkeligt, at vi under Muhammed-Krisen for 10 år siden havde Anders Fogh som STM - mens tøsedrenge og vindbøjtler vendte ryggen til. #dkpol"
647667607559098368,2015-09-26 07:02:45,Rød svensk regering indfører skattestigninger. De borgerlige stemmer for. Alene for at holde Sverigedemokraterna ude. Ha-Ha-Ha.... #dkpol
647028860740075520,2015-09-24 12:44:36,To grønlændere blev anholdt ved Aalborg fordi de gik på motorvejen. Men syrere og afrikanere må godt. Jeg forstår ikke noget mere... #dkpol
646438001728425984,2015-09-22 21:36:44,"EU indfører pistol-diplomati med tvangsudskrivelse af flygtningekvoter til 4 EU-Lande, som ikke vil finde sig i det . Føj...! #dkpol"
646308376461320192,2015-09-22 13:01:39,"Norge har nu indført grænsekontrol... De må da vist være meget dumme, de nordmænd, når alle nu VED, at grænsekontrol ikke virker...! #dkpol"
645144273860624385,2015-09-19 07:55:55,Klar til kæmpe jubilæumsfest i Dansk Folkeparti i Boxen i Herning http://t.co/p9hyMslVcG
644861691210166272,2015-09-18 13:13:02,Klaus Pagh i BT: Jeg giftede mig med en kvinde fra Orienten... Hun er ikke som de danske kvinder Hun er meget mere serviceminded....!
644770529514274816,2015-09-18 07:10:48,"Hurra for Sverigedemokraterna, som nu støttes af en tredjedel af svenskerne. Partiet er det bedste værn mod alvorlig uro i landet.#dkpol"
644493216125972480,2015-09-17 12:48:51,Så lavede Løkke og Støjberg flygtningepolitik med de røde. 1.000 nye flygtninge. Kan vise sig at være en uklog beslutning... #dkpol
644127987999342592,2015-09-16 12:37:34,"""Flådestation Grønnedal er et vidunderligt sted med alle faciliteter"" http://t.co/V8Wx5eLT5y"
644117379241390080,2015-09-16 11:55:24,"Tyrkere og kurdere slås lige nu i Stockholms gader... Utroligt, at vi i Norden skal blandes ind i deres århundredgamle konflikter #dkpol"
644083708220305408,2015-09-16 09:41:37,"Libanons undervisningsminister Elias Bousaab: ""Rundt regnet 2 ud af 100 flygtninge ind i Europa er sendt af sted af Islamisk Stat""#dkpol"
644083096862769152,2015-09-16 09:39:11,"Tak til Ungarn, fordi landet gør sin pligt: At bevogte og beskytte Schengen-landenes grænser #dkpol"
644082730813255680,2015-09-16 09:37:44,Hvornår har TV2 og DR egentlig sidst lavet gallashow med indsamling til fordel for danske hjemløse og mindrebemidlede? #dkpol
644073518095826944,2015-09-16 09:01:07,"Markerer lige FNs demokratidag sammen med medlemmer af FNs menneskerettighedsråd: Saudi Arabien, Qatar, Kina, Algier og Venezuela.. #dkpol"
643433236585148416,2015-09-14 14:36:52,@BosseStine Så altså - bare lige for at forstå det rigtigt: Man må gerne overtræde konventioner og regler - bare man mener det samme som dig
643431306374868992,2015-09-14 14:29:12,"Ham, der fandt på åbne grænser og ham, der fandt på Euroen - de må da gå rundt med kronisk dårlig samvittighed samt postkasse-røde øren..."
643337566423502848,2015-09-14 08:16:43,"@BosseStine Det er da ikke mig, overtræder alle regler og konventioner - som Schengen og Dublin... Det er Merkel. Kan dine ører klare det?"
643085240706158592,2015-09-13 15:34:03,"Så har Tyskland genindført grænsekontrol. Hvorfor er det, at Løkke og Pind tøver og tøver og tøver? #dkpol"
643081282847698944,2015-09-13 15:18:20,"DF indkalder nu Søren Pind i samråd. Han må forklare, hvorfor det sejler mellem Politiet og ham Og hvorfor vi har lovløshed i landet #dkpol"
643028879435767809,2015-09-13 11:50:06,"Nå, nu vil Politiet så igen oplyse antallet af indstrømmende... Hold da op, hvor det sejler mellem Justitsministeren og Politiet...#dkpol"
642770096558075905,2015-09-12 18:41:47,"Politiet vil fremover ikke offentliggøre tal på indstrømmende. Gad vidst om det er fordi, der er ganske få eller rigtigt mange? #dkpol"
642323875842367488,2015-09-11 13:08:40,"Saudi-Arabien har - ifølge Ritzau - netop tilbudt at bygge 200 moskeer i Tyskland. Det synes jeg da, er pænt af Saudi-Arabien... ! #dkpol"
642279162649161728,2015-09-11 10:11:00,"Kunne være interessant at undersøge, om der overhovedet findes et menneske i Mellemøsten, som ikke har familie i Sverige... #dkpol"
642266202488897537,2015-09-11 09:19:30,Merkel er med sine konventionsbrud ved at ødelægge Europa. Og vor egen regering ved hverken ud eller ind. Få nu lukket de grænser. #dkpol
642233913109254144,2015-09-11 07:11:11,"@BosseStine @lukasballin Ja - lige indtil de 3 mdr. efter har fået opholdstilladelse i Rumænien og Bulgarien, så kan de rejse til Danmark"
642232340379516929,2015-09-11 07:04:56,Samtlige EU-lande bør øjeblikkeligt genindføre streng grænsekontrol. Og Danmark må gå forrest i dette helt nødvendige tiltag.#dkpol
642003407532916736,2015-09-10 15:55:14,Lovløsheden hersker i Danmark Hvor er sheriffen?
641574308519800832,2015-09-09 11:30:09,"Merkel kræver bindende flygtningekvoter uden øvre loft...! Ser i dén grad frem til, at danskerne stemmer ""nej tak"" den 3. december.#dkpol"
641517334126067712,2015-09-09 07:43:45,"Sveriges statsminister indkalder Riksdagens partiledere til krisemøde fredag. 3. største parti, Sverigedemokraterna, er ikke inviteret..."
641509559740309504,2015-09-09 07:12:52,"Flygtninge fortæller åbent, at de præcist ved, hvor de vil hen, når de er ude af Syrien. Accepterer vi nu bare Asyl-Shopping?#dkpol"
641216818296786944,2015-09-08 11:49:37,"DR orienterer om et nyt forsøg, som skal fastslå, om god nattesøvn har en positiv effekt for studerende. Vildt spændt på resultatet...!"
641167558863888384,2015-09-08 08:33:53,"BT viser en træls karl, som står på broen over E47, og spytter ned på de vandrende migranter. Han skulle da i dén grad skamme sig..#dkpol"
640979239303577600,2015-09-07 20:05:34,"Daily Express citerer ISIL for, at gruppen nu har smuglet i hundredvis af krigere ind i Europa blandt uskyldige tilstrømmende #dkpol"
640948647828582401,2015-09-07 18:04:00,De tilstrømmende siges at gå på motorvejen Man må altså ikke gå på motorveje....! #dkpol
640787869355872256,2015-09-07 07:25:07,"""Der er en ny sherif i byen"", proklamerede Søren Pind efter sin udnævnelse. Hvad om sheriffen nu gør sin pligt og sikrer grænserne! #dkpol"
640072582558052352,2015-09-05 08:02:50,.... og når Angela Merkel så har åbnet grænserne for 1 million migranter - er hun mon så også klar til at tage de næste millioner...?#dkpol
640046380015353856,2015-09-05 06:18:43,"Søren Espersen i Berlingske Tidende: ""Selvfølgelig skal Europa være et fort"" http://t.co/Yrl1iaOU6K #dkpol"
639905710487248896,2015-09-04 20:59:44,Palæstinensisk skuespil....uge efter uge. Utroligt som verdensopinionen falder for det.... uge efter uge... http://t.co/bWCSn3oJLN #dkpol
639808507504664577,2015-09-04 14:33:29,"3 danskere har FN topposter. Nr. 4 er på vej. Og så siger alle de mavesure, at Danmark har et ""dårligt image"" ude i verden... #dkpol"
639783005804961792,2015-09-04 12:52:09,10 får revet ihjel af ulve i Jylland. Næste gang et barn eller en svagelig medborger? Det hér går simpelthen ikke længere.#dkpol
639461410855067648,2015-09-03 15:34:15,"Forskere på Yale oplyser, at der er 4 billioner træer på Jorden. Virkelig nyttig viden, vi har gået og sukket efter. Nå, nu ved vi det så..!"
639056117277007872,2015-09-02 12:43:46,"Finansminister Claus Hjort Frederiksen vil med i EUROen.... Keep on dreaming, Claus...!"
638619015737384960,2015-09-01 07:46:52,"Ret fjoget, at Kræftens Bekæmpelse udnævner Anti-Ryge-Ambassadører, som ryger... Hvem blir den næste? Dronningen? #dkpol"
638617855660019712,2015-09-01 07:42:16,@MortenGrubert DDR spærrede folk inde. Ungarn forsvarer sine grænser
638606105703251968,2015-09-01 06:55:34,"Guldet, som nazisterne stjal fra jøderne, inden de myrdede dem, og som nu er i toget ved Wroclaw, bør foræres til staten Israel. #dkpol"
638242557143724032,2015-08-31 06:50:58,DF vil nu anmode Regeringen om at indlede drøftelser med Marokko om tilladelse til dér at oprette dansk-drevne flygtningelejre. .#dkpol
638219418108067840,2015-08-31 05:19:01,Stor forståelse for at Ungarn nu af bedste evne forsøger at beskytte folk og fædreland imod tusindvis af illegale grænseoverløbere #dkpol
637917499695177728,2015-08-30 09:19:18,"Volds-forherligeren al-Haddad var gæst DIT dagen før ""Fredsringen"". DF vil ikke længere acceptere, at folk som han får indrejsetilladelse."
637896204437876737,2015-08-30 07:54:41,"Søren Krarup: ""Europa bør igen blive et kontinent bestående af national-stater med fuld bestemmelse over eget land"". Enig!"
637511213468000256,2015-08-29 06:24:52,En engelsk politiker må godt være imod skotsk selvstændighed. En dansk politiker må ikke være imod grønlandsk selvstændighed. Hvorfor?
637019144723005440,2015-08-27 21:49:34,"Schengen-Traktaten tillader faktisk midlertidigt, i nødstilfælle,at lukke grænsen. Det bør Regeringen, i lyset af folkevandringen, nu gøre."
636198381715652612,2015-08-25 15:28:08,Danmarks øer lades i stikken af Mette Frederiksen. Alene fordi hun går og surmuler over DF. Hvor ER hun dog barnlig. #dkpol
636144993191731200,2015-08-25 11:56:00,"S vil ikke stemme for at gøre færgedriften til de små øer billigere, for så kommer de jo til at stemme jo sammen med DF (..!). #dkpol"
636072950551199744,2015-08-25 07:09:43,"Belgien ønsker grænsekontrol efter tog-terroren. Glimrende! Måtte den dag snart komme, hvor alle Europas grænser atter kontrolleres.#dkpol"
634993568139100160,2015-08-22 07:40:38,"Løkke udtaler truende: ""Der er intet alternativ til et Ja"". Men - jo, Løkke - der ER faktisk et alternativ til et Ja - nemlig et Nej #dkpol"
634965677632307200,2015-08-22 05:49:49,"""Tilvalgsordning""... Det lyder så lækkert tillokkende. Ligesom ""A-la-Carte"" på en hyggelig restaurant. Men vi bliver klogere...! #dkpol"
634824394121084932,2015-08-21 20:28:24,"Er der mon endnu enkelte danskere tilbage derude i cyperspace, som tager EU-halleluja-partiernes dommedags-trusler alvorligt...??? #dkpol"
634601340711346177,2015-08-21 05:42:04,"""Sikkerheden er i orden!"", forsikrer Glyptotekets direktør efter at tyveknægte vadede ind og stjal en Rodin-buste... Ork, ja...!#dkpol"
634212609735163908,2015-08-20 03:57:23,Sverigedemokraterna størst i ny måling. 26 pct. Hurra! Måske genindføres normaliteten i landet hurtigere end forventet. #dkpol
633529189732380672,2015-08-18 06:41:43,"På tide, at vi med hegn og grænsekontrol forhindrer alle disse stærke, unge, pengestærke afrikanske mænd fra at strømme ind i Europa."
633340460711460864,2015-08-17 18:11:47,"@SimonEmilAmmitz Jamen, jeg siger jo, at jeg græder... Det er blot med tørre tårer..."
633328773308526592,2015-08-17 17:25:20,7 mænd dræbt ved årets tyreløb i de spanske gader. Jeg græder tørre tårer...
632990040071794688,2015-08-16 18:59:20,"Modbydeligt ildspåsættelse mod Islamisk Trossamfund. Håber, politiet har fat i den rigtige gerningsmand, og at han får den strengeste straf."
632805843474456576,2015-08-16 06:47:24,"""Vandkanten"" er da et åndssvagt navn til Provinsen... New York, Hong Kong og København er osse vandkanten - og der går det da meget godt"
632802068999348224,2015-08-16 06:32:24,EU skal aldrig nogensinde lå lov at stikke snuden i DKs flygtningepolitik. Vi glæder os til at sige nej til afskaffelse af retsforbeholdet!
632430941047291905,2015-08-15 05:57:41,Elitens mangeårige eksperiment med det svenske folk er ved at krakelere. Jeg ser nu Sverigedemokraterna som Sveriges eneste mulige redning.
632101347156992000,2015-08-14 08:07:59,Hvornår kommer der et flygtningecenter på Christiania?
632087626397417472,2015-08-14 07:13:28,"Morten Korch-bøgerne genudgives.... Hurra - nu godt på vej til et Morten Korch-samfund, hvor de gode vinder til sidst. Lige noget for mig!!"
631523728698949632,2015-08-12 17:52:44,"Stort set hver politimand herhjemme vil - dog KUN på tomandshånd - fortælle, at afskaffelsen af grænsekontrollen var katastrofal.#dkpol"
631521890692022278,2015-08-12 17:45:26,"@m_abs Nej, han ER banket - for danske og tyske journalister citerer generelt korrekt, og SÅ meget kan han ikke være blevet ""misforstået"""
631501576302145536,2015-08-12 16:24:43,"Den tyske politiformand føler sig ""misforstået"" om ønsket om grænsekontrol... Oversættelse: Han er blevet banket på plads #dkpol"
631361411122376704,2015-08-12 07:07:45,Først smuldrede euroen - så smuldrer den tåbelige ide om åbne grænser. Virkelighedens verden er ved at overhale drømmerierne. #dkpol
631149435544805376,2015-08-11 17:05:26,"Tysklands Politiforening opfordrer til genindførsel af politikontrol ved alle Tysklands grænser. Hurra, fornuften er på vej tilbage! #dkpol"
631056908628140032,2015-08-11 10:57:46,@MoScheelsbeck Nej De økonomiske rammer VAR lagt fast af S V og K Dem havde vi ingen andel i Vi protesterede derimod og stod udenfor
631056385673928704,2015-08-11 10:55:41,"@afriishansen Ja men forinden havde Corydon lavet en finansiel aftale med V og K, som fastslog de økonomiske rammer: minus 2,7 mia pr år"
630991923969441792,2015-08-11 06:39:32,"Bemærkelsesværdigt, hvordan V og K nu jamrer over Forsvarets ringe stand - Sammen med Corydon tog de 2,7 mia. fra forsvaret pr. år. #dkpol"
630811125802762241,2015-08-10 18:41:06,"Hvis Løkke vil være Danmarks i særklasse absolut mest populære partileder, indfører han bare grænsekontrol med politi og toldere #dkpol"
630684111049498624,2015-08-10 10:16:24,"Tænk, om SKAT en dag rent faktisk begyndte at hjælpe skatteborgerne med råd og dåd... #dkpol"
630096269034299394,2015-08-08 19:20:31,"Depardieu bandlyst på ukrainsk TV... Øøøhhh, er det det Ukraine, vi har fået at vide at vi skal holde med, som optræder så umodent? #dkpol"
629910713046274048,2015-08-08 07:03:11,"Super, at Sigøjner-Bossen blev smidt ud, men hvordan kan vi - uden grænsekontrol - vide, om han ikke bare sniger sig ind igen? #dkpol"
629554818609233920,2015-08-07 07:28:59,"Dumt af Regeringen med afstemning om Rets-, og Forsvarsforbeholdet. Løkke får en ørefigen af folket. Danskerne gider ikke mere EU... #dkpol"
629369156312375296,2015-08-06 19:11:14,Glædeligt at opleve at der for alvor er ved at komme velstand og fremgang i Ægypten efter Det Muslimske Broderskabs kaos... #dkpol
628319232552529925,2015-08-03 21:39:13,"Selma Lagerlöf anklages nu for racisme. Er der mon stadig enkelte, som er i tvivl om, hvorvidt Sverige lider af kollektivt sindssyge?#dkpol"
628096139271737344,2015-08-03 06:52:43,"Erhvervslivets advarsler tager kun få alvorligt mere... Man har FOR mange gange råbt ""ulv"" for at få os lokket til endnu mere EU-integration"
627940296559620096,2015-08-02 20:33:27,Store israelske demoer mod israelske terrorister. Palæstinensiske demoer mod palæstinensiske terrorister lader derimod vente på sig...
627123669043691520,2015-07-31 14:28:28,"Skal vi gætte på et nyt traumatisk græsk euro-drama inden for få uger? Tror, at grækerne så småt gør klar til at trykke drachmer..#DkPol"
627118827336282112,2015-07-31 14:09:14,2022 Vinter-OL til Peking...! Hovedstaden i et kommunistisk diktatur uden sne.... Smart valg? Tjah-bum-bum-bum #dkpol
627012049583874048,2015-07-31 07:04:56,Nu begynder EB at kritisere Kongefamilien for at benytte Dannebrog. Men det må familien dæleme da selv om - om de så brugte det hver dag!
626355704983592960,2015-07-29 11:36:51,"Mullah Omar, som nu er død, havde ""en særlig form for humor"", skriver Taliban i en officiel hyldestbiografi. Dét tror vi på...! #dkpolitik"
626308651423264768,2015-07-29 08:29:53,@larsmathiasen Alternativet er ingen sanktioner. Vh Søren Espersen
626301315216486400,2015-07-29 08:00:44,"Vore ""sanktioner"" mod Rusland koster os 4 mia pr. år - mens russerne fløjtende finder andre markeder. Sanktioner er latterlige. #dkpolitik"
625616818955288576,2015-07-27 10:40:47,"Forsvaret i UK opfordrer til, at soldaterne ikke bærer uniform i ""det offentlige rum"". Sikken falden på maven for islamisterne.. #dkpolitik"
625608279423602690,2015-07-27 10:06:51,@jakobandresen ja
625580762344128512,2015-07-27 08:17:31,Nu trues danske og færøske politikere på livet af Sea Shepard-medlemmer. Stor foragt for dette fanatiske foretagende! #dkpol
624875326800326656,2015-07-25 09:34:22,I det kommende Forsvarsforlig skal der efter Dansk Folkepartis mening primært satses på Kongeriget Danmarks territoriale forsvar. #dkpoll
624858761384095744,2015-07-25 08:28:32,"OL for homoseksuelle - jamen, undskyld mig, men ideen bag forstår jeg bare ikke. Alle bør da konkurrere sammen - uanset seksuel orientering."
624462012408590338,2015-07-24 06:12:00,EUs altoverskyggende projekt burde være effektivt at standse folkevandringen fra den 3. verden Australien HAR fundet ud af hvordan. #dkpol
623395957984620544,2015-07-21 07:35:53,"Færre og færre kvinder bader topløst, skriver BNB - og nu det regner det osse... Møgsommer!"
622664862146129920,2015-07-19 07:10:46,Landbrug og Fødevare truer med at flytte 40.000 arbejdspladser ud af landet. Den slags faneflugt-trusler bryder jeg mig ikke om. #dkpol
621975401057923072,2015-07-17 09:31:06,"Marie Krarup: ""Krig handler om at besejre fjenden. Det er vigtigere end at føre statistik over fanger og lave fortegnelser"" Enig! #dkpol"
621937541638422528,2015-07-17 07:00:39,Grønlands to MFere bør- hvis de vil have indflydelse og formandsposter - altid støtte den til enhver tid siddende regering.#dkpol
621568135976587264,2015-07-16 06:32:46,"Nu holder Venstre fast i, at EU-jordbær-plukkere kan få fuld børnecheck, selvom V rasede over det i valgkampen. Løftebrud? Ork-ja..! #dkpol"
621022881879867392,2015-07-14 18:26:07,UK indfører nu endnu skrappere grænsekontrol mod illegale indvandrere Hvornår dæmmer DK op mod folkevandringen fra Afrika...? #dkpol
621019378654556161,2015-07-14 18:12:12,"Irans præsident:  ""Vi vil skabe venskaber overalt i Mellemøsten."" Mon ikke israelerne glæder sig til at udveksle ambassadører! #dkpol"
620468487245406208,2015-07-13 05:43:09,"Arenas direktør finder det ""morsomt"", at hans elefanter gik berserk. Jeg finder det til gengæld forargeligt at holde vilde dyr i cirkus."
620114790799835136,2015-07-12 06:17:41,"""En enkelt god dansker blandt lutter onde"", skriver David Trads i dag om Wulf i filmen Guldkysten - men mener reelt sig selv: David Trads..!"
619545178693632000,2015-07-10 16:34:15,"Tsipras foreslår nu en plan, som han for et par uger siden anbefalede sit folk til at sige nej til. Forvirret..? Njahr...#dkpol #grexit"
619031591487164420,2015-07-09 06:33:27,"Svensk politi forlanger grænsekontrol, skriver Berlingske. Men hvorfor nu det? Vi ved jo, at det ikke virker - eller hvad..? #dkmedier"
618674286300147712,2015-07-08 06:53:38,"Når Folketinget beslutter at sende danske soldater i krig, så er det lovligt, og så er vores deltagelse lovlig. Alt andet er snak. #dkpol"
618662711157780480,2015-07-08 06:07:39,"For 38. gang har EU nu ""mistet tålmodigheden med Grækenland..."" Imens kører den altid storsmilende Tsipras rundt med dem alle sammen #dkpol"
618284677913296896,2015-07-07 05:05:29,Far og mor holder ferie og kører alligevel hver dag deres barn i daginstitution. Den slags bryder jeg mig ikke om... #dkpol
617774916331511808,2015-07-05 19:19:52,"UK, DK og nu Grækenland... Igen-igen spåede meningsmålings institutterne i den grad forkert... ""Dødt løb"", spåede de. #dkpol @tv2newsdk"
617769702606143488,2015-07-05 18:59:09,"Tror, at genindførelsen af Drachmer ad åre vil blive en ægte velsignelse for Grækenland...!#dkpol @tv2newsdk"
617732911064838144,2015-07-05 16:32:57,Søvndal fløj i fredags med Ryanair fra Malaga til Billund... Villy dog...!!!
617731482858209280,2015-07-05 16:27:17,Hvor var det dog gennemført fedt at danskerne sagde nej til Euroen. Det har sparet os 25 milliarder kroner til det store græske hul. #dkpol
617580114981875712,2015-07-05 06:25:48,"Trættende procent-opgørelser over hvor mange kvinder og mænd, der nu er i Folketinget. Jeg er sådan set ligeglad med de procenter. #dkpol"
617253243677224960,2015-07-04 08:46:55,@CasperDall  glimrende!
617239760076148736,2015-07-04 07:53:21,"Har Kvinfo mon sommerferie...? For det kunne jo være derfor, Pia endnu ikke har fået en lykønsknings-buket fra dem...#dkpol"
617049064195104768,2015-07-03 19:15:35,3 rumænske tyveknægte har fået indrejseforbud til DK. Det er de da akkurat ligeglade med. Der er jo ingen grænsekontrol her... #dkpol
616847868201172992,2015-07-03 05:56:06,"Enhedslistens Nikolaj Villumsen @nvillumsen haster til Athen for at redde Grækenland. Hvor han dog overkommer meget, den mand!#dkpol"
