id,created_at,text
779782306697474049,2016-09-24 20:39:24,"DCU, Vejen Cykelklub, Grindsted Cykelmotion og Billund kommune er sammen om Danmarks cykeluge 2017 i juni 2017 https://t.co/nHZfpHgIUx"
733748243696390146,2016-05-20 19:56:28,Billund byr친d inviterer til borgerm칮de om kommende budget. https://t.co/ssrU6K8Uk6
720981999989755904,2016-04-15 14:27:58,LegoHouse# skyder i vejret i Billund midtby - forventer 300.000 + bes칮gende fra 친bningen i slut 2017 - dejligt https://t.co/gMaOH64U8T
720278207849721856,2016-04-13 15:51:21,"Ca 300 forskere, fagfolk, beslutningstagere og andre kreative fra hele Verden samlet 3 dage p친 Hotel Legoland https://t.co/kTVHGvzfac"
716709990694785024,2016-04-03 19:32:32,Bridge Walking p친 Lilleb칝ltsbroen - det kan kraftigt anbefales https://t.co/oe5HTS8BPv
715515530707382273,2016-03-31 12:26:10,"Billund byr친d p친 strategiseminar p친 Hotel Sixtus, Middelfart i dag og i morgen - flot sted https://t.co/o6HnwI6wmr"
714155367350018048,2016-03-27 18:21:22,Billund bymidte under kraftig forandring - byens/kommunens fremtid sikres i disse 친r - kom til udviklingscentret. https://t.co/MsjaGHRgUr
714154907226472448,2016-03-27 18:19:32,"Butikstorvet i Billund - har aldrig v칝ret nogen perle, men de kommende 친r vil grundl칝ggende 칝ndre p친 det 游땙游땙 https://t.co/8uXiM1MIEF"
711292446718738432,2016-03-19 20:45:09,Antikmarked i R칮dekro ogs친 i morgen s칮ndag - mange smukke ting https://t.co/M0F8XGlV9r
708189110704287745,2016-03-11 07:13:36,"Anden dag p친 KL's Topm칮de i Aalborg - morgenmad overst친et - var p친 hotellet i fornuftig tid, s친 der er lidt liv i dag游땙游녨游땙"
707883390633164800,2016-03-10 10:58:46,"Mette Frederiksen# p친 talerstolen foran den st칮rste gruppe i ""kommune Danmark"" 游꺛游꺛 https://t.co/uinsjxbtXL"
707863845696643072,2016-03-10 09:41:06,KL's Topm칮de sparkes i gang med n칝stformand Jacob Bundsgaards velkomst https://t.co/TvHZujd9Fu
707845955916267522,2016-03-10 08:30:01,KL's Topm칮de er startet her i Aalborg - satser p친 et par dage med gode debatter https://t.co/n1WNDqzpng
707547392162340864,2016-03-09 12:43:38,"Inside LegoHouse, Billund https://t.co/TO0AstAq8E"
693508966505172992,2016-01-30 18:59:57,Socialdemokrater i Vejen Kredsen samlet til generalforsamling med MF Troels Ravn som taler https://t.co/hNnixXGS3M
690483604862926850,2016-01-22 10:38:14,B칮rner친det har endnu ingen adresse i Billund https://t.co/ITvFfiv5xx I Billund l칮ser vi problemer - vi begraver os ikke i dem
680020739421024256,2015-12-24 13:42:33,Lidt lommefilosofi her lige f칮r tr칝et skal t칝ndes - tegneserie eller ej - guldkorn findes ogs친 her 游꾻游꾻 https://t.co/nEJgikIt91
669492039348826112,2015-11-25 12:25:15,https://t.co/8lGl2V2aB5
667658082416205824,2015-11-20 10:57:45,Direkt칮r for Social og Sundhed til Billund kommune https://t.co/05XmAF7RcI
645618443031584773,2015-09-20 15:20:06,"Manden, der afsl칮rede Carl Holst-sagerne: Holst har n칝rmest aldrig villet tale med mig http://t.co/wLEP9gf9Yq"
644442437088374784,2015-09-17 09:27:04,https://t.co/ndp4EEOE5M
644407188191117312,2015-09-17 07:07:00,https://t.co/bBeCSWiGgH
642277458637639680,2015-09-11 10:04:13,Pressem칮de om FLOT budget 2016 - visionerne for b칮rn og unge i B칮rnenes Hovedstad kan nu foldes ud 游땙游땙 http://t.co/R9TLiAzjxw
642277086837784576,2015-09-11 10:02:45,"Vi er f칝rdige med pressem칮de ifm budget 2016 - V, S og DF har sammen lavet det flotteste budget, jeg har v칝ret med til i 16 친r  i byr친det"
641592818864136193,2015-09-09 12:43:42,Leder Susanne Mathiesen holder tale for Head Space http://t.co/sVLDE85lZ3
641589484828626944,2015-09-09 12:30:27,Ib Kristensen holder anden tale ved indvielse af Head Space i dag http://t.co/Xl4jldSroT
610470791415734272,2015-06-15 15:35:53,Valgm칮de arrangeret af LO Kommuneudvalg Billund http://t.co/wOT02xzGxW
610136944304082944,2015-06-14 17:29:17,Afgang fra Folkem칮de# nogle mindre bekvemt end andre http://t.co/KtW5hS39Nb
609660172953354240,2015-06-13 09:54:46,"Kan det virkelig v칝re rigtigt, at L칮kke var truende overfor sminkepersonalet p친 TV2?#"
609334957975203840,2015-06-12 12:22:29,Statsministeren i dag og i morgen# http://t.co/9h7FfVTOCb
609020951209062400,2015-06-11 15:34:44,Dansk Flygtningehj칝lp afholder debat med 3 chefredakt칮rer# http://t.co/m021TC2K8O
609014943820705792,2015-06-11 15:10:52,Galschi칮t p친 Folkem칮det http://t.co/1uwTVwbmcj
608987064915341312,2015-06-11 13:20:05,Venter p친 Mette Feederiksen p친 Folkem칮det# http://t.co/5RhesutjsX
596358149256433664,2015-05-07 16:57:17,Murano glas for alle pengene - overd친digt og dyrt - set p친 Venedigs nabo칮 http://t.co/Sq0zwxtGlF
596357529757732864,2015-05-07 16:54:49,"Burano er en smuk 칮 nabo til Venedig - her er turisme, vasket칮j, vandpumper, religi칮se figurer og farvede sm친 huse http://t.co/I6Qao9oIrR"
564774301258489856,2015-02-09 13:14:21,#arosrainbow http://t.co/2ZTnA3DfJW
563288795781795840,2015-02-05 10:51:28,Veteranbil auktion i Billund 07.06.15. http://t.co/gLfb33eTmA
556566307748184064,2015-01-17 21:38:42,LEGO House midt i Billund by bliver et 친r forsinket. Den sp칝ndende konstruktion med et 2000 m2 stort torv er en sv칝r n칮d.
545623747810840576,2014-12-18 16:56:53,GOCK koret sang julesange p친 Billund r친dhus - surprise - god modtagelse http://t.co/eDhUhG6dKR
543775059140419584,2014-12-13 14:30:51,Julegaver칝s i Aarhus - godt at det kun er jul en gang om 친ret 游땹
452517291499200512,2014-04-05 18:45:04,L칝ste i dagens Politiken et befriende 칝rligt og usnobbet debatindl칝g af Ulla Holm om kokke og deres mad - fri os for ordflom og giv os mad..
447446557559111680,2014-03-22 18:55:47,Torsdag og fredag KL Topm칮de i Aalborg - godt arrangement - god stemning http://t.co/t0OQZvV7IV
447062215221575680,2014-03-21 17:28:32,"To gode og sp칝ndende dage i Aalborg til KL's Topm칮de er nu slut, og jeg er hjemme for at komme til kr칝fter igen - er ved at v칝re for gammel."
431899301724557313,2014-02-07 21:16:32,COCC's direkt칮r Mette pr칝senterer det nye hovedkvarter i B칮rnenes Hovedstad http://t.co/CxSsRslfm4
431898642921041920,2014-02-07 21:13:55,Bes칮gte i g친r COCC (Capital of Children Company) i Billund's nye hovedkvarter - B칮rnenes Hovedstad buldrer derudad med utallige aktiviteter
424606359439802369,2014-01-18 18:16:59,S친 en flot cykel med kardantr칝k p친 Designmuseet
410493480037666816,2013-12-10 19:37:26,"Hele verden griner af Thorning og Obamas selfie
http://t.co/ic21OUH4fp http://t.co/pBJ3Q3GDXJ"
403114035094507520,2013-11-20 10:54:10,P친 valgdagen tog jeg fri for at modtage donation til St칮tteforeningen for SVS Grindsted fra S칮sterlogen i Grindsted
403113609330720768,2013-11-20 10:52:28,"Dagen efter lang valgdag/aften - genvalgt, vi gik 1 mandat frem, men Venstre fik absolut flertal - surt"
400673072531136512,2013-11-13 17:14:39,Nu er der omdelt n칝sten 2000 valgfoldere i Billund by. Jeg har cyklet rundt og efterh친nden f친et en ret god kondition - 3 arrangementer endnu
399993720818651136,2013-11-11 20:15:09,"I dag havde liste A valgcafe p친 biblioteket i Magion, i morgen tidlig poser m frugt v gymnasiet, roser i Billund og bestyrelsesm칮de"
399233695653318657,2013-11-09 17:55:05,Samtidig har DSU formand og byr친dskandidat Simon Nicolajsen J칮rgensen taget den sure tjans i m칮jvejret med at forny en del Gitte O plakater
399233307067813888,2013-11-09 17:53:32,"Har taget en n칝sten valgkampfri dag i dag - b칮rneb칮rnef칮dselsdag i Aarhus - rigtigt hyggeligt, og det skal der ogs친 v칝re tid til."
398406198325555201,2013-11-07 11:06:54,"Stemmer p친 Kanten valgm칮de p친 Cafe Jydepotten arrangeret af Karl Nielsen - godt med ""speeddating"" 游땕游땕 http://t.co/9vlWJt8POF"
397324036113321984,2013-11-04 11:26:46,Valgmaterialer i Billund Centret #billundpol #abillund http://t.co/HM02KNv00f
397285993268523009,2013-11-04 08:55:36,Kandidater klar til valgm칮de med 600 unge i Magion #billundpol #abillund http://t.co/QT9OfkNIdU
397285587167637504,2013-11-04 08:53:59,Simon Nicolajsen er klar til valgm칮de med 600 unge i Magion #billundpol #abillund http://t.co/OnfEYwr63F
395612917971693569,2013-10-30 18:07:24,Eva Kristensen er Socialdemokraternes repr칝sentant ved v칝lgem칮de i Billund Centret http://t.co/hFY8DlMhGa
395490176220160000,2013-10-30 09:59:40,"Gitte O med mikrofonen ved stort, flot valgm칮de i Vorbasse i aftes http://t.co/ute0yFbU5C"
395304257744011266,2013-10-29 21:40:54,Lige kommet hjem efter godt valgm칮de i Vorbasse - som s칝dvanligt fuldt hus - de kan bare i Vorbasse - Gitte Ottosen klarede det igen godt
391600182426497024,2013-10-19 16:22:13,St칝rk plakat p친 Trapholt - klar tale #kvsyd13 #billundpol #abillund http://t.co/MDJ5j8jdgO
391239341298552834,2013-10-18 16:28:22,Et st칝rkt par - Toyota og kandidat - venter p친 19.11. #kvsyd13 #billundpol #abillund http://t.co/JAitthBhOM
391124318702161920,2013-10-18 08:51:18,Mand og bil er klar #kv13 #billundpol #abillund http://t.co/2C77et7FTD
389807604161327104,2013-10-14 17:39:09,"Flot pr칝sentation af Gitte Ottosen som ny borgmester i Billund #kvsyd #billundpol #abillund  - god politisk analyse, det sket i 친r..."
389480450600607744,2013-10-13 19:59:10,"Jorn Museet i Silkeborg - specialudstillingen ""Jorn og Picasso - myter og m칮der"" 친ben til 08.12. - anbefales http://t.co/zd0U0aW4VV"
383197062705057792,2013-09-26 11:51:13,"Plakater i efter친rssol - ikke d친rligt #billundpol #abillund
Gl칝der mig til at f친 dem h칝ngt op http://t.co/yx0NfXvlQr"
382191241728757760,2013-09-23 17:14:27,Landdistriksr친dene holder valgm칮de i Urup forsamlingshus http://t.co/HS5Ya9IeFQ
382107630522880000,2013-09-23 11:42:12,Ja - vi skal have mere velf칝rdsteknologi - ja - vi skal have et etisk regels칝t for det #billundpol #abillund
382095874836267008,2013-09-23 10:55:30,"Jeg s칮ger genvalg som socialdemokratisk byr친dsmedlem i Billund kommune, f칮lg mig her og p친 FB #billundpol #abillund"
381842769909927936,2013-09-22 18:09:45,"Der er bestilt annoncer, visitkort, brochurer, nu k칮rer toget langsomt derudad #billundpol #abillund"
381842428451618816,2013-09-22 18:08:23,"Weekend uden det store program - afslapning - i morgen landdistriktsdebatm칮de i Urup Forsamlingshus, sp칝ndende #billundpol #abillund"
380763159398981633,2013-09-19 18:39:46,Har lige lavet et debatindl칝g om borgerinddragelse p친 andre m친der end h칮ringssvar #kvsyd #billundpol #abillund
380749908644741120,2013-09-19 17:47:06,"#billundpol Det er l칝kkert, at alle medier g친r sammen om at f친 flere v칝lgere til at stemme den 19.11."
344370729543929857,2013-06-11 08:29:14,LEGO Huset - det kunstige bjerg midt i Billund - forventes f칝rdigt i 2016 ;0)
344370307278204928,2013-06-11 08:27:34,"LEGO koncernen unders칮ger muligheden for, at Billund f친r Danmarks f칮rste kabelbane til transport af turister til byens attraktioner - fedt."
312936521592356864,2013-03-16 14:40:55,Grindsted Produktionsh칮jskole har i dag afholdt et fantastisk godt P친ske Marked - godt initiativ - motiverede unge
307530987196276736,2013-03-01 16:41:15,"Knap 28 milliarder til togtrafikken over de kommende 친r - det er da en positiv nyhed, som vil noget - godt g친et"
306165610742677506,2013-02-25 22:15:44,"Istanbul kan anbefales som oplevelses- kultur- og afslapningssted.
Turkish Airways skal ogs친 have ros for rigtig god service."
303219466773340161,2013-02-17 19:08:49,For f칮rste gang i lang tid har vi v칝ret ude p친 en l칝ngere tur i naturen - det lader hele systemet op igen
302040920575049728,2013-02-14 13:05:41,Det bliver dejligt at se b칮rneb칮rnene i dag - Orla er et n칝sehorn - st친r p친 den blandede menu - rart
301445400823472129,2013-02-12 21:39:18,Pernille RT klarede Clement roligt og i stiv arm - l칝kkert
301393423460605952,2013-02-12 18:12:46,Det bliver et sp칝ndende valg친r - hvad kommer landspolitikken til at betyde for os i kommunalpolitik?
301391537303089152,2013-02-12 18:05:16,"Efter flere 친r p친 FB fors칮ger jeg lige, om tweet dur til noget. Er der nogen andre derude?"
