id,created_at,text
501973197277777920,2014-08-20 06:05:11,Lukker hellere regionen end pladser i børnepsykiatri. Promis! @anderslegarth http://t.co/JqNN9DsVoG
501970577960087552,2014-08-20 05:54:46,"Kom så, Christiansborg. Danskerne er klare. #dkpol @kristeligt http://t.co/BsDIw7kN5v"
501755573357252608,2014-08-19 15:40:25,@CopenhagenIPA formand skal også være formand for @Wonderful_CPH. Godt med mere sammenhæng. #dkpol
501637230780116992,2014-08-19 07:50:10,"Dobbelt fradrag for fagforeningskontingent koster halv mia. Hm. Penge ku være brugt på miljø, sundhed, børn. #dkpol http://t.co/5WHGSIOvMQ"
501244843796881408,2014-08-18 05:50:58,Klogt. #dkpol http://t.co/s48S2EjyRF
499958563893022720,2014-08-14 16:39:45,"Hvis DR har ret, lyver WoCo. Eller omvendt. Cirkus! Kontrakt skal ud i det åbne. #dkpol http://t.co/nmotq1q9Wi"
499657367319887873,2014-08-13 20:42:54,Findes der en grænse for ged???!? #dkpol http://t.co/dGsAPWcZrV
499625210048290816,2014-08-13 18:35:07,"2 off. finansierede, politisk ledede instanser indgår aftale. Hemmelig? Selv for os politikere? Nul demokrati. #dkpol http://t.co/kSK8ul9977"
499444822206603264,2014-08-13 06:38:19,DK økonomi 4. bedste i Europa. 1 step ned. Finland Europas powerhouse. @davos #dkpol http://t.co/vbYMm4sSZA http://t.co/vr1Yt644yw”
499295017190424576,2014-08-12 20:43:03,Homo... og ikke radikal... Pape for pokker... :) http://t.co/Lc07VpWGEV
499201412308299776,2014-08-12 14:31:06,Inspiration for DK. Epic laver ny sundheds-IT for Region H. Shttp://www.dr.dk/Nyheder/Viden/Tech/2014/08/12/145433.htm
499175961900744704,2014-08-12 12:49:58,Spiste rullepølse kl. 10.05. Aaarggh. http://t.co/tdywu3pv27
499116514314682368,2014-08-12 08:53:44,"Tak, Pia! #dkpol http://t.co/bJjpC6GZKH"
498729525790781440,2014-08-11 07:15:59,Spitze! #dkpol http://t.co/5VfX5sKmT8
498393042014183426,2014-08-10 08:58:55,Håb for at Ring 3 letbane føres ud til @dtu. @RegionH bør støtte #letbane #transport
497398087208673280,2014-08-07 15:05:19,Har været i @P1radio i @Orientering og tale om tvang i #psykiatri. Den skal halveres. Vi kan!
497026333055012864,2014-08-06 14:28:06,"Er på TV2 Nyhederne i aften og slår et slag for max #deleøkonomi. Bremser lovgivning, må den laves om. http://t.co/15kUwnNgkm"
497025338304499712,2014-08-06 14:24:09,Det kan virkelig sætte mit p.. i kog! #dkpol @ekstrabladet http://t.co/qQiPJf7GQL
496543080167002112,2014-08-05 06:27:50,"Yes, lad os tale om etablering af én stor, slagkraftig turist- og vækstorganisation i Hovedstaden. @DRNyheder #dkpol"
496537503982039040,2014-08-05 06:05:40,"Hvis Rigsrevision skal granske Eurovision, gransk håbløs styringsmodel. Plumret, splittet ansvar. @berlingske #dkpol http://t.co/84YZHSlQ5J"
496408085326749696,2014-08-04 21:31:25,RT @mkrasnik: Leder i Information i morgen: http://t.co/lTB5hYpFuQ
496407799375859712,2014-08-04 21:30:16,@Martin_Geertsen @DRNyheder næ næ openminded as ever. WoCo bare ikke total ged.
496402486807126016,2014-08-04 21:09:10,Åben for ny org. Men iflg Cowi er WoCo klar succes! Har V læst evaluering fra dec 13? @martin_geertsen @drnyheder http://t.co/vCDxefgTQW
496400635756314625,2014-08-04 21:01:48,@nsnielsen sorry!
496394243334623233,2014-08-04 20:36:24,"@DR: Vi skrev krav til arena ned, før vi indgik aftale. Kan vi se det? #dkpol @eurovision http://t.co/MAIkNVenj9"
496234378339426305,2014-08-04 10:01:10,Wonderful CPH må afdrage de millioner over nogle år. @eurovision #dkpol #suppedas http://t.co/52byIJ4QFP
496232960337539072,2014-08-04 09:55:31,Hvad siger @DR og REDA til rapport om hul i kassen for @Eurovision? #dkpol
496212599194021889,2014-08-04 08:34:37,Hul på 77 mio. i @Eurovision regnskabet! Mere end 3 x forventet. Vildt. Nærlæser rapport. #dkpol
493132955829542912,2014-07-26 20:37:13,Jep. Stensikkert tegn på at V seriøst vil nedlægge regioner. #dkpol http://t.co/JyVUt7c4F8
492290106733363200,2014-07-24 12:48:02,Lyt til @vonhaller om #CPHFTW på @P1radio Start me Up. Fordi vi skal leve af de kvikke der finder på. Thumbs up. http://t.co/LcLc9LtPCW
491334115979825153,2014-07-21 21:29:16,Vi andre kalder det en grundlov @martin_geertsen. Så støtter V ny grundlov? #dkpol @berlingske http://t.co/uGYRje0PTi
491187973212233729,2014-07-21 11:48:33,"Er det kun Dronningen og præster, der må moralisere? Nej, vel? #dkpol http://t.co/HjnILgrRhx"
490771443496394753,2014-07-20 08:13:24,Spitze @oestergaard! DK brug for folk der skaber virksomheder. @berlingske #dkpol http://t.co/ZhgOq9RpPt
489150792851402756,2014-07-15 20:53:31,Hvem kan bedre end regionerne? Staten? #dkpol @berlingske ttp://www.b.dk/politiko/blaat-krav-til-loekke-nedlaeg-regionerne-efter-et-valg
488739926469394432,2014-07-14 17:40:53,"CSC, forklar! #sundpol http://t.co/IisQ2J1Ols"
486827495715389440,2014-07-09 11:01:34,Enig: 24 års-reglen er et godt kompromis for de radikale #dkpol http://t.co/Ig2UeIGjb3
486802874983145472,2014-07-09 09:23:44,"Ny national strategi for sjældne sygdomme. God, men savner mere #EU. #sundpol #dkpol http://t.co/tyJ9CAwIW8"
486757317413994496,2014-07-09 06:22:42,Alle voksne bør default være donorer. Vil sikre donorer - og at vi tager stilling. #sundpol #dkpol  http://t.co/22mZsoMP4s
486254533215928320,2014-07-07 21:04:49,IT- tilsyn i DK i slæbespor. Datatilsynet heller ikke nok i gear. @drnyheder #dkpol http://t.co/BTwIkCX3po
485709129021808640,2014-07-06 08:57:35,"Ja, hvorfor ikke lade royalisterne betale? Og: Få så åbnet royale regnskaber! @annesophiahr @berlingske #dkpol http://t.co/SYXW1zV0Li"
485706645276602369,2014-07-06 08:47:42,Yes. En start: Åbne regnskaber for Kongehuset. #dkpol http://t.co/SYXW1zV0Li
485543732112941056,2014-07-05 22:00:21,Keeps an eye on Berkeley #sundpol http://t.co/87fAe358Qt
484976558713884673,2014-07-04 08:26:36,RT @EU_ENV: What if we transform #waste into gold? What if we move to a #circulareconomy? Watch video http://t.co/OpNB7xpMWx
484599142036307968,2014-07-03 07:26:53,Wonderful Copenhagen må svare på nepotisme-kritik. Beder om redegørelse @RegionH @borup_mx
484594967893917696,2014-07-03 07:10:18,WoCo må svare på det! Nepotisme fy. http://t.co/1PP80NQVgk #metroxpress via @MXnyheder
484003088915644417,2014-07-01 15:58:23,Magen til rå-skævert! Det må EU lave om. Pronto! #eupol #dkpol http://t.co/hoN16yWO33
483979826689105920,2014-07-01 14:25:57,"Kan man så slutte, at indvandrere ikke er tøsedrenge...? http://t.co/0GqjjpEFvY"
483962604453249024,2014-07-01 13:17:31,"Gør noget, Carsten Hansen! #dkpol http://t.co/bC0HdTVGdK"
483895413519286272,2014-07-01 08:50:31,"Go home, Atkins! Bøffer truer klimaet. http://t.co/8tBjdrzG43 via @washingtonpost"
482662130659753984,2014-06-27 23:09:54,"Aller ku have lavet åben, uvildig, snarlige undersøgelse. Gjorde det modsatte. Hvorfor ikke det ringeste overrasket? http://t.co/mCV7L0FPsR"
482558012314238976,2014-06-27 16:16:10,"Luk op, Aller! Og rens dit beskidte legeme. #dkpol #seoghoer http://t.co/5yWkkMglt1"
482055549500940288,2014-06-26 06:59:33,"De ansvarlige for miseren er de, der ikke vil reformere brugerbetalingen. #dkpol #brugerbetaling http://t.co/y7jSFO1Vr4"
481824944138227712,2014-06-25 15:43:13,@karmel80 @RegionH thnx! ikke ok. Tager den flux under armen.
481766676132687873,2014-06-25 11:51:41,Super kronik. Psykisk syge vil gerne tilbage i job. De skal bare have chancen. @sherpa #psykiatri #dkpol http://t.co/rtpLaideeT
481045976723890177,2014-06-23 12:07:52,Håber saftsuseme ikke det beløb er sandt #dkpol @drnyheder http://t.co/B3ZZlgRlml
480946802888159232,2014-06-23 05:33:48,Sjusk eller bedrag? Aner det ikke. Men den kultur skal ha skalpellen @jp @drnyheder #dkpol http://t.co/mJ06GxvEWL
480608543297400832,2014-06-22 07:09:40,Har bedt om redegørelse fra @regionh. Fortsatte sager skader tillid. Rigets radiotavshed øv.@drnyheder @jp #dkpol http://t.co/W4QipEkJU3
480020399984357378,2014-06-20 16:12:36,Dagens juhu! 2.2 mia til psykiatrien. Hårdt brug for dem. Alle vegne. Men børn og unge min prioritet. #dkpol http://t.co/HxAcwRgSR0
479560967290761216,2014-06-19 09:46:59,"Klogt handlet, @regionmidt! Prisværdigt resolut og med proaktiv kommunikation. Kunne @regionh lære af. http://t.co/LX0cxzE2OO"
479504672987029505,2014-06-19 06:03:17,Kan DK virkelig få EU-toppost m alle de forbehold? DK en halvforkølet kandidat  #dkpol
478790913016074240,2014-06-17 06:47:03,Det kan vi godt! Alle har dyner og tøj. Alle skal købe bleer anyways. #dkpol @politiken http://t.co/oNioJXUfbr
478128950002978816,2014-06-15 10:56:39,RT @bornefonden: .@lottefischer @radikale deltager i #nonstopdebat fra morgenstunden og taler partnerskaber op #fmdk @GKKbh #dkaid http://t…
477479090594013184,2014-06-13 15:54:20,Tak til UCC! Super diskussion om børns leg. Hip til os kvinder. Vi glemmer at lege. Selv og med vores børn. #folkemoede2014
476599461607534593,2014-06-11 05:39:01,Uha. Sundhedsstyrelse akse om alting. Skal funke. #sundpol @berlingske http://t.co/tRN5QxAuU9
475543709015363584,2014-06-08 07:43:50,RT @torjuul: Super indlæg i @politiken af @lottefischer om nødvendigheden af at tale om de politiske prioriteringer i sundhedsøkonomien #su…
475543672168390656,2014-06-08 07:43:41,@torjuul @politiken @lottefischer Tak! :-)
474128749571493890,2014-06-04 10:01:17,"@DR ""meget tilfreds"" med sin V-dækning!?Forkert og baseret på én kilde. Hvornår lærer DR at erkende fejl?? Andre kan. http://t.co/msZF1PvHob"
474055206511312896,2014-06-04 05:09:03,Breaking bad #dkpol
473939303765008386,2014-06-03 21:28:30,"@radikale grundlagt på Odense-program i 1905. Var det noget, I kære slagne V-folk i Odense? Kom da hjem til os #dkpol"
473938405156339712,2014-06-03 21:24:55,Måske efterårsudstilling på Charlottenborg hyldest til erfarismen. Stur stur kunst. Frodig fantasi #dkpol
473935761012555777,2014-06-03 21:14:25,RT @annaallerslev: Ikke meget plads til regeringens og KLs gode aftale om kommunernes økonomi. Men her er den: http://t.co/C2epp7vM8F #dkpo…
473759491113353216,2014-06-03 09:33:59,@MichaelM_ller gør de heller ikke. Ny økonomiaftaler rummer realvækst på halv procent.
473745148187119616,2014-06-03 08:36:59,Til lykke til Gentofte Hospital og @evazeuthen. Må andre lære af det gode eksempel. http://t.co/EDsy1hegFx
473737029969539073,2014-06-03 08:04:44,"Økonomiaftale med @regionerne vil stille økonomi i @RegionH i 2015 bedre, end vi frygtede. #dkpol"
473727781239783424,2014-06-03 07:27:59,Har ok'et regeringens udkast til økonomiaftale her i @regionerne. Der skal prioriteres hårdt i @RegionH i 2015. Jubel suspended. #dkpol
473693862926753792,2014-06-03 05:13:12,Bestyrelsesmøde kl 8 i @regionerne om økonomiaftale. 2015 bliver stram. #dkpol
472122996593664000,2014-05-29 21:11:08,V vil have nulvækst. Men@carlholst synes dybt bekymrende med nulvækst. Forvirret? #dkpol http://t.co/3bcITZigca
471689020754251776,2014-05-28 16:26:40,Kom så! Lad os få det prioriteringsinstitut. @politiken @anderslegarth #dkpol http://t.co/EkLHHHSkoB
470816546164457472,2014-05-26 06:39:46,"Vi skal lytte mere, siger DF. Demokrati = at sige, hvad man vil. Så må folket følge eller ej. Andet = populisme #ep14dk #dkpol"
470590219214127104,2014-05-25 15:40:26,stem stem stem stem stem stem stem stem stem stem stem stem stem stem stem stem stem stem stem stem stem stem stem stem  #ep14dk #EP2014
469366907523444736,2014-05-22 06:39:25,Super! København og @ninnathomsen åbner stressklinikker. Andre kommuner må gerne abe efter. #psykiatri http://t.co/6OrCkP9l9a
469052372447416320,2014-05-21 09:49:34,@labeet @informeren hænger sammen med bortfald af mælkekvoter i 2015. Krav til foder og grønne marker gør det dyrt. http://t.co/8n0GFeupHo
469050835171700736,2014-05-21 09:43:28,"Elektrochok kan da aldrig, aldrig blive betingelse for hjælp fra kommunen. @ekstrabladet #psykiatri #dkpol http://t.co/IdJy3GsTzt"
469026209855074304,2014-05-21 08:05:37,"En sag for EU. Hvordan kan EU ændre sin landbrugspolitik, så økologi fremmes? #ep14dk http://t.co/lNNZFS00JB"
468706987640098816,2014-05-20 10:57:08,"Valgkampens elefant i rummet: Hvad skal EU gøre for verden? Sult, vandmangel, krig, klima... EU mere end os selv. Kom nu, DK! #ep14dk"
468632375803404288,2014-05-20 06:00:39,"Så hva foreslår DF? Vente, trille tommelfingre, mens alting smelter ned i Syrien? @berlingske #syrien #dkpol http://t.co/TuTuk1plgt"
468281411519406080,2014-05-19 06:46:03,RT @LoneLoklindt: Vindmøllerne er mere effektive end vi havde håbet på. det er jeg glad for http://t.co/Q9I8YgP0rw #dkpol #dkgreen #ep14dk
467948801445990400,2014-05-18 08:44:22,Så fri os fra de puljer! #psykiatri #dkpol http://t.co/DNr49x9ytW
467243686892277760,2014-05-16 10:02:30,"Vilde tal fra USA: Kriminalitet ned 45 pct siden 1990, men fængslinger op 222 pct fra 1980 til 2012! http://t.co/98c7YsRG8G via @harvard"
467068503460048896,2014-05-15 22:26:23,Vigtigt og godt! Efterslæb i psykiatri rettes op. #psykiatri @bt http://t.co/mOJjpscvsA
467038694676119553,2014-05-15 20:27:56,Mit EU-hug i @berlingske i morgen: Giv patienterne mere EU. Vil give mere kvalitet og sundhed for pengene #ep14dk http://t.co/vIvdvIThUj
466804345539801088,2014-05-15 04:56:43,Metroligt! @frankjensen http://t.co/WYHWFYyFKR
466148297170616320,2014-05-13 09:29:49,"Politikere når værst. Video god, hvis virker på modtagerne. Det finder vi så aldrig ud af #dkpol @folketinget http://t.co/7KkYHKbT5Z"
466143287103864832,2014-05-13 09:09:54,"Dumt! Har brug for at mobilisere unge. Halvgamle knibske politikere aner ikke hvad duer, Hvad nu? #dkpol #ep2014 http://t.co/sIKRL1yfLk"
466095836414242816,2014-05-13 06:01:21,Skræmmende... Klimaudslip runder et skarpt hjørne http://t.co/yTqj2ETNfj
465953441559232512,2014-05-12 20:35:32,Drop moral. Virker filmen eller ej. Får unge til urnerne. Længere er den niks #dkpol #ep2014 @folketinget http://t.co/QHIcReQVdB
465401094969892865,2014-05-11 08:00:42,Skal vi sende Jehovas Vidner blomster? http://t.co/cRnSXE4jdp via @kristeligt
465056400356294657,2014-05-10 09:11:00,Antallet af bæltefikseringer af børn og unge fordoblet http://t.co/QbkOtHnVpi
464417558951919617,2014-05-08 14:52:29,God plan. Cigaretter ku godt have fået et hak eller to op også. #dkpol http://t.co/K5uGe3eIPZ
464295134029684736,2014-05-08 06:46:00,Cykler til første møde som formand for regionernes Psykiatriudvalg. I action-hunting-mood. #psykiatri @regionerne
464060425345449984,2014-05-07 15:13:21,Midt i en EU-tid: Danske patienter vil have gavn af mere EU. #dkpol #eupol @informeren http://t.co/1hse5VIBay
463931531308699648,2014-05-07 06:41:11,Userdriven transparency. Exciting. The Wikirate Project http://t.co/v4FIKEnrzP
463772980456067072,2014-05-06 20:11:09,Hmffr! Det skal undersøges. @bt #dkpol @seoghoer http://t.co/pMBYQEfsLt
463610398961590272,2014-05-06 09:25:07,1813 glødede i påskeugen. Vi ved ikke helt hvorfor. Men kan øv også aflæses på ventetider. @RegionH #1813
463550034072846337,2014-05-06 05:25:15,Haves: portalen tandlægepriser. Ønskes: portal lægepriser. @berlingske #dkpol http://t.co/M332VxVqk7
463548267737788416,2014-05-06 05:18:14,Luk op for lægernes gebyrer. Tager sagen op i @regionh #dkpol http://t.co/4iPBiXj1wA
463351112930557952,2014-05-05 16:14:48,Blir lidt knibsk. Nødløgn? Folketinget er da bedre end det. #dkpol http://t.co/Y2XHNkgR7K
463287696660889600,2014-05-05 12:02:49,@eurovision forløb ikke ok. KBH skal kunne holde store arrangementer og have styr på pengene. #dkpol http://t.co/nEZuRND7NW
462603427634114560,2014-05-03 14:43:46,Jeps! Lasse Jensen: Der er brug for en presseetisk stramning http://t.co/CWTuu4KUJQ
462482721743175680,2014-05-03 06:44:08,Kammeradvokat har monopol. Monopol giver højere priser.  Elementært. http://t.co/UNjFKGR0X9
461199698620329984,2014-04-29 17:45:51,Mindre overrasket over @seoghoerdk. Hvad ku man forvente? Paf over Nets. Har de styr på vores data? I dag? #dkpol
461171094855376896,2014-04-29 15:52:11,Ond tautologi: vil registrere bureaukrati for at afvikle bureaukrati. Erkendelse efter to timer i udvalg. @RegionH
459314717534609408,2014-04-24 12:55:36,Politikere tager fejl. Det gør vælgere også. Skal man være radikal for at mene det? #dkpol @berlingske http://t.co/91fpTtiZgE
459217723344433152,2014-04-24 06:30:11,Danskerne har ret i hvad? Hvad vil @mettefrederiksen rulle baglæns? #dkpol http://t.co/SXYqz1ZCQV
458671273229291520,2014-04-22 18:18:47,Mode der gør en forskel. http://t.co/7qn9VsjtXJ
458589692003225601,2014-04-22 12:54:37,Stigende pres for bæredygtig fodersoja  http://t.co/rOH90lRIwx
457474734024712192,2014-04-19 11:04:10,God idé! Bakket op af forskningen. #dkpol @drnyheder Psykiatriske patienter ansat på lukket afdeling http://t.co/Nu4wh1SfjA
457204526274342912,2014-04-18 17:10:28,RT @christian_dawe: waaauu der vil jeg på ferie! #spaceliving Nasa opdager ny planet der ligner Jorden http://t.co/sD6gUzFs8z
454938637839241216,2014-04-12 11:06:38,Uacceptabelt!!! Riget må forklare. #dkpol @jp Hospital indrømmer at have ændret udgiftsbilag http://t.co/rnt5Pgy6Hz
453278111283425280,2014-04-07 21:08:17,Så er det godt vi har @vestager #dkpol http://t.co/TPWZpOvwH2
451751346006290433,2014-04-03 16:01:28,Alle psykisk syge velkomne hos @Alka. God karma!  http://t.co/Gzb2tUvJX8
451750894648819712,2014-04-03 15:59:41,Alka ændrer praksis: Alle psykisk syge bliver velkomne hos os http://t.co/Gzb2tUvJX8
451681721553911808,2014-04-03 11:24:48,@etiskraad formand i @berlingske om nej til aktiv dødshjælp: Hellere samfund hvor vi hjælper hinanden...??!? http://t.co/jvawfe4Mww
451002275314401280,2014-04-01 14:24:56,Be inspired. Textiles manufacturers can't avoid circular economy principles forever http://t.co/Dpvv0SNUEc via @guardian
450968478225149953,2014-04-01 12:10:38,Indfør aktiv dødshjælp og hjælp arme mennesker som Jane Aamund. #dkpol @bt http://t.co/SFXXFm68cp
449809670534746112,2014-03-29 07:25:57,"Vi hjælper flere. Godt! Gad vide hvor godt det virker... @politiken #dkpol 
Danskere valfarter til psykolog http://t.co/jtLceAolX7"
449120089330425857,2014-03-27 09:45:48,Stålsat på fbureaukratisering. @vestager peger fint på muligheder. Videre. Har listige forslag. @regionerne #dkpol
449106016027025408,2014-03-27 08:49:52,Regionerne dygtige. Men folkekære? Behov for at nytænke demokrati anno 2014. @regionerne #dkpol
447976056889569281,2014-03-24 05:59:49,KBH vokser vildt og har brug for flere ikke færre udlejere! Lejelov kan skræmme folk væk fra at leje ud. #dkpol http://t.co/s54qRL0u0b
447606948813623296,2014-03-23 05:33:07,Ulighed handler osse om netværk. Ensomme på spanden. Screen patienter for netværk. Gør forskel. #dkpol @politiken http://t.co/UfpKGJNZjx
446726690811965441,2014-03-20 19:15:17,Hæv først løn til regionspolikere! Udvalgsformand i kommune får +200.000 kr. I region max 30.000. @DRNyheder #dkpol http://t.co/ioFRgPLD5N
443394352782790656,2014-03-11 14:33:46,Keep up @oestergaard! #børnecheck
443287001211883520,2014-03-11 07:27:11,@JeppeMikkelsen mange tak! 😊 her link til dagsorden. Sag nr. 2. http://t.co/XBJ4707U9V
443282967977533440,2014-03-11 07:11:10,"Radikal mærkesag, når Region H i dag som første region beslutter ny whistleblowerordning. Proces bare for laaaaang. #dkpol"
443275906866765824,2014-03-11 06:43:06,"@P1radio @P1Morgen DK nr 2 i EU til at flexe. Ikke nok. Revolutionér arbejdstid. Hjemmearbejde ny normal. Giver bedre klima, gladere os."
443275483393032192,2014-03-11 06:41:25,@P1radio @P1Morgen DK nr 2 til at flexe i EU. Vi skal videre. Superflexe og revolutionere arbejdstid m hjemmearbejde som ny normal
442607581488754688,2014-03-09 10:27:25,Giver op. Hvad er det nu at være liberal...??? @LiberalAlliance @berlingske http://t.co/FkD31IGJo4
441827563527077888,2014-03-07 06:47:54,RT @MadsBrandstrup: Radikale får bedste måling hos Greens i @vestager 's formandstid #dkpol http://t.co/13FQfJ1e4D
441503220792569856,2014-03-06 09:19:05,Dødsfald ifm #1813. Tragedie. Skal analyseres til bunds. Ventetid ned ned ned! @berlingske #dkpol
439673069658185728,2014-03-01 08:06:43,Hurra! Håber start på nyt og bedre samarbejde også med PLO i Region H. #dkpol @DRNyheder http://t.co/Y2XIpBGCcI
439136408977309696,2014-02-27 20:34:13,"Har lige set @DRDetektor om politikeres mundhuggeri. Skal vi så stramme op, os politikere??? Elsker det program. Keep up @BuchAndersen!"
438666006228381696,2014-02-26 13:25:00,@ANDERSBONDO @DRNyheder En klar fejl!!! Jamen altså. Beklager dybt og uforbeholdent. Man skal vare sig for at læse om morgenen.
437952538424668160,2014-02-24 14:09:56,Første møde i Region H's IT-og afbureaukratiseringsudvalg. Vil ud på planken og eksperimentere med afbureaukratisering. Gode ideer?
437951801003085824,2014-02-24 14:07:00,Hvad med et videnskabeligt kontrolleret forsøg? Videre! #dkpol @DRNyheder http://t.co/vsNPtTkf6W
437116851118931968,2014-02-22 06:49:13,Lap det hul! Er det @manusareen der skal i sving? Finder ud af det.  #dkpol http://t.co/epHIyOTYdZ
436894746997309441,2014-02-21 16:06:39,Lidegaard om aftale i Ukraine: EU’s strategi er lykkedes http://t.co/2Gts9CVxtA
436627145453228032,2014-02-20 22:23:18,"RT @oestergaard: Bryder mig ikke om en hjemmeside til anonyme skatteanmeldelser. Det er ikke sådan et samfund, vi skal have. http://t.co/wb…"
436401851823816704,2014-02-20 07:28:04,@labeet Enig!!! pokkers til kasser. Har fat i vores administration.
436397097634770944,2014-02-20 07:09:10,"Et styk solstråle + konstruktiv journalistik. Godt gået, regioner - og godt sagt, @EvaZeuthen, i @P1Morgen. http://t.co/UfK8T0dKMP"
436252092303699968,2014-02-19 21:32:58,@politiken: Fy kommune og region! Den mand skal til UK og behandles - NU. Drop den abe og find pengene. #dkpol http://t.co/37GHD4MiDl
435993942539395072,2014-02-19 04:27:10,Kan udlicitering gå i takt med solidarisk velfærd? Ja. Spm er hvor og hvordan. Corydon skaffer viden. Tak! #dkpol http://t.co/WqqY3KK4FY
435387172116779008,2014-02-17 12:16:05,Skal granske Produktivitetskommissionens nye rapport. Hvor gevinster v at få private ind - køligt og uideologisk set? http://t.co/kQF2AuSOx6
432061246796349440,2014-02-08 08:00:03,"Uddelegér, kære praksislæger! I blir for få til for meget. @apoteker_org @laegeforeningen http://t.co/87AOXN5w7N"
429589828754096130,2014-02-01 12:19:31,"@IdaAuken, godt! #dkpol"
429132286362402817,2014-01-31 06:01:24,"Ritt ville jo ikke være Ritt, hvis ikke hun var Ritt... #dkpol http://t.co/SnVKrR94zw Blokpolitik ufedt."
428844901586198528,2014-01-30 10:59:26,Held og lykke SF - håber I finder et godt ståsted. #dkpol
428821485126713344,2014-01-30 09:26:23,SF ude. Giver mening #dkpol
428664177587388416,2014-01-29 23:01:18,"Ny grundlov, tak! En dansk statsborger i Malmø, der arbejder og betaler skat i DK, kan ikke stemme i DK!!! Fy. #dkpol http://t.co/A7iADwUJJd"
427698231922135040,2014-01-27 07:02:59,Pensiondanmark ville ikke tage risiko. Vil disse pensionskasser? Tvivler... #dkpol @GoldmanSachs @DRNyheder
426984363365265408,2014-01-25 07:46:19,Hvor har de kasser været henne...??? Seriøst...??? Og hvad skal de have for at overtage risikoen? @DRNyheder http://t.co/ifKtDHmCkv
426741283567448064,2014-01-24 15:40:25,"Yes, kom så mig, dig, alle! Vi er en nation af sløve frikadeller :-) @DRNyheder 
http://t.co/zRB7swlUCX"
425878246325248000,2014-01-22 06:31:01,"Ventetider på 1813 slemt. Det her ubærligt! Kan vi få flere psykiatere til at arbejde i fritid?  #dkpol
http://t.co/twkt8jc9t5"
423230232460795905,2014-01-14 23:08:45,Hollande talte i timer for pressen om økonomi. TV-A og TV2 Nyhederne på pletten. Men nul om økonomi. Kun om sex. Public service? #dkpol
423129626425446400,2014-01-14 16:28:58,"Læge eller telefonterrorist? Fortæl mig, at denne fis-fadæse ikke er sand... #dkpol 
http://t.co/acnXe3ylIh"
422978514053509120,2014-01-14 06:28:30,Nedsæt lejelovskommission! Mål: Et mere fair og effektivt boligmarked - også for dem med små indkomster. #dkpol @berlingske @politiken
422858523299831808,2014-01-13 22:31:42,"Jo jo Pind. Lav den lejelov om. Nepotistisk. Skader lejerne. Ingen ved, hvilken leje de skal af med. http://t.co/Nl5uysUsiR #dkpol"
422720554559602688,2014-01-13 13:23:28,RT @politiken: Flere politikere vil gøre det lovligt at håne en religion http://t.co/32jAxv9duM
422716688975409152,2014-01-13 13:08:07,I 2007 stemte jeg ene ikke DF-MF for DF's forslag om at afskaffe blasfemiparagraf. Nu flertal. http://t.co/8KxIzmCCtg  @politiken #dkpol
421902485679513600,2014-01-11 07:12:45,Rigsrevisionens formand vil kulegrave akuttelefon. Behøvs ikke. Står på nakken af vores administration. Går frem. #dkpol @DRNyheder
420094235669704704,2014-01-06 07:27:25,Mesteren ud i Twitter- og FB-polemik @sorenpind advarer mod skinger debat drevet af uhøvisk netkultur... @P1Morgen
418655721232687104,2014-01-02 08:11:16,"Region H første region til at få whistleblowerordning.Kom så, I andre regioner! http://t.co/qgZAY3HS2x"
418485616998100993,2014-01-01 20:55:20,"Gys for en tale, Helle T! Provinsiel, tilbageskuende og ældrefetischistisk. Nul svar. Klima, EU væk. Hulk. #dkpol"
416147654226481152,2013-12-26 10:05:07,@JensAnton Region H skal som første region indføre whistleblower. Offentlig sektor må se at komme i gear. #dkpol @politiken
416130648504815616,2013-12-26 08:57:32,"Rød solidaritet med rige ældre. Don't get it. Helle, gør dog noget for dem, der har brug for hjælp! #dkpol
http://t.co/igwBJaXBXi"
414266587701854208,2013-12-21 05:30:25,"Vestager i 2013: Forsørg dig selv, hvis du kan. Jelved i 1995: Slut med forsørgersamfundet. Vi mener det. #dkpol http://t.co/R9ohi1158s"
413943861837561856,2013-12-20 08:08:02,"DF: Fed fordel for os, at de andre laver fælles patentdomstol. DK skal bare også have sin egen. En nation af nassere?  #dkpol"
