id,created_at,text
342300801668091904,2013-06-05 15:24:05,I dag fejrer vi Grunslovsdag! og går mørklagde vi lidt af demokratiet. En god reminder at demokratiet er noget vi skal pleje og passe på!
342299274408767489,2013-06-05 15:18:01,"Og du havde ikke kalkuleret med den risiko, fordi der kun var to navne; eller du tænker det kunne være gået meget værre?"
342296227808952320,2013-06-05 15:05:54,@mortengad det er jo både dumt og farligt! og lidt sjovt:-)
341887993092644865,2013-06-04 12:03:44,På en dag som denne har Harbermas måske levet forgæves. Trist for den borgerlige offentlighed! #offentlighedslov
341610320902631424,2013-06-03 17:40:21,Vi skal frisætte vores børneinstitutioner og åbne vores civilsamfund op. Kom med bud på hvordan!
341227518176686081,2013-06-02 16:19:14,@mibelib Til og held og lykke:-)
340495296364679170,2013-05-31 15:49:39,"@mortengad Øl nåede du da, jeg henter en ny om lidt:-)"
329522424649490432,2013-05-01 09:07:22,God 1 maj. Husk nu det internationale i dagen. Vi kæmper også og især for fx de arbejdere der ligger fanget under bygning i Bangladesh!
323013343235428352,2013-04-13 10:02:36,"@MarieHonore Ja vi er nogle radikale både i baglandet og som folkevalgt, der er imod den lov!"
309686129530122240,2013-03-07 15:25:01,Dagens tanke til visse medier og militærstøvler: tænk i større sko!
305265411434360832,2013-02-23 10:38:40,RT @MajaAbild: #rvudd. Rekruttering af frivillige: Man skal være berørt. Det skal betyde noget. Man skal opfordres. Det skal føles menin ...
123340714099748865,2011-10-10 10:14:52,Det store borgerlige løftebrud http://t.co/81GNWCoK via @berlingske. Fordi Kastrup kan noget særligt med perspektiver
114368837054504960,2011-09-15 16:03:50,en hyldst til demokratiet http://t.co/yHL843qB
114258121152663552,2011-09-15 08:43:53,Hyld demokratiet ved at stemme i dag:-)
113730917918457857,2011-09-13 21:48:58,fra ADHD til Ph.d. Uddannelse til forskellige mennesker stiller forskellige krav til den enkelt og til samfundet. http://t.co/mJXcaQH
112784513653944320,2011-09-11 07:08:18,"@MissAndreasen Hvor dejligt, at høre, Tak, sig' det endelig videre, og undskyld jeg ikke har fået svaret, men bare alt for travlt lige nu;)"
112016698500059136,2011-09-09 04:17:16,Rummelighed er en investering
111549253079416832,2011-09-07 21:19:49,Transparency er vigtigt for tilliden til politikerne - også i Danmark. Superdebat hertil aften
109550286200254464,2011-09-02 08:56:38,"Dagens gode nyhed! Vælgerne vil have substans, ikke fnadder
»TV 2 skulle skamme sig« - Politiko | www.b.dk http://t.co/bMiA8HJ."
109007506596048896,2011-08-31 20:59:49,Bus nr. 40 rocks! http://t.co/ffF5pPi. Noget om hvordan uddeling af flyers fører til tanker om individuelle valg og fællesskaber
108835285990768641,2011-08-31 09:35:28,Efter endnu en morgenuddeling - kun en ting at sige. B-menneske helt igennem!
108600736920776704,2011-08-30 18:03:28,Jeg lover ikke at synge i nogen valgvideoer ever!!!!
108043059140362240,2011-08-29 05:07:27,Helt rigtig set af Jens Rohde: VKO-blokken er død: http://t.co/2tjBkDF via @AddThis
107907191264124929,2011-08-28 20:07:33,filosofiske tanker om politik over en perleplade http://t.co/9XBtagb
107185081940066304,2011-08-26 20:18:09,"Valgplakater oppe, så kan resten af valgkampen bare komme an!"
106622741679050752,2011-08-25 07:03:37,"Vi har brug for fællesskaber, der kan sikre den enkelte frihed til at vælge sine egne veje og derved blive en bedre version af sig selv."
105953623950884865,2011-08-23 10:44:47,RT @oestergaard: VK-vækstpakke skaber for få jobs for pengene. Og så er der jo ikke investeringer i fremtidrn som vores klima-jobplan #dkpol
105934513217085440,2011-08-23 09:28:50,boligpakker nej tak!
105934430778032128,2011-08-23 09:28:31,livsfæller?? altså hvis det hedder ægtefæller for en mand og en kvinde så hedder det vel også for kvinde og kvinde eller mand og mand!
105369606415327232,2011-08-21 20:04:06,"Skat - også I morgen, er mit lille indspark til en synes jeg manglende skattedebat http://t.co/3P7m9tS"
104489875675426817,2011-08-19 09:48:22,"Radikale går til valg på radikal politik og forhandler et evt. regeringsgrundlag, når vælgerne har talt og mandaterne fordelt!"
103088388638388224,2011-08-15 12:59:21,"flere lærere og pædagoger skaber trygge børn, der lærer mere. Hvilket da er at foretrække fremfor karakter til i 1. klasse?"
102825256435191809,2011-08-14 19:33:46,@Kristian_Jensen Jo jo men læser at berlingske kalde V's oplæg for skræmmekampagne. Med sådanne venner hvem behøver fjender?
102824131816460288,2011-08-14 19:29:18,Bedre sundhed og gode patientforløb http://t.co/ZwKdc3q
102015961732890624,2011-08-12 13:57:55,synes nogen mangler lidt næstekærlighed. SF: Politi bør slå til ved sundhedsklinik: http://t.co/lweEHK4 via @AddThis
101303792829603841,2011-08-10 14:48:01,Mere iværksætterstøtte - ja tak!
84130875327004672,2011-06-24 05:28:58,"Tak til Uffe, for denne opsang! Hvad med at melde Danmark ud af EU? - Kommentarer | www.b.dk http://t.co/5EDX3hx"
83840434249531392,2011-06-23 10:14:51,Læser i wired at man kan bygge sin egen soloplader til mobil mm. Det må være sommerens projekt.
83445759076347904,2011-06-22 08:06:33,Wired bedste dameblad overhovedet! Så er det knap så træls at vente i lufthavnen
79213601797308416,2011-06-10 15:49:29,"@tokehelmo tror nok, det er praktisk, så svanerne ikke flyver ind i dem, får stød og drætter ned på kørebanen, it is know to happen"
79187393965600769,2011-06-10 14:05:20,Håber det 1 mandat bliver væk og grænserne forbliver åbne - Politiko | www.b.dk http://t.co/a93HYpC
79187100779556866,2011-06-10 14:04:10,"Copenhagenization oversættelse ""jeg er så glad for min cykel"" http://t.co/3Acr1qX"
79154716059238400,2011-06-10 11:55:29,"Nej Nej Nej!""Vi skal tage et opgør med, at borgerne selv må vælge, hvordan de vil leve deres liv."" I,H Clemmensen i P1. Jeg er lidt skræmt!"
78773173948133376,2011-06-09 10:39:22,RT @LoneLoklindt: Erhvervslivet advarer imod grænseaftale - Nationalt | www.b.dk http://t.co/a4rE0Ut - erhvervslivet må snart anbefale e ...
78354433100091392,2011-06-08 06:55:27,Er som Morten Østergaard godt tilfreds med 9% til de radikale;) dejlig morgenlæsning http://t.co/wsOc74M via @AddThis
76022855413936128,2011-06-01 20:30:35,@AngelaBrink til mia.nyegaard@gmail.com så kan du lige få nogle flere tips
76022652539645952,2011-06-01 20:29:47,"@AngelaBrink man skal være lidt stædig og sende en god mail, så når man frem til den rigtige, der giver super sparring. men send en mail"
75980114642468865,2011-06-01 17:40:45,"Væksthuset et rigtig godt sted for iværksættere som mig, mere af den slags, hvis DK skal vækste sig ud af krisen"
75563179547176960,2011-05-31 14:04:00,øj den er lang - afslutningsdebatten
75296292141662209,2011-05-30 20:23:29,RT @annaallerslev: Interessant klip med #OleSohn om #boligskat: Især boligskatten er det mest asociale. Det er R og SF enige om! #dkpol  ...
75160849685282817,2011-05-30 11:25:17,"RT @AndersReuter: ""Sammenblandingen af retspolitiske stramninger og økonomiske reformer er uskøn og uværdig."" http://bit.ly/kvrare"
75128939957325824,2011-05-30 09:18:29,Barfoed(lytter ikke til eksperterne)Højere straf virker http://t.co/C7FLaUz. Underskud i år 74 mia. er det penge til fængsler der redder DK?
74905194294554624,2011-05-29 18:29:24,@MiaNye Ok så Løkke har forstået http://nyhederne.tv2.dk/article.php/id-40303522:l%C3%B8kke-ingen-n%C3%B8dplan-med-vestager.html?nidk
74904158813167616,2011-05-29 18:25:17,"Vestager som statsminister ved BT og de borgerlige ikke, at vi peger på Helle T? Og det gør vi altså!"
74477509802065920,2011-05-28 14:09:56,"Fra et seminar til det næste, sådan kan man også bruge sin weekend. Men synes det er det hele værd!"
74477231799414784,2011-05-28 14:08:50,RT @sofiecn: God stemning på radikalt kandidatseminar i Nyborg. Argumenterne skærpes og erfaringer udveksles. Dygtige folk underviser ht ...
74229782866440192,2011-05-27 21:45:34,"Drengepolterabender er sjove, nøj man får drukket mange øl"
73844940630794240,2011-05-26 20:16:20,RT @jacobpackert: Ting som Henrik Sass vil sænke: a) Støtte til borgerlige medier. b) De Radikales indflydelse. c) Prisen på plankebøf p ...
73491874773602304,2011-05-25 20:53:23,"Vil bare lige gerne vide, hvornår det er ok at gå ind for positiv særbehandling og hvornår det ikke er? og hvad betyder lighed for loven?"
73388210738315265,2011-05-25 14:01:27,Tænker at Ørume spillede for højt spil og tabte.VogK må være glade for PCM lige nu http://jp.dk/indland/indland_politik/article2442717.ece
73387876133515264,2011-05-25 14:00:07,@AngelaBrink Meget meget rigtig set.
73034030525853696,2011-05-24 14:34:04,måske det handler om at vælge det bedste af to verdner http://raeson.dk/2011/torben-m-andersen-hverken-r%c3%b8d-eller-bla-plan-er-nok/
72571009663905792,2011-05-23 07:54:11,Stop skattestoppet! Lad ejendomsværdiskatten følge prisudviklingen og sænk skatten på arbejde.
71236055600336896,2011-05-19 15:29:33,@manusareen fordi bagerne også skulle have fri på St. bededag. Så de bagte hveder - som folk så evt. kunne varme dagen efter.
71232990017101825,2011-05-19 15:17:22,"8,3% til de radikale sikke en dejlig måling. http://ekstrabladet.dk/nyheder/politik/danskpolitik/article1557463.ece?refimg=658223"
70772140055597056,2011-05-18 08:46:07,RT @radikale: Verden er ikke rød eller blå. DK har brug for begge planer: BÅDE fokus på uddannelse + vækst OG efterlønsreform http://bit ...
70749034603741184,2011-05-18 07:14:18,RT @sofiecn: http://politiken.dk/debat/ledere/ECE1285013/oekonomisk-vaekst-skabes-ikke-ved-at-lukke-os-inde/ URL siger det hele...
70747868583043072,2011-05-18 07:09:40,har 2 gange på et år været enig med brixtofte http://politiken.dk/debat/ECE1113495/er-det-dit-danmark-lars/
70747310967099392,2011-05-18 07:07:28,Enig med Brixtofte http://politiken.dk/politik/ECE1284214/brixtofte-jeg-stemmer-paa-margrethe/
70479753697689600,2011-05-17 13:24:17,"Udsyn Ja tak, og tak til Ole Thyssen for denne præcise beskrivelse
http://politiken.dk/debat/ECE1284222/loeft-blikket-danmark/"
70422159012532224,2011-05-17 09:35:25,"valg eller ikke valg - det er spørgsmålet, kun Løkke har svaret. Ser i den grad tv lige nu også selvom jeg burde arbejde"
70415313287643137,2011-05-17 09:08:13,"@mibelib også i den grad, som Thomas skriver på fb Rigtig god karma. ha' en dejlig dag"
70415163567767552,2011-05-17 09:07:37,RT @mibelib: @MiaNye #smukverdeniregnvejr
70391589293404160,2011-05-17 07:33:57,"Er ude at løbe, og en ung kvinde stiller i regnen sin cykel og løber efter mig ca 300m for at aflevere mine nøgler. Så fantastisk! 1000 tak"
70255599316766720,2011-05-16 22:33:34,Har en lille men supersej kampagnegruppe - 1000 tak for alt jeres hjælp. Og husk sig' til hvis du har tid eller lyst til at hjælpe
67902672396750849,2011-05-10 10:43:53,Det er ikke samfundets skyld - men samfundet er vores ansvar
