id,created_at,text
723149225962430464,2016-04-21 13:59:45,Meldingerne i blå blok har nået tragikomisk niveau. Hvad bliver mon det næste? #dkpol https://t.co/ZAxIuAUOU5
722867075996225537,2016-04-20 19:18:35,Bombe under Løkke. DF trækker tæppet væk under hele regeringens økonomiske politik #dkpol https://t.co/BD6hbPVyQE
722400192188821504,2016-04-19 12:23:22,DF straffes som halehæng til svag Løkke og for besparelser på ældre og kontanthjælp #dkpol https://t.co/EhCZETMiWZ
721983209307770880,2016-04-18 08:46:25,Dårlig dag i blå blok. Hård kritik og manglende opbakning. Peger DF fortsat på Løkke ? #dkpol  https://t.co/WssnVQ845S
718680197000773632,2016-04-09 06:01:26,Meget skidt signal at Løkke dropper FNs store klimamøde i New York. DKs statsminister bør naturligvis være med #dkpol
718014428357214208,2016-04-07 09:55:54,Alvorligt nyt. Godt PET er på vagt #dkpol Politiet anholder fire for at være hvervet til terror https://t.co/QhHuy0dUoC
717632592481239040,2016-04-06 08:38:37,Arrogant statsminister og regering i gylle-gate. Hvad blev der af løftet om ydmyghed og samarbejde #dkpol
716543612377559040,2016-04-03 08:31:24,S kræver redegørelse om landbrugspakke https://t.co/OQXe4OrdAj
716344988590845952,2016-04-02 19:22:08,Bad Løkke Eva K om at bryde reglerne på trods af advarsler fra embedsmænd ? Soc.dem kræver redegørelse fra stm #dkpol
716208118489853952,2016-04-02 10:18:16,I dag siger vi farvel til en lille kæmpe. Han var Danmarks statsminister og danskernes Anker.  Vi vil savne dig. #dkpol
716006102425579520,2016-04-01 20:55:32,"""Alt er egentlig bedre end i dag"". Tag den Løkke ! #dkpol Den irriterende dreng fra blå blok https://t.co/ccyOB4N5F1"
716002139189993472,2016-04-01 20:39:47,"Gigantisk kovending. Først ville LA vælte Løkke, nu vil de i regering med ham. Useriøst. #dkpol https://t.co/VAvB5ylUiU"
715146355073761280,2016-03-30 11:59:12,Holger K. Nielsen stopper efter næste valg. Vil savne Holger. Han er en hædersmand og en god og vidende kollega #dkpol
713109409044553728,2016-03-24 21:05:06,"Nyt ""ultimatum"" til LLR fra Pape. Spændende at se hvordan Langfredag bliver i blå blok #dkpol   https://t.co/SoQtO8dGQh"
712218269999042560,2016-03-22 10:04:02,Forfærdelige angreb i Bxl. Mine tanker går til ofrene. Vigtigt at vi står skulder ved skulder i kampen mod terror #dkpol
711584070795436032,2016-03-20 16:03:57,Anker er død. Han var Danmarks statsminister og danskernes Anker. En lille kæmpe er ej mere. Vi vil savne dig #dkpol
711583227710939140,2016-03-20 16:00:36,Anker er død. Han var Danmarks statsminister og danskernes Anker. En lille kæmpe er ej mere. Vi vil savne ham #dk.pol
709766647041662976,2016-03-15 15:42:10,Overtager Helle Thorning-Schmidts plads i Udenrigspolitisk Nævn. Glæder mig meget til opgaven #dkpol
709146463855648769,2016-03-13 22:37:46,Forfærdeligt terrorangreb i Ankara her til aften. Mine tanker går til de mange ofre og deres familier og venner #dkpol
709144146880155648,2016-03-13 22:28:34,RT @tv2newsdk: Efter islamiske organisationers TV 2-fordømmelse: - Imamer skubber ansvaret fra sig https://t.co/aVln0Uolhb https://t.co/6fQ…
709079813848494080,2016-03-13 18:12:56,"Formørket Imam-møde. Imamerne burde fordømme stening, voldtægt, vold, snyd og svindel - ikke TV2 #dkpol"
708956282192052225,2016-03-13 10:02:04,De hygger i Venstre #dkpol Kristian Jensen klar til kampvalg om formandsposten i Venstre https://t.co/pAppu5eFKL
708392275643080705,2016-03-11 20:40:54,"Stor respekt og god bedring til Maja Panduro. Modig, klog og ærlig måde at fortælle om hvad der kan ramme os alle #dkpol"
706861606689513472,2016-03-07 15:18:34,RT @politikodk: S: Trepartsaftale bør ikke kun handle om flygtninge https://t.co/0Km9PrD97A #dkpol
706826666052624384,2016-03-07 12:59:44,"RT @FrankJensenKBH: Jeg er skuffet over, at Esben Lunde Larsen starter som miljøminister med at sværte min gamle ven Svend Auken. Havde håb…"
706595698251337731,2016-03-06 21:41:57,Esben Lunde sviner Svend og Ida Auken. Det var den ydmyghed. Totalt manglende format fra LLRs svageste kort #dkpol
706574845723746304,2016-03-06 20:19:05,"Klog og rigtig beslutning af Bundsgaard. Jeg forstår godt, at tilliden er væk.  https://t.co/iGI8nxJlzi #dkpol"
706549228743606272,2016-03-06 18:37:17,RT @tv2newsdk: Efter TV 2s afsløringer: Borgmester trækker støtte til stormoske https://t.co/cLQ2Z2WAqA https://t.co/ryd0S2OSHG
706425182790012928,2016-03-06 10:24:22,"RT @perchristen3F: #3part om flygtningekrisen kan ikke ses uafhængig af #3part om stort uddannelses- og kompetenceløft. #dkpol #dkøko 
http…"
705711553568489472,2016-03-04 11:08:40,"F-16, C-130 transportfly og specialstyrker sættes ind i kampen mod ISIL. Vigtigt dansk bidrag i kampen mod terror #dkpol"
704925752576364544,2016-03-02 07:06:10,"Nu bliver det Clinton vs. Trump. De andre vil hænge på lidt endnu, men slaget er reelt afgjort #dkpol"
704698235634507776,2016-03-01 16:02:06,RT @Spolitik: Tak til @LarsMidtiby for benhårdt arbejde som partisekretær i ni år. Held og lykke fremover #dkpol https://t.co/lfghIWJj8Q
704275079857831936,2016-02-29 12:00:38,Tillykke til Ulla Tørnæs og Esben Lunde Larsen. Socialdemokratiet glæder sig til samarbejdet med de nye ministre #dkpol
703612203245694976,2016-02-27 16:06:36,"RT @simonkollerup: Nu kører en masse medier et V-spin om en forsker, som tager fejl. Han har intet med sagen at gøre. Drop spin - fortsat v…"
703592849430978561,2016-02-27 14:49:42,Efter Eva K afgang er LØkke en historisk svag statsminister i en splittet blå blok. Der er ikke styr på butikken #dkpol
703509856645472257,2016-02-27 09:19:55,Kjers afgang efterlader historisk svag LLR #dkpol
703135059834851328,2016-02-26 08:30:36,Dag 4 hvor vi ikke ved om Løkke ønsker at fortsætte som statsminister. Meget lidt imponerende politisk håndværk #dkpol
702539301268156416,2016-02-24 17:03:16,"LLR, Thulesen-Dahl, Samuelsen og Pape i politisk parterapi. Nu skal Pape vise, om han står fast eller ej  #dkpol"
702488338192846849,2016-02-24 13:40:46,"Løkke er dansk politiks Kaptajn Kaos. Farceagtig forløb i Blå blok, hvor Løkke kører chickengame mod Pape #dkpol"
702378100605198336,2016-02-24 06:22:43,"Twitter kan ikke erstatte lederskab. Nu må Løkke fortælle danskerne, hvad der foregår i kaosramt blå blok #dkpol"
702220827526348800,2016-02-23 19:57:46,"Kaos i blå blok. Mistillid til Eva K og krisemøde hos Løkke, der ikke ved, om han kan fortsætte som statsminister #dkpol"
701444478566055938,2016-02-21 16:32:50,Episk kamp forude. Boris Johnson vs David Cameron. Gad vide hvem af dem der er PM efter 23. Juni #dkpol
701112090065551360,2016-02-20 18:32:02,"@DavidTrads @Heunicke Det tyder så også på en klar Clinton sejr i SC, mens Nevada unægtelig er too close too call..."
701020192269279232,2016-02-20 12:26:52,"Britisk folkeafstemning den 23. Juni. Et ja vil gavne Storbritannien, EU og Danmark #dkpol"
700984225470803968,2016-02-20 10:03:57,Connie Hedegaard sætter Eva Kjer på plads i gyllegate. Hvor jeg dog savner Connie som blå bloks grønne stemme #dkpol
700980254270234624,2016-02-20 09:48:10,Godt at se Connie Hedegaard sætte tingene på plads overfor Eva Kjer. Savner Connie som blå bloks grønne stemme#dkpol
700826377105383424,2016-02-19 23:36:43,"Godt at Cameron fik på plads, at DK ikke længere skal sende fuld dansk børnecheck til Rumænien og Bulgarien #dkpol"
700800662716739588,2016-02-19 21:54:32,Aftale på plads. Godt at Storbritannien nu kan vælge at forblive i EU. Spændende hvad aftalen betyder for Danmark #dkpol
699887705170317312,2016-02-17 09:26:46,Dagens gode nyhed. Bossen kommer til byen #dkpol
699851492568727553,2016-02-17 07:02:53,RT @mfMorten: Grotesk! @DanskDf1995 vil forhindre nye almene boliger i byerne. Hvad med almindelige familier? https://t.co/xN64kklzVo #dkpo…
699700398320390144,2016-02-16 21:02:29,"RT @tv2politik: Wammen: Nu må Samuelsen vise, om LA er en politisk joke https://t.co/YFKofoRq8a #dkpol https://t.co/4M740B3Bvw"
699514169939390465,2016-02-16 08:42:29,Banemand eller julemand ? AS har nu sat ny deadline for at vise om LA er en joke eller en politisk magtfaktor #dkpol
699369921575305217,2016-02-15 23:09:17,Statsminister LLR afklapser konservative I Gyllegate. Gad vide om Pape finder sig i den behandling af C #dkpol
699366469994487808,2016-02-15 22:55:34,Anders Samuelsen truer igen LLR. Bliver interessant at se om AS bliver regeringens jule eller banemand i december #dkpol
699365623365812226,2016-02-15 22:52:12,Liberal Alliance: Løkke har kun året ud til at levere markante reformer https://t.co/MHr7BYjL32
698413454034649088,2016-02-13 07:48:37,"""Tulle-torpedo"" direkte ind i siden på Løkkes treparts-projekt. Uhørt DF angreb på Løkke. Det sejler i blå blok #dkpol"
698398451030192128,2016-02-13 06:49:00,Thulesen: Fordel hvis treparts-forhandlinger falder til jorden | Berlingske Politiko Tulle-torpedo mod Løkke #dkpol https://t.co/g2ai9VYwPy
698396935745572865,2016-02-13 06:42:59,Det Islamiske Trossamfund forsvarer kontroversiel imam - Politiken.dk DIT fastholder vanvidskurs #dkpol https://t.co/rU84RNUDZZ
698041450521632768,2016-02-12 07:10:25,"Stormagter er blevet enige om delvis syrisk våbenhvile https://t.co/FWMbeh9kO2
Dagens gode nyhed #dkpol"
697722719023075328,2016-02-11 10:03:53,"Barnebrude på 14-år bliver aldrig i orden i DK uanset, hvad Grimhøjmoskeen siger af formørket vrøvl #dkpol"
697359330459389952,2016-02-10 09:59:55,Mette Frederiksen stiller ultimativt krav til ny planlov https://t.co/EBTJBtq9MP
697006461809987584,2016-02-09 10:37:44,Udskydelse af ejd vurd. DK har en manana-manana regering som udskyder alle store beslutninger. Nul lederskab #dkpol
686445416632717312,2016-01-11 07:11:55,Tak til David Bowie ! En fantastisk kunstner som på en helt unik måde prægede generationer af musikelskere #dkpol
686317405073739776,2016-01-10 22:43:15,Uhørt hård kritik af Løkke fra Kl-formand Damm (V) Han sammenligner V politik med at brænde rudekuverter #dkpol
685197591563362304,2016-01-07 20:33:30,Søren Pind har givet sig selv mundkurv på. Gad vide om regeringens koordinationsudvalg følger hans eksempel😉 #dkpol
684622260737540096,2016-01-06 06:27:21,"16 % til V, Mette F suverænt i front og intern grænsestrid i V-toppen lækket fra K. Nok ikke den bedste dag i STM #dkpol"
684508255587024897,2016-01-05 22:54:20,Børsen mobil | Avisen: Chokmåling: Vælgerne flygter fra Løkke   LLR i frit fald. 16.6% bag ham #dkpol https://t.co/rhvtfL6FVy
684501987631706112,2016-01-05 22:29:25,Kæmpe konflikt i V-toppen om grænsekontrol. Forbløffende hvis Løkke kan leve med endnu en lækage fra K-udv. #dkpol
684500315488534530,2016-01-05 22:22:47,Kæmpe konflikt i V-toppen om grænsekontrol. Forbløffende hvis Løkke kan leve med endnu en lækage fra K-udvalg#dkpol
684498367922204673,2016-01-05 22:15:02,Kæmpe konflikt i V-toppen vedrørende grænsekontrol. Forbløffende hvis Løkke kan leve med lækager fra K-udvalget #dk.pol
683010523143733248,2016-01-01 19:42:53,"RT @QvortrupHenrik: På DR får @Spolitik's pol ordf @NWammen en garanti fra @skaarup_df om, at DF ikke vil støtte topskattelettelser. Hva så…"
682612715031019520,2015-12-31 17:22:08,Tak til Prinsgemalen for en flot indsats for Danmark#dkpol
682611482819977219,2015-12-31 17:17:14,"Vi skal stå sammen og ikke lade frygten vinde, når vi møder terror. Stærkt budskab fra vores dronning#dkpol"
678320865684103169,2015-12-19 21:07:51,"Med Rohdes radikale beslutning, må man sige, at der er travlt ved udgangen hos Venstre i disse dage #dkpol"
678126856835604480,2015-12-19 08:16:56,Ældre Sagen og KL afslører Thulesen-Dahls og DFs hykleri mht billige boliger til de ældre#dkpol https://t.co/LdcNnyQLuL
673834859870224388,2015-12-07 12:02:04,Det sejler for Løkke. Åbenlys dyb krise i forholdet imellem regeringen og DF efter asylaftale er faldet på gulvet #dkpol
665861624037818368,2015-11-15 11:59:16,DF top vil nu have DK til at bombe civilbefolkningen i Irak. Det er barbarisk og helt i strid med danske værdier #dkpol
665431949129986049,2015-11-14 07:31:54,De forfærdelige angreb i Paris er vendt mod alle der tror på demokrati. Vi står sammen i kampen mod terror#dkpol
665286898655563776,2015-11-13 21:55:31,Forfærdelige nyheder fra Paris. Mine tanker er hos ofrene og de pårørende som gennemlever en frygtelig aften#dkpol
664575740390805505,2015-11-11 22:49:38,Helle Thorning-Schmidt ville være blevet en fremragende FN flygtningechef. Nu får vi fortsat glæde af Helle i DK #dkpol
652404789574258689,2015-10-09 08:46:37,DF kaster håndklædet i ringen. Ikke meget indflydelse ved at fravælge regeringsansvaret #dkpol http://t.co/Znzr0VGdFm
652036434803748864,2015-10-08 08:22:54,"Stærk tale af Mette F. Håber at regeringen er klar til samarbejde om god velfærd, flere jobs og dagpenge#dkpol"
651365874419531776,2015-10-06 11:58:20,Løkkes fine ord er ikke nok. Brug for handling når det gælder jobs og velfærd. S er i arbejdstøjet #dkpol
651355372150726657,2015-10-06 11:16:36,"Løkkes fine ord er ikke nok, brug for handling når det gælder bedre velfærd og flere job. S er i arbejdstøjet #poldk"
651259829454008320,2015-10-06 04:56:57,I News debat med Jakob Ellemann. Jakob ville ikke bekræfte at Løkkes skattemelding fra i går også gælder i dag. #dkpol
649175256255623168,2015-09-30 10:53:36,Tillykke til PC og velkommen tilbage på Borgen. Håber at der nu kommer ro om forsvaret efter turbulente uger #dkpol
649114235000258560,2015-09-30 06:51:08,Danmark skal have ny forsvarsminister. Håber at Løkke vælger min gode ven Jakob Ellemann-Jensen #dkpol
648797825233481728,2015-09-29 09:53:50,Uambitiøs finanslov. Få investeringer i velfærd og job. Håber V vil forhandle med S om en bedre aftale. #dkpol
648792346885292032,2015-09-29 09:32:04,Uambitiøs finanslov. Få investeringer i velfærd og job. Håber V vil forhandle med S om bedre aftale #poldk
648372009336967168,2015-09-28 05:41:47,De mindste børn og børnefamilierne skal betale regningen for Løkkes finanslov. Trist og kortsigtet #dkpol
641221589179236352,2015-09-08 12:08:34,Dybt alvorligt og helt bizart at Støjberg har brugt skattekroner på at annoncere i avis med terror-forbindelser #dkpol
641211756036104192,2015-09-08 11:29:30,"Situationen er så vigtig og alvorlig, at Løkke bør mødes med den svenske statsminister, så samarbejdet sker på øverste niveau #dkpol"
639728103670026240,2015-09-04 09:14:00,Helle er den helt rigtige til en af verdens vigtigste internationale poster. En stærk kvinde med internationalt format #dkpol
639305002595536896,2015-09-03 05:12:44,LA mener at social dumping er noget fagbevægelsen har fundet på for st skabe angst. Lever den mand på månen. Kom ud i virkeligheden #dkpol
639173409302315008,2015-09-02 20:29:50,LA mener at social dumping i DK er noget fagbevægelsen har fundet på for at skræmme. Lever den mand på månen. Kom ud i virkeligheden AS!
632198541851631616,2015-08-14 14:34:12,Kristian J slår sig gul og blå på svensk plaster. Ikke imponerende diplomati. Måske KJ næste gang skal sætte plastret på munden  #dkpol
580775933864484864,2015-03-25 16:59:07,RT @rufusgifford: Minister Wammen how about bet on tonight's #US/DK match? Case of beer for whoever wins? I'll put up Sam Adams. @usembdenm…
518280838136754176,2014-10-04 06:05:55,"Terrororg ISIL har myrdet britisk nødhjælpssarbejder Alan Henning på bestialsk vis. ISIL er brutal og bindegal org, der må bekæmpes. #dkpol"
