id,created_at,text
793732652285194240,2016-11-02 08:33:05,Besøg af svensk UM Margot Wallström. Vi fik hilst på Christian 4 og vendt verdenssituationen. Nok at tale om !… https://t.co/0alVd5DrNf
793198742153363456,2016-10-31 21:11:31,"Samuelsen har lige sagt, at LA står fast på nytår som deadline. Løkke har gjort regning uden vært #dkpol @spolitik https://t.co/rSq9hjNPPI"
793179115071373320,2016-10-31 19:53:32,Kæmpe nedsmeltning for Løkkes 2025-plan. Elendigt politisk håndværk og stort selvmål af statsministeren. #dkpol
793061852754407424,2016-10-31 12:07:34,Klar DF besked. Nu ligger bolden for alvor på Løkkes banehalvdel. Statsminister i knibe #dkpol https://t.co/Yq52gdzxtL
791360344186904576,2016-10-26 19:26:23,@MFThomasJensen @AAS Bring it on😉😎👍
791360240025497600,2016-10-26 19:25:58,"@CKrzyrosiak Jeg holder meget af Holbæk, så jeg ønsker jer alt det bedste i alle andre kampe end mod GF😉"
791357417682563077,2016-10-26 19:14:45,Dagens gode fodboldnyhed ! ⚽️https://t.co/OKEwp8sarL
790660530910494723,2016-10-24 21:05:34,"@JoachimBOlsen @Astridkrag @jyllandsposten Vi har aldrig støttet de topskattelettelser, LA kræver. Glem det. En død sild !"
790654375190466561,2016-10-24 20:41:07,@JoachimBOlsen @Astridkrag @jyllandsposten S vil ikke være med til topskattelettelser som LA foreslår. Synes JBO skal lytte til danskerne!
790630213528985600,2016-10-24 19:05:06,"Så mangler vi bare, at Løkke lytter #dkpol Vælgerne har talt: Nej tak til både Løkkes og Samuelsens model https://t.co/2F5EAFxbKn"
790628214779547648,2016-10-24 18:57:10,Spændende melding fra SF. Antal betyder noget #dkpol Med en ny linje i udlændingepolitikken vil SF lægge s https://t.co/LOwJLPH9wd
790288947402383360,2016-10-23 20:29:02,Fortjent skulderklap fra Dronningen til vores udsendte og veteraner #dkpol  Danmark har ydet et vigtigt bidrag med https://t.co/LXCDyMdgV7
790215765215612928,2016-10-23 15:38:14,Av den må gøre ondt i Trump-lejren😊 #dkpol Karl Rove: Donald Trump can't win https://t.co/6oKfYS4vI9 via @HuffPostPol
789140419561005056,2016-10-20 16:25:12,Markant føring for Mette over Løkke #dkpol Mette Frederiksen er danskernes klare favorit som statsminister https://t.co/hm0e6fUb7Z
788934940230557696,2016-10-20 02:48:42,Det svar kan have afgjort valget #dkpol Trump on Whether He'll Accept Election Results: 'I'll Keep You in Suspense' https://t.co/Zvw87awyvs
788759212696502272,2016-10-19 15:10:25,"Respekt for folk
der dag efter dag kæmper for, hvad de tror på #dkpol https://t.co/OrStzyyhNs"
787669694920724480,2016-10-16 15:01:04,"RT @nbcsnl: Right behind you!

Watch the Trump-Clinton Town Hall #Debate on the #SNL App: https://t.co/7dmmWQgqPD https://t.co/yk4UpNx53h"
787377427861430272,2016-10-15 19:39:42,"Nye Borgerlige truer med at vælte Løkke. Blå blok er blevet en stor rodebutik, hvor konkurrencen går på hvem der først trækker tæppet #dkpol"
786937524388261888,2016-10-14 14:31:41,Finansministeriet slår gækken løs i anledning af kulturnatten😊 #dkpol https://t.co/VVCB7yWJLn
786675497795280896,2016-10-13 21:10:29,Klarsyn og klar tale fra DF ! #dkpol DF-toppen: Lavere topskat vil koste blå blok magten https://t.co/rBlTcgaCgz
786621136209645570,2016-10-13 17:34:28,RT @thehill: Social media goes wild over Michelle Obama's takedown of Trump https://t.co/vunyDCkd6l https://t.co/jkRQBSyvpx
786616027765288960,2016-10-13 17:14:10,Den kvinde er for sej. Historisk tale #dkpol Michelle Obama calls on women to rise up against Trump https://t.co/cUV9lLy6uU
786443550103703552,2016-10-13 05:48:48,Aldrig kedeligt når Thorpedoen går i aktion #dkpol Tidligere V-finansminister kritiserer opgør med skattestoppet  https://t.co/80LRlqrxIJ
783994876014817281,2016-10-06 11:38:39,"Jacob Ellemann Jensen mener, at det er ""en håndsrækning"" og ""generøst"", at en enlig mor mister 2600 kr om måneden. Jeg er helt uenig! #dkpol"
783963718552027136,2016-10-06 09:34:50,"Vigtigt støtte fra Thulensen-Dahl til S budskab. Soleklart at regeringen må efterleve, at der er et flertal bag togforliget #dkpol"
783918782779654144,2016-10-06 06:36:16,RT @BennyEngelbrech: Finansministeriet anerkender at der er strukturel balance i @Spolitik udspil til #tyve25 forhandlinger. Tak for det #d…
783331606476025856,2016-10-04 15:43:03,Som dreng elskede jeg at være med min far på arbejde. I dag var min far med på arbejde hos mig😊 Glad søn og stolt f… https://t.co/J8MZr3FA1B
783163006200999936,2016-10-04 04:33:05,"Med venner som Samuelsen. Endnu en spændende dag i den blå familie, nu hvor LA fortryder, at de ikke væltede Løkke i august #dkpol"
782893334134226944,2016-10-03 10:41:30,Fantastisk sjov og lige på kornet #dkpol Saturday Night Live’ mocks Trump’s microphone problem during first  debate https://t.co/aKRjR9v8Ze
782887115277369344,2016-10-03 10:16:48,Tillykke til Bertel. En mand af format og udsyn #dkpol https://t.co/3eAhN6Lozj
782577134355218432,2016-10-02 13:45:03,Michelle Rocks #dkpol https://t.co/iM1iL8nSFY
782509183736348672,2016-10-02 09:15:02,"Godt at der nu kommer dato på, så man kan komme igang med at få en fornuftig EU-skilsmisse på plads. #dkpol https://t.co/pegMVPAZ09"
780796335603716100,2016-09-27 15:48:47,Stålsatte øjne eller nedslået blik ?  #dkpol Blinker Samuelsen? DF-boss kræver svar om ultimative krav https://t.co/b74rrFzLGg
780656190007209984,2016-09-27 06:31:54,"@Kirstenbrosbol Du er en rigtig god ven og en super dygtig kollega. Respekterer og forstår dit valg, men vil godt nok savne dig !"
780652399115591680,2016-09-27 06:16:50,Stor respekt og tak til en meget dygtig og engageret kollega og et rigtig fint menneske # dkpol https://t.co/q8aggJUyUQ
780650064721154048,2016-09-27 06:07:33,Post-debate poll: Hillary Clinton takes round one @CNNPolitics https://t.co/rI5L2nZuQU
779694761099849729,2016-09-24 14:51:31,"RT @simonkollerup: .@NWammen: ""Kære @larsloekke, nu kan du ikke længere gemme dig bag Marienborgs tykke mure. Kom i arbejdstøjet!"" #dkpol h…"
779315047474589696,2016-09-23 13:42:40,RT @ACakademikerne: Vigtigt signal fra @spolitik Tillid og rum til ansattes faglighed i opgaveløsningen giver stærkere off sektor https://t…
779276917199532034,2016-09-23 11:11:09,RT @Spolitik: Første gang i over 50 år med medlemsfremgang to år i træk. Hjerteligt velkommen til alle nye! #dkpol #skongres https://t.co/a…
779027410591375362,2016-09-22 18:39:42,RT @DMiliband: An attack on an aid convoy is an attack on all of us. We @theIRC stand in solidarity with humanitarian aid workers. #REDForS…
778864841327009793,2016-09-22 07:53:43,Dagens politiske spørgsmål: Vil Nye Borgerlige støtte Løkke som statsminister - og ønsker Løkke dem som parlamentarisk grundlag ? #dkpol
778473551867281408,2016-09-21 05:58:52,Vi venter stadig på LLR udspil #dkpol Børsen mobil | Avisen: Helle Ib: Boligskatten er giftgas under regeringens liv https://t.co/kJGXW1EPFn
777436233828012037,2016-09-18 09:16:56,"RT @BennyEngelbrech: 19 dage siden @larsloekke sagde nyt ejendomsvurderingssystem blev præsenteret ""meget snart""
Vi venter stadig #dkpol ht…"
777402476463058944,2016-09-18 07:02:48,"S ønsker hverken blå eller rød blokpolitik. Ser frem til godt samarbejde med både Radikale, DF, SF, Enh, Alternativet, V og C. #dkpol"
777118318805352449,2016-09-17 12:13:40,Med S og DFs melding er Samuelsens hede drømme om topskattelettelser en død sild i dansk politik #dkpol
776865448210132992,2016-09-16 19:28:50,"Tiden er kommet, hvor Løkke bør indkalde S og DF til forhandlinger, hvor topskattelettelserne skrottes og pligtopgaver løses #dkpol"
776714164052062209,2016-09-16 09:27:42,Fredagshygge i blå blok #dkpol https://t.co/uek4mkyDWc
776513189206958081,2016-09-15 20:09:05,RT @BennyEngelbrech: 69% af danskerne stoler ikke på regeringsløfter om boligskat - hvornår kommer Hjort med hans lovede plan? https://t.co…
776505898965532674,2016-09-15 19:40:07,@helleib Med DFs meldinger i dag er 5% point topskattelettelser for indtægter over en million en død sild i dansk politik.
776498571839430660,2016-09-15 19:11:00,Borgen kalder Borgen. Spændende om Løkke lytter og dropper topskattelettelserne #dkpol https://t.co/jVvAF22wm8
776460247313637376,2016-09-15 16:38:43,Spændende og positiv melding fra DF. De politiske kontinentalplader er sat i bevægelse #dkpol https://t.co/D7vIOMyjfi
776161506044022784,2016-09-14 20:51:38,Særdeles markant og positiv melding fra DF. Håber at Løkke lytter og samarbejder med S #dkpol https://t.co/MePSAs0LTJ
776154714425679873,2016-09-14 20:24:38,Stærk melding fra Thulesen-Dahl til Løkke. Drop blå blok og lav en fornuftig aftale med S #dkpol https://t.co/SuUjHbgean
776122866282684417,2016-09-14 18:18:05,Temmelig desperat finansminister på slap line. Tror Hjort har fået solstik i septembervarmen #dkpol https://t.co/jSZp96NHdH
775966099577929728,2016-09-14 07:55:09,"Gad vide om næste ""high level"" audiens bliver hos Seier på en alpetop i Schweiz 😎 #dkpol https://t.co/uw8DGoJW9N"
774567404403908608,2016-09-10 11:17:14,Spændende beretning om krisehåndtering under de mest ekstreme betingelser #dkpol ‘We’re the Only Plane in the Sky’ https://t.co/odKxrC6FR5
774550396463382528,2016-09-10 10:09:39,Godt nyt fra Syrien med aftalen mellem USA og Rusland. Et vigtigt skridt på vejen mod fred. Lad os håbe at det holder #dkpol
774505925403115520,2016-09-10 07:12:56,Pinligt at Løkke kom med løfter til rengøringsassistenterne som bare ikke holder i virkelighedens verden #dkpol https://t.co/9P6Uk2KLBE
774258566286811136,2016-09-09 14:50:01,Nsturligvis skal Facebook ikke slette et episk og historisk foto der handler om krigens gru og rædsler #dkpol https://t.co/ZdT2KMhKBr
774257947463614464,2016-09-09 14:47:34,Facebook sletter indlæg fra Norges statsminister med historisk Vietnam-billede https://t.co/ZdT2KM09JT
772723749284175874,2016-09-05 09:11:12,"Flagdag hvor vi hædrer vores veteraner. Vi skylder vores udsendte mænd og kvinder stor tak, respekt og støtte ! #dkpol"
772509851389980672,2016-09-04 19:01:15,"@larsloekke @Jens_Joel 
S laver gerne finanslov med V der styrker veteranindsatsen. Lad os finde løsninger sammen til gavn for veteranerne."
772504981698125825,2016-09-04 18:41:54,"@larsloekke @Jens_Joel 
Der blev bl.a. afsat penge til flere veteranhjem, lokale initiativer og hjælp til pårørende. Vigtigt!"
772503025965465601,2016-09-04 18:34:08,"@larsloekke @Jens_Joel 
Vi fik blandt andet styrket indsatsen for PTDS ramte veteraner og igangsat en række andre tiltag."
772471341903667200,2016-09-04 16:28:14,Så vigtigt at vi takker og støtter vores veteraner og deres pårørende #dkpol https://t.co/jGY4bipKrI
772469450654318592,2016-09-04 16:20:43,"Dommer ved hotdog DM i Aarhus. 16 hotdogs og ca 240.000 kr til Børnefonden senere, slår jeg mave. #dkpol https://t.co/HkxRINDntB"
772357151171960836,2016-09-04 08:54:29,Løkke spin vs virkeligheden #dkpol Løkkes plan giver direktøren det største procenthop efter skat https://t.co/2EFwaKMpYB
771980645841117184,2016-09-03 07:58:23,"Klart budskab fra danskerne. Nu mangler vi bare, at Løkke lytter #dkpol Markant flertal: Nej tak til skattelettelser https://t.co/eRjZ7mbAny"
771980060660236288,2016-09-03 07:56:03,Markant flertal: Nej tak til skattelettelser https://t.co/eRjZ7mbAny
771587899624005632,2016-09-02 05:57:45,De råhygger i blå blok inden dagens sættemøder😊 #dkpol Pape dumper Løkkes plan: Boligbomben tikker stadig https://t.co/wQ2Y0b6aoB
770983963074723840,2016-08-31 13:57:55,Samuelsen versus Løkke. High Noon i Nyhavn ! #dkpol
770979282030096385,2016-08-31 13:39:19,"Ryster Løkke på hånden, nu hvor Samuelsen siger, at han står fast? #dkpol"
770891501664698368,2016-08-31 07:50:31,"Ups,det var vist ikke lige planen #dkpol Lars Løkkes salgsargument modsiges af regeringens egne regneeksempler https://t.co/PBJYagVOU9"
770873499586031616,2016-08-31 06:38:59,"Spændende om Samuelsen har stålsat blik eller flakkende øjne, når han i dag skal vise, om han er mand eller mus på topskatten #dkpol"
770356626536751105,2016-08-29 20:25:06,RT @BennyEngelbrech: Lad os lige huske at regeringens forslag vil give en direktør med millionløn topskattelettelse på ca 25.000 kr #skævt…
770325436043759617,2016-08-29 18:21:10,"Ikke for at ødelægge den gode stemning, men hvor skal pengene komme fra Løkke? #dkpol"
770323347859275776,2016-08-29 18:12:52,Løkke vil bruge milliarder på topskattelettelser. Det vil Socialdemokratiet ikke. Banen er kridtet op for efterårets forhandlinger #dkpol
770008705450577921,2016-08-28 21:22:36,Tilståelsessag ! #dkpol Finansministeren anerkender tvivl om effekten af topskattelettelser - TV 2 https://t.co/3Ouqu7B4Ns
769794270073065472,2016-08-28 07:10:30,Klart budskab fra danskerne. De vælger velfærd fremfor topskattelettelser #dkpol https://t.co/Pew2dYfC0b
769260248288858112,2016-08-26 19:48:30,"Se billederne fra den røde løber: Festugen åbnes
Med Karen og Anna til festugeåbning #dkpol https://t.co/4oI4M3Ik5E"
768698240808128512,2016-08-25 06:35:16,RT @Jesper_Pet: .@jyllandsposten viser geografisk skævhed ved sænket topskat. Midlerne bedre brugt på udd. og velfærd. #dkpol #tvsyd https:…
768558523772989440,2016-08-24 21:20:05,Fornuftige meldinger fra V-borgmestre. Tror desværre ikke Løkke lytter #dkpol https://t.co/R4IzEH1upF
767429096850743296,2016-08-21 18:32:09,Så flot af Danmarks guld-drenge. I gør Danmark stolt !!! #dkpol
766507090290454528,2016-08-19 05:28:25,Suveræne Super-Sara. Så sejt og flot løbet. #dkpol https://t.co/xwrYWGEv1m
764727891624136704,2016-08-14 07:38:31,Så flot. Stort tillykke ! #dkpol Pernille Blume vinder OL-guld! https://t.co/95pGeU2jtk
764415947243417600,2016-08-13 10:58:58,Så er terningerne vist kastet. Spændende om Thulesen Dahl vil underkaste sig Samuelsens revolverpolitik? #dkpol
764385542091997184,2016-08-13 08:58:09,Håber at DF vil lytte til danskerne og støtte Socialdemokratiets budskab om nej til topskattelettelser #dkpol https://t.co/w9cWQ8lhqh
764056621785899010,2016-08-12 11:11:08,"Løkke vil foreslå topskattelettelser, LA kræver mindst 5% points nedsættelse af topskatten. Hvad siger DF nu ?#dkpol"
764023562789191680,2016-08-12 08:59:46,Efter LAs melding ligner det High Noon i Nyhavn #dkpol https://t.co/HQ5cTke9LO
763983613096366080,2016-08-12 06:21:02,Samuelsen sætter pistolen for panden på Thulesen Dahl efter DF vaklen på topskat #dkpol https://t.co/lxa1hzRMeY
763616039447961600,2016-08-11 06:00:25,@BennyEngelbrech Er det en overspringshandling😉?
763336669856690177,2016-08-10 11:30:18,"Hårdt presset Thulesen Dahl vrider sig voldsomt, mens journalisterne presser ham på topskatten. #dkpol"
763320477544804353,2016-08-10 10:25:58,"Spændende om DF melder klart ud med definitivt nej til topskattelettelser, eller om Thulesen-Dahl ryster på hånden? #dkpol"
763135709846900737,2016-08-09 22:11:46,Amazing disgrace #dkpol Ex-CIA chief: Trump comment would get someone else a ride in 'police wagon' https://t.co/fXhjzvmjTL
762148010902118400,2016-08-07 04:47:00,Sandhedens time. Vil DF sammen med S sikre velfærd og job eller vælger de topskattelettelser med Løkke og LA? #dkpol
762027688118943744,2016-08-06 20:48:53,Socialdemokratiet vil ikke give topskattelettelser. Er DF parat til at give en garanti om det samme? #dkpol
759024785586348033,2016-07-29 13:56:25,"Historisk aften. Jeg håber inderligt, at Hillary bliver USAs præsident. Så vigtigt for USA og for verden! #dkpol https://t.co/ahVAwLvE6B"
758855095899394049,2016-07-29 02:42:08,Hillary Clinton på scenen. Hun bliver en klog og cool præsident. I'm with her ! #dkpol https://t.co/ItNSa4yNPW
758764200420225024,2016-07-28 20:40:57,Sen frokost med David Miliband og nu på vej til Hillarys store tale. Stor aften forude #dkpol
758124713075888128,2016-07-27 02:19:51,"Smuk, stærk og sjov tale. En kærlighedserklæring fra Bill til Hillary. Salen elsker det #dkpol https://t.co/WEmRrAgvZ6"
758081603306266625,2016-07-26 23:28:33,@ElsebethYNWA uden tvivl. Men united we stand!
758079322649309184,2016-07-26 23:19:29,"Socialdemokrater for Hillary på plads i salen, mens historie bliver skabt #dkpol https://t.co/c66jlmNc1I"
758075291751161856,2016-07-26 23:03:28,Euforisk stemning her i Philly. Hillary netop valgt som første kvindelige præsidentkandidat #dkpol https://t.co/V6iW7AACfM
757923069021265920,2016-07-26 12:58:35,Fantastisk tale af Michelle Obama her i Philly. Håber vi en dag ser den første sorte kvindelige præsident. Michelle Obama #dkpol
756735799740227584,2016-07-23 06:20:48,Kaine er et solidt og sikkert valg for Clinton. Nu er det showtime mod Trump i november. #dkpol https://t.co/BL2Rnwa1jP
756606627701293056,2016-07-22 21:47:31,Fejt og forfærdeligt angreb #dkpol LIVE: Seks personer meldes skuddræbt i indkøbscenter i München https://t.co/FteEBQVik4
755492182149177344,2016-07-19 19:59:07,I det franske parlament. Stærk tale af Valls om kampen for demokrati og mod terror efter angrebet i Nice #dkpol https://t.co/IMIxU3yqXu
754036413906161665,2016-07-15 19:34:25,RT @BBCNews: .@bbcproms opens with La Marseillaise as mark of respect to #NiceAttack victims https://t.co/gX5NZhofQ8
753991674083307520,2016-07-15 16:36:38,Kram og solidaritet med Frankrig i deres kamp for demokrati og mod terror #dkpol https://t.co/a3KzYrHwNf
753722093741699072,2016-07-14 22:45:25,"Forfærdeligt, fejt og usselt angreb på mænd, kvinder og børn i Nice. Mine tanker går til ofre  og pårørende #dkpol #Nice"
753301032818601984,2016-07-13 18:52:16,Boris Johnson som ny britisk udenrigsminister. Kedeligt bliver det næppe! #dkpol
748913401615753216,2016-07-01 16:17:23,RT @tv2politik: Langballe: Regeringen kan se frem til endnu flere problemer med DF til efteråret https://t.co/sJeEoy6y7y #dkpol https://t.c…
747907998270525440,2016-06-28 21:42:16,Forfærdeligt terrorangreb i Tyrkiet. Vigtigt at vi står sammen i kampen mod terror. Mine tanker går til ofrene og deres kære #dkpol
747541063187869696,2016-06-27 21:24:12,Brexit-karma. The Lord works in mysterious ways ! https://t.co/IDhVEBXFxV #dkpol
746666395568570368,2016-06-25 11:28:35,"Klogt at få skilsmissen på plads, så hurtigt som muligt, så pinen ikke trækker ud  https://t.co/68Hyv9unUe #dkpol"
746212592255807489,2016-06-24 05:25:20,"Trist resultat i UK. Vigtigt at vi nu får det bedste ud af en svær situation til gavn for UK, EU og Danmark #dkpol"
744985701037518849,2016-06-20 20:10:06,Det er i Danmarks klare interesse at være medlem af EU. Derfor ikke grund til en dansk folkeafstemning https://t.co/gHiEJvaLaF #dkpol
744168954906746880,2016-06-18 14:04:39,"Man kan ikke være halvt gravid. Hvis DF vil i regering, hvorfor så vente 3 år? https://t.co/qno21B25Bh #dkpol #FMDK"
743797636206051328,2016-06-17 13:29:10,"Fint at Løkke ønsker brede forlig til efteråret, men han mangler at svare på, om han vil bøje sig for LAs topskattekrav ? #dkpol #fmdk"
743501295080857601,2016-06-16 17:51:36,Klar til debat med uffe Elbæk og Clement K. Folkemødet er i fuld gang #dkpol @uffeelbaek
742055308617523202,2016-06-12 18:05:46,"Had og terror vil aldrig vinde over kærlighed, livsglæde og frisind. Det gælder i Orlando, det gælder i Danmark #dkpol"
742006490454740992,2016-06-12 14:51:47,"RT @HuffingtonPost: Our hearts are with you, Orlando. https://t.co/7lQcXF31XC"
741975456510058496,2016-06-12 12:48:28,"Forfærdeligt angreb i Orlando. Gør mig vred og trist, at fest og livsglæde mødes med had, død og ødelæggelse #dkpol"
741322957688049664,2016-06-10 17:35:40,Regeringen opgiver omprioriteringsbidraget. Kæmpe sejr for kommunerne og fornuften. Stort nederlag for Løkke #dkpol  https://t.co/OfJKkMV9ke
741321586284888064,2016-06-10 17:30:13,Fantastisk. Regeringen opgiver omprioriteringsbidraget. Måneders hårdt pres har virket. Kæmpe nederlag til Løkke #dkpol
740800482713686017,2016-06-09 06:59:33,"Blå blok har bøjet sig. De almene boliger er sikret, så også folk med almindelige indtægter kan bo i byerne #dkpol"
740756564399796224,2016-06-09 04:05:02,Reg skal opgive kravet om at fjerne 25% reglen på almene boliger. Ellers bliver der ingen aftale med S om planlov #dkpol
739404679642238976,2016-06-05 10:33:07,Super Grundlovsmøde hos Dansk Metal. Tid til et grin og fokus på fællesskab i min tale #dkpol https://t.co/a3XoKQsEVt
739141708655513600,2016-06-04 17:08:10,Dejlig dag med solskin og gode franske venner #dkpol https://t.co/juhmgjJWn9
739099618663878656,2016-06-04 14:20:55,"En gigant har forladt ringen !Muhammad Ali: 'Greatest' boxer, showman, ambassador https://t.co/TUQPQI3MSh"
737969634067001344,2016-06-01 11:30:46,RT @karlkbang: What a difference a month can make... #dkpol https://t.co/YFdqNS8La6
737920361069694976,2016-06-01 08:14:58,Stærk tale fra Mette F. Nej til topskattelettelser og ja til nye jobs og kernevelfærd #dkpol https://t.co/4ehqL5gg88
737588578855706626,2016-05-31 10:16:35,Aftale om indsats overfor hadprædikanter og formørkede kræfter på plads. Enighed om S-krav #dkpol
737583936239345664,2016-05-31 09:58:08,Enighed om S-krav til stærkere indsats overfor hadprædikanter og andre formørkede kræfter. Forventer snart aftale #dkpol
736088717585092608,2016-05-27 06:56:40,Ruslands ambassadør skal stikke piben ind og stoppe sabelraslen. DK bakker naturligvis op om de baltiske lande #dkpol
733609162094071808,2016-05-20 10:43:48,"RT @simonkollerup: K har alene fået frivilligt pyntegrønt oven på landbrugspakken - og solgt den grønne sjæl for ro i blå blok, ak #naturpa…"
733005409896763392,2016-05-18 18:44:42,RT @mfMorten: Nu igen! En regering for hele Danmark? Nej! Hjort i angreb på togforbindelser til bl.a. vores yderområder #dkpol https://t.co…
730868984506109953,2016-05-12 21:15:19,RT @mfMorten: YES! Letbanen er reddet! Hård kamp! Tillykke til Københavns Omegn! 🇩🇰 #dkpol @tv2lorry @P4Kbh
730085224093192193,2016-05-10 17:20:56,RT @mfMorten: LETBANE: Svigter Pia Kjærsgaard Vestegnen? Vil hun hjælpe? Oprør i DF-bagland: #dkpol #dktransport @DanskDf1995 https://t.co/…
730032149580132352,2016-05-10 13:50:02,"Jønke og co. bliver aldrig velkomne i Aarhus. Når de viser rygmærker, viser byen rygrad #dkpol https://t.co/rHhvhilSuY"
730029658973077504,2016-05-10 13:40:08,RT @simonkollerup: Nu kan @larsloekke ikke gemme sig mere. Han var orienteret om kæmpe EU-risiko med landbrugspakken! https://t.co/y0300hgD…
729953670343888896,2016-05-10 08:38:11,Aftale om S krav om styrket indsats for at få styr på de friskoler som ikke underviser ud fra frihed og demokrati #dkpol
729915551364026368,2016-05-10 06:06:43,"S kræver stærkere tilsyn, og at der skal indsættes en ekstern observatør på friskoler under skærpet tilsyn #dkpol"
729528975442219008,2016-05-09 04:30:36,S står for en benhård kurs overfor hadprædikanter. De må Ikke kunne sprede deres had i DK #dkpol https://t.co/LRVSQoxzS5
729361226061516800,2016-05-08 17:24:01,Historiens dom over Fogh bliver hård https://t.co/Uvdeozwm3d
728662156523245569,2016-05-06 19:06:10,"Tankevækkende at tænke på at, Khan ikke vil være velkommen i USA, hvis Trump vinder #dkpol https://t.co/i7LaywjZrS"
728479880892035072,2016-05-06 07:01:52,RT @mfMorten: Vildt! Statsrevisorerne anklager transportminister for MISBRUG af letbane-rapport. Samråd i finansudvalget! #dkpol https://t.…
728467763795087360,2016-05-06 06:13:43,Top-politiker til Ståle: Pas din egen butik https://t.co/4L9fEV8DnF
728310198809546752,2016-05-05 19:47:37,"Pas din egen butik Ståle. Aarhus er en fodboldby, hvor vi støtter byens hold i medgang og modgang ! #dbupokalen https://t.co/ShuexLBGPr"
728303035819110402,2016-05-05 19:19:09,"@FrankJensenKBH Ja intens fight og fantastisk stemning i Parken. To stærke hold, to fantastiske byer !"
728301597583941632,2016-05-05 19:13:26,Pas din egen butik Ståle. I Aarhus holder vi med byens hold i medgang og modgang! #dkpol https://t.co/vTC1BucgEX
728191859823149056,2016-05-05 11:57:23,Glæder mig til pokalbrag i Parken. Det bliver så stort⚽️👍 #dkpol https://t.co/0V7M5XSMP5
727783937129496576,2016-05-04 08:56:26,Stort tillykke til Pernille. Hun bliver en dygtig skipper for Enhedslisten. En stærk kvinde afløser en anden #dkpol
727782249958117376,2016-05-04 08:49:44,"Tak for flot indsats, samarbejde og gode grin til mn sidekammerat i folketingssalen #dkpol https://t.co/sXZmy3rNwN"
727777013663182848,2016-05-04 08:28:56,"Har Elbæk sin egen ""kreative kasse"" eller hvordan skal de 11 mia. ellers betales ? #dkpol https://t.co/1T8nPYd5l4"
727766208766939140,2016-05-04 07:46:00,"Elbæk har i den grad åbnet den ""kreative kasse"" op på vid gab. Hvor finder han de 11 mia  #dkpol https://t.co/1T8nPYd5l4"
727601448452820996,2016-05-03 20:51:18,Elbæk og co vil ikke lukke solcelle-hul til 11 milliarder kroner. Meget alternativt og dybt uansvarligt #dkpol
726654846850490368,2016-05-01 06:09:50,God start på dagen. God 1. Maj #dkpol https://t.co/zT5Y6pH8oK
726167172356165632,2016-04-29 21:52:00,Indhentet af virkeligheden. Danskerne vil have styr på butikken og ordentlig velfærd #dkpol https://t.co/h3WA8RuSLM
725307505052667904,2016-04-27 12:55:59,"Flot gave og velfortjent klap på skulderen til en meget, meget vigtig indsats #dkpol https://t.co/dOpQIJ7Tvk"
724716889247744000,2016-04-25 21:49:05,Dagens tilståelsessag fra regeringen ! #dkpol https://t.co/LEm1tL8Wp6
724300216023822340,2016-04-24 18:13:23,"@mfMorten @BrondbyIF @oestergaard Håber at du er lige så begejstret, når du støtter GF i Parken til pokalfinalen."
723154612610580480,2016-04-21 14:21:09,Spændende læsning !  #dkpol Hans Engell: Nogen i blå blok kommer til at løbe fra løfter https://t.co/AO26sx1n6I
